40,“買物・グルメ天国！”,韓国にはもう何度も足を運んでいますが、何度行っても「ご飯が美味しいな～！！」と思いますね。韓国は辛い料理のイメージが強いですが、辛くない料理も意外と多いんですよね。キンパッとかプルコギとかマンドゥとか！アイスクリームやパッピンスなど美味しいデザートも多いので、休憩がてら食べるようにしています。そして韓国と言えば忘れてはいけないのが、お買い物ですね！女性の方には、コスメショップ巡りがお勧めです。韓国の化粧品ってお値段の割には、質が良くってお得感でいっぱいなんですよねー。あちこちのお店で買いだめをするようにしています！
50,“생기발랄한 서울”,서울에는 여러가지 다양한 공연을 볼 수 있어요!! 제가 진짜 재미있게 봤던 공연은 '사랑하는 춤을 춰라'라는 공연인데 춤으로 포현하기 때문에 외국인들도 아주 많아요^^
50,“地下鉄を利用しよう！”,11月23日から4泊、ソウルへ行ってきました。今回で4回目のソウル訪問ですが、移動手段は断然、地下鉄に限ります！日本と比べ、運賃の安いタクシーを利用するのもいいかもしれませんが、地下鉄を乗りこなせば地理感もわかりもっと楽しい旅行になりますよ。ハングルが読めない方でも大丈夫です。路線は色で分かれ、停車駅にはそれぞれ番号がふってあるので、ソウル地下鉄路線図さえ持っていれば、簡単に乗り換えだって可能です。私は、いちいち切符を買わないですむT-money を使っています。T-moneyとは、地下鉄とバスで利用できるICチップが内臓された交通カードのことです。今回、W5000のチャージで滞在期間中の移動は事足りました。それにこれを利用すれば、各区間W100ずつ割引になるのでとってもお得です！ぜひ、地下鉄を利用してソウルを満喫して下さいね！
40,“買い物三昧”,ソウルに滞在中は、必ず買い物をします。まずは、ミョンドンで化粧品を買います。友人たちに頼まれたのもの、自分で使っているもの、お土産用に。たくさん買うと、サンプルをつけてくれます。これがまたお土産用に使えます。足元が寒いので、ミョンドンの地下で、ブーツを見たら、皮のロングブーツが、なんと1万円以下で買えました。ちょっと歩いて、南大門へ。午後から露天商がたくさん出てきて、洋服を広げています。トレーナーと冬登山用のパンツが、合計3000円でした。最後は、ロッテホテル横の免税店へ。ルイヴィトンを見ていたら、円高で安い。日本で買うより、2割くらい安いです、と勧められ、小さいバッグをつい買ってしまいましたが。
20,“東京・大阪の劣化バージョン”,買い物するか、飯を食うくらいしかやることがない。1日もいたら飽きてしまう。どこを見ても、日本と同じようなもの。同じかそれ以下。街は日本の方がきれいかな。きれいなビルが立ち並んで一見してきれいに見えても下水が強烈に匂っていたりで、全然洗練されていないようだった。あと、どこでも違法に露天を開いているらしく、活気があってやっぱり”アジア”なんだなあと思った。まあ、食べ物がおいしくて安いから良いけど、それ以上の魅力がほしかった。
30,“Big city”,"Seoul wirkt und ist sehr gross. Die stadt wirkt teilweise ein bisschen leblos und blass. Im winter wird es zudem sehr kalt mit bissigen winden. Es gibt riesige shopping center zu entdecken, dazu auch kleinere marktgassen. Vom tower der per seilbahn zu erreichen ist sieht mat über die ganze stadt. Die anbindung an den airport ist per metro und express train (der leider noch nocht bis in die stadt fährt) gut möglich."
50,“沖縄にいくより、近い。”,関空から行きは１時間半。帰りは１時間10分でしたよ。北海道や沖縄にいくより、早く着きます・・・ってところが身近に感じます。３泊４日JALで行っても５万円未満で現地で３万円をウォンに替えると　充分遊べて食べれて楽しめて・・・コスメもたっぷり買えます。ってところが　病みつきになりますね。地下鉄は1000ｗって日本円で　80円弱ですから　日本なら子供料金で移動できるって感じです。タクシーに乗っても　初乗り１８０円ほどです。景福宮の入場料なども3000ｗで230円くらいで　何時間もかかって見学できますから・・・焼き肉、ビビンバ、チャプチェ、ﾁﾁﾞﾐ、マッコリ韓国は食べるものがおいしいですね。日本人に合うのでしょうか。おなかいっぱい召し上がっても　日本でランチを食べたくらいの料金でした。（女性ばっかりでしたけれどね。）明洞では　ほとんど　普通に日本語が通じます。
40,“クリスマスのソウル”,１２月クリスマスシーズンのソウルに行きました。ライトアップされたソウルの町　素敵でした。ロッテホテルの周辺はロマンティックでした。日本よりソウルのほうが　クリスマスはにぎやかに祝うような気がしましたが～。いつか彼と来たい～
40,“首尔是一座很有古典风格的现代城市”,近期前往韩国参观游览的几天，这一次比07年去印象好了很多，大概是因为自由行吧。首尔是一座很有古典风格的现代城市，兼容了古代王国首都的历史文化背景，现代大都市的动感与活力，以及汉江两岸秀美的自然风光。可以说本次不虚此行。
50,“夜通し遊べるソウル”,東大門市場の洋服の問屋ビルは明け方5時まで営業していて活気があるので夜通しお買い物を楽しむことができます。2泊3日の旅行で、実質2日程の滞在でも、昼間は観光やエステ、夜中はショッピングとかなり充実した旅ができます。問屋さんに売っている洋服も、かなり値段が安くロングTシャツなどは1000円以下で買えるし、靴なども1000～2000円しない値段で買う事が可能です。また、問屋さんなのでお店に人と値段を交渉することも可能。ただし、フィッティングルームなどはなく、店先でフィッティングする羽目になります。洋服のデザインなどは日本と変わらない感じで、かなり良い買い物ができると思います。お買い物に疲れたら、カフェでお茶か、問屋ビルの外にある屋台で何かを食べるのも楽しいと思います。
50,“今が行き時”,年に1回ほど、国内の搭乗でたまったマイルでソウルに行きます。今、国内社（ＪＡＬ、ＡＮＡ）は国内の旅行でマイルを使うよりも比較的お得なキャンペーンをやっており、国内の旅行と同じくらいのマイル数で旅行ができるので、マイルが貯まっている方は狙い目だと思います。ソウルはショッピングが目的ですが、焼肉等に代表される韓国料理がとてもおいしいものがそろっており、また、リーズナブルな値段で楽しむことができますので、下手な国内旅行よりも低コストで充実した旅行ができます。
40,“Super Stadt!”,"Seoul steht nicht in allen Reiseführern ganz vor, aber zu Unrecht. Die Stadt ist modern und bietet persönliche Sicherheit. Trotz eventueller Sprachschwierigkeiten kann man durchaus eine Privatreise dorthin unternehmen, es gibt in der Regel günstige Flüge z.B. mit Lufthansa, KLM oder den beiden (durchaus empfehlenswerten) lokalen Fluglinien (Asiana und Korean Air). Die Stadt biete viel: schöne Fussgängerzonen, große Einkaufszentren mit guter Ware, gute Restaurants aller Richtungen, und viel Kultur (wunderschöne Tempelanlagen). Aufgrund des derzeitigen Wechselkurses sind die Preise sehr günstig. Taxis sind sehr billig, das U-Bahnnetz ist bestens. Auch Konzerte oder Theater (Musicals) werden oft geboten. Die Bevölkerung ist sehr freundlich, die Englischkenntnisse meist aber sehr dürftig. Trotzdem kommt man gut zurecht."
50,“ソウル”,毎年行ってます。あまり休暇が取れない！と言う方にはお薦めです。１泊でも行けます。できれば２泊した方がゆっくりできますが。出発日によっては2万円未満のツアーもあります。食べ物の美味しいし、ショッピング天国です。しかも今は円高！人気の韓国コスメも格安です。市内に免税店がいくつかありますが、価格は米ドルなので、これまた今は円高なのでブランドものを買うチャンスです。年に数回ある免税店のバーゲンも見逃せません。グルメ、ショッピング、エステと女性なら思う存分楽しめると思います。
40,“卫生干净”,国庆假期再此来到首尔，因为有多次往返的商务签证，所以这次是自由行。语言方面本身也有优势，感觉这个城市史如此的熟悉：熟悉的仁川大桥，熟悉的汉江，熟悉的明洞，熟悉的京畿道，熟悉的爱宝乐园。当然最熟悉的依旧是干净卫生的街道，和蔼的市民，对于这个城市有太多的眷恋，最终是因为这个城市干净的就像是新生婴儿的皮肤~~~
40,“韓国の良さ、ソウルの良さ”,まず近いところ。日帰りでもいけそうな距離で、便も豊富。なんといっても時間がかからないことで、いろんなことが楽しめます。ソウルは大都会なので地下鉄も発達してますし、比較的のりやすい。タクシーも日本に比べると安いので、気軽に乗れます。地元の方も親切で、犯罪についても夜歩いている分には危険をかんじませんでした。
40,“変化し続けるエネルギッシュな都市”,１０年以上ぶりに訪韓しましたが、かなり変わってました。ファッションビルが増えて夜遅くまでキラキラしています。店舗が深夜まで開いているので（明洞のファッションビルなら２２時位・屋台は２３時過ぎまで）開いてますので夜遅くまで遊べます）　　　明洞の中心部に韓国コスメが連なっている通りがあり、客引き合戦が活発で各店のお姉さんが入口でマスクシートなどタダで配っています（店内を見るのが条件）　　　　コスメショップも遅くまで開いていて面白かったです。　　　　市場でも客引きが活発です。通りの真ん中にリヤカーの上にいっぱい品物を置いたおじいちゃんやおばあちゃんがお店を開いてます。元気ですね～　　　　　東大門市場付近は明け方までオープンしているファッションビルもあり深夜すぎまで遊べます。　　　　　早朝から深夜まで本当に韓国の人たちは勤勉でエネルギッッシュと感心しました。　　　　江南方面にカロスキルと言うお洒落な通りがあり、カフェが沢山あります。カフェの料金は少々高めですが、韓国に来た事をしばし忘れるほど欧風なカフェばかりで落ちつきますよ。　　　　　　　色んな事がひと昔前とはかなり変わってとても進化していました。
50,“やっぱり最高！！”,ショッピングも最高！食べ物もおいしい！観光名所もあり、人々がすごくパワーがある感じですね。子連れで行ったので満喫したとまでは言えないけど、子供の手が離れたら絶対に友達と行きたい場所ですね。
50,“身近な海外旅行”,ソウルは日本から行ける最も身近な海外旅行都市だと思います。同じアジアということで、見た目も似ているので、白人や黒人の中にいる緊張感もありません。地下鉄が発達していて色や番号でわかりやすいので、移動も楽で一人旅にも向いていると思います。おいしくて安い韓国料理のお店がたくさんあり、中でもお粥はお勧めです。リピーターが多いのも納得です。
50,“マシソヨー！”,なんといっても韓国はグルメの国！キムチ・チジミ・トッポッキ・サムギョップル・キムパ・サムゲタンなどなど。健康的でおいしいごはんとともに幸せになれる国です。ちょっと美味しいもの食べに、ぷらっと出かけられる距離もうれしいですね。
50,"“Seoul e la Corea, un'esperienza indimenticabile!”","Io amo la Corea del Sud e l'ho già visitata tre volte.Consiglio di visitare tutto il paese, dalla remota e romantica isola di Jeju, passando per le rovine di Gyeongju, per la provincia Jeollanamdo e per la sua grande e luminosa capitale, Seoul.Seoul è una città da mille colori, con contrasti che riflettono la sua vocazione moderna protesa al futuro, ma anche la sua tradizione e il passato che ancora vivono nei suoi vicoli.Così accanto ai grattacieli, e la super moderna zona di Gangnam, troviamo le zone più vecchie, la romantica e caratteristica In-sadong con tante botteghe artigiane, pittori, salette da the, ristoranti tipici (andate da Gun, fanno solo mandu - i ravioli coreani di verdure e carne - da generazioni. Indimenticabili!!), il vastissimo mercato di Namdaemun, la zona commerciale di Dongdaemun con i suoi mille e mille negozietti che vendono qualsiasi genere di materiali.Di sera passeggiate lungo lo splendido canale di Cheonggyecheon in mezzo al centro cittadino, tra locali, bancarelle, giochi di acqua e luci e tanto movimento fino a notte fonda.Per la cultura c'è da sbizzarrirsi tra i vari palazzi reali, primo tra tutti il grande Gyeongbokkgung, i musei, le porte storiche della città, la Seoul Tower, gli hanok village (villaggi tipici tradizionali).La Corea ti avvolge, in ogni tuo passo, dall'inconfondibile odore del cibo che si sente per strada, per via di tutte le bancarelle che lo vendono, ai grandi centri commerciali, ai templi dove pace e serenità regnano.Il progresso tecnologico li contraddistingue con metropolitane, treni economici, veloci e pulitissimi, taxi economici, pullman e bus che portano ovunque. Come li contraddistingue il cibo; la Corea ha una grande tradizione gastronomica per cui osate e provate tutto (magari non i bachi da seta che hanno un odore terribile). I prezzi per mangiare sono irrisori per cui assaggiate il Kimpap (rotolini di riso e verdure con alghe), il bibimpap (riso con verdure e uovo cotto in una ciotola di ghisa pesante), il bulgogi (il barbeque coreano con carne cotta in una mistura di cipolle, salsa di soia, zucchero, aglio), i mandu (vedi sopra) etc...Vorrei dire tanto altro, ma non posso dilungarmi troppo.Fate una vacanza diversa, andare in Corea del Sud e rimarrete affascinati (e vorrete tornarci [--])"
30,“stadt mit kultur und einigen sehenswürdigkeiten”,"seoul ist für mich eine recht ansprechende stadt mit einigen gut ansprechenden sehenswürdigkeiten,die geprägt sind von einer langen und sehr beeindruckenden geschichte des landes.in gut zwee tagen kann man die wesenntlichen kulturstätten besichtigen.Daneben beeindrucken sehr die moderne konzeption der stadt,die sehr an westliche bseonders amerikanische stilkomponenten erinnert."
40,“3 Tage Seoul im tradiotionellen Viertel um die Anguk Station”,"Seoul ist eine große Millionenstadt, was man spätestens von dem großen Fernsehturm aus sieht - in der Stadt selbt hatten wir nicht den Eindruck. Die Stadt teilt sich in viele, überschaubare Stadtviertel auf, die zum Teil noch sehr tradiotionell sind.Wir haben im alten Stadteil von Gwanghwamun, U-Bahnstation Anguk Station gewohnt, in einem alten Hanok Guest house (Sophia Guest House).Die Zimmer sind alle zu einem bepflanzten Innenhof ausgerichtet, die Wände sind aus Papier, der Boden beheizt, man schläft auf zusammenrollbaren Matratzen. Das Zimmer hat 50.000 Wong gekostet pro Nacht, ein fairer Preis, inkl. Frühstück.Die Gegend um die Anguk Station ist voll von kleinen Cafes, Schuhläden, Kunstboutiqen, man kann überall gut zu Fuß laufen. Ein Teil besteht aus den alten Hanok Häusern, alte, charmante Holzhäuser, die einem das Gefühl geben, in eine andere Zeit versetzt zu werden.Absolut zu empfehlen!"
50,“買物目的でリピート！”,円高なので、たっぷり買物できます。とくに女性にはうれしい韓国コスメ天国です。サンプルもたっぷりもらえるのでコスメショップめぐりだけのためにソウルに行くぐらいです。ｸﾞﾙﾒもおいしいものがたくさんあって帰ってきてもまたすぐに行きたくなる街です！インチョン空港から街が遠いのが難点・・・
40,“In Asien noch ein Geheimtipp!”,Die Stadt befindet sich im Vergleich zu Hongkongoder Singapur noch in den Startlöchern.In vielen Stadtteilen ist man als Tourist oft der einzigeEuropäer.Die Verständigung in englischer Sprache ist meistein kleines Abenteuer.Sehr gut ausgebautes und preiswertes Verkehrsmittelnetz.Es lässt sich vorzüglich in den einheimischen Restaurantsessen.Der September ist eine sehr gute Reisezeit.
40,“meine Tipps für einen Seoul Besuch”,"Also die Innenstadt von Seoul ist mehr als eine Reise wert. Interessant sind vor allen der Fernsehturm, die innere City mit den unterirdischen Märkten und eine Bootstour über den Han River kann ich auch nur empfehlen.Um einen kurzen Eindruck zu hinterlassen habe ich ein paar Bilder angefügt."
30,“ソウルで辛いカレーライスを”,７，８年前まで、辛い食事が多い、韓国では、以外にも、一般の食堂では、カレーライスのメニューが殆ど見当たらなかった。確か、その頃、港町、プサン中央洞にあった地下の食堂でカレーライスを食べたことがあった。しかし、その味はあまり辛くなく、むしろ甘かった。それ以来、韓国では、辛いカレー、ライスに出逢うことを諦めていた。辛国たる？韓国では、韓食以外は、辛いものを食べるのは、韓式料理の伝統を穢すのだろうか？しかし、近頃、ソウルの中心街の鐘路あたりでも、カレーライスを食べることができるようになった。私自身、食べたわけではないので、味の中身はわからない。今、韓国のスーパマーケットでもパックに入ったカレーが売られているので、それを食べた、私の感じから推察すると、激辛ではないかも知れないけれど、恐らくは甘くはないでしょう。日本人のショッピング散策で超有名な南大門の近くにも数軒はあるとおもいますが、私のお薦めの食堂は地下鉄４号線、三角地駅下車、徒歩７，８分のところにある戦争記念館の敷地内にある！！カレーはカツカレー１品のメニューだけれど、少しは辛い。カレーの常道には反していない！！スープ付きで６０００ウｵン。、
50,“明洞　めぐり　7月末”,昨年7月に友人と2名で女旅をしました。7月末はバーゲン真っ只中すべて日本の半額定価のさらに　なんとその50％引きがザラ仕事着　遊び着　小物　Ｗウォン安も便乗しとってもラッキーでした。12月も15日過ぎるとバーゲンになるとか？12月以降なるとか？12月も訪韓予定しております。
50,“Seoul - die schönste Stadt der Welt”,"Das ist ein Geheimtipp, da gebe ich jedem Recht. Diese Stadt verzaubert einem - trotz Hightech und viel Tradition: Wenn man einen Tag Zeit findet und das Treiben rund um den einen oder anderen Platz beobachtet. Wie entspannt die Menschen sind, wenngleich Hektik in der Luft liegt. Es ist einfach ein wunderbares Gefühl, nicht unbedingt Teil der Menschen zu sein, aber doch dabei zu sein. ICH LIEBE DIESES LAND"
50,“コスメ天国”,ソウルは女の子にとってキレイの宝庫です！コスメ、韓風エステ、買いもの、食事などなど飽きないまちです！個人的なおススメは明洞より、梨大エリアです。女子大があるのでその周りには安くて可愛い洋服や靴屋さんがたくさんあります。カフェもオシャレです。エリアを少し離れて歩くとセレクトショップみたいな個性的ファッションのお店もありますが高くても5000円くらいで買えたと思います。梨大は人も明洞より多くないし落ち着いていてゆっくり買い物ができるのでおススメです！！あとコスメを買うなら明洞より東大門エリアのコスメショップの方がおススメです。おまけが明洞よりたくさんついてきます！！あかすりエステを予約するならたくさん遊んで12時くらいに予約して2時とかに終わってそのまま飛行機で帰れるくらいが時間のロスも少なくていいと思います。私はそうやって時間をできるだけ使ってソウルを楽しみました！
20,“Bitte nicht!”,"Mitr hat Taipei nicht gefallen und auf meiner Liste der schlechtesten Städte Asiens darf auch die südkoreanische Hauptstadt nicht fehlen. Dder Flughafen ist sehr weit vom Zentrum entfernt. Wenn Sie in die Stadt kommen wird Ihnen nicht viel spannendes begegnen. Ich habe einen Tag verbringen dürfen, es hat gereicht. Privat würde ich andere Städte vorziehen!"
30,“局限的繁华”,在韩国长驻了几年，认为首尔的繁华仅仅局限于汉江周围的若干半径之内．所以去韩国玩的话，有个短期的计划就好，３天左右就能把这个国家所谓的最美好的事物看全．时间再长的话，恐怕就也觉得无趣了．
50,“活気のある都市”,ここ10年の間に、韓国は国・街・人・・・すごーく変わりました。服装もすごくオシャレになったし、カフェもすごく多くなりました。ほんの２，３年前までは飲み屋ばっかりだった通りも、最近はコーヒーショップが軒並みならんでます。お店の立ち代り入れ替わりも早く、ほんの数ヶ月前まであった店がもう違う店になってたりもします。よくも悪くもアグレッシブです。ホンデやイテウォンのクラブは外国人も多く、年齢層も幅広いです。基本的に踊りが好きな民族なので、クラブへ行くのも日本より行きやすいです。洋服は日本からの買い付けの方も多いので、日本で人気なスタイルはどこでも買うことができます。日本人に対する意識も昔より緩和されているので、初韓国の方にも安全で楽しいたびができると思います。韓国リピーターになれば、ソウルだけじゃなく、カンウォンドやテジョン方面など、もっと韓国文化にふれると楽しいです。
50,“食べ物！最高”,何度言っても食べ物は魅力的です。というより食べるために行っているようなものです。突き出しがたくさんあり、おなかは確実にいっぱいに！ご飯もおかわりしほうだいです。最近韓国のりが出てこない店が増えたのですが、高くなったのかな。地下鉄は結構深く階段がたくさんあり荷物を持っての移動はつらいですよ
50,“干净、秩序、文明”,初到首尔的第一印象就是这座城市台干净了，地面上看不到一张废纸。、每一个人都非常的左手公共场所的秩序，人们也非常的礼貌文明。
40,“セールはお得！”,グランドセール期間のソウルへ行きました。恒例のグランドセール中で、ショップ、レストラン、乗り物、カジノ、とあちこちでセールクーポン使いまくりでお得度満開でしたー。ソウル行くなら、ウオンも安い今ですよ～
40,“ソウル全体の感想”,１０回は訪れているソウル、何度行っても楽しめる街です。厳寒の冬も真夏のソウルも、それなりに魅力があります。食べ物も安い、うまい・・・、一流のお店は勿論ですが、そこらへんのお店に入ってもそうがっかりすることはないですね。特に居酒屋は、庶民の生活が垣間見れ　アジュマの一生懸命働く姿が感動を呼びます。愛想がない分は日本とは違いますが　何回も訪れるうちに気にならなくなりました。音楽（K-pop)もレベルが高いしね・・・。遺跡や観光地というと、他の国には負けるかもしれませんが、ちょっとお気軽に楽しめる海外ですネ！！
