50,“Seoul ist wirklich the Soul of Asia”,"Ich war in den letzten 3 Jahren nun schon 7 mal in Seoul, und werde in einigen Wochen schon wieder dort hin fliegen.Seoul bietet einfach alles. Kultur wie Paläste, Museen, Traditionelle Handwerkskünste und vieles mehr. Im gleichen Atemzug verbindet es aber wunderbar die Moderne.Trotz Großstadt, ist man in wenigen Minuten schon in der Natur. Man kann dort viele Wanderungen übernehmen. Seoul ist ja umragen von Bergen.Sportmöglichkeiten werdne zu Hauf geboten. Ich empfehle Joggen am Han River. Besonders zur Sommerzeit bekommt man dort eine kleine kühle Briese.Unterhaltung wie Kinos und Arcade werden natürlich auch geboten. Kann hier sehr das Lotte Cinemal empfehlen. Besonders den ""Charlotte"" Saal. Kino ist sehr günstig und alle westlichen Filme werden in Englisch gezeigt. Anschließend am Besten noch zu einer Arcade gehen und die neuesten Videospiele daddeln :-)Es stehen viele Freizeitparks zur Vefügung (Lotte, Everland,...). Die sind auch auf jeden Fall einen Besuch wert.Das schöne an Seoul ist, dass die öffentlich Verkehrsmittel wie Busse und Bahnen sehr günstig sind. Auch bei kurzem Aufenthalt empfehle ich, eine T-Money Karte zu kaufen. Damit kann man die Bahnen und Busse bezahlen, aber auch in Geschäften wie 7-eleven, Family Mart,...)Das Nachtleben ist auch sehr zu empfehlen. Koreaner sind generell etwas ungezwungener als z.B. Japaner, und man kommt oft relativ schnell ins Gespräch. In Itaewon reicht dazu Englisch, in ländlichen Gegenden ist es jedoch von Vorteil zumindest einige Brocken Koreanisch zu beherrschen.Ich liebe das Koreanische Essen. Besonders Koreanisches BBQ. Es sit vergleichsweise recht günstig."
30,“传统与现代”,和上海很像的一个城市，有江南和江北，一如上海的浦东和浦西。传统的东西保留了很多，韩屋村的感觉不错。现代商业化的街道鳞次栉比，是个购物的好地方。首尔的人多数是很热情的，只有在机场过关的时候遇到了小小的不愉快。同行的朋友说：走在路上的感觉就像在看剧，呵呵！
40,“Seoul - eine MegaCity - absolut eine Reise wert!”,"Unsere erste Reise nach S-Korea, aber bestimmt nicht die Letzte! Wir waren zwar nur eine Woche in Seoul (City), aber diese Reise war jeden Tag wert. Seoul ist eine MegaCity mit historischem und modernem, sehr leckerem Essen, viel Kultur und sonst allem, was das Herz so begehrt. Die S-Koreaner sind sehr nett und freundlich und mit Englisch kommt man einigermaßen gut zurecht. Wir werden bei der nächsten Reise auf jeden Fall auch das Umland erkunden, da es bestimmt noch einiges zu entdecken gibt."
30,“适合购物”,首尔总的感觉，没有很高的建议，没有很宽的马路，到处都是车，而且都是本国生产的现代，进口车很少，虽然路不宽，但次序仅然，城市环境较好；在建工程及一些施工路段环境较好；首尔适合购物，尤其是化妆品较便宜，其次，衣服的质地不错；一些小饰品很漂亮，但不建议购买，因为都是中国进口的，一些是韩国设计，中国制造的。
30,“近い海外　涼しい”,2回目の訪韓です。15年も前に訪れたのでほぼ忘れていました。韓国は酷暑の日本に比べて、涼しかったです。異国だけど、日本と似ている、韓国に影響を受けているのでとても親近感があるくにでした。景福宮で衛兵の交代式をみました。欧州とも違うので、興味深かったです。隣接の国立民族博物館も無料で入場でき、韓国の文化がわかり、見ごたえはありました。特定の曜日に無料の日本語ガイドさんもみえます。徳寿宮は小さいですが、人も少なく、公園のようにゆっくり休めます。こちらの交代式は2時過ぎの交代式が賑やかで30分以上パレードのように行われていました。こちらも見ごたえがありました。開催前に、写真を一緒にとってくれました。南山韓屋村は小規模ですが無料で、昔の役人の家が見れます。ソウル駅の近くのロッテマートにはフードコートもありますし、韓国のりやみそ、お酒などかなり安く手に入ります。同じみそが免税店にありましたが、４分の１でした。明洞からタクシーで3000ｗでした。3人なら地下鉄より安いです。韓国は昼頃からどこも賑わうようです。午前中は店はあまり開いていないので、歴史的な建造物観光が良いようです。三清洞ギル、仁寺洞ギル、明洞は活気があり、行くだけでも楽しかったです。もちろん南大門、東大門も活気があり楽しいです。コンビニも点在してます。タクシーもぼったくりにはあわず、急いで走ってくださる人ばかりでした。新しい車の方は道がわからないといわれ、少し古い感じの車の方は慣れているようで、遠くても走って下さいました。日本語で対応してくださるので、不自由なく過ごせました。
40,“おいしい国です。”,初ソウルで、エネルギッシュな人たちに圧倒されました。市場にいくたび、元気をもらえました。食べ物は美味しいものばかりで感動サムギョプサルは最高でした。気軽に行ける街なのでまた訪れたいです
50,"“Aufregende, pulsierende Metropole”","Seoul ist eine aufregende, pulsierende Metropole die mit allen Metropolen der Welt mithalten kann. Ein gut funktionierendes U-Bahn-System, günstige Taxipreise und natürlich Soju an jeder Ecke. Der Flughafen liegt gut 70km ausserhalb der Stadt und ist mit Bussen gut zu erreichen, allerdings macht die Verkehrssituation in Seoul es manchmal schwer die Fahrtzeit zu kalkulieren. Mindestens dauert es jedoch immer eine gute Stunde um vom Flughafen in die City oder umgekehrt zu kommen.Leider ist nicht immer alles in Englisch ausgeschildert, aber das macht es ja gerade immer so spannend und aufregend."
50,“Megacity Seoul”,"Mit knapp 12 Mio. Einwohner, die größte Stadt Koreas. Kaum eine Stadt in Asien erlebte wohl in den letzten Jahrzehnten eine deartige Veränderung wie Seoul. Hier trifft moderne auf Kultur, eine Stadt die niemals zu schlafen scheint. Sogar in mitten der Woche pulisert das Leben auf und um den Straßen. Für den Asienliebhaber ist hier alles geboten, vom skurilen, modernen nachtleben, bis hin zu Kaiserpalästen und Tempeln. Die traditionellen Märkte wie Dongdaemun, lassen jeder Shopper das Herz höher schlagen. Die Auswahl an schier unendlich vielen Restaurants, sorgen für die nötige Abwechslung. Seoul ist ein muß für jeden Asienfan!"
40,“Spice!”,"Gefällt Ihnen würzige Nahrung, wenn Sie so wie Korea. Gefällt Ihnen auch Bergen, werden Sie lieben. Allerdings mag ich nicht Spice Essen aber living sechs Monaden in Korea war sehr interessant und lärerikt."
50,“不错的城市！好吃！好玩！十分有活力！”,"去年去了首尔玩~不愧是持续发展中的城市！美食：餐餐都吃的好！五花肉，牛肉,生猛海鲜，火锅，泡菜，人参鸡。。。太多了！从早吃到晚，还外加宵夜！去那里准备胖个几斤吧！滑雪是一定要的了,这么漂亮的户外山景，值得开1小时车去一趟！化妆品也别错过了，只要台湾1/3价！便宜到你买不完。。。多准备些预算吧！"
40,“A‘REX（空港鉄道）を使って仁川国際空港からソウル市内へ！”,仁川国際空港からソウル市内への新しく便利な移動方法をご紹介します。それはＡ‘ＲＥＸ（空港鉄道）です。まだ全線開通してないので利用者も少なく余り便利な乗り物とは言えないのですが、何せ鉄道なので移動時間が予測でき、渋滞の心配があるリムジンバスより安価で安心です。今現在、仁川国際空港～金浦空港間を約32分で結んでおり、金浦空港でソウル地下鉄の５、９号線と接続してるのでソウル市内への移動はそんなに苦になりません。大韓航空やアシアナ航空を使ってソウル以遠に向かい予定で仁川国際空港で長い乗り継ぎ時間があるのなら思い切って市内に出るのも楽しいかもしれません。
50,“３回目のソウル”,ANAのマイレージを使って３回目のソウルへ行ってきました。前回購入してあったTーMoneyカードにコンビニでチャージし空港から　バスでミョンドンへ。このカードはバス代も割引になり、地下鉄に乗る時にも　料金を調べ切符を買うこともなくとても便利です。ホテルは　ミョンドンの中心、ザボイホテル。ここは立地がとてもよく便利です。無料の朝食もついていて、甘いポンデケージョ風のパンがおいしかったです。円高の影響もあり、服やアクセサリーなど買い物も楽しめました。サムゲタン、ソルロンタン、プルコギ、ユッケビビンバ　韓国料理も楽しめ、東京から　２時間ちょとお買いものという感じで手軽に行けます。
30,“旅は必ず準備をしていくこと。”,ソウルには2泊3日の旅で友人と行きました。航空券だけを買い、勢いでお隣の国韓国へ遊びに行きました。焼肉と買い物、そしてカジノに行ければいいと思って旅立ちました。ホテルは現地の格安ホテルに泊まりましたが、普通にきれいで広く居心地の良いホテルでした。初日に行った焼肉屋さんも、おばちゃんが経営する地元の人のための焼肉屋といった感じで、3人で食べるだけたべて一人800円くらいだったと思います。お肉の質は高いものではないけれど、普通においしい焼肉でした。最後に行ったのが、日本で有名な韓国焼肉料理店。ビックリしたのはその価格。一人8000円から12000円のコースか単品でひとつずつ頼む形のお店で、一つ一つも高い。お金と相談して単品で頼む事にしました。しかし、実はその値段は二人用であるということが、あとからきた日本人女性3人のグループの注文を聞いているときに発覚。僕たちが頼むときは何も言ってくれなかった店員さんが、「これは二人の値段。みんなは3人だけど、この値段でちょっと多めに出して3人で食べるといい。」と女性にめっちゃ丁寧に説明してる店員さんを見て、なんで僕たちには言ってくれなかったんだろうかとちょっとガッカリ。でも疑問に思うのは、一人4000～6000円かかるんだったら、日本で行ってもおいしいんじゃないかなって思った。ソウルにはミョンドンとかナンデムンとか、若者の買い物の街もあって、見所はたくさん。ぜひ計画的に旅をしてもらいたいと思います。焼肉は、その値段を日本で出せばどれほどおいしい料理が食べれるかを考えてから行ってもらいたいｗ
40,“Stadt der Moderne”,"Seoul ist die Hauptstadt Südkoreas mit geschätzten 20 Millionen EInwohnern (incl. Umland)In Seoul vereinigen sich hochmoderne Bauwerke (einschlieslich Flughafen und Ubahnen) mit den alten Kaiserpalästen.So kann sich das Strassenbil innerhalb von ein paar Metern komplett ändern.Was allerdings überall bestand hat ist die Sauberkeit in der Stadt.Sehr gepflegt und ohne Abfall auf den Strassen.Sowohl Kultur (Paläste etc) als auch Shopping geht hier hand in Hand, ohne das es caotisch wirkt.Das Ubahn Netz ist sehr übersichtlich und ausgereift, so dass sich auch ortsfremede Personen sehr schnell zurecht finden.Als geheimtip gelten die kleinen einheimischen restaurants, die es in den Seitengassen reihenweise gibt undeine der besten Küchen der Welt beherbergen .Auch ich als skeptiker der Asiatischen Küche bin vollauf überzeugt worden.Das Essen dort ist sehr günstig im Gegensatz zur westlichen Küche oder den Fastfoodketten.Unbedingt Probieren!!!"
50,“ホットな都市ソウル”,食べ物も辛くて美味しい！地図をひろげてたら「だいじょうぶですか？」って声をかけてくれる人情味のあったかさ！夜中でもすごい活気の東大門や南大門！ほんとに飽きない楽しい国で、大好きです！
30,“Koreas groesste Stadt”,"Seoul habe ich schon mehrmals bereist.Diesmal im Mai 2010, im Frühjahr, mit mehr officefreier Zeit.Und siehe da: Plätzlich sieht die Stadt, mit dem mitten durch sie gehenden Fluß Hangang, im Sonnenuntergang richtig gut aus!Einen Einkaufsbummel in den ""Unterground malls"" sollte man sich auch nicht entgehen lassen."
40,“ソウル新ﾀｸｼｰ登場!!”,ソウルの移動はなんと言ってもﾀｸｼｰ安いの何のって!!!!!ちなみに、地下鉄も安いんですが、階段の上り下りがちと疲れます！なので、ソウルでは迷わずﾀｸｼｰを利用します。が・・・模範ﾀｸｼｰはちょいとお高め料金（安心感込み）なので、通常はｼﾙﾊﾞｰの一般的なﾀｸｼｰを利用しています。が・・・ラッキーだと日本語が話せるﾄﾞﾗｲﾊﾞｰ、もしくは感じのいいﾄﾞﾗｲﾊﾞｰ。アンラッキーだと、ハングルのみで感じも悪く、おまけに運転も荒い・・・と、ある意味一か八か的な。。。でも、最近はオレンジ色の『ｲﾝﾀｰﾅｼｮﾅﾙ・ﾀｸｼｰ』が登場!!!!車体には、“日本語”“英語”と表記されてるらしく、ﾄﾞﾗｲﾊﾞｰさんはその言葉が話せ、さらには料金も一般ﾀｸｼｰと同じ!!!!これは安心な上に、お財布にも優すぃ～☆
50,“日本人好みの味”,安い。近い。うまい！！プルコギ。冷麺。焼肉は食べて欲しい。南大門、東大門の露天でショッピングや食べ歩きが最高！！！あと、あかすりもグッド！！汗潤幕が最高！！家族やカップルよりは同姓友達との旅行におすすめ。
40,“五月晴れソウル”,５月１４日から２泊3日でソウルへ行ってきました。１月にも行ったのですが、その時は身体全体を切り刻まれる様な寒風の吹くソウルでした。おかげで龍山にあるサウナでポカポカと一日を費やすことを教えてもらい満足でした。風薫る５月とはソウルも日本と同じで、さらに３日間とも素晴しい天気に恵まれました。今回は、韓国が初めての方を数名連れて行ったので基本的なソウル観光をしました。貞洞劇場で民族芸能鑑賞、烏頭山展望台で北朝鮮を見て、世界遺産の景福宮に触れ、骨付き豚肉の焼肉、牛肉のもつ焼き、参鶏湯、お粥など食べる方も満足でした。初めての方々もリピートしてくれそうです。ただ、明洞で朝食をとるとき、お粥もソルロンタンも鱈のスープの店も日本人で一杯で行列を作っているのにはチョット困ります。
50,“何度も行きたくなる国”,外国って感じがしないくらい楽しいです！女の子同士で行く旅行に最適☆美味しいモノたくさんだし、コスメが安いのでいつも大量に買っちゃいます＾＾免税店でも、時期によってはセールしたりするのでブランド物を更に安く買えるのでオススメです。
40,“不买东西绝对会后悔的地方”,首尔shopping最疯狂的地方应该是明洞了，一过去便会有把所有商店逛个便的冲动。可惜米不够多，好多都没有舍得买，现在真的很后悔。。。严重推荐乐天世界，不要周末去，基本都不要排队，设施很好，很喜欢里面的气氛，很童话，很好玩
50,“活気があって、楽しい街”,初の韓国旅行！韓国といえば、ファッション・焼肉・コスメなどなど・・・物価も安く、堪能してきました！できれば、また行きたいです！
50,“一人旅も安心”,ソウルは一人でぶらっと遊びに行きます。主要観光地やお店では日本語通じるし、みんな親切で安心して遊びに行けます。ただ、焼肉や鍋を食べに行くと、2人前からの注文になるので、少しもったいない気はしますが。。
50,“金浦空港からホテルへのアクセスが不便”,JALの関空からソウルへの便が、金浦空港のみになり、ホテルへのアクセスが非常に不便になった。昨年はヒルトンを予約して、バスでソウル駅で降りたものの、カートをひくには坂が急で、タクシーを頼むと、一方通行のため高料金。今回はプラザにしたが、空港案内所で尋ねると、バス停で市庁駅は無く、明洞下車とのこと。地下鉄で行ったが、乗り換え駅のエレベーターがわかりにくかったり、エスカレーターのない出口で、カートを持ち、ソウルの深い階段を上り下りするのは重労働。仁川空港の有り難さをつくづく感じた。用事で仁川ー金浦間をAREX特急を利用したが、約２０分程で非常に快適。時間を調べて直通特急に乗るのがベター。各駅停車なら３０分以上かかる。
40,“清溪川~”,美丽的清溪川~~去之前看过很多节目里都做过介绍~但是没有一个是雪后的景象~~~~首尔70年来最大的雪，让清溪川也变了个模样~~~
50,“ソウルの食事最高”,ソウルは東京からただ３時間弱で着けることろは魅力的です。また、エステや買い物など、全部大好き。特に食事中無料なキムチはたくさん出てきて最高です。
50,“一番近い海外”,東京在住の私にとって、羽田から行けるソウルは国内より手軽に行ける海外です。食事、買い物、リラクゼーション。まさに私の欲望を全て満たしてくれる街なんです。二泊三日が通常ですが、一泊でも、場合によっては日帰りでも楽しめるんじゃないでしょうか。正直、韓国旅行は男性より女子のほうが楽しめると思うのですが、男子は食事以外カジノとかを楽しんでいるのかな???旅行に行くと暴飲暴食で体が重くなることが多いのですが、ソウルは逆。お野菜やコラーゲンたっぷり、キムチのような発酵食品も毎食たべるし、アカスリしてもらって代謝も良くなるので、帰るころにはお肌がツルツルもちもちになるのです。これには毎回感動。何回行っても飽きることないパワー溢れるソウルは絶対オススメ!!!
50,“一座干净 时尚 美味 清新 的都市”,首尔 小资 那个韩剧中出现的场景一幕幕的呈现在我眼前 很不真实 超爱的泰迪熊博物馆 骊州的奥特莱斯 乐天游乐场 首尔塔 烤肉 正宗的石锅拌饭。。。。。。我还想去！
40,“ビックリ、バッタ物天国”,ソウル初体験、焼き肉、キムチ、DF、かなと思っていたら、なんと、屋台でビトン、シャネル、エルメス、などのバッタ物ばかり売っていて、中国みたい。良くできていて、分からないくらい。もちろん本物はDFでショッピング。焼き肉の値段が安くてそれもビックリ。眼鏡が安く直ぐできるし、何でもお届が基本らしい。ホテルに届けてくれて、送迎もしてくれて、サービスのいいこと。路が渋滞しているのは、そのせいか？活気があって、アジアな感じ。日本は最近元気がないなと感じてしまった。
40,“购物好去处”,"韩国人很热情,即便是大部分的人英语都不好.但都很热心的用手机到处帮忙找会英文/中文的人.明洞的确是购物天堂.梨大附近更是潮流的集聚地.东大门的24H营业购物地让同伴兴奋的夜不归宿.除了实在没什么可吃的.其他都很好."
10,“Anarchie architecturale et manque d'espace”,"Séoul est une très grande ville, où l'on peut se sentir ""écrasé"" par la trop forte densité de population. En effet, le manque de place est flagrant et l'on a l'impression d'être constamment dans le métro parisien aux heures de pointes...par ailleurs, au niveau architecturale c'est l'anarchie, aucune unité dans le design des batiments, on regrettera surtout les grands ensembles de batiments type HLM des années 60.Bref, ville à éviter pour le tourisme."
50,“异域风情”,让我最震撼的还是~~马路上的人熙熙攘攘，街边垃圾桶也少的可怜，可是马路上却非常得干净！！地铁站内，大家也会自觉排好秩序~~“老弱病残”区的座位即使是空着的~，不符合此类要求的人也不会去坐在上面！
50,“ショッピング＆グルメ天国”,都内に住む友人は、”横浜に行くのと同じ感覚”と言ってますがまさにそんな感じです。気が向いたらちょっと買い物に。ちょっと食事に。と気軽に1泊で行ってしまいます。日本から2時間足らずで行ける海外。とにかく商品が安い！ご飯は美味しい！！これが全てです。　韓国最高！
40,“ソウルの食”,基本、安くて美味しいものが多いのですが、ガイドブックに載っているような観光客向けの焼き肉やさんは日本とかわらない金額です。ボリュームは日本よりすごいですが。現地で、地元の人がいくお店を聞いた方がよさそうです。韓定食のお店では、テーブルに置ききれないくらい小鉢が出てきました。置けないのに、重ねてでも無理やり置こうとする韓国のおばちゃんにはびっくりしましたｗ
30,“the 韓国”,南大門、東大門では日本の市場とは比べ物にならにくらい広く店が密集していたため道に迷わないように気をつけないといけません。大坂の鶴橋の駅周辺を思い浮かべてもらって、あのあたりの規模が大きくなったものと思ってもらっていいと思います。食べ物は本当にどこへいってもキムチでお店に入るとキムチは無料でおいてあるのには驚きました。韓国のりも日本で売っているものより種類も多くキムチ味、焼肉味などがありました。また、あかすり、ヨモギ蒸し、エステ、マッサージの店が韓国は多いので安いのかなと思っていましたが、思っていたほど安くはありませんでした。今はウォン安でもあるので一度行ってみてはどうでしょうか。
40,“韓国の両替”,初めて韓国に旅行をしました。昔は近くて遠い国と言われていましたが、東京に行くのより時間がかからず快適でした。今ウォン安と言われていますが、両替について便利な情報です。両替は日本でするのではなく韓国に到着し現地の銀行の支店が空港にあるのでレートもよくとても便利です。クーポン券がインターネットで取得できますのでそれを持参したらいいです。
40,“グルメ＆ショッピングを堪能”,定番の焼肉やビビンパも美味しかったですが、屋台の食べ物も安くて美味しかったです。また、格安ブランドの化粧品も多く、ついまとめ買いしてしまいます。免税店の化粧品も日本の免税店よりずっと安かったです。
50,“明洞”,2009年８月にソウルに行きました。なかでも明洞（ミョンドン）はとってもいいところ！！韓国語が話せなくても、店員さんは話せるし、コスメショップでは何も買わなくてもサンプルがもらえます。サンプルはパックなどもありますが、ジュースももらいました。あと、なんといっても物価が安い！！韓国コスメを買うなら、いろんなお店が点在している明洞がオススメです。コスメだけでなく、飲食店やエステなどもいいところが一箇所に集まっているのでとても便利でした。
