50,“A quickie in Seoul City”,"My husband and I had a 12 hours layover before we head to our destination. We decided to take the Seoul Day City Tour ala our own way.We actually wanted to take the free tour provided by the Korean Government at the airport. The packages they offer are actually very good. However, they have a tight schedule that we must follow (for instance, leave exactly at 8 am and return to Incheon Airport at 1 pm). We asked whether we could leave the tour in the middle of the schedule and roam on our own but they told us it was not allowed to. So in the end we decided to do it on our own.We are happy to say that doing the tour on your own is very easy. The information table at Incheon Airport is very helpful. We were told to buy a tourist day pass which cost around 10 dollars. With this pass, you can get on most buses and trains from and to the airport and also around Seoul.The trains in Seoul are also easy to navigate. So you do not have to worry about getting lost. One important note though, exits can get a bit confusing because one train station can have up to 14 exits. So make sure you know exactly where you want to go.No need to worry about getting lost. First of all, wifi is everywhere and its free. So if you can easily use GPS wherever. Secondly, the Seoul people are very very helpful. Even if they cannot speak English (like the elderly) they will try their hardest to help you. One of our experiences was an old lady at the information centre helped us to call our friend with her own phone when all we asked was where is the nearest public phone. That was very sweet of her.While the places to visit, I recommend going to the Dream Design Play Building at Myeongdong, the King Seojeon statue and Gyeongbuk Palace at Gwanghamun Square, some shopping at Insadong, and try interesting cafes in Hongdae. If you still manage to catch the summer, make sure to try some Patbingsu! It is to die for!!!"
40,“WCP Adventure Camping Seoul/ Goyang”,"3 of us did the Korea East Tour with WCP Adventure Camping in July 2013. It was a good way to experience a bit more of Korea & were glad we did it. Some of the places we visited would have been hard to get to without a car but this way we had someone to explain & organise it for us. It was good value, as well as great to be outdoors & see more than just city tourist spots. Sitting round the BBQ at night, near the beach, was particularly lovely as was climbing up Mount Seoraksan. Andy our guide was very conscientious re: our wellbeing & most helpful before & at the end of our trip & he helped us get the bus to our next destination. The camping kit and transport is new & very good. However, it is camping, so be prepared to rough it a bit, particularly with washing facilities. The places we stayed were mainly car parks in scenic locations rather than specific camping sites.We had just done a templestay (sleeping in dormitories on the floor) and had been staying in a traditional style B&B so the camping was fine for us. It is a new small company so the trips had not been running long and not everything went as smoothly as Andy would have liked - but for us that was part of the charm - & the adventure!"
50,“Very Nice”,Visiting Korea ? If not go there the country is great and the places incredible. Biggest Christian churches in the world ( yes ). The palace is great too or even the airport inside the departure area is amazing with lots to do.
40,“Not to be missed”,"Seoul is as modern a city as they come, and at first glance can be compared to most other modern big cities. Still, underlying all that and all the Westernization, Seoul is still wholly Korean with historical touches found all over. With temples and markets interspersed with luxury hotels and department stores, everything you may be looking for can be found here."
40,"“Peace, Love & Seoul”","After living in Seoul for over a year, I've been fortunate enough to experience so many wonderful events and attractions that make this city one of the best and most underrated in the world. First of all, its extremely safe. Crime is very very low in this country. Even in the middle of the night in a dark alley, its 100% safe. I know its hard to believe, but its true. Its the safest city in the world, in my opinion. Seoul is full of great attractions for families. There are tons of museums as well as Lotte World and Everland amusement parks. Throughout the year, there are various festivals and parades for all sort of occasions and holidays. The locals are kind, helpful to foreigners, and many of them can speak some English. The downtown areas are clean and expansive. There are various restaurants everywhere you go where you can try different kinds of traditional Korean foods at all price ranges. Also there are palaces scattered throughout the city that offer a look into the culture of Korean kingdoms of years past. There is so much to see and do here. Come over and see for yourself!!"
40,"“Busy place, great shopping!”","I have been in Seoul couple of times, such a great city, but really hard as not many people understand English. Shopping is great and shops are open till late, shops are everywhere underground, on the streets, in a big massive buildings. Sometimes you can bargain with shop owners, but not everywhere. Was surprised as found quite a few shops, where you were not allowed to try clothes on."
50,“Seoul - a nice experience!”,"Just got back from a 4days tour of Seoul,Korea. Seoul is definitely big..i would recommend more than 4 days stay. Try the seoul city tour hop-on-hop-off...its informative, cheaper and cover all interesting areas in Seoul. I particularly like the Seoul Museum, it consists of past and present artifacts about Seoul.They have a restaurant with reasonable prices beside the Family Mart(near entrance to the Museum). Its cheaper than most Korean restaurants we've been to.There's also a lovely view of the N Seoul Tower near the entrance of the Musuem. Don't forget to drop also to N Seoul Tower for a good view of Seoul. Everland is also a must try compared to Lotte World. Try the Safari World, my kids love it.Drop by during weekdays, weekends are very full. We waited 90minutes for the Safari World alone.TIP: You can bring water your own water and sandwiches inside the Everland."
50,“SEOUL - THE SOUL OF SOUTH-KOREA”,"When people think about populous cities, there are several cities which are coming to their mind: London, New York, Tokyo, Mexico City. But Seoul is in most of the cases not included. Seoul tends to be overlooked when it comes to great cities. This fact is a shame, because Seoul has so much to offer and so many things can be explored and discovered. Over ten million people are living in Seoul, twenty-five per cent of Korea’s population live in Seoul city and further 47 per cent live in Greater Seoul. As you can see, the city is the “soul” of South-Korea. The first impressions of Seoul I got were how huge the city is and how clean (even the subways) it is. Also, from the first moment I felt very safe in this big city and indeed Seoul is a relatively crime-free city.Seoul is divided into 25 major districts. The North Korean boarder lies around 50 km to the north. Most of the residents living in Seoul are Korean, with some small Japanese and Chinese minorities. International residents represent about 2% of the total population. Buddhism and Christianity are the two major religious in Seoul. In 1988 the city hosted the Summer Olympics and in 2002 the FIFA World Cup. It is the fifth most expensive cities in the world and the second most expensive city in Asia. The Han River bisects the city.How much is the daily life in Seoul? Public transport, basic meals, admission prices and accommodation are rather cheap, although famous restaurants and luxury hotels are expensive. Examples: 2km taxi ride: ₩1900, Cinema ticket: ₩7000, Litre bottle of water: ₩1000, Palace entry ticket: Free to ₩3000, Top-class dinner: ₩50,000. And if you like to travel within Korea, then I can give you an advice – you can save a lot of money if you book the famous Korean love motels. I have never seen so many motels in my life, but it is convenient. You get everything you need, it is clean and per night you pay around ₩30,000 for one room. Tipping is not necessary in Seoul. This is not common in Korea and people will insist on giving you change. You can use your credit card in nearly every shop, hotel and restaurant. Otherwise you can use the Global ATMs. They can be found outside banks, near subway stations, airports and department stores, as well as convenient stores. If you need a newspaper, Korea has three locally published English-language newspapers: the Korea Times and Korea Herald and not to forget the International Herald Tribune. Beside these three English-language newspapers, nearly every other magazine and newspaper is in Korean.Almost everything I experienced in Korea was different. The customs, the food and the writing-system are unlike anything in Western countries. For example parts of the street scenes are: “bali bali” (hurry, hurry), pushy people and scooter drivers on the sidewalk who absolutely don’t care if you move out of the way or not. And be prepared when it comes to communication. Few people speak English, but there is always a way to communicate. So, don’t worry! It is a part of the experience. Many restaurants in Seoul also have an English menu, but there are also many restaurants (especially on the countryside) with no English menu, so you have to order your food by picture."
50,“Visit Seoul!”,people are friendly. food choices are awesome at reasonable prices. many places to visit. public transportation is so amazing. several hundreds of subway stations in and around Seoul. Bus system is awesome as well!
40,"“My short stay in Seoul, South Korea”","I was in Seoul for 4 days and 3 nights. Coming back from a business trip in China. It was supposed to be a relaxed short stay. But what I got out was way more than it.Seoul was a lot like Shanghai, China(maybe it's the other way around). The street scene, the city, the store, the subway. It's like a modern asian city. The place is filled with coffee shop, brand name like Starbucks or Coffee Bean & Tea Leaf is everywhere, the density of those shops are so high, that you can see the whole street is filled with coffee shops.I heard lots of tourists love shopping in Seoul. I guess I really don't see much desire of shopping there. I can get way cheaper and better quality stuff anywhere in a mall in US. I don't see the appeal of that anywhere in Seoul.Food in Seoul is good, it's normal compare to other asian countries. BBQ is most made with pork. I need drink more next time to see whether it is that good.Overall experience is good. Just wish to have a bit longer"
50,“A Fabulous City to Visit - Wonderful People and Sites”,"Seoul is a huge city of 22 million within the regional area, yet it is clean, safe, and has excellent transportation. The historic sites and cultural attractions are incredible,10 UNESCO properties within a short distance - more than some countries have all together. Entrance fees are $1 or $2 or free for some of the largest, most incredible museums and cultural attractions in the world. If you are a vegetarian you will love it here - they eat lots of vegetables, rice and meat is always optional - the food is exquisite, fresh and it is fun to eat with metal chopsticks; much tricker than plastic or bamboo. At night the city comes to life with music lights, and you feel the dynamic of a major city like Paris, Bejing, New York or Frankfurt. There are very few homeless, the streets are clean and safe, and you can walk the various shopping districts, night and day in comfort. The shopping is amazing, they have stores and shopping districts that are larger than some North America cities! And if you want a cultural shopping experience - go to Isadong; if you want fashion, go to Meoyondong. And there are many markets where you can barter - but watch out, they know if you are a tourist - so negotiate, you always can. The airport is efficient, transportation efficient, but watch the taxi prices to and from the airport. They charge you for the driver, and the tolls, but our driver never told us. To take the limo bus was $30, the taxi drive who was to take us to the limo bus told us he could drive us to the airport for $50 - so we said yes. When we arrived, he charged us $70 as he paid a $7.50 toll bridge in, and presumably then again out, plus a $5 extra fee! So while the ride was comfortable, this was the only dishonest experience we had. For english speaking people, there are folks who can help you, but be prepared to be immersed in a language and culture where Koreans, Japanese and Chinese represent the majority of tourists - it is simply wonderful if you like to mix with foreign environments and don't mind a few adventures with limited language! I will definately return and recommend to my friends."
50,“BigBang BigShow 2010 in Seoul”,"Date: 2010/01/29After planning for so long, finally I arrived Seoul.Thank GOD, I made it!!!To be here in Seoul, and have chance to enjoy a greaaaaaaaaat concert in 잠실종합운동장( Jamsil Olympic Stadium) with BigBang and VIP.I really enjoyed the concert, BigBang really had a great show!I enjoyed the video they took, they are so cute!!!!Especially GD, when he woke up, his hair style is so cute. :)Though he put on his hat right away...........XDDDI also love Taeyang's solo performance!!!I loooooooooove his song ""WHERE U AT"" and ""WEDDING DRESS"".In the concert TOP also revealed his new song ""Turn it up"",although I couldn't realize the meaning of the lyrics,I was impressed by the music video. TOP is so cool!!!I love BigBang's songs!Their songs were so cool.I wish I could go to their concert again!Again and again!!（←2PM？ hah）"
50,“What a great city Seoul is”,"My wife and I had our holiday in Seoul in beginning of June. I must say that it is the one of the best trips we ever had. Before we leave for Seoul, we are expecting that everything is Seoul is expensive due to the fact that she is one of the most expensive cities to live in in the world. But to our surprise, we found it the opposite. Food in restaurants is very reasonably priced, I can say that it is cheaper than the same meal in my home city, Jakarta Indonesia. We tried some of the restaurants that is recommended by tripadvisor and it is not to be disappointed. We did a lot of shopping but not once, we stepped into a department store. We went to Insadong, Namdaemun Market and Myeongdong to shop and found a lot of bargains. The people of Seoul are very friendly towards the tourist and there are many tourist information centre to help us. They will walk to you if you look confused and help you in everyway. Great food, Great Shopping, Friendly People, had a nice hotel to stay.....what more can I ask?"
50,“Overlooked city ... although it has sooo much to offer!”,"Being the first time in Seoul, South Korea, I was amazed! I didn’t expect the city to be that vibrant, lively, and upcoming/modern. Luckily I was there before the rainy/wet/hot season; so May/early June seems to be good. Culture-wise Seoul offers sooo much (especially World Heritage sites, but also art galleries, very authentic food places, etc.). I definitely will come back, as this – in my opinion – is one of the most underestimated travel destinations in Asia. As a downside, though, I think the size and the “outspreadness” of the city is something to bare in mind, when planning a trip."
40,“full of surprises”,"The trip to Seoul was an experience. November was cold ( -14C ) and I could feel my feet goin numb even while walking on the street. We had to walk into a store every 5 mins to keep warm. the food was great..an experience in itslef with the grill and the iceberg lettuces that go with every meal. Its a great place for shopping too... A TIP : go thru a local Travel agent for a trip to the DMZ ...going thru the hotel was extremely expensive...in the DMZ , go thru the tunnels only if you are fit and fine...it can get very tiring...overall the place was clean, the food was great and the people were very friendly..Nice place."
40,“Seoul food”,"Sally and I arrived in Seoul with our little travel map that we got from our hotel. The Rainbow Hotel was very clean & inexpensive, but from a western standard, needs some improvements. 8000 won ($8.00 AUD) via a very clean bus to our destination from the international airport. Language was the main issue as there was very little signage in English. This aside, the locals were very helpful in advising us where to get off and also one girl directed us to our hotel. Great service. We walked around the city for the next day, visited the Imperial War Museum. Huge place and well worth the admission fee. We had a Korean guide the next day. He was brilliant! English speaking and very knowledgable.Well done Bumsoo Kim! Food is brilliant! Cheap, filling and lots of it. The last day we had to try a Korean BBQ. We found one in the Yongsungoo District just around the corner from the hotel. Once again, we were not disappointed! The food was excellent, the table was packed with condiments and replenished as used. For $8 AUD, it was well worth it. $4 for a 500ml beer or $2 from the 7-11. We will definately go again!!"
50,“I love Seoul!”,"A friend and I decided to go to South Korea on a whim. See, most people our age would choose to go to places like Hong Kong or Singapore for shopping. But since we're not big shoppers, and Manila's currently being invaded by the Korean fever, we wanted to know what the fuss was all about. We didn't want to invest too much so we decided to get a budget hotel, Garbato Hotel at Hawolgok-dong, Sungbuk-Ku.Day 1: Traffic was bad going to the city from Incheon so we got there at about 11-ish and at that point in time, we were dying to lie down on a bed. The previous review was right. It was about a 5-min walk from the Wolgok subway station and a stone throw away from the SK gas station. The hotel looks cozy but unfortunately, we never got to see the insides of the rooms. While checking in, the owner, Mr. Hiroshi Matsunami, pulled us aside and told us that they overbooked. I was tired and confused, I couldn't think straight. Fortunately, Mr. Hiroshi-san was a kind businessman and have made prior arrangements for us to transfer to another hotel, with all expenses paid! I couldn't believe our luck! How lucky were we to encounter such honest, kind man at a time like this! He was truly a good man and I thank God that there are people like him left in the world. If only for that experience, I would go back to the Garbato Hotel and write a good review even without experiencing their in-house service. When we finally got to our new hotel, Hotel Noblesse at Yeoksam, we were hungry as hell so we walked to the nearest food establishment that's still open. We paid about 25,000 Won for a fried chicken dish which is expensive by Philippine standards since there was nothing special about the chicken. But we haven't eaten dinner at 2am so I could eat anything at this point. Finally at about 3am, we were able to catch some sleep before out big day.Day 2: On our first full day, we decided to get our cultural sightseeing and shopping over with and headed towards the Geongbokgung Palace. The sites were fantastic! Especially when they were changing guards around noontime. The costumes, the handpainted ceilings, the gardens were a feast for the eyes. I felt like I was watching one of those Korean-novelas on TV live. The National Folk Museum of Korea is a must see as well. The locals were friendly and although they have difficulties with English, they try hard to make the tourists happy. Our day was starting right. At around 2pm, we decided to get some shopping therapy and headed towards Insa-dong. From the Jong 3 (sam)-ga subway station, we walked straight into a local Korean restaurant for lunch. It was a traditional restaurant so we sat on the floor and ordered some Kimchi Pork Stew and rice. It was served with the traditional Kimchi, pickled Zucchini and Fried Seaweed Stems with a sour-like sauce that I can't identify. Our meal was fantastic and very affordable at 7,000 won in total! After that, we walked to Insa-dong and it was a sight to see. The street was filled with tourists and locals alike and was lined with street vendors selling anything between little knick-knacks, hats, street snacks, cherries, candies, etc. It was definitely an experience. At the middle of the street was a park where free drinks from tea, hot chocolate, coffee and popcorn where passed around. I love Seoul! After hours of shopping, we headed towards the Gangbuk Jeongdong Nanta Theater for the 8pm show. Although tickets should be reserved at least a day before, we were lucky that a couple of seats were still available. The theater was small, probably about 200-seater but was jampacked with tourists. The show is a must see in Korea! I was laughing the whole 1-1/2 hrs so I will definitely go back if given the chance. The actors were multi-skilled performing like standup comedians, doing stunts, magic, interacting with the audience without talking so even non-Korean or English speaking audiences would be able to appreciate it. After the show, we went to a small local restaurant across the theater and grabbed a quick bibimbap and ramyeon dinner. Nothing spectacular but it was filling for the price so no complaints there.Day 3: Our third day was allotted for some amusement park fun at the Everland theme park. We had some problems looking for the bus stop going to the park so for first timers, it's actually the bus stop in front of the Who.A.U flagship store at Gangnam. It was about an hour ride, including traffic. We didn't get to enjoy most of the signature rides like the T-express or any of the roller coaster rides because of the rain but the rose garden and the four seasons flower garden were a sight to see. On our way back to the city, we stopped by one of the inner walk local restaurants to get some Jjigae stew that's cooked on a stove top on the dining table. Because we were at downtown Seoul, the price was fit for downtown dining but it was a different experience cooking and eating at the same time so it was good value for the price. Finally at 2am, we got home and rested our throbbing feet in preparation for last day.Day 4: Our last day in Korea was a Sunday. It was still raining and we only have half a day to do some last minute siteseeing and shopping so we thought we'd limit our trip to the Dongdaemum market which supposedly was open 24hrs a day. This was not entirely true since when we got there, we didnt see any open establishment so we decided to just head back to Insa-dong for a quick lunch at our now favorite little restaurant and some last minute souvenir shopping. We got some walnut cakes which are yummy and tasty specially when hot and picked up some extra souvenirs to be given to friends at home. After struggling to haggle with the non-English speaking front desk officer at the hotel, we checked out at 2:30pm and headed to the Airport Express bus terminal at Gangnam. After an hour we got to the Incheon International Airport. The airport is huge and as impressive as the Hong Kong International airport (sorry Changi, I wasn't that impressed with you) housing some well known international brands and local souvenir shops. You need to catch a short train ride to the 100+ gates so make sure you allot at least 30mins going to those gates.I was sad to leave because in 3-1/2 days, I got to love Seoul. If given the chance, I would definitely go back!"
50,“fantastic city”,seoul is the cleanest city we have ever visited and we have traveled through out the world. the people were helpful even when they spoke no english they would find others to help us get around the city.i recommend those that think all asian cities are all alike to take a visit and see this fantastic city.
50,“Seoul-Free and easy travel”,"Seoul-Free And Easywe had an excellent one day tour of seoul organised by US TOUR-email master@ustravel.kr, thier tour guide B H YOO email [--] was a real gentleman and so informative-the korean culture, history, food, politics and no pressure shopping. We had a excellent introduction to seoul and korean way of life and sightseeing. We were hesitant at first, the ongoing war talk from the north korea, after this one day visit we felt as safe as anywhere in the world. We visited the king's palace, the korean folk village, the korean folk museum, passby the presidential palace, ate a typical korean lunchbimbibak I think. It's really healthy.The city is spotless clean, very polite people, even changed money for us when we are stuck with big notes in the local bus ride. Great bargains at the namdaemun and dongdaemun markets.And the usual high end fashions and the big prices.The Ibis Hotel in Myeong Dong is in a fantastic location, close to everything and bend back wards to please us and the other customersYou will just love Seoul, like us."
50,“Shopping heaven!!!”,If you like to shop -- don't miss visiting the MANY marketplaces of Seoul! You will NOT be disappointed. Surf the internet in advance of your trip and print out maps and location names for the places you want to visit in Hangul. These will come in handy when you are asking for directions or needing to provide a place name and location to taxi drivers. The only drawback is you'll want to return again and again!
