40,What a climb!,You can take the big stone stairs straight up or the trail with switchbacks. We took the trail up and the stairs down. Great view from the top and there is a small interpretive center up there. It was a great activity for getting a bit of exercise and not taking too long to do it.,https://www.tripadvisor.com/Profile/DeeD916
50,View,"Beautiful view over the city.Also, a lot of people walk up the stairs to the top, really great excersize.",https://www.tripadvisor.com/Profile/Britt333777
50,Hidden treasure in Culver City,"This is a great place to exercise, enjoy nature and see a great view of the city. It has a street and also nature trails where you can admire the plants, flowers and insects. I always use the entrance that gives access from the Culver City Park. While my sons practice, I exercise in the Baldwin Hills Scenic Overlook.There is a $6 parking at the top or you can parked on the street. Bring your camera and taje pictures! From the top you can see Culver City, The Hollywood sign and downtown on clear days.",https://www.tripadvisor.com/Profile/Mayra-EstiloFamiliar
50,Stairs at Baldwin Hills Scenic Overlook,"If you need/ want a free workout, hit the stairs at this park! When you get to the top, you'll have a 360 degree panoramic view of Los Angeles and a racing heartbeat! hundreds of locals hit the stairs here daily for a tough workout and a rewarding view!",https://www.tripadvisor.com/Profile/stephencP5577BL
50,Amazing view of L.A.,This place is so intense! Park on Jefferson and walk up the stairs or the hill. Once you're at the top take a moment and enjoy it. It's a great view of LA.You can also turn into Hetzler and go up the hill to park for $6.,https://www.tripadvisor.com/Profile/kisssmee
50,Great hike,"It's a great hike up the stairs. It's close to 300 steps and the steps are not even, some are wider some are more narrow. It has nice bathrooms at the top and a nice are to relax at the top of the mountain. Street parking (my car got broken in) so make sure you have nothing visible in the car.",https://www.tripadvisor.com/Profile/Missellen1
50,Beautiful view and good workout,"This is a great view and great workout. Come prepared. Parking was easy (Friday 4:30pm). The view was amazing at sunset (even on a hazy day), we were able to see Downtown LA, Hollywood, Century City, Santa Monica, and I'm guessing El Segundo it looks like. If you don't feel like doing stairs there is still a winding hiking with a gradual incline. It can still be a workout, but not as difficult or rough on the knees.I definitely recommend this place for residents to visit if they are looking for a fun workout. I would recommend it for visitors for the view. I couldn't see a visitor spending a whole lot of time here unless they were working out and making multiple trips up and down. It is also not really close to anything. So you would need to drive.",https://www.tripadvisor.com/Profile/27amandag
50,Walk Up the Hill Regularly,"Beautiful views from Catalina and Marina Del Rey to the Santa Monica Mountains and the Hollywood sign to Downtown L.A. and the San Gabriel and San Bernardino Mountains.Awful stairs too large to be comfortable. You see people twisting their bodies in unhealthy ways to get up some of those huge, chunky, deteriorated concrete slabs. But the zig-zag trails that go up the hill are great.People, please don't take shortcuts! With hundreds of people walking up to the Overlook daily, just a small proportion taking shortcuts quickly causes erosion and packs the soil so much that plants can't grow back.",https://www.tripadvisor.com/Profile/SingDanceTravel
50,Scenic Stairway Trail to Marvelous Views,"This is a recent addition to the attractions in Los Angeles. I really enjoyed visiting here. I went on the Baldwin Parklands shuttle to get here. Once you're on top of the hill, there is a visitor center (open only Friday-Monday from 9-4, depending on staff availability) with a short film, and a number of trails you can explore to get magnificent views of the Los Angeles area. You can drive to the top but there is a $ 6 charge to park up there. Most visitors avoid the fee by taking either the stairway trail or another trail without stairs to reach the top. On Saturdays, Sundays, and some holidays, a shuttle bus (costs 25 cents to ride) called the Baldwin Hills Parklands Shuttle goes to the top of the hill from the Metro Expo Line station at La Cienega at Jefferson. From Hollywood and Highland you can take the Metro bus line 217 going Westbound on Hollywood Blvd (southbound on the bus schedule) to get to this station.The website for this attraction is http://www.parks.ca.gov/?page_id=22790Here is a website for the shuttle info:http://www.transitunlimited.org/The_Link_Baldwin_Hills_Parklands_ShuttleNote that the shuttle stops running at sunset which can be earlier than 6 pm or later depending on the time of year you visit.",https://www.tripadvisor.com/Profile/jasonplatt
