50,"One of the Great, Small Museums","This place is easy to get to and with good parking. There is a shop and some dining--Patina. There are gardens and outside sculptures. The paintings are the draw, European and wonderful. Then you wander and discover the excellent south Asian and Indian art, and you see this collector go beyond the Western traditional and into new areas of interest, with great results.Then you might take in the new designs by Frank Gehry to make the interior work better, and this too is pleasing. Nancy Goslee Power's gardens are a complement to the museum's interiors, but very different.Then you might see an exhibit of recent and contemporary work the museum received dating to the 60s, which is one more surprise.So it is a small place, the opposite of an encyclopedic institution like LACMA. What it does have, though, is the best of things Simon collected. It reminds me of the Frick.",VeniVidiFrui
50,A really important art collection but manageable to see!,"This is a very manageable museum to see. The impressionist collection is excellent and includes a complete set of Degas' sculptures -- the only first casting in the world made directly from Degas' wax figures. There are wonderful Renaissance and later European masterworks: Botticelli, Fra Angelico, Rembrandt, Memling, to name just a few. What is most unusual is that almost every painting is a gem. There is very little of ""ordinary"" art here. Walk outside before the end of the day into the sculpture garden. It is not large, but is beautifully conceived and filled with masterpieces of modern art. If you have time, go downstairs to see the famous collection of art from India. I learned to appreciate the lovely sinuous qualities of Indian art in this museum. When you leave be sure to get your free copy of one of the museum's artworks. They give out a different work of art every day.",oldtravelady
50,A World Class Museum,"This is a magnificent art collection. The Museum doesn't open until noon and is closed on Tuesdays, a problem for us since my companion was free only on Tuesday. That aside, I spent a full 4 hours there and could easily have spent a full day savoring this wonderful art.",laurgam
50,Norton Simon Museum is a Pasadena Treasure,"Adjacent to the 134 and 210 freeways gives easy access. Located just around the corner from Orange Grove Blvd on Colorado Blvd - you will glimpse this museum often in the background for it is where the Rose Parade makes its first turn that one can see on TV.There is a schedule of special exhibitions and events - even movies of his movie star wife, Jennifer Jones. If you wish to spend a pleasant afternoon - this will keep you absorbed with its variety and splendor. There is so much of this collection in storage that what is on exhibit today you will have fresh art work to view on subsequent visits. If you have a large group, do request a docent. Parking is free. There is a lovely garden in the rear with food and drinks available along with many sculptures. My grand daughters, from 5 to teens, love to take a sketch book and draw their favorite statues or paintings. It seems to me private collectors like Norton Simon have the better of the artist's work very often - rather than documenting all phases. A superb European collection from the 14th through the 19th century - not to be missed. Military and children under 18 are free. Admission is 10 for adults and 7 for seniors see web site for schedule of free days. Closed on Tuesdays. The Degas paintings and sculptures are a favorite of my young ladies.",Go_USC
50,"smaller art collection, very high on quality","I was highly impressed with the number of famous artists whose works are on display. This museum is easy to get to, nesr the freeway in Pasadena. well worth your time to visit. free parking.",KAQuinn
50,A Favorite Place,"This museum is one of my very favoriteSouthern California haunts to visit. The setting, art work, sculptures and especially the impressionistic art are appealing to me. The atmosphere is relaxing and the layout of the galleries and gardens are conducive to a pleasant experience. We have visited this site about six times and never tire of the experience",gusgus1
50,Worth a visit,Excellent art collection. Reminds of the museums I visited in Paris and Rome. A nice outdoor garden for relaxing and waiting.,starfong
50,Think Amazing Art Gallery across 2000 years!,"We aren't even big Museum or Art gallery fans (at home), but we followed the high TA rating to visit Norton Simon, and loved it. To us this is more Art Gallery than museum, but the art (including SE Asia) dates back from BC, and includes European work from 14th century through modern 20th century art works - both painting and sculpture.Norton Simon collected one of the most amazing private art collections during just his last 30 years to then share with the public in Pasadena! Allow 2-3 hours, or come back several times. And stroll through the sculpture garden when you visit the outdoor cafe.",BogeyPeter
40,The best museum in Pasadena,"Although many are not aware, there are actually dozens of museums in Pasadena, but Norton Simon stands apart from them all. The collections of this museum are on par with what you might see at a New York Met or MOMA or even the Louvre, all of which I have been to at least once in my life, so walking through the halls and exhibits of this medium-sized museum felt as if I had been transported to another time and place and that is the magic of this museum. You can spend just one hour here and find yourself completely immersed in culture from the European impressionism to classical Chinese paintings to culturally-relevant American pop art. The sculptures in the garden make for a nice stroll.If you are only able to visit one museum in Pasadena, this would be the MUST SEE museum.",mrmiguelito
50,Excellent collection,My favorite museum. Great paintings and sculptures. Perfect size and nice little cafe in the beautiful garden.,cherylflea
50,Awesome collection,"This is an incredible collection of modern, classical and impressionist art. The layout provides an opportunity to view paintings and sculpture to the left from Degas, Picasso, Van Gogh, Cezanne, Rodin, etc., or a more classical collection to the right as you walk in. Don't miss the sculpture garden in the back. It is a wonderful way to spend 1-3 hours and not a bad walk from the center of town.",Ger203
50,Pasadena's Gem,"It's a must-visit for the art lover. The collection, although not massive, is very impressive. The attractive garden with its lily pond and nice little cafe allows for a nice break during the visit. Well worth a visit.",cahrcgjpc
50,Excellent collection,"It's a small museum with exquisite selections of Impressionist and Asian art. The garden is smallish, but allows for a lovely stroll.",cjnkira
50,Norton Simon,I go two times a year and it is always a treat. Well worth the time. some type of art for everyone. I like the old art the best my friend loved the newer stuff. This is one of the nicest in town .,samewame
50,Don't miss the Simon,Tons of Degas and some van Gogh too. Easily worth 3 hours or more. Best attraction in Pasadena. Do not pass up this museum.,Ross R
40,Chillin' on Colorado Blvd,"Whether you spend an hour or an afternoon you will be delighted with this museum. The art is amazing and depending on the feature of the month the new installations are presented with great care. I always try to go when they are featuring photography. A lovely, peaceful place to spend an afternoon.",nanip123
50,This is the number one place to visit just 10 mins from South pasadena hotels.,"There was art work from 14th - 19th Century with all the top artists. The gardens outsdie were excellent with a good cafe and a lakeside walk with all trees, plants and flowers all named as you walk around. Also Henry Moore sculptures all the way round.",WestLondonMrBaxter
50,Big Enough to Merit a Visit But Not to Wear You Out,"The Simon has a very nice- but not huge- collection of Western art complemented with a decent collection of South and Southeast Asian pieces. It's a great place for families or people who have limited time/patience/energy for museums. $10 to enter for adults and kids get in free. Works in the permanent collection of Western art spans from pre-Renaissance to impressionist to modern. Great special exhibits too. If you're visiting Pasadena, this museum is a must.",Arashibi
40,A little gem,"When you enter the museum be sure to walk around the lilly pond in the central garden that has a wonderful display of Henry Moore, Rodin, Maillol, and other notable sculptors. Off the garden is the Museum Cafe where you can enjoy a snack and take in the lovely plantings. Although the museum collection is small by big city standards it has a choice collection that is representaive of Europena, Asian, Modern and other periods. There are other attactions as well such as a multi-media auditirium and gift shop. You can easily spend a few very enjoyable hours in this Pasadena gem of a museum.",Alan G
50,Wonderful Museum,"Great artwork. If you like Indian (Asian) sculpture this is THE place to see it. Rodin as well. I have been to the Louvre, British Museum, etc. While this place is not as impressive it is just the right size for a two to three hour trip. I visit every time I go to Pasadena.",joetzu
50,Awesome! Top Notch,"I used to live in Pasadena and go to the museum every month. I went back to Pasadena last month. Since they remodeled the museum it is even better now! The lighting is better. The design is better. The layout is better.Do not miss the sculpture garden and lily ponds. It is to die for.There are works of art from great masters and the Asian art is fabulous as well. It would take you about two days to see everything if you were to read the plaques with the description of the piece and linger over each piece. It is a large museum. Not as large as LACMA, but still large.It is a top notch collection.",Anja D
50,One of the best!,"Love this Art Museum. Beautiful grounds, and excellent art display. Always a pleasure to visit. Highly recommend this one!",Larry J
50,Beautiful Little Gem,"This museum is just the right size to cover in an afternoon, and it has great depth in its Impressionist collection. The garden is also beautiful and restful (it resembles Giverney, which fits with the theme of the art).",Jazzbeau1130
50,One of the best art collections in the USA,"Amazing art collection, one of the best museums, very relaxed atmosphere, great coffee shop and great museum shop, they have the most extensive private art collection, I have ever seen. You will not be disappointed it is an amazing museum.",blink99
50,A gem,"I'm not sure if this would be worth a trip from afar, but having been in Pasadena, I stopped in and was VERY impressed with the collection. It's on the small side, but full of gems.Well worth a visit if you're in the vicinity.",SanFranDan99
50,Fantastic collection of art,This gallery has a great selection of art works by many of the top painters in each period - definitely worth the small entrance fee. Lovely selection of excellent examples from each painter - almost like leafing through an 'introduction to art' book. The garden is lovely and peaceful and the small café reasonably priced. Best gallery in LA (perhaps even the whole West Coast).,Taymar
50,Still one of the great museums of the world,"Walking through the beautiful sculpture garden is always a treat. The atmosphere is soothing and the work is always world class.Nothing in any museum beats the modernist/impressionist wing that holds some of the world's best paintings by masters. The Van Goghs (self portrait, mulberry tree, and his mother's portrait) are some of the best in the world. From Manet to Money, Picasso, Klee, Kandinsky, Nolde, Tamayo, Braque, Mondigliani, the list goes on and on. Many museums have works by these masters, but the paintings that Mr. Simon amassed are simply the BEST OF THE BEST. Museums like the Hammer (who had scads of money) have many of the artists, but NOT the BEST works by far. Simon had the best.Don't miss the extensive Asia collection on the other side of the museum which has some of the most peaceful spots to meditate of any museum I know. Not to mention the stunning Rodan's that greet you upon arrival in the front.",CayeBoy
10,RUDE RUDE RUDE,"Unless you're over 50 and have NO KIDS this will be the only way to enjoy this place. The art collection is vast and the outside ground beautiful. The had Dali and Van Gogh. Too bad all that beauty is over shadowed by the rudeness of the staff. They keep a close eye on kids and make a point to be very forward and blunt if they even think your kids are misbehaving. My kid wasn't running around or touching anything and just because she kept walking fast to each art work I was told that my child needed to stop horsing around. So what she was excited! She loved painting and her favorite was Andy Warhol. Seriously, If there are children misbehaving, the parents shouldn't have taken the kids to the Norton Simon Museum in the first place. It's the parents fault not the kids for lack of better behavior. After being told 3 times for my daughter to contain her excitement, I told her we needed to leave. I even told the guard by the door that they were rude and expected visitors to be prude and quiet as in a funeral. I WILL NEVER take my child or myself to this museum again. If you have kids I suggest the Getty Museum or La Brea Tar Pits, with plenty of children's activities to do there. You and your family will enjoy the day. I was so disappointed in this place and after all the recommendations I heard, never again.",cloudb310
50,Favorite smaller museum,"Exceptional collection of Impressionist, post-Impressionist and earlier European art complemented by an appropriate pond and garden. Artists include van Gogh, Renoir, Monet, Cezanne and Rembrandt.Great for both those who like long and those who prefer efficent (one hour?) museum visits. The lunch offerings at the garden cafe could be a lot better.",packcal
50,Birthday fun,Came to Pasadena for a quick little birthday get away and specifically to visit the Norton Simon Museum. What a gem of Southern California! I love not too far from it and had never been. I absolutely loved the visit and so did my children. The collection of art is spectacular! We have been to the Getty and enjoyed there but especially loved Norton Simon and how beautiful the grounds were and how amazing the collection was. Loved the Degas!!,Nordyclan
50,A true museum,"Every place art could be is displayed. The environment is relaxing, including the portion outside. Not to mention Veterans have free admission. A Pasadena secret.",Opie T
50,Worth the walk,"Having been advised this would be a good place to visit and having made the decision to use public transport in LA, I made the trip to Pasadena and from the shopping area on Colorado BL I walked to the Norton Simon Museum. It was well worth the walk. An excellent collection of European art and sculpture together with an Asiatic section, made for plenty to see without being overwhelmed. The outdoor sculpture garden and cafe area were a haven on a very hot day.",Maria S
50,Gorgeous,"Worth the drive to Pasadena for a nice afternoon visit. This is a gorgeous collection in a lovely and relaxing little museum. Since it's open noon to 6pm, you can take your time getting there and have brunch on the way.",CapricornSister
50,So much to see,"Games of color light and shadow many styles paintings, sculptures tapestries take your time. I enjoyed this definite change of pace for me.",Joseamel
40,"Great collection, lovely garden, not super baby-friendly","I'm a local and I've been to the NS twice. The collection is a nice size and quite impressive. It's a moderate sized museum without the name recognition of, say, the LACMA or the Louvre, but they have Gaugins and Riveras and Van Goghs etc. The sculpture garden outside is just lovely. BUT.BUT apparently it is one of those museums that doesn't allow you to put babies in back carriers. I guess this is a thing? I've gone to a zillion museums in my life, but I only just had my first baby, so I never knew it was a thing before.Long story short, baby gets fussy in his stroller and is too heavy to wear in front carrier, so I brought a back carrier. Not only did the guards refuse to let me put him in the back carrier, but they were huge jerks about it. Guard #1 asked if I wanted to check with her manager, to which I said yes (hoping the manager guard might cut me a break), but he just marched up and said, ""You wanted to talk to me?"" and then stonewalled me with the ,""Sorry, it's a rule,"" response.I get it. I get that they're concerned people with backpacks, back carry babies, will turn around and accidentally knock into some art. Or maybe the baby will reach out and grab something when you can't see it? But to that second end, why allow children at all? I just felt like, it was 5 o'clock on a Thursday afternoon, there were about 10 patrons left in the museum and a zillion guards. Maybe tell me not to do it next time, and cut me some slack this time, and let the guards just keep an eye on if I get too close to stuff? Instead it was more like a person being excited to wield the small amount of power he has, this time to a woman with a screaming 6 month old who was just trying to get out of the house and enjoy the cool air and the pretty art collection with a friend.Honestly, I was so shaken by it, that when the baby needed his bottle I hid in the bathroom stall with him because I figured I'd get yelled at again for having liquids in there. It should go without saying that the bathroom has no nursing facility or area at all, so I'm guessing you are supposed to go outside to do that?I will say the 'no backpacks' rule is listed on their website, but the back carriers thing is kind of obscurely mentioned (eg it doesn't say, no back BABY carriers, so it's easy to miss that that is what they mean by carriers or you're supposed to deduce from backpacks.Anyhow, bottom line, it's a beautiful and nicely curated museum, but they aren't very baby-friendly and most of the guards I encountered weren't interested in being helpful, which is a shame because it's left quite a bad taste in my mouth that I didn't want to have.",Heather H
50,"Free first Fridays, joined in support!","The first time I visited the Norton Simon museum was on a first Friday of the month, and it turned out to be free! The show was Hiroshige: Visions of Japan. Drawn from the museum's extensive Japanese woodblock-print collection, the exhibit featured 175 prints by Utagawa Hiroshige (1797-1858). So I joined on the spot to support this fine museum, and saw this exhibit about 5 times, bringing a different friend as my guest each time. This is a fabulous private art collection housed in an intimateThe museum is located at 411 W. Colorado Blvd. in Pasadena on the corner of Orange Grove and Colorado Boulevard at the intersection of the Foothill (210) and Ventura (134) freeway. It's in downtown Pasadena, with easy freeway and surface street access and free and ample parking.As you exit the parking lot and walk up the entrance steps, several of Rodin's sculptures greet the guests, but walk around the whole building for some surprises. Pass through the museum's lobby and exit to the large garden, surrounding a pond with bog plants, lilies, and often, a family of ducks or geese. Each section of the garden has its own theme and seasonal specialties. A circular stroll around the pond yields sculpture but also each significant plant is labelled, so you get your botany lesson too. http://www.nortonsimon.org/gardenInside, intimate rooms featuring 14-16th century art, 17-18th, 19th and 20th-contemporary art (a lot of Degas sculptures too) and sculpture. There are also rooms with Asian art and prints. You might take in just a room or two or the whole museum, depending on your time allowance.I often bring a friend for lunch - I can bring in one guest with my membership - and the museum is less than 10 minutes from my work. We view one room or section, have lunch, then return to work, refreshed and inspired.As a member, I look forward to the member's receptions held several times a year. Built around a special exhibit, or a preview of a loaned treasure, these evening receptions with lite refreshments (by the Patina Group) and wine are an elegant introduction to a prospective member, or a treat for a friend.Recent reception previews of exceptional art included Johannes Vermeer's Woman with a Lute c. 1662-63, Vincent Van Gogh's Self Portrait 1889, and Hans Memling's Portrait of a Man c.1470-75. Recent collections featured at a reception include Beyond Brancusi, contemporary sculpture of 16 different artists, and Significant Objects - The Spell of Still Life - 17th and 18th century still life paintings.I have the row of the reception invitations, the front of which is a work of art from the special showing, on my wall at work. They inspire me when I can't get out to the museum.So whether you have just an hour to spend, or an afternoon, you'll enjoy a visit to this museum. Admission is $10, but if you join, you get free headphones ($3), a quarterly magazine, and invitations to lectures, movies, and the wonderful evening receptions.If you are a local or visiting Pasadena for the Rose Parade, a football games or just some southern California tourism, add the Norton Simon to your itinerary. It's the #1 Tripadvisor attraction in Pasadena.A plus, not like many larger museums is the hassle-free free parking just steps from the museum, plus comprehensive indoor and outdoor exhibits. Oh, there's also a nice outside cafe with shaded tables just outside too. And a great museum store, too. 12-6 p.m. except Fridays, 12-9 p.m. Closed Tuesdays. Students with ID are free, as are children 18 and under.Worth a visit!",astrojane
50,Spend a day,"Fabulous art museum with outstanding collections. Spring for the $3 audio tour, and start to the left of the entrance with the 20th century.",dle0313
40,"excellent collection, finely managed, friendly staff","This is a fine museum with modern, soothing color schemes and well designed floor-plan.They have an extensive collection of excellent Eastern artifacts. A lot of care is invested onthe staging and lighting to amplify the quality of the artifacts.They allow photography! What a real treat! I had a field-day.Outdoors they have copies of Rodin's sculptures. I will return some-time in day light to take photos soon. I saw the originals In Musee Rodin, Paris just last month.Students with ID gets Free Admission here. Seniors $7. On the first Friday each month, admission is free from 6-9pmThey also have musical performance, Lectures in their theatre.We just saw a Harp, Flute and Soprano ensemble tonight - no additional charge.Check their web-site for updates and Go!",3Kells
50,Lots More than One would Expect,"Terrific museum with lovely sculpture garden, as well (unfortunately the garden was near a highway so you heard lots of road noise although you did not see the highway). The exhibits contained several impressionist works of art that we do not expect to see in Pasadena: Van Gogh, Manet, Monet and others.",RichardLBrown
50,Don't Miss The Norton Simon,"Over the past 10years my wife and I have probably visited the Norton Simon no fewer than 5 or 6 times. This is a collection that is forever new and interesting-- the number of Cezanne paintings alone would make it a destination, but there is so much more, the Dutch paintings, including several Rembrandt's too would justify any visit, not to mention the wonderful oriental sculpture collection on the lower floor. Give yourself at least 2 hours. An added benefit is the free parking, simply inviting you to visit.",oborozuki
40,Impressive...but expensive,"The Norton Simon Museum is a must stop if you are anywhere near Pasadena, CA! The collection of Impressionist artists is truly amazing, with a very good study of Degas. The museum is on the small side - but you would still need at least 4-5 hours to take really view the works both inside the museum and outside in the sculpture garden. And therein comes my 4 versus a 5 rating. The cost for adults is $10 per visit, not optional. The average person can spend about 2 hours max in a museum if you really want to digest the art. So you would ideally need 2-3 visits to really enjoy the Norton Simon - which would translate to $30 per adult over 18 years of age. A little pricey for someone on a travel budget when many museums are free or accept a voluntary donation. I was also a little off put by the ""shushing"" of people talking (normal voice) by the museum guards. Engaging and talking about the art in a museum is one way to gain different perspectives on a work of art, in other words expands your enjoyment and understanding. Even with the cost and ‘shush’ factors, I know I found a few new 'favorite works' to add to my list and would go back on my next visit to explore more!",SullyGirly
