30,"Average little museum, I don't understand the hype?","Its a beautiful little museum w Free admission, It takes maybe 10 minutes to walk all the way through it you are a casual viewer. If you like to read the plaques, maybe 1 hour to complete. Exhibits change often and the staff is friendly.Parking is not easy and you will need to pay and park underground of one of the nearby Skyscrappers. There are no signs once you leave the parking garage to get to the museum, you just have to find your way outside first and then eventually you will find the sign leading up the hill to the small museum.If you are visiting Los Angeles, definitely not worth the trip.",https://www.tripadvisor.com/Profile/ashleysK4355MG
50,Loved the Lauren Greenfield - Generation Wealth Exhibit!,Super cool space! Show was packed but worth seeing. Nicely laid out. Parking was easy. I ended up buying her book and the service was excellent. Nice people and the space was very clean. I am submitting this review way after the fact and cant remember if this date is correct or not.,https://www.tripadvisor.com/Profile/bridgetf985
50,Outstanding exhibits,We have been to many of their exhibits. They are well done. There is a video giving an overview of the exhibit and then there are wonderful pictures with explanations,https://www.tripadvisor.com/Profile/Romance2016
50,Terrific Small Museum,"This museum teaches us about the impact of photography of each of us. THe video is gripping and, while the exhibit itself is small, it is thoroughly engaging. Parking is free. Admission is free. Allow 1 1/2 hours (then walk over to Century City Mall for a great lunch or dinner).",https://www.tripadvisor.com/Profile/valtraveler10
50,A must visit!,"Whenever I visit my brother in Los Angeles we usually go to the Getty Museum or LACMA, both of which I love. However this time I found the Annenberg space for photography on Trip Advisor and since he had never been he was interested in going also. What a fantastic exhibit. The video explaining the exhibit was excellent and the photos included in the exhibit were outstanding. I only wish that there would’ve been room for more photos. As a bonus there were several restaurants in the same complex so we were able to have a wonderful meal at the completion of our tour. Don’t hesitate to visit this museum. You won’t regret it.",https://www.tripadvisor.com/Profile/687jeannec
50,Small but Excellent,Enjoyed catching the current rotating exhibit shown in the Annenberg Space for Photography. Visits take at least a full hr. They offer free audio tour devices covering about 14 selected exhibits along the self tour path (must trade ID for equipment). There's also a 15 min documentary video in the center area open theater. Don't forget to get your parking stub validated (parking cost is outrageous otherwise - I paid just $1.50 at the kiosks by escalators when headed back to car).,https://www.tripadvisor.com/Profile/Jolangfo
40,A place to see!!!,"Located in LA, the place has a variety of photos from different artist, that will show you USA and its culture in a different way. I had the change of enjoying exhibitions of American Indians, the depression, the changes in neighborhoods through the time, presidents, the United States Congress building and many topics more that emphasizes the humanity of this big nation and its changes in time.Even though the place is small, you can spend hours taking a look of every single shot. The admission is free and the stuff really nice.A must visit if you are a lover of art.",https://www.tripadvisor.com/Profile/Travelcooking
50,A place to see for all those into photography,"The building itself is pretty amazing, and they have incredible photo exhibits. Definitely worth to follow their exhibits program, as they offer very interesting options. Apart from the exhibits themselves, they also have interesting installations to see. I discovered there a few photographers I previously have not noticed.",https://www.tripadvisor.com/Profile/786malgorzatac
50,A true destination for fans of photography.,I have visited the Annenberg on several occasions. There is always interesting exhibitions taking place and a true,https://www.tripadvisor.com/Profile/stuarts813
50,One of the best place to experience in,"This attraction is very wonderful and you can take a look at the most awesome things about space here. When going to LA, you have to check this out",https://www.tripadvisor.com/Profile/navas2002
50,A Wonderfully Located Space,"The Annenberg is a concise, beautiful space located near grasslands and nestled between large, elegant buildings in the heart of Century City, California. I was recently invited to see the Cuban exhibit, entitled CUBA IS, and I liked the fact that the exhibit was in two places: The upper museum and then a short, tranquil walk to lower museum quarters located across the grassy courtyard.",https://www.tripadvisor.com/Profile/rokce
50,Loved this museum,"Tucked away in Century City is this amazing space for photography. My wife and I caught the tail end of their ""Cuba Is"" exhibit and were incredibly impressed. And, with free admission and validated parking, it is a low cost way to spend an hour soaking up great photography.",https://www.tripadvisor.com/Profile/N1337ZZchrisg
50,An LA gem,"Consistently excellent! Not only is the space and exterior surrounding quite stunning, the curated work is always eye candy. Additionally, comprehensive stories and video presentations round out the exhibit and serve to evoke intended emotion and substance. The museum is free and parking only $1.50 with validation. Great receptions and other parties too.Totally worth a couple hours of your time.",https://www.tripadvisor.com/Profile/dawnalicious
50,Excellent place to visit if you [re in the century city area of la,I saw a great exhibit of Cubanphotographers: the museum isbeautiful though t hey do make you walk around outside toget the parking validated.,https://www.tripadvisor.com/Profile/RKZ90027
50,Really worth multiple visits,"First visit to the Annenberg Space for Photography for the exhibit ""Cuba Is."" We were missing out on this incredible venue. Traffic was easy on a Saturday morning. In-house parking was $1.50 with validation. This is a beautiful complex with great landscaping, and seating in the open air. Great place to chill, especially on a weekend. The Annenberg is actually in two parts within the complex. Apparently, they schedule about 50 exhibits a year. I'm looking forward to seeing more of them.""Cuba Is"" is a well-curated, well-documented exhibition. Very helpful labels are in English and Spanish. The photos seem almost personal, often tragic, mostly sad. The video documentary on Cuba, today, is fascinating, educational, and personal, introducing the viewer to interesting people, both photographers, and their subjects. I particularly enjoyed the combination of photography, videography, and music.",https://www.tripadvisor.com/Profile/randylee223
50,Fantastic,The exhibition “Cuba Is” was phenomena! The docents were helpful and friendly and the photos and multimedia exhibits showed a well-rounded view of what modern Cuba is like. It’s not too big so there is time to enjoy each photo and still peruse the gift shop. Don’t forget to validate parking so it will only cost you $1 to park.,https://www.tripadvisor.com/Profile/msdebra007
50,must-see on the west side,"this space is a bit difficult to find at the outset, but worthwhile. you park off constellation blvd in century city. thereafter, the signage is poor. head up to the plaza level, from which you enter the museum. it has two parts. parking is validated. museum, itself, is free.currently, the exhibit is on Cuba, a gem of a presentation, part of Pacific Standard Time/LALA. this is a comfortable, small exhibit space with friendly staff. it is well-organized.one of the nice aspects of this museum is the division into two sections. you walk across the plaza, which is a nice break outdoors. you can get food and sit in the sun, if you wish, as part of the experience.",https://www.tripadvisor.com/Profile/812jeffreyk
50,"""Cuba Is"" is great",We stopped by in the early afternoon last Saturday to see Cuba Is. This was a great exhibit. Multiple photographers capturing life in Cuba. It was fun recognizing places in the background having visited Cuba earlier this year. There is a 20 minute movie that i hope to find on youtube or Vimeo as I would have liked to see it again. Admission is free and they validate parking.,https://www.tripadvisor.com/Profile/craigcN9891HF
50,Always Outstanding,"i have never seen any exhibit that was not excellent including the current CubaThe museum is free, small, validates toward parking and always gives a meaningful exhibition of photography accompanied by a film about the subjects and photographers.Good for all ages",https://www.tripadvisor.com/Profile/joanneg28
50,One of the top 10 things to do in Los Angeles,"I just came from the current ""Cuba Is"" exhibit. Fabulous....felt like I had visited the country. As always there is film along with still photos. They have added a second space just steps away. Several good food options are also on the plaza (at least on weekdays). This great venue is FREE. Parking with validation is $3.00 (a real bargain in one of the most expensive places to park). Always check hours & dates as it does close when changing exhibits. I have never been disappointed.",https://www.tripadvisor.com/Profile/ManhattanBeach
10,Cuba is,Great show but seriously disappointed as an international tourist to not be able to pay for coffee with cash .,https://www.tripadvisor.com/Profile/992sydw
50,A Must-See Destination of High Quality Photo & Video Exhibits,"First, the Annenberg Space offers totally FREE admission all the time, and advance reservations are NOT required. Second, they validate your parking right under the building. Third, the curators do an absolutely amazing job with the selection of the works and the display and content of the work. This is one of the cultural gems of LA in my opinion. Not only have I learned more about the art of photography from exhibits such as the past exhibit of Helmut Newton, but I have also learned more about the world in which we live.If you are in LA, this should be top of the list for any arts-appreciating person or family. I have taken my friends' tweens here, and they were actually moved by the exhibit. Further, the exhibit we saw provoked intelligent questions from the tweens. Enough said. You must visit the Annenberg Space.",https://www.tripadvisor.com/Profile/T5193HZmelissad
50,Music and Photos,"I came here for the KCRW free music event. Really enjoyed the food trucks and being able to browse the photo exhibits in-between music. Cuba exhibit now. I hear it's good, but haven't seen it.",https://www.tripadvisor.com/Profile/Mapman62
50,Architecture and Art,"One of the finest venture for not only photographers but anyone interested in photography or applied arts.A great piece of architecture right in front of my architecture and design studio on the penthouse across the street.Food, wine and the best restaurant in town in the same block.Must visit. You will be happy you did.Enjoy a glass of wine in the restaurant below.",https://www.tripadvisor.com/Profile/Getaway730435
40,Something new in Century City,Never knew this was there until friends decided to make a plan to stop in after a birthday lunch out and view an exhibit which was wonderful about living in Los Angeles. Lovely photographs and a 10 minute film that runs on a loop. The walk however to find the place wasn't well marked and then they made us walk about 1/2 block to get our ticket validated over in another building.,https://www.tripadvisor.com/Profile/385eileenz
50,Well Worth Your Time,"A compact exhibition space which featured wonderful work by Lauren Greenfield titled Generation Wealth, a nuanced collection of mostly portraits chronicling the adulation of celebrity, consumer culture and money's profound influence on individuals around the world.Based upon the thought provoking curatorial displays done in conjunction with this show, I would strongly recommend taking the time to check the Annenberg's schedule & making it a part of your time in LA.",https://www.tripadvisor.com/Profile/pookala
50,Greenfield’s exhibition on capitalism and the rich in Los Angeles.,"I really adored this photography museum. I saw the Lauren Greenfield exhibition, her photography showed the many faces of capitalism and the ultra rich in Los Angeles. The exhibition was informative, fascinating and touching. I found the exhibition quite large with a lot of information. If you have the chance to see the exhibition in two separate days, I believe you will be able to take in and appreciate much more. The entrance is free, so that should not stop you.",https://www.tripadvisor.com/Profile/whyitripped
50,A Great Space to appreciate photography,"We went for a particular exhibit, The Culture of Wealth, which was just fascinating; very well curated and displayed. I believe that they feature one photographer and/or theme in their changing exhibits and I would expect all exhibits to be as comprehensive and informative as the one we saw. I will definitely make it a habit to check out what is happening here whenever I travel to LA.",https://www.tripadvisor.com/Profile/ebk16
50,Stumbled upon this gem-what a great experience,Found this museum by chance and wished we had allowed more time. An excellent exhibit on the influence of affluence on society by photographs. So interesting. And gives you a lot to think about.,https://www.tripadvisor.com/Profile/mommal2014
40,Picture Yourself Here!!!!,We always enjoy our visits to the Annenberg Space for Photography. Particularly enjoy the lectures that are held at times to enhance the photography exhibit. The Annenbergs are to be thanked for offering this wonderful opportunity to residents of Los Angeles to enjoy some of the most outstanding photography exhibits and lectures......it is offered with no charge.. Call or check the website to determine when lectures are to be held,https://www.tripadvisor.com/Profile/Lovevacationtime
50,Outstanding experience!!!!,"Exquisite exhibits and frequency of new exhibits make this museum a unique expereince every time!!!! Never too crowded, great Sunday outing, outstanding for out of town guests and family, superb location and FREE!! Motivational and inspiring!!!!Interactive exhibits and videos give you insight to the photography process.",https://www.tripadvisor.com/Profile/livingthislife
50,BEST SUNDAY OUTING,"Ok. It is FREE. It is in a off the beaten path location , between office buildings in Century City. It is perfect on a Sunday when there is NO ONE at the office buildings. The outdoor lawn adjacent ot it is specatuslar for lounging . The Space itself is full of inspiring photography. There are books of Photograpyh art on the shelves to peruse. The video theatre is super, and gives context to the collection currently showing. I like to take out of the area visitors here. This is a gr4eat spot to take teens for a family outing. the subject matter is fodder for conversation.My kids are all adults now. We still love to go here togehter.",https://www.tripadvisor.com/Profile/rng17
50,A marvelous museum of photography,"My girlfriends and I visit museums for our birthday celebrations several times a year for art and lunch. This is a gorgeous museum with very compelling photographic shows, often along with documentary presentations in a very comfortable environment. The gift shop is great as well, and the outdoor area is a beautiful place to picnic on a sunny day!",https://www.tripadvisor.com/Profile/elainesokoloff
40,Nice exhibition space,This is a good place to pop in and see some photography and film. Some good restaurants and cafes within walking distance.,https://www.tripadvisor.com/Profile/mrsirin
40,Nice site to view some great work,"The Annenberg had the DENTITY: Timothy Greenfield-Sanders The List Portraits show when we went. The portraits were large and intimate. We also enjoyed the video interviews that were presented in theater. It was a bit surprising to find this was a one -person show, but still it was nicely done and a very large collection.",https://www.tripadvisor.com/Profile/Begreen
30,Interesting short stop,Took the kids to this exhibit for about 2 hours and then left. Learned a lot and saw some very interesting photos.,https://www.tripadvisor.com/Profile/CaribbeanFan79
50,Must do!,Always first class and you can park at the Century City Mall close by (small fee with validation). Just go!,https://www.tripadvisor.com/Profile/LocalLALALocal
40,Nice way to spend an hour on a rainy day,"In LA on its wettest day in some years, we abandoned all hope of sightseeing and looked for an indoor activity. As a photographer I was drawn to Annenberg. It turned out to be a very modern facility in Century Plaza. It seems to be dedicated to single themed exhibits - on this occasion a series of portraits by one photographer called 'Identity'. On there own I would have struggled to maintain interest, although they are beautifully shot and in an unusual (or rather very old) method (which may not be of interest to the layman). However, the portraits were very much enhanced by a thought provoking film which perfectly accompanied the exhibition and gave real substance and context to the viewing experience. Overall we enjoyed ourselves. On this evidence, If I lived in LA I would keep an eye out for exhibitions at the Allenberg as they seem to know how to put a show on.",https://www.tripadvisor.com/Profile/rkyprian
50,"Fascinating, classy learning experience","Love this place. And they always have such interesting, thoughtfully curated presentations. Never disappointing and you can go back over and over again and never be bored. And the Broad bores me, so I have a low ""boredom"" threshold!",https://www.tripadvisor.com/Profile/MANGOphoto
30,"OK, but not what I expected",I was looking for a different kind of photography exhibition but the current exhibits weren't of interest to me.,https://www.tripadvisor.com/Profile/flyboy1946
50,Inspiring Exhibit - Visually and In Substance,An outstanding stop in Century City if you have an hour or two. Free admission and validated parking.Don't miss the movie. Seeing the movie first helps to frame the exhibit.We will bring visitors here when the opportunity arises.,https://www.tripadvisor.com/Profile/JoshPhD
50,Great exhibits,The exhibits are first rate and change often.I was surprised at the wonderful variety of exhibits and look forward to visiting again soon.,https://www.tripadvisor.com/Profile/SMOgal
50,Great public program,"Great place to see photography, but even more wonderful to attend lectures/talk there. Very good programming, so many inspiring photographers have gone and share their expertise and experience with the audience. All free! Just make sure you reserve online for the more popular speakers.",https://www.tripadvisor.com/Profile/joyfulsteps
40,A plethora of photos,"I have been there at least two times. Every visit is an experience, much like my travel experiences. The exhibits transport you to other lands and cultures. This is a valuable and important ""Space.""",https://www.tripadvisor.com/Profile/notfromla
50,Great smaller museum,"Smaller, rotating exhibits with movies and other audio portions to truly give you a feel for the art/photography and the photographer's vision. Since the exhibits are changed out every three months or so, also a great place to re-visit to see a new exhibit. Have seen many really interesting, focused exhibits at the Annenberg. Can go at lunch time and see quite a bit!",https://www.tripadvisor.com/Profile/NEvisitorfromCA
40,fantastic photography!,Visited here for the Life exhibit by Franz Lating in February. Had not been here before. Very nice exhibit and space!,https://www.tripadvisor.com/Profile/dziran
50,Free and Fabulous for Foto Fans,"Tucked into Century City's office buildings, the Annenberg isn't the most obvious museum space, but it's one of the most focused and effective. Free admission grants you an immersion into worlds captured by exceptional photographers in exhibits that often deliver powerful political or cultural commentary. And you can walk to nearby Westfield Mall afterward for a bite and discussion.",https://www.tripadvisor.com/Profile/VeryValli
50,Great night out,Always a treat. Showcases some of the world's best photographers. Sign up early for chance to listen to the amazing stories behind the photos. A great way to be transported around the world through some very magical eyes,https://www.tripadvisor.com/Profile/roxyrae
50,Photography Exhibitions with Changing Topic in Depth,"This is a wonderful space. It has a few exhibitions a year. Each exhibition focuses on one topic with great photography and a constantly running short film on the subject. The subject range is as diverse as Who Shot Rock & Roll (great Rock photos), to Celebration of 125 Years of National Geographic Photography, to Refuges, to . . (you get it.), The space is small, so depending on your depth, it will take 30-90 minutes. It is free and there is parking less than $5 in nearby garage. (Clean your truck . . they check it so you can enter the garage!) The photos are captioned, there are not audio tours. However, the small back room, typically has headsets for each photo. It is a relaxing space to wander at your own pace. For those of us that have become casual photographer . . now that we all have cameras with us ALL the time, it is nice to see what really creates a captivating photo.",https://www.tripadvisor.com/Profile/IreneDJ2
50,Exhibition on photos of refugee,"Wonderful layout of photos of refugees around the world- including new Americans- until August 21st. Brave, heart wrenching, and hopeful faces and stories. Amazing children at play despite their desperate situations. Great video of the photographers taking the photos that are in the exhibition. Don't miss the virtual reality experience! No entrance fees! Parking validation so only $3.50",https://www.tripadvisor.com/Profile/DeborahandAndy
50,Lovely Space,"I saw the National Geographic exhibit at the Annenberg with a group of friends. The space is small, intimate, decently laid out, and friendly. I enjoyed the exhibit and hope to see more in the future.Parking is available in the underground lot (I think it's free or seriously discounted with a validation from the Annenberg).",https://www.tripadvisor.com/Profile/StaziaW1
50,Extremely important photographs that will move you!,"We recently went to the ""Refugee"" exhibit. We were deeply moved by the photographs taken of people in many different countries who are living in terrible conditions in refugee camps. The pictures told amazing stories of resilience, suffering, and humanity. Viewing the pictures expanding my understanding of the refugee crisis throughout the world. The museum is free and exhibits are rotating. Check the website for more information.",https://www.tripadvisor.com/Profile/P9218BCchrisb
50,Always a Great Experience!,I try to go to every new exhibit. The photography is amazing. Always watch the film(s) that accompany the exhibits. Entry is free. On Sunday you can park below for $1.00. What's not to like?!,https://www.tripadvisor.com/Profile/hopeisatraveler
50,Moving Refugee Exhibit,"A heart-breaking, heart-warming collection of photos of refugees of all sorts from all over the world. Definitely worth seeing.",https://www.tripadvisor.com/Profile/cveaswaran
50,Emotional. Beautiful.,"The Refugee exhibit was fantastic. The stories and views of the photographers pulled on my heart strings. The one quote said ""never take for granted being able to go home."" For these people will never be able to do that again. After vacationing here for just a few days I am ready to go back to the comforts of my own home so that is a concept that breaks my heart. What a brilliant way to shed light on the world. Next door at Skylight you can follow up with them as they settle into their ""new"" lives. Well worth a visit!",https://www.tripadvisor.com/Profile/151taral
50,"By All Means, Go There","Very cool. Not exactly a museum, or a gallery. Sort of halfway in between. Always something interesting to see.",https://www.tripadvisor.com/Profile/ProPhotoLA
50,"Powerful exhibits, always",Visited today to see the exhibit REFUGEE. Powerful images showing the displaced with their stories on all continents. Moving. Heartbreaking. 26 minute film repeats itself. In two hours you can see and read everything. Validated parking $3.50 on weekdays whether it is a holiday or not. Weekends $1. Admissions to gallery is free. Recommended.,https://www.tripadvisor.com/Profile/OBD2142
50,Innovative and superb photography museum,I try to never miss an exhibition here my favorite museum in LA. This space is all about photography and doesn't care about museum convention. They always have a well produced film to compliment the exhibition. The current exhibition on refugees has lots of interactive content including a Virtual reality experience designed around students in Columbia. The space has expanded to include an annex across the way where they have lectures and exhibits. Free admission and they even mostly cover the parking. One of my favorite places in LA.,https://www.tripadvisor.com/Profile/JKPImageFusion
50,Great Exhibits,"This gallery is a hidden gem. Located in Century city, They have had exhibits on rock and roll, Photography, and much more. It is best to make a reservation.",https://www.tripadvisor.com/Profile/lshaw3010
