40,Skip the North and do Playa Del Rey to Torrance,,,https://www.tripadvisor.com/Profile/649eugeneh
30,got lost getting to Venice Beach from Manhattan beach,,,https://www.tripadvisor.com/Profile/PattyM340
50,Excellent trail,,,https://www.tripadvisor.com/Profile/JuanPabloTraveller
50,Brilliant Idea,,,https://www.tripadvisor.com/Profile/pamvose
50,What a bike trail !,,,https://www.tripadvisor.com/Profile/Frenchfrog39
40,Bike trail from Playa Vista,,,https://www.tripadvisor.com/Profile/kdolotina
50,Fantastic paved cycle track along the beach,,,https://www.tripadvisor.com/Profile/SueJim126
50,Great Path from Torrance State Beach to Marina Del Rey,,,https://www.tripadvisor.com/Profile/SteveZ739
50,Best Way to Spend a Day along to LA Beaches,,,https://www.tripadvisor.com/Profile/Golfer15544
50,Great way to see the beach cities,,,https://www.tripadvisor.com/Profile/randomhappiness
50,wow. Great biking by the sea.,,,https://www.tripadvisor.com/Profile/X-NYr
50,Wonderful Trail Along the Pacific Ocean!,,,https://www.tripadvisor.com/Profile/LovetoWalk51
40,Paved Path Along the Beach ...,,,https://www.tripadvisor.com/Profile/dblmed
50,What can beat riding along the beach on a sunny day?,,,https://www.tripadvisor.com/Profile/jerjon
50,Nice and flat bike trail,,,https://www.tripadvisor.com/Profile/billg829
50,Miles of Beach riding,,,https://www.tripadvisor.com/Profile/695judj
50,One of the BEST Bike trails in Southern CA,,,https://www.tripadvisor.com/Profile/NickiG555
50,My favorite thing to do at the beach,,,https://www.tripadvisor.com/Profile/barbielab
40,"Great exercise, watch for pedestrians",,,https://www.tripadvisor.com/Profile/Saragrad
50,Here's Where You'll Learn That L.A. Is Not Just About Cars!,,,https://www.tripadvisor.com/Profile/Arashibi
50,My favorite thing about Southern CA,,,https://www.tripadvisor.com/Profile/chipsahoy67
50,Fantastic Ride,,,https://www.tripadvisor.com/Profile/NickyH169
