20,A beautiful waste of space,"First parking is bad, yes you can park in the garage, but its a long walk to Macys, and the worst directional signs I have every found in a public place. The signs are hard to read, too small, and they are so narrow, one person can block everyone else. And you have to get up close to understand where each store by number is located. Rest rooms are down exit hallways that you aren't sure where it is taking you. And for me a man, there is not a store for my interest. The mall is beautiful, but it is confusing, and finding what store you want can take alot of your shopping time away. I will not shop there again.",https://www.tripadvisor.com/Profile/Dizzydazz
40,recently redone mall,"It was the largest mall in the USA, before Minnesota's big mall was built. Is several blocks long. Nice outdoor area with a good choice of restaurants in the mall. Several even have some good happy hours. Definitely someplace my son and I enjoy going to.",https://www.tripadvisor.com/Profile/Msjersey14
40,Everything you search for at Del Amo fashion mall,"Del Amo fashion mall has been recently renewed and doubled in size. So many stores to shop, dining areas with tasty food for all kind of taste, ideal for families or friends, or simply chill out by yourself. Big movie theatre available on the second floor. Several parking lots available, and Torrance transit bus stops (3-4 stops) along the perimeters of the mall are available for people without own transportation.",https://www.tripadvisor.com/Profile/AdaAlessandra
50,Nice!,"The new and renovated mall all is simply beautiful. Large isles plenty of light, simple wonderful...Great restaurants to boot too!",https://www.tripadvisor.com/Profile/375rickf
40,Hang out,"Something i like to call a nice HOP, hang out place. Few stores, around, not too big not too small. You can find pretty much everything in there and not so crowded. I like it.",https://www.tripadvisor.com/Profile/Tim_tam987
40,Huge Mall,"Good rainy day walk, movie, shopping and eats. The Del Amo Fashion Center has every thing you can expect, including AMC.",https://www.tripadvisor.com/Profile/turissd
40,Great shopping in the new remodeled mall,The newly remodeled mall makes shopping a pleasure. The new shops and restaurants are a wonderful addition to the Del Amo mall. The lighting makes everything bright and inviting. The mall is very large and is great to get your steps added to your Fitbit.,https://www.tripadvisor.com/Profile/imalinda
40,Del amo fashion center,"The mall was redone in the last year. Added a lot of high end stores, restaurants and upgraded the food court. It has two floors and is very nice atmosphere. Very classy. Like the restaurant in Nordstroms -food is very good. Food court has a good selection of food. Stone oven has great sandwiches. Noodle place always has a long line. They have make your own pizza, gourmet salad restaurant, chipotle , and a few other restaurants. Also have BJ's , Lazy dog, PF Changs,and other restaurants on the outdoor part of the mall. It is very big -great to get some steps in!",https://www.tripadvisor.com/Profile/firepit2015
30,The Recently Expanded Mall Maybe Too Big,The new owner created a two-story addition to house a Nordstrom and about 25 new shops. From an architectural perspective the complex now ranges from a Sears built in the late 1950s to this new additional with an open air section off to the east which was created by the previous developer. The good news is that Macys and other smaller stores have upgraded their fixtures and decor.Note: The new Norstrom's does NOT have a petite department!,https://www.tripadvisor.com/Profile/deniseo632
50,Del Amo Fashion Center totally refreshed!,This mall has really made a 360 degree turned around on its facilities and shops. The food court is so refreshing with all the greens and the cozy couches and chairs around the area. Really love shopping here.,https://www.tripadvisor.com/Profile/Rizart2015
50,"Crate and Barrel rocks, clearly!","Whoa, I love this store! I could easily lose track of time and just admire all the lovely items...I want them all!!!The sales clerk that helped me was so amazing and helpful. She even checked on her iPad and provided me with store locations that I can shop at closer to home.",https://www.tripadvisor.com/Profile/brendae153
50,Went to check out the NEW remodeling opened last year,Terrific selection of new stores as well as the old ones. Great food area with several NEW places. This Mall is a great place to just hang out & visit things at your leisure.,https://www.tripadvisor.com/Profile/AllenH959
50,"Great for indoor exercise and of course, shopping","When the weather is too hot or too cold to take a walk outdoors, this mall is big enough for you to do some exercise. You can walk all over the mall and in no time, you have done cardio exercise already.But of course, you can also do some weight training by carrying numerous shopping bags on the side. :) They have a newer portion where all the good brands are housed.Nordstrom is their anchor store.Some parts of the mall are still undergoing major renovation with bare flooring and boarded up shops. So, just avoid these areas for now.",https://www.tripadvisor.com/Profile/mimabama
40,Del Amo Mall,"This is a huge Mall with over 300 Outlets, covering virtually everything one would like to buy. A must visit place in Los Angeles",https://www.tripadvisor.com/Profile/Sunilvk64
50,Amazing Makeover,"It's been a while since I've visited this mall, but to my surprise the remodel, makeover, transformation it has gone through has turned it into something new.They have a large Norsdtroms, many upscale stores and a surprising NYX cosmetics store. All you make up gurus know what I'm talking about.The whole place is inviting, airy, lots of bright natural light, many areas to sit back and chill if you need to take a break. Some very unique stores with many regulars.They have added some great new restaurants, I suggest Maple Grill, oh my it's superb.Plenty of parking and valet too.I can't wait to see with the portion of the mall that still needs updating.",https://www.tripadvisor.com/Profile/Lauramaldonado34
50,Good Shoping,"This was my 3rd visit to thel amo Shopping mall and i always find what i need, this is perfect place to go shopping",https://www.tripadvisor.com/Profile/RicardoU
40,Very New...,"Great big, new space mainly fashion as the it is a Fashion Centre. Great Nordstrom store well set out and everything looks new! Lots of places to have something to eat we had a good wonder around and Lucille's Smoke-House BBQ Restaurant is nearby!!!",https://www.tripadvisor.com/Profile/Simone_Neil
30,So So,"This mall has areas still under remodeling construction with no shops open in those areas.This is a really large mall requiring a whole lot of walking. It provides a great many areas to sit and rest and has a very accommodating food court. The big anchor stores are Nordstrom, Macy's, JC Penny and Sears. There are loads of all sorts of small boutique type stores but make no mistake...these are all geared to attract and please the under 30 crowd.If you're a woman, 50 or older, your choices are slim with Nordstrom and Macy's mostly. Would have been a whole lot better had they been able to add a Dillards to this mall.It was a whole lot of walking with very little for us over 50....disappointing at best.",https://www.tripadvisor.com/Profile/941JudyC
50,"Big in the 80's and still as fun as ever, just more upscale","The Del Amo Mall was a staple in the 80's and truthfully a great mall. It still had the 80's retro look up until the recent makeover. Funny that now the 80's are really trendy, but the look they went for is timeless, and bit more international. Great stores, great choices and some old faves are still there as well.",https://www.tripadvisor.com/Profile/B8427JTmarkh
50,World Class Shopping Experience,"A world Class Mall with great Stores like Nordstrom and Macy's and manny more the new Mall area is spectacular and appealing with a great Food Court and great Restaurants inside and outside the Mall, the second part of the Mall which is going through a massve reconstruction promises great things for Del Amo, Its a Must Visit.",https://www.tripadvisor.com/Profile/carlosmN3278FD
50,The new section is nice and clean,"Del Amo's new portion of the mall is much cleaner and much more grand. It's pretty light and bright and a good place to walk around and look at some shops. The restaurants are good, too. I don't mind the older part of the mall either....I do miss the nostalgia of the Sears wing as well....movie theater is nice, too. Parking is tough at times, but not in the parking structure.",https://www.tripadvisor.com/Profile/dmyla
50,The next Beverly Center,"Huge Mall I love it ! must say , its a huge mall with many stores to shop from . Many restaurants , bars , and movie theater's near by .",https://www.tripadvisor.com/Profile/Yvette_Ram
40,Huge Mall,"Del Amo was once the largest mall in the country. It is now undergoing a much need renovation and it has expanded its anchor stores to include Nordstrom. JCPenney, Sears and Macy's are still there with smaller stores like Old Navy, Express, Marshall's, Bath & Body Works, etc. There are restaurants, besides the food court, where you can sit down and have a nice meal whether the mall is open or not. You can spend a good portion of your day there because there are so many stores to choose and shop at. Once the renovations are completed with the old part of the mall, it will be gorgeous once again. There is also AMC movie theaters located there. The Marriott and DoubleTree hotels are located across the street as well as restaurant row.",https://www.tripadvisor.com/Profile/Jeane141
50,great mall,"Great Mall. Plentiful parking, Movie theater and lots of great shops. Nice for a relaxing day of shopping. Anything you could want is here.",https://www.tripadvisor.com/Profile/TH0718A
50,A Largest Fashion Mall with Great collection,"Mall is one of the largest in the US with all the major brands Macys, Old Navy, JCPenny, Sears, Marshall, JoAnn. Very nice Mall with navigation signs and sufficient space for the shoppers to relax and complete their shopping. It has nice parking space and good eateries too.",https://www.tripadvisor.com/Profile/Easwarin
50,Lov e this mall,"The Del amo Mall has been all newly done and upgraded. Very beautiful with so many lovely stores of every kindlots of places to rest and relax also a coffee bar outside of Nordstroms very nice feature. A fun place to walk around and check out new places. Highly recommendedJT - Torrance,Ca",https://www.tripadvisor.com/Profile/JoTuzz
40,Great shopping mall!,"Love the renovated space, it's huge! Great shop/brand selections. My favorite store is easily Ay Guey, with an amazing intricate T Shirt designs! Vera Bradley also at this store! Love easy parking and food selection too.",https://www.tripadvisor.com/Profile/Rinihasbi
50,Major improvements,"I hadn't been to this mall in a while. Wow! It's beautiful, clean, and has a ton of great stores and restaurants. Even movies. What a difference!",https://www.tripadvisor.com/Profile/RonaldM876
40,Great Mall!,"Huge mall ,just renovated.You can find everything you need especially American brands .3 must go shop for good bargains like TJ Max,Burlington Factory and Marshall for cheap branded stuffs .Lots of nice restaurant to eat around the mall or inside the mall .There's a foodcourt inside the mall ,Starbucks ,Cinnabon etc to fill up your tummy after long day shopping .There is Macy and JC Penny too.You can spend few hours shopping and eating .ToyRUs ,Walmart is located outside the hotel.Few hotels around the mall .Worth going .",https://www.tripadvisor.com/Profile/isssssss
50,Renovated and beautiful!,"Del Amo just re-opened it's north wing (where the old movie theaters and Montgomery Wards used to be), and it is gorgeous! Nordstrom's, Kiehls, Lush, Sephora, and other shops are now there (at least those are the ones I noticed). More shops opening soon. Nice to see a new energy and modernness to that part of the mall - connects to the already open open-air part of the mall where the AMC theaters are.",https://www.tripadvisor.com/Profile/LAWoman_2011
