40,"I'm not going to lie, I come here for the hot dogs with bacon!","You haven't fully experienced L.A. until you've had an L.A. dog. Forget Pink's, this is the best place for a hot dog. Several street vendors sell bacon wrapped hot dogs which are beyond delicious!! Get all the fixings which includes ketchup, mustard, mayonnaise, grilled onions, pico de gallo, and avocado. They'll even throw in a grilled jalapeno on the side. For about $5 you can get a combo which includes chips and drinks. Ok so that is the best part of the alley. Other than that, there's cheap clothing, jewelry, and toys mostly. Beware of many knock off products such as Mac makeup. It's cheaply made and you get what you pay for. I come here mostly for the food but on occasion buy a pair of sunglasses.",https://www.tripadvisor.com/Profile/Carolinelomeli
30,You need to be 'brave' to get the most out of it,"2 -3 blocks of market style shopping from clothes, shoes, toys, luggage/bags etc. Mostly spanish speaking stall operators who are happy to negotiate. Offered copy handbags, LV, Coach etc buy needed to go to different building located upstairs - wasn't game enough to go an take a look whilst I would have liked to. We walked from Staples Centre and whilst we were on 'heightened alert' there were no issues. Very quiet on the street until we got to Santee Alley and then there were large numbers of people - can't say I heard any Australians! If you are brave and happy to explore the stores you will no doubt pick up some bargains. You can't just hail a taxi you need to call for one - just something to keep in mind",https://www.tripadvisor.com/Profile/roko_me
30,Crowded yet cool,"I was amazed at the endless array of clothing items for sale, all of which seemed to be fairly reasonable. But, if you're looking for brand-names, theres not much here, most of it is of unknown brands with questionable quality. To me, this is a place to go for the experience, a bazaar in the middle of downtown Los Angeles!",https://www.tripadvisor.com/Profile/DevonE303
50,LOVE THIS PLACE!,"If you're in LA, you've got to go to Santee Alley! It's a bargain hunters paradise! Swarovski phone cases, Miss Me Jeans, BB Simon belts...this place has everything!",https://www.tripadvisor.com/Profile/mom-2-4boyz
20,Crowded swap meet,"I took my family to the Santee Alley to shop for my young teen girls back-to-school clothes.We walked away empty handed. My wife had her rear pinched by some stranger in the crowds, and she commented that it seemed like a third world shopping bazaar.Never again.",https://www.tripadvisor.com/Profile/SimiFamily
40,Great Fun!,"Took my daughter and her friend for an afternoon of shopping. It was a great time and the girls enjoyed themselves immensely. However, it is very crowded so be prepared to pay for parking and wear walking shoes. Also, keep your billfold or pocketbook close as you do get bumped into a lot.",https://www.tripadvisor.com/Profile/ADavis91381
40,Crowded but great deals,"Guys out on the street flag you into parkades which was helpful. Alleys are like an open air outlet market. Tons of shoe stores and clothing stores interspersed with purse stores and some men's shops. Prices are crazy cheap and clothes are quite original which is a nice change from name brand tshirts that all have the same design. Shopping for grad, weddings, etc., this is THE place to come!",https://www.tripadvisor.com/Profile/nevillcanada
30,Great to visit but BE CAREFUL with what you buy!!,"I just came back from my 3rd visit to Santee Alley, and as much as I L0VE visiting this place, I have to share the negative aspects, so I can help save the next person money. All three times, I have purchased DVDs, and all three times I have been completely let down. I have finally learned my lesson. The DVDs that are being sold on the streets in the Santee Alley are GARBAGE!!!!!! We just bought ""TED"" and were assured by the vendor that this movie was high quality. She lied. We played the movie and it froze halfway through, so now, in order to see the rest of it, we will have to go sit at a theater and re-watch the first 40 minutes. I should have known better, but I let my guard down, even after the first 6 movies (bought at past visits) were all junk. Now for my next complaint, I bought a small suitcase, cute as can be. After I took it back to my hotel, packed it with my belongings, and threw out my other suitcase, the handle broke on this brand new one. 0k, I only paid $20, but the handle that allows a person to pull their suitcase around, is pretty important!! My advice, visit Santee Alley, it is amazing!! D0 N0T buy anything that has any importance. You want ""fake"" perfume? Great place to get it!! Be careful with clothing also because we witnessed first hand a vendor crossing out a size to change the size to what we needed, with black marker. I am not kidding. But if you can try stuff on, they do have great deals on really cool clothes. Visit the place because it does make for a really great day!!",https://www.tripadvisor.com/Profile/679chard
40,I would love to go back!,"Had a super time going from shop to shop, even my kids had a good time shopping around.",https://www.tripadvisor.com/Profile/alisia23
20,Not fun.,"I'd so hoped that the happy reviewers were right and that I'd find some great clothing buys at rock bottom prices. Unfortunately, the pessimists were more reflective of reality. To be fair, this is probably a good place to shop if you are a young budget shopper who can speak Spanish. If you are a mature woman, forget about finding anything that fits. It really is like a big Forever 21 with the same prices, and lots of cheap-quality made-in-China stuff. I bought only a cheap pair of sunglasses, because I forgot mine. My husband bought a cute fedora, which he's happy with. Even my teen daughter bought only a couple of things. The highlight of the entire experience was the bacon-wrapped hot dog and fresh watermelon chunks -- Delicious!",https://www.tripadvisor.com/Profile/Jusie
40,Great outdoor bazaar,"Lots of small shops selling knock off clothes, belts, handbags, fashion accessories, perfumes, food etc etc. Nice place to spend several hours browsing and buying also. Save lots of $'s in the process. Take your time, and odnt buy at the first place you see what you want; make sure you browse a bit first to see all options",https://www.tripadvisor.com/Profile/alikarim
50,I want to go back!,"Santee Alley is situated downtown within the larger LA Fashion District. The area is essentially an open air bazaar packed with small stores, vendors, merchandise and shoppers. There is a vibrant, multicultural flavour to the area and this is reflected in the merchandise. The clothing is a mix of wholesale, sample sale items and knock offs. Quality can vary but the prices cannot be beat. I bought a pair of name brand shoes for $29 (the same shoes were $45 in a shoe store in Santa Monica and $47 at that brand’s outlet store in Cabazon). In general, the styles appealed more to my teenagers than to me – but it was still a hoot to be there. It was a sensory overload and a fun and memorable shopping experience. Now that I have been there once, I will definitely go back when I return to LA. At the very least, this is the place to buy your tourist t-shirts, ball hats, sunglasses, etc.There are numerous parking lots in the area (check LA Fashion District on web for parking and washroom maps). There are also options for snacks and beverages. I recommend being cautious in this area – but do not let the somewhat gritty street scene scare you away. I cannot think of anything like this in North America.",https://www.tripadvisor.com/Profile/NorthVan_dan
40,Great Finds and Bargains!,"Clothes, shoes, belts, accessories, shoes, sports attire all at reasonable prices. Colognes and perfumes (original) at 20-30 dollars off duty free prices. Make this part of your travel itinerary.",https://www.tripadvisor.com/Profile/Thebutcherswifey
