50,Fun & Unique,"I can't believe I forgot to review this LA gem! My husband and I knew we might be leaving LA to go back to the east coast, so we scoured Trip Advisor to look for any must see attractions in this city.I started looking for tickets in March or April, but realized they were all booked up. I should point out tickets are free, you can order them online or wait in the standby line (which could take HOURS). I signed up for the e-mail list for The Broad, so when I learned tickets would be available May 1st I made sure to be on the website ASAP at the release time. I tried to for the earliest available weekend tickets, they were about 5 weeks out from 5/1. This is a good activity to plan in advance for so you can get tickets on the date you need.I opted for a ticket time of 11 AM. I highly recommend doing anything like this in LA first thing in the morning. There is usually not enough parking in the city of LA, so it's 100% worth it to be up and at 'em before the rest of the Angelenos. It's great to sleep in, but generally not worth it if you have to compete for parking spots and deal with more traffic on the highways. The Broad has a parking lot, it's $12 on weekends, but pricier on weekdays.I am not an art person, but while in California I also visited Getty Center, LACMA and Getty Villa. I was very disappointed in LACMA, it seemed like it hadn't been updated much since the 80's, which was kind of sad since this town is a mecca for creatives. We loved the architecture and grounds of the two Getty buildings, but a lot of the art pieces were replications. Before going to The Broad, my assessment of the LA art was that it did not rival anything in NYC (where I lived a few hours from for most of my life).We arrived a bit before our ticket time, so we had to wait in a line outside for a few minutes. Once we got in we checked out some of the art in the lobby and ascended up the escalator to the main museum floor. The bright colored Takashi Murakami exhibit was one of the first exhibits we saw and one of my favorites. I don't know much about Murakami, but he did have some amazing collaborations with Louis Vuitton back in the 2000's.It didn't take us terribly long to get through the museum, it's not particularly large. I would say it's probably safe to budget 1-2 hours of time for your visit. I could see taking teenagers here, as it is a very unique and fun experience. This is definitely not drab 17th century French art, which to be honest, kind of bores me. I would not recommend taking small children here, as they don't want you to touch most of the art (understandably so).I didn't know about Yayoi Kusama's Infinity Mirrored Room until a few days before my visit, so we unfortunately were not able to secure tickets and experience this. It looks amazing though and if you can get tickets in advance, it's probably great to experience.Again, I really loved how the art here was so fun and vibrant. Make sure your camera phone is charged up before you visit, there are some neat photo ops. One of my favorite photos of my husband and I was taken under the Robert Therrien table & chairs.If you are planning a trip to LA, I would definitely recommend working this in to your schedule.",https://www.tripadvisor.com/Profile/NYCaliKara
50,Amazing and it is free!,This Museum has the most wonderful collection. The physical plant is easy to navigate and the galleries are light. What a wonderful addition to the 'art scene' in LA.,https://www.tripadvisor.com/Profile/travelG5
50,Lives up to the hype!,"We didn't get advanced tickets, but showed up Sunday afternoon and got in after waiting just 15 minutes. The times online/twitter were WAY exaggerated so I recommend just showing up and checking what the wait is if you don't have tickets.Inside, the main collection is FANTASTIC. I don't usually love art museums but this is really great and of course the fact that it's free doesn't hurt!",https://www.tripadvisor.com/Profile/friendofjojo
50,great art museum - must see,"This is a new museum showing the Broad Collection - very modern, contemporary (Basquiat) Admission is free so there may be a long line BUT - if there is a special exhibit and you pay for that, you don't have to wait in line. Therefore, in my opinion, even if you aren't interested in the special exhibit, (but why wouldn't you be) it definitely is worth paying for it - it was maybe $15.00. I go to alot of aet museums so I think that inside this one there is also a special area behind a curtain where you go in alone for a few minutes and walk on a wooden walkway over water with flashing lights. As long as you are there, you should see this.",https://www.tripadvisor.com/Profile/Phillygirl2017
50,Well worth a visit.,"We were told about this wonderful, relatively new museum and when we knew we were going to LA my wife found out about calling a month before our visit to make reservations. What a treasure for the community to have the Broad family lend their name, support and art collection for locals and visitors alike to see.",https://www.tripadvisor.com/Profile/elliotr977
50,An awesome modern art museum,"An awesome and free museum downtown. I especially loved the giant, larger-than-life art here, although the whole thing was great. They have a little area in the stairwell where you can peek into where they store art, too, which is pretty cool. If you enjoy art then this is definitely one to see! Get tix online to avoid wait times.",https://www.tripadvisor.com/Profile/itsmetheresac
40,Fun Modern and Avant Garde Art Scene,"The Broad is a cool place to visit to be part of the Avant Garde art scene...the space itself is quite interesting...but unless you follow art or have a very open mind you will wonder what all the fuss is about. I love art and lived in New York City, but somehow I feel this place is missing some major content...but it is fun to experience and lots of great restaurants around it to explore...maybe stop over to the Modern Art Museum across the street for additional immersion. Must do: Make a reservation for a smoother entry.",https://www.tripadvisor.com/Profile/calleyne
40,CONTEMPORARY Art,"I capitalize the contemporary because it really is contemporary o the inside and outside. Located in the LA Financial District right next to the Disney Concert Hall.We went early to avoid lines and to get into the Infinity Room without having to wait for hours. The Infinity Room, designed by Yayoi Kusama was pretty awesome. Smaller than I expected, it still took you out of this world. The museum only allows you to stay inside for one minute so you'll have to make the most of it.Other popular works of art are the ""Under The Table"" piece of work by Robert Therrien, the ""Balloon Dog"" and ""Tulips"" by Jeff Koons, and the stacked plates, also by Therrien.The museum is two stories with multiple wings. You can spend anywhere from an hour to 5 depending on your intrigue. My girlfriend and I spent a good 2.5 hours inside before getting hungry for lunch.If you're in LA, this is one of the better museums. Do it for the IG as most do.",https://www.tripadvisor.com/Profile/itsDannyLin127
50,Loved this museum!,"We should have planned more in advance for this one. Tickets are free, but you can reserve them in advance. We should have done this. We stood in line for probably about an hour and we were in line only 5 minutes after it opened. So, if you don't have tickets reserved, go early! However, we waited and it was well worth the wait. The art is very modern and immersive. The way everything is displayed flows perfectly. There is a separate installation inside the museum, which requires you to get in line/put your name on the list. That wait was 2-3 hours for us, but you can leave the museum and come back so you're aren't stuck walking around the same place for that long. All in all, one of my favorite museums.",https://www.tripadvisor.com/Profile/kristentuell
50,Architectural Gem.,"Full of iconic modern art pieces.The design of the building is also very impressive.Apparently timed entry fills very quickly when releasaed , which is a problem for o/seas visitors. However the ""standby "" line is quite reasonable if you arrive around a couple of hours before closing time.",https://www.tripadvisor.com/Profile/24MalO
40,"Free admission, but you may wait a long time to get in","I hadn't made an advance reservation, so waited in the standby line for an hour to gain admission. When I got inside, the gallery was far from crowded, so the silly line seems ridiculous. The works are contemporary and very, so you can see the entire collection in less time than it took to gain entrance. The contemporary art isn't for everyone (I enjoyed most of it) and the building almost overshadows what's inside. Across the street from the Gehry-designed Disney concert hall.",https://www.tripadvisor.com/Profile/Marblehead750
50,"A Must See--Get Advance Tickets Or Wait In Line, But It's Worth It!","This is a wonderful new contemporary art museum. If you are in LA you really should make time to see it. The building is a beautiful design itself, but the collection of contemporary art on view is absolutely first rate--a contemporary who's who in the art world and excellent works by each of the artists in the collection.Admission to The Broad is free, but you must have a ticket to go in. It's best if you plan your visit in advance and go to their website: the broad.org and reserve your advance tickets for the date and time period you wish to visit. If you are there, as we were and all of the advance tickets are sold out already, there is a line across from the Disney Concert Hall that will allow you to wait for an opening to go in. We waited in line for about an hour--depending on the day and time your wait could be more or less. If you have Twitter, you can check TheBroadStandby to see what the current wait is. There is also an app for The Broad which will give you the wait time and allow you to purchase tickets.The Broad has it's own parking garage; take your ticket with you and have it validated in the museum for three discounted hours of parking in the museum. Be aware, however, that if you stay longer than three hours, there is no discount and you'll pay full price for all of the hours you parked.",https://www.tripadvisor.com/Profile/192debd
50,spectacular new museum- stunning and great art!,loved my visist. Special instralation with lots of reflected lights on the first floor. the art upstairs was exceptional. I loved the collection and the groupings. It is a very big place. I think itis hard to keep a group together. the building is beautiful and it was fun to see the neighborhood. That said I do not undersstand why the new trend is for everyone to open a museum with their own name on it. Would it be better adding toe LACMA where the Broad's have already given a building?,https://www.tripadvisor.com/Profile/dlsoduku
50,Great new museum - free admission!,"Order your tickets early because it's free and tickets on the weekend are probably gone already. Parking is easy and validated and the museum is large enough to see a number of pieces but not overwhelming. Also, the rooms are by artist which is a nice feature.",https://www.tripadvisor.com/Profile/K2209VLteresam
50,Great modern art,"We ordered the free tickets on line, having read reviews that suggested doing so. Arrived 15 minutes before our assigned time and were ushered right in! Very new, very interesting building, from the outside and inside. A great variety of art, from oversized table and chairs, to Andy Warhol, to tremendous murals, something for everyone. Old and young alike were intrigued. Did not make use of the AP that explained varied artworks as we were pressed for time, but next time will allow enough time to do so. You start at the top floor- travelling up by an escalator through a tunnel like fixture and work your way around through the endless number of rooms. REally creative, and to think this is just some of the art collected by the Broad family!",https://www.tripadvisor.com/Profile/mommal2014
50,Great Contemporary Art,Can't believe this is for free. Thank you to the generous family who envisioned and then manifested this museum. Loved the Infinity Room although you only get to spend 2 minutes in it. Loved the Jeff Koons' Michael jackson sculpture and the colorful blue balloon dog. Many wonderful world-class pieces of art to enjoy.,https://www.tripadvisor.com/Profile/grandoldgirlb
50,Beautiful Museum in downtown LA,"If you like modern art, then The Broad is a must, You need to get tickets in advance but they are free, There is also a wonderful gift shopBy sharing your experiences, you're helping travelers make better choices and plan their dream trips. Thank you!",https://www.tripadvisor.com/Profile/Wiscyken
50,Art for free,"It's a Saturday and I waited less than hour for my turn. It's a worthwhile wait, admission is fee and it houses an amazing collection of contemporary art.",https://www.tripadvisor.com/Profile/foodcrawlph
40,excellent museum,loved the visit to the Broad - if you dont feel like waiting on line for a ticket - go visit the shop and walk into the museum.the artwork is fantastic - great representations of best artists of our time.,https://www.tripadvisor.com/Profile/RR22RR
50,Fantastic modern art,"This is a relatively new museum for LA and it was really cool. The museum houses the private art collection for Eli Broad, a well know LA developer. The museum doesn't take long to go through, but give yourself at least an hour. The tickets are free but you need to reserve well in advance as the museum is very popular. The art is allModern and interesting. We went on a satiety afternoon and there were food trucks outside and there is also a small grove of olive trees that are really beautiful right next to the museum. It is a beautiful way to spend a couple of hours in DTLA.",https://www.tripadvisor.com/Profile/299daniellep
50,Go!,"I did not have tickets and stood on the stand-by line on a Sunday. I waited around one and a half hours. It went quickly, the people on line were interesting to talk to. Admission is free. The art is thought-provoking. An important museum to visit in Los Angeles.",https://www.tripadvisor.com/Profile/911Traveler007
50,Infinity Room...Mind Blown!,"Yayoi Kusama, 2013 Infinity Room is astonishing. It's set up like a highly anticipated Disneyland ride. After entering you put your reservation in on an iPad, return and wait to enter a secret chamber. It's a blacked out mirrored room with an island in the middle and water on the floor. You get 45 seconds inside to experience either the beginning of time or the end of time, based on your optimism. It's so worth the trouble to experience this. You enter either solo or with a partner.",https://www.tripadvisor.com/Profile/rocor335
50,Love love love,Love the building. Love the artwork. Love the concept. Toilets are amazing. Loved peeking into storage areas. Great commentary. Free to boot.,https://www.tripadvisor.com/Profile/spiceylulu
50,Amazing contemporary art,"Has some really amazing contemporary art pieces, mostly painting and some sculptures.Relatively small you can view it within 1 hourFree admission, lines could be lengthy. Register online for admission to skip the wait and enter immediately .Highly recommend to visit it if u r in down town!",https://www.tripadvisor.com/Profile/NuhaSD
50,Free entry and Beautiful Art Collection,"We booked in advance to get inside the museum as we heard that it can get so crowded any day. We were there on a weekday so the queue at 10AM wasn't that long yet although it was hot outside. The staff were kind enough to lend people ""baking"" outside an umbrella. The queue for the infinity room was long however I am happy that we were able to get a slot only after waiting for 2 hours. It's just good enough for me to have a look see at the beautiful arts in this museum. Furthermore it's free. I don't know how long the queues are on weekends but I suggest you go on a weekday. I love this museum.",https://www.tripadvisor.com/Profile/averywildchild
40,Interesting facade,The time we visited the area was early in the morning so I did not have the chance to see the interior which seemed fascinating. The facades are really interesting and the building stands beautiful next to the Concert Hall.,https://www.tripadvisor.com/Profile/AlexiosVandoros
50,Big and Unfinished,"Mr. Broad has put together a sizable collection in a fascinating building. It has many aspects to recommend it. However, we hope that as it ages, that it also creates a more compelling theme to follow...",https://www.tripadvisor.com/Profile/bradp705
50,A Fun House Of Art,"About 100 years ago modern art began. And my interest in art fades. Anything really old could find a home in the Met or the Louvre and I would be OK with that, But new things I am not yet ready to give the black dot on white a place of honor. So when I had extra time at the Music Center before my performance start time I walked pass the Disney Hall and entered the Broad. What a rush it is to take the escalator to the 2nd floor and wow! A really big balloon dog greeted me. Koons I believe.A bright shiny blue child's toy make solid and gigantic. Looking a this big blue thing my reaction was to laugh. I felt wonderfully silly like a four year old. Here was art to share a laugh with. The sense of wimsey was patable. Gone was the morbid and profound statements over bits and pieces of recycled trash that the artist had so lovingly put in a new light. Mr Broad must have a enlarged funny bone and these visual jokes must have tickled him. While you or I might have a cartoon tacked up over our office computer rich people like Mr. Broad can find art that make them smile.""Art is either our passion or our addiction and I don't know which one perhaps both.""Eli Broad .How is your relationship with art going ?He likes art that plays the wolf in sheep's clothing. Soup cans that are way too big. Strange signs. Hidden messages hiding in plain sight. A fun house of distorted mirrors. Questions that have no answers and lots of bright shiny objects. I've been back several times just for the fun of it. Often enough to have favorites and have found a comfy seat where I can wait for everyone to make selections at the gift shop.",https://www.tripadvisor.com/Profile/divagreta2016
50,Treat yourself!!!,"The Broad was a real treat to visit. We had purchased tickets, but ended up getting in a bit early. The staff at this museum was absolutely amazing. The friendliest and most informative I have ever encountered at a museum. Not only is the art collection a must see, but the building architecture is definitely something to study. Outside the building was a small grove of 100 year old olive trees. I was captivated by them.....",https://www.tripadvisor.com/Profile/630CB
50,20th Century Art,"If you know about Warhol and Lichtensein, and are vaguely aware of world's best known graffiti artists, but want to expand your knowledge about contemporary art, this is the place to learn while being amazed at the huge and often zany pieces. Building architecture is also very 21st century. It fits in nicely with the Frank Gehry-designed Disney Conert Hall next doo.",https://www.tripadvisor.com/Profile/Ralyce
40,Long line,"The day we went we got there about 30 minutes prior to opening. The lined moved so unbelievably slow and after about 1 1/2 hours we got close enough to see why. The docent at the front door was letting one group at a time in and giving out information that should have been directed to the docents that were stinging inside the front hall, with nothing to do! She would then stop letting the non ticket holders in and let the people who I assume ordered tickets online with a preset time???? Not sure, but it was maddening waiting and frankly took away from the experience. By the time we got inside, we were so frustrated, it was going to be tough to enjoy it. Once inside it is quite open and not crowded at all. Make sure you go directly to the line to get a place to go into the exhibit of one million lights or something like that. It is worth the stupid way they let you in.....",https://www.tripadvisor.com/Profile/DeanneI
50,Love it!,"We made reservations for the Broad (pronounced """"BROOD"") Museum and were glad we did as the standby line was long, really long. The building, itself if worth visiting even if contemporary art is not your 'thing'. We enjoy contemporary art and The Broad's collection is both large and interesting. Cannot pick a particular piece or room as the entire viewing experience is more important than seeing a particular Warhol or Lichtenstein.The museum is free, but reservations are absolutely necessary; at least that was our experience.",https://www.tripadvisor.com/Profile/Irish_Harry
50,4th visit and I'm still loving it.,"Been here 4 times now and I still things I missed. Not a big museum, but a great collection of contemporary art! Warhol, Koons, Murakami, etc etc. Must make reservations for Yayoi Kusama's Infinity Light Room, and it's pretty cool.",https://www.tripadvisor.com/Profile/tomasviska
50,Wonderful Art in a Wonderful Building,"The Broad collection is simply outstanding. While the building is really innovative, it doesn't detract from the art, but rather enhances it. The location, across the street from MOCA, allows you to visit two museums in one trip. The Broad Museum is free and you can get advance tickets online, which you should, because if you don't then you will stand on line in the hot LA sun for, what could be, hours. The natural light in the third floor galleries is amazing, and other museums could learn from the Broad in this regard. The collection is amazing and we are so fortunate that the Broads have decided to share it with the world.",https://www.tripadvisor.com/Profile/YayaShare
50,Powerful without being overwhelming,I'm not a huge fan of contemporary art but this was the best experience I've ever had in a contemporary art museum anywhere. The architecture is stunning and powerful. The galleries are so bright and cheerful and the art has been wonderfully curated. It's a wide ranging collection of styles. Also powerful to look into their vault and see scores of art hanging on rolling racks. One of the best parts is riding the escalator up and walking down the stairs which overlooks the vault.Be sure to join their wifi when you arrive and download the free audio tour app. All museums should have free audio tours utilizing your cell phone. Bravo Broad.,https://www.tripadvisor.com/Profile/hcmjkm
50,Fabulous!,I loved the view of the vault of stored works....transparent feel. The architecture is unique..wonderful space! And art of course was organized by art period.,https://www.tripadvisor.com/Profile/Angela89345
50,MUST GO!,"One of the best collections of contemporary art in the US. Get there early as there are long lines. Don't miss visiting this place, it's a gem!",https://www.tripadvisor.com/Profile/dillmonishd
50,MOMA in New York has a rival!,"MOMA NYC is my favourite gallery in the world, but Broad is up there even though it is on a much much smaller scale. What fabulous art work.Got a ticket for Infinity too as I went at 11am - had to wait over 2 hours but was wise enough to go do the Self guided tour of Gehry Walt Disney auditoriumn across the road during that time",https://www.tripadvisor.com/Profile/AMANBRAD
50,So many good things...,"I loved this museum - thoroughly enjoyed myself. I was probably there for two hours, including the amazing 'Infinity Mirrored Room'.I recommend it if it you get an opportunity!",https://www.tripadvisor.com/Profile/rowenas504
50,Fantastic & forward thinking art space,"Checked out The Broad and enjoyed every second. Love the layout, and the eclectic selection of modern art-- everything from mid-century to pop culture. Friendly, helpful, and very hip staff, too",https://www.tripadvisor.com/Profile/979pleasantg
50,Breath of fresh air in downtown Los Angeles,"If you are able to plan this trip far in advance, it is smart to get tickets online. They are free and become available in 30-minute time slot increments on the 1st of every month at noon for the following month. I was able to get in pretty early on a Saturday, which I highly recommend.We parked in the lot beneath the museum. It was $12 and I'd say pretty worth it. When it is your time to go in, you just line up in front of the museum, they check your ticket and then you walk in. Right now, they have Yayoi Kusama's Infinity Mirrored Room on exhibit. You cannot sign up for this in advance, but when you walk in to the museum and line up directly to your left, you'll be able to sign up for a time slot. The mirrored room is incredible. When I went, they allowed you to go in by yourself or with one other person for 45 seconds. It's hard to capture how cool it is on your phone so I'd recommend going in and just taking it in, without using your phone.The collections in the rest of the museum are so refreshing. It is an amazing collection of modern art and just the right quantity of pieces. It's not too overwhelming and you can see everything in just a few hours, while taking your time. Just the architecture itself was art in its own right. The natural light coming in while we were there in the morning was so calming and peaceful.There is a small gift shop, but no cafe inside. There are trucks and small stands outside on the street. All-in-all, I can't wait to go back!",https://www.tripadvisor.com/Profile/allisong339
50,Great modern art collection,"The Broad is a fascinating museum featuring a variety of modern art pieces - sculpture to paintings - that challenge the visitor to think. From Warhol to Basquiat to Jasper Johns to Lichtenstein, and many others. A nice hour or two here is well worth it.",https://www.tripadvisor.com/Profile/DenMarkster
