50,A modern art marvel,"This is the latest of several modern art museums in LA in the last 20yrs. You will need reservations to view the permanent collection and special exhibits, but most(all) are free. Make sure you check the website as soon as possible, and schedule both general admission and special exhibit reservations. Entrances are timed, so make sure you arrive early to make your slot. There are generally 2 floors of art on view available to the public. The ground floor has the special exhibits and gift shop. The 2nd floor is where the permanent collection is housed. You will be treated to a great collection of the greatest hits of modern masters: Pollack, Warhol, Litchenstein, Rauschenberg, Johns, Ruscha, Miro, Twombly, de Kooning, as expected. Also, some lesser known modern artists, particularly women and people of color. Make a whole modern art day of your visit by going to MOCA across the street and eating at the beautiful Otium restaurant. Do not come here if you want to see Monet or Picasso, tho.. save that for another trip to LACMA or the Norton Simon. I've been 6 or 7 times since their opening and it is still a pleasure to go each time.",https://www.tripadvisor.com/Profile/justsandra13
50,A really fun experience,I totally enjoyed my visit to the Broad. It has interesting architecture. I especially liked the clear glass elevator in the middle. I also liked the art collection which was eclectic and I thought reflected a sense of humor. The Jeff Koons pieces are wonderful. Most people walked around smiling and seemed to be enjoying themselves.,https://www.tripadvisor.com/Profile/wardnick1
40,Contemporary Art on a scorching day,"Due to construction and a movie screening, parking was a challenge.Note*** keep on moving don't park in the structure on the left hand side as that is for residents only!Parking is to the right of the building, $15.Take elevators up to entrance.Get your tickets online in advance.My baby cousin visited from out of state.We wanted to do something fun.So the goal was "" Infinity mirrors"" by Yayoi K usama.We were scanned in given highlight info on the exhibits, I asked about the infinity mirrors, was told that was booked up for months.Umm we didn't drive 90 mins for nothing.Asked another worker, told oh sign In, on the iPad and if there is opening you will be alerted.We did, meanwhile went and looked at some captivating exhibits..Yes, they had some pieces from Jean-michel Basquiat!!There was alot of people as groups trying to get out of the heat.We received the long awaited page to line up for the Yayoi event.A sign is posted to prepare.Only few may enter at a time.We enter and with the lighting and placement of mirrors, absolutely cool!Will return when it cools down and is more quiet to enjoy the works.",https://www.tripadvisor.com/Profile/IESHORTIE
40,"Interesting space, worth a look","The Broad is a free museum, so I was nervous about how crowded it was going to be, but overall, I found the experience to be a pleasant one. In my opinion, there is no real need to wait in the extra queue for the Kusama infinity room (especially if you have visited other infinity rooms). Given the number of people they are trying to get through the space, you do not really have enough time to fully experience it, and it is, in the end, underwhelming.The special exhibition space was not open while we were there for some reason. That was a bummer, because I definitely thought we were going to be spending more time there than we did.Hot Tips!- Go on a weekday, and get your timed ticket for first thing in the morning (especially if you want to get into the second queue for the infinity room)- A lot of pieces seem to attract crowds because they are ""Instagrammable"" - go off the beaten path! Check out the stuff that isn't surrounded by selfie-takers, and you might be surprised!- Go in with an open mind! Modern and contemporary art can be challenging, but some of it is really worth seeing.-Eat somewhere else downtown! The adjacent restaurant is HELLA pricey, and while it is good, you can get really decent food down the hill for half the price.- Don't touch the art, man! Also, don't walk backwards in any gallery with your phone in your face. Trust me, it WILL end in disaster, and that selfie ain't worth it.",https://www.tripadvisor.com/Profile/ImekaSF
40,The Broad Is Great For Pop Art,"Wonderful private museum featuring pop and contemporary art. You'll find lots of colorful Koons sculptures. A room for Rauschenberg, Warhol, Lichenstein, and others. Multi-media also. Start up on 3 and then come down to the lobby. But secure your ticket for the Hall of Mirrors first. Look for a standing I-Pad by the window area. You'll probably find an attendant there to help you. Admission is free and it's best to secure a time on-line. This museum seems really popular with the younger set.",https://www.tripadvisor.com/Profile/Zoom_Gotti
50,Second visit. Still impressive.,"Comparing to the Broad back in summer 2016 when I first visited, the art on display do not seem to have changed much. There’s still these panoramas of colorful pieces greeting you at the entrance, and the line to the infinity mirror room stays overwhelming (you, of course, do not get to realize about its length since they use a digital system for the line-ups. Only the numbers on their iPad shock the innocent visitors chanting “omg they don’t have a line”). However, I still enjoyed it absolutely. The museum was cool, quiet and uncrowded as always (even for the Saturday when I was there). The pieces deserve a second and even a third look, and the great variety of art types there satisfied me although I am more of a classical art fan. I wish they could add more descriptions for the abstract pieces though.",https://www.tripadvisor.com/Profile/qinghuix
50,Wonderful art gallery experience!,The venue is an art experience. Beautiful building. All the art is fun to see . Just a wonderful experience! !,https://www.tripadvisor.com/Profile/Spotter95
50,Great Location,"Very nice to have this world class museum in my daughter's neighborhood. The building design is very cool and the layout is great !! My Friend - Jill - works there and gave me a private tour and the museum has lots of interesting exhibitsIt is a fun way to spend a few hours, and I am glad to see a new place like this",https://www.tripadvisor.com/Profile/old-man-orange
30,Disapointing,"About 15% of the art shown in this museum are 5 star. The rest is pretty poor.Mr.Broad has done some wonderful things for the city of Los Angeles...hopefully, he will upgrade the displays at this museum. The building itself is a work of art, and worth seeing inside and out.",https://www.tripadvisor.com/Profile/SharonA966
50,"Amazing museum, a MUST !","One of the best museums we have visited around the world. Very interesting building, as well. Not too big, great for kids. Tip: “buy” for free your e-tickets, to avoid long lines.",https://www.tripadvisor.com/Profile/Yolyni
40,Interesting Art,Went here this past Sunday. We had read the reviews that said although it was free you might have to wait in long lines. When we arrived there were only a few people waiting in the general admission line. We ended up waiting about 5 minutes. It is a free museum which made it even more worth it. The art was interesting as modern art usually is. We definitely enjoyed some more than others. It's certainly worth the visit.,https://www.tripadvisor.com/Profile/Cttraveler66
40,Awesome building - a creative experience you can enjoy in one visit,You have to call the First day of the month to get free tickets for the following month. Then you get right in. Register for the special exhibits as soon as you get Inn the door.Lots of well knows Contemporary Artists. Jeff Koons exhibit when we were there. Do be sure to go.,https://www.tripadvisor.com/Profile/etnbanker
40,Nice for a few hours but park elsewhere!,"So first of all, unless you can get advance tickets you will wait 20 minutes to 2 hours, and it varies quite a bit.There are a few iconic items, like Jeff Koons' ""Balloon Dog"" and some funky stuff and some weird stuff. Currently there is an LED light mirror room (separate sign up once you're inside for that) and a mirror pillar thing in an upstairs corner.It's not a huge museum, we saw everything in about 3 hours, not including a duck-out to the cool Grand Central Market for lunch (with a return up the trippy little Angel's Flight mini-tramway.At the end of which the parking was $25 (!!). I knew that going in, but we were running late to meet someone. Research a bit to find other options-Music Center maybe, or there was a lot kind of across Grand Avenue which was $14 max.",https://www.tripadvisor.com/Profile/870tobym
50,The Broad Collection is awesome,"This is a place where all the good art lives. if you get the chance to get a ticket and check out the Broad, the time is well spent with all the wonderful art they have in their collection. Parking is easy. A must see in this place is Kusama's infinity room.",https://www.tripadvisor.com/Profile/ispeakfoodtooblogger
20,Poorly organized reservation system,"Making your reservation a month in advance apparently doesn't help if you are hoping to see the infinity room. We got there early, went immediately to register for the infinity room, and were told it was an additional 4.5 hour wait. It's not like there is enough to see or do to occupy that amount of time in this tiny museum, so of course, we didn't get to see it. I recommend any of the other wonderful museums this city has to offer instead.",https://www.tripadvisor.com/Profile/tania012016
50,Goooooooooo!!!,"This was one of the coolest art museums that I have ever visited. Make sure you get your FREE tickets online before going because the standby line is loooong!! Plenty of parking underneath, but its $15 (Well worth it to us), but don't forget to the get yellow card validation before you leave the museum. Enjoy",https://www.tripadvisor.com/Profile/we_out
50,The Latest in Contemporary Art in LA!!!,This is one of the latest attractions in LA and really cool if you have a few hours to spare. This museum was made by Eli Broad-Billionaire Philanthropist and has several unique collections of contemporary art. The infinity room built out of LED lights and glass( the souls of million light years away ) is simply awesome and stretches your imagination. The music room is very unique. There is a line for the infinity room of about 2 hours on a Sunday and you have to book as soon as you enter the museum.The wait time to get into the museum is about 20 minutes if you did not book online.The other collections ( about 2500 ) are quite varied. There is parking in the same building ( about $15 for all day ) and there are several restaurants around that place.The Broad is quite small compared to Getty Center but definitely worth a visit.,https://www.tripadvisor.com/Profile/paulrupesh
50,With timed tickets its a cinch...,"We are native to SoCal. We live in Santa Monica. And for years now we have been put off by the scrambling for tickets one has to endure if one wants to visit The Broad. (It is pronounced BRODE - long ""O"" - and while that doesn't matter much - Eli Broad would probably tell you the same.) Contrary to my initial thoughts, the online ticketing process where you choose your timed entry was so easy, worked well, and actually made our visit much better. Also, timed tickets mean fewer people trying to see that works of art at the same time. The collection at The Broad is important...and well worth the investment of your time to get in the place and that's good to know. Enjoy!",https://www.tripadvisor.com/Profile/cgtravers
30,"Free, but book online in advance and feel like a VIP","Waltz past the lines of those who didn't reserve and walk right in on your timed admission. Remember to sign up for ""MIRRORS"" room before you tour the rest and they will text you for your timed admission to the 45 second experience. But if you forget, you can afford to miss this over-hyped sideshow. Odium Restaurant is worth it to keep your VIP journey going- pricey yet upscale and hip. Parking is $15 in the garage if you get the museum to validate it, otherwise $25. Installations change regularly and the gift shop is funky.",https://www.tripadvisor.com/Profile/jaywhitney2018
50,Awesome Place,"I have been there a couple of times. My 11 and 14 year old loved this place. We got bummed out because the mirror room was booked. After a few hours they made more openings and it made our outing much better. We took a bunch of cool pictures, after that we walked to Central Market for lunch.",https://www.tripadvisor.com/Profile/gamezr1974
40,"Nice museum, and interesting area to visit","The building is super nice, the exposition was ok, and you can reserve your spot online, otherwise you may not be able to get in.And it is right next to the philarmonica, which you must see building, made by Gery.",https://www.tripadvisor.com/Profile/danerias
50,There are interesting pieces of art,"(1) The parking fee is a little bit pricey.(2) The museum have different kinds of art pieces... some are really interesting (I like the big dining table and chairs the best) and (maybe I am not artistic) some looks like arts that anybody can create.(3) They have a room filled with lights which is really cool. You have to make a reservation beforehand to enter.(4) They have another room that you would need to pay to get in.(5) As with other museums, they have a lot ""not allowed"" rules, and they are not posted anywhere so be careful... (a) No food allowed inside; (b) No flash; (c) No selfie stick; (d) No touching the art; (e) No having picture close to the art -- they should put a rope around it so people would know how far they should stay away from the art.",https://www.tripadvisor.com/Profile/HHM_JMS
30,Open?,"Didn't seem to be much happening at the time. Kind of unremarkable, like they weren't really open. Free.",https://www.tripadvisor.com/Profile/JFF34
40,Great museum with kids (9+),Free museum but you may have to wait 1+ hour but it's worth if you don't reserve in advance.We all liked the museum. I have 2 girls (9 and 15). It can take an hour to do but the infinite mirror room it's on appointment and it's about 2 hours after entering.,https://www.tripadvisor.com/Profile/damorin
50,Stunning,This museum is free so often there are queues so is best to pre reserve a ticket which you do the month before your visit.The buildings architecture itself has had mixed reviews but I simply love it and was most appreciative of the shaded canopy while queuing in the baking heat wave.There are a few mirrored installations that you have to queue for. One of which you have to have a ticket for that you should get immediately when you walk in. Again it is free.The spaces are nice and open and easy to walk around and full of interesting pieces particularly on the top floor.There is a free bag check facility and I spent about three hours there with about 40 minutes of queueing to get in.,https://www.tripadvisor.com/Profile/TheIrishFella
50,Wow!,This was a super museum!!!We did not buy tickets online but got there at 10:30(on a Sunday) and waited maybe 15 minutes in line before getting in.Once in we immediately signed up for the Yayoi Kusama exhibit. We had a 3 hour wait for that so we went off and enjoyed the rest of the museum in a nice slow pace.My favorite room was the music room with all the videos of individuals singing and playing the same song. It’s mesmerizing.There are some other neat exhibits and a few that were weird and a few I cared less for but all in all it was a really nice time.My hubby loved exploring the buildings architecture through his camera.And my daughter finally introduced us to Yayoi Kusama as she has been wanting to for some time. Very interesting artist!,https://www.tripadvisor.com/Profile/DianeRenee
50,Most amazing contemporary art museum!!!,"Been to a lot of contemporary art museums and this one is the winner, hands down. We didn't pre-buy our tickets so waited in line which was fine as the wait wasn't that long and after seeing the regular exhibit, realized we didn't need to see the special exhibit anyway. The art was fantastic, I was in the building less than a minute and was already mesmerized with what I saw. There are free tours periodically which we just happened to time right so that added greatly to what we saw. Highly recommend!!",https://www.tripadvisor.com/Profile/rduinc
50,Not worth a long wait,Grateful it was free but if I had to pay to get in I’d be bummed. Breezes thru in 18 minutes. The restrooms are ridiculously small....one sink? Come on.,https://www.tripadvisor.com/Profile/529sukij
50,Great hang out place,I wish they had more events though. It is easy to get to but make your reservations online beforehand,https://www.tripadvisor.com/Profile/tongotuesday
50,Excellent museum,"Beautiful museum with modern arts collections. We came in the afternoon and as we didnt have tickets, we queued for 30 minutes. Beautiful modern art collections and there were assistants that keep an eye of your activity, to ensure not touching the displays or posing too close etc. Thats for good intention I believe. Pity we didnt get to see the ground floor exhibition as the tickets were no more available. Be advised to book early by online on the First date every month.",https://www.tripadvisor.com/Profile/Arsu_12
40,BOOK TICKETS WEEKS IN ADVANCE TO AVOID LONG STANDBY LINE,"Book your tickets weeks in advance, so you won't have to wait in the Broad's long standby line. Usually, during the summer, the waiting line is 60+min in the sizzling LA heat. If you didn't book your tix in time, and you are thinking about waiting in line, make sure to follow the Broad's Twitter account - they post regular updates about how long it will take to get into the museum via the standby line.",https://www.tripadvisor.com/Profile/GreenLakeGirl1
30,"Big Yawn, A lot of Hype, Really Small","Sure there are some interesting exhibits, namely the Infinity Room. You will need to book in advance to see it and its a cool experience, its ok good if you want some instagram photos. The rest of the museum they will request a ticket to enter which you will reserve a month in advance online and they probably won't even ask for it at the door. Parking is easy but cost about $9 and admission is free. Its an ok contemporary museum, its small, its ok but nothing WOW in my eyes. I wouldn't make the effort to come here If I was here on vacation.If your coming here to see a show at the Disney Concert Hall across the street or MOCA, ok you can come check it out, but not worth the effort for a whole trip.",https://www.tripadvisor.com/Profile/ashleysK4355MG
50,Amazing World-Class Modern Art Museum!,"This is a gem of world-class modern art. You should have reservation. The admission is FREE, but the crowds make it necessary to have a reservation system. There is a stand-by line for those without reservations, with an app that provides an estimate of wait time. I did the stand-by line no a Saturday at 10:30 AM and only a 20 minute wait. The FIRST thing to do when you enter is make a reservation for the Infinity Mirror room. Give them your cell number and they text you when you are at the front of the line. This exhibit is a must-see! You get 45 seconds inside the Infinity room and it is almost impossible to describe other than it is like floating among a million points of light!. The other exhibits are amazing,-- loved the gigantic table and chairs. Take some time and walk all the galleries, well worth any waiting in lines.",https://www.tripadvisor.com/Profile/lovetotravel92630
30,Decent modern collection,"Famous names in modern art are represented, not perhaps their best works, but worth while if you are in the area.",https://www.tripadvisor.com/Profile/arthurr4
50,Lovely collection,"My friend's friend suggested we visit the Broad when I was going to be in Los Angeles. I booked tickets April 1st for our day in May, choosing opening time (11am). We parked in the car park and almost immediately got our validation ticket. We entered the ""Advanced Tickets"" line about 25 minutes before the gallery opened, the first ones there. Ultimately, we were the first ones to enter the Infinity Mirrors.The art work upstairs is interesting, the collection is good...but it's very small. If I had waited for longer than an hour to enter the Infinity Rooms, I would have run out of art to look at.The washrooms were clean and the staff were really lovely.",https://www.tripadvisor.com/Profile/wherelolawent
50,Something for Everyone!,"The Broad has something for everyone to enjoy, young and old alike! I guess you would call it contempoary art but that does not quite describe how fun and unique this place is. It was great to see the children enjoying this place so much along side the adults. I really felt delighted by what I saw and uplifted! Definitely not a stuffy museum, a place for all ages to explore, enjoy and imagine!",https://www.tripadvisor.com/Profile/LPinAZ
50,Best Part of the Trip,"Visiting The Broad was one of the highlights to our visit in Los Angeles. The architecture and set up of the exhibits were remarkable, and the art was relatable. The museum employees were phenomonal as they were knowledgeable about the art peices and artists. They got the visitors involved in the art and left their explanations open for our own interpretations. We will definitely return to The Broad to see future exhibitions.Note: We arrived at the museum later in the afternoon and all the spots for the Infinity Mirror room were taken. We returned to the sign up list right before museum closing and was able to snag a last minute cancellations. So don't give up on seeing the Infinity Mirror room!",https://www.tripadvisor.com/Profile/kwelsh14
50,LA has become a cultural behemoth!,"No trip to Los Angeles is complete without a visit to at least two of the Big Six museums, one of which is The Broad (others include the Getty, Getty Villa, LACMA, Norton Simon and MOCA, which is just across the street from The Broad). The Broad is a contemporary space with highly stylistic and fresh design and a collection that is breathtaking in its breadth and audacity. And, like the Getty and Getty Villa, admission is FREE!",https://www.tripadvisor.com/Profile/ronaldwT5420YM
50,Vacation in Los Angeles,"One of the highlights of our visit to Los Angeles was to visit The Broad Art Museum. I highly recommend it to anyone who lives or visits Los Angeles. The museum has a display of very beautiful art pieces and collections. My teenage son was impressed with the display of won of his favorite artists, the late Andy Warhol. He stopped to take a few pictures of Mr. Warhol's paintings. We had to wait in line to enter the museum. It was definitely worth the wait and admission is free. The museum closes at 5pm.",https://www.tripadvisor.com/Profile/jacquelynu2015
40,Great museum,"The waiting line is about 30-40 minutes but one can avoid the line by booking a ticket online 10-15 days in advance. Fortunately, the entrance is free. Definitely worth the waiting time. Both the inside and outside of the museum is really interesting.",https://www.tripadvisor.com/Profile/717armenk
50,Amazing art collection and building,"The Broad has everything that you would expect form a world class private collection museum. While I understand that this is the private collection of the Broad's I was sad to see that the audio app that accompanies the collection is quite substandard, the stops would simply not load and it was not very user friendly.",https://www.tripadvisor.com/Profile/P2561APjuliom
30,Is this the real dismaland?,"There were (just) enough interesting works of art to merit the effort of organising a visit to the Broad, however I guess this is one for real art aficionado's. The general atmosphere seemed very somber and the works of art a bit detached. The Broad is free to visit and I would recommend booking online. If this is modern art at it's best then I'll have mine a little bit more traditional, please.",https://www.tripadvisor.com/Profile/mibrah
50,Gorgeous museum,This museum is beautiful inside and out. The architecture is amazing. A bonus for anyone who gets museum-fatigue: it is definitely manageable to see everything here in less than a day.,https://www.tripadvisor.com/Profile/THD
40,Fun modern art experience,"Definitely book your tickets online ahead of time! It's free, and we only had to wait in line about 10 minutes before we got to go in. The museum is very nice and well organized, and the building itself is an interesting piece of architecture. If you plan on bringing young people, I would recommend checking out the exhibits online ahead of time. A fair amount of it was explicit and not really appropriate for kids.The staff were all very friendly and helpful, and they were able to answer all the questions we had.",https://www.tripadvisor.com/Profile/Rachel_Marie_Be
50,Book ahead free online! Modern art,This museum is free but they only allow a certain amount of guests in per day and you need to reserve free tickets online at least a month before you plan on visiting Los Angeles.This museum contains modern art so be aware before coming. The art is wonderful. The natural light is magical and the staff are friendly and welcoming. The gift shop is small but the exhibitions are exciting. There is no restroom on the main floor so use the lobby bathroom prior to riding the escalator to the main showroom.Weekdays are significantly less crowded than fri-sat- sun.,https://www.tripadvisor.com/Profile/davidpond
50,Fantastic a must see,We did not precook a ticket and waited in the standby line for about 45 minutes. It would certainly be busier on weekends so go early or later in the day.,https://www.tripadvisor.com/Profile/255060Charlie10
