50,"Well Curated, Contemporary Art Museum","The opening of The Broad is so well received it may be difficult to obtain tickets. This relatively small museum on two levels is packed with thought provoking, mind expanding installations. As you enter going up an escalator through a tunnel, one has the sense of being transported into a parallel universe where collections of artifacts are displayed for the explorer to see. Under the Table installation is memorable. The highlight for me was a painting depicting the burning of art by the Nazi's. A part of the downtown revitalization, it has memorable impact and provides another reason to experience the rise in LA's art and fashion culture.",https://www.tripadvisor.com/Profile/Art-Fashion-Travel
40,"It's free, and not too big so quite manageable","While visiting I kept seeing the line at the Broad snaking down the block and around the corner, so one morning when I had planned to do the free audio guide tour at Disney Hall and when I saw that there were only three people in line I went for it. That was the beginning of an 1 1/2 wait in the sun in July. That's not terrible in itself because it is after all free, and a new venue, with a very popular installation (Infinite Expansion).The 3rd floor which is a selection of the permanent collection had some iconic pieces which I appreciated. As I had already spent so much time in lines I chose not to go to the Cindy Sherman retrospective. That would have to be for another time.I really liked seeing where the collection is housed.One, it was REALLY hot. Why not put up some spritzers for those who have to line up in the sun. I am surprised no one's keeled over yet.I did find it puzzling that I had to line up twice. Once for the museum, and another time for the installation. With computers it would be easy enough just to ask people as they enter if they want to enter the installation and assign them a number or a time to enter. Takes fewer staffers anyway.Also, I parked at the Disney Hall but Broad wouldn't validate it. This isn't the Broad's fault but why don't all these places share their validation and their parking. Do they really expect that I am going to park once at the Broad and then get in the car and drive it across the street to Disney. Really? How L.A.",https://www.tripadvisor.com/Profile/PRKPinCH41
50,Fabulous Modern Collection,"Our first visit to the Broad, especially went for the Cindy Sherman exhibit. At $12, it was well worth it and the works were displayed well. One suggestion, make the print on the walls bigger! Had to wait at every one for people to clear out so could get up close enough to read the excellent information. Come on, 30 year old installers, get your Mom or Dad in to help you select a type size. The layout is excellent, and the line to get tickets ""same day"" went smoothly and surprisingly fast. The galleries upstairs were well laid out and the collection is a strong representation of contemporary art. Not always speaking to me, but clearly the work of committed collectors and our thanks to the Broads for donating this treasure.",https://www.tripadvisor.com/Profile/DrZ63
40,"I am Not the Biggest Fan of Art, But","I am not the biggest fan of art, but I enjoyed this museum.I suppose one would call the Broad Collection, Modern Art.The collection is interesting, thought provoking and sometimes vulgar.I found myself asking, how did they do this or that. I am often as interested in the technique used in creating or assembling a piece of art as I am in its artistic value.I must say that the building itself was a big part of experience and what I said about the art holds true for it as well.The entire museum can easily be viewed in a couple of hours.",https://www.tripadvisor.com/Profile/kenmO7019MI
50,Great museum of modern art!,One of the best museums of modern art I ever visited! Free attendance. I've booked tickets in advance on a website.Download museum's app In advance and enjoy the audio guide with your own headset!,https://www.tripadvisor.com/Profile/Doctor328
40,Amazing building,"I liked very much the collections of modern art . Paintings , sculptures , installations . My favorites Jeff Koons, Barbara Kruger, Takashi Murakami , Ellsworth Kelly .",https://www.tripadvisor.com/Profile/Aikaterini2013
50,Exceptional!,"The building itself is eye-catching. The collection is eclectic and fun. We enjoyed it very much. I recommend getting tickets far in advance so that you don't have to wait in line. I was surprised that there is not more to see. If you're at The Broad, it's worthwhile going to the Disney Concert Hall next door, even if there is not a performance. The architecture and gardens are beautiful.",https://www.tripadvisor.com/Profile/wuvhawaii
10,Don't want visitors from abroad?!?,"We are traveling California for a couple of weeks, during our trip we are visiting LA for a couple days. Really stupid we can't get any tickets for tomorrow; tickets have to be booked in advance.....The most foreigner-unfriendly museum we ever found on our travels (all over the planet....)",https://www.tripadvisor.com/Profile/dutchbuddies
30,Too little payoff for all that hype,"The building is stunning, but it is supposed to be about art, not about how great the building is. That's the best thing I can say about my visit to the Broad, that the building is amazing. The art? Please! This is second-tier art. Granted it is a private collection, so perhaps ought not to be subject to harsh criticism, yet it is open to the public, so I guess it's fair game. The art is just not worth: a) the hype; b) the drama to get tickets; c) the long wait if you don't have a reservation (I did have tickets that I bought in the THRIVING secondary market for the Broad). Is it worth visiting? I don't think so, but the crowds prove me wrong, I guess. Disappointing.",https://www.tripadvisor.com/Profile/LATraveller77
40,The Infinity Exhibit Is Worth the Trip!,"So our friend scored some free tickets to the The Broad Art Museum in downtown L.A. If you're into modern art, then you'll like The Broad. Warhol and contemporaries line the walls. Some very nice and interesting pieces. I'm not really into modern art so I cannot give you an objective review of the art.However, the Infinity Mirrored Room is totally awesome! It is something you have never seen before and well worth the visit to The Broad. It is so popular that it has it's own reservation and wait line. And you can only make reservations at the kiosk inside the museum and then wait for your turn. Depending what day you visit, it may take an hour or more wait. And they only allow one or two (your partner) to enter the exhibit and you only get to stay inside for 45 seconds. I have never seen anything like it before. It is truly incredible and worth the trip in and of itself. It will end this year so see it if you can.I've attached photo but it does not capture the true look and feel.",https://www.tripadvisor.com/Profile/ralphh909
50,My new favorite museum in LA,"It's not very large but has a great collection. The line is long, about an hour long, but when you think that there are some lines at Disneyland where you wait for an hour for a 30s ride, then this is not so bad... It's a very friendly museum, great to bring teenagers.",https://www.tripadvisor.com/Profile/sheilafajl
50,Museum itself is a work of art!,Amazing! We love The Broad. Go to the website to get general admission Tix (which is FREE!) unfortunately it's very hot so they sell out fast! So we decided to pay $12 (free for kids) for the current exhibition of Cindy Sherman. It's worth it so you don't have to stay in the long line. As soon as you get there make sure to go to the queue line for the Infinity Room! It's a magical 45 seconds!,https://www.tripadvisor.com/Profile/judibootyt
40,modern art,You can make on line reservation for free tickets.But still you have to wait in lines before you can get inside.Funny experience.,https://www.tripadvisor.com/Profile/kcwyhoney
20,The scarcity of tickets does not equal the experience…,"From the moment I tried to reserve tickets to The Broad, I was not impressed with the experience and ultimately, the museum. You must reserve tickets one month in advance of your visit on The Broad’s website (tickets go on sale at noon on the first of the month). Fine, I logged on and got the spinning wheel of death for 15 minutes. I finally had to call The Broad for assistance and they gave me an entirely different web address to reserve tickets than what was listed on their home page or reminder email. By the time I logged on, the earliest reservation I could get was for 12:30pm on a Saturday in June. Fine, tickets reserved.Parking can be found at The Broad for $12.00 on the weekend (same as LACMA). We valeted by The Broad on Grand for about the same price. The tickets say to arrive early, promptly, blah blah blah, so we did. Even though our tickets were for 12:30pm, we did not enter the museum until 1:00pm. The museum has three floors (Ground: Infinity Room, Exhibit, Gift Shop; Second: Office Space, Curation, Classrooms; Third: Main Floor). When we walked in, we went straight to the Infinity Room Reservation iPad and found out the wait was five hours. Yes, FIVE HOURS by 1:00pm (the museum had only been open for three hours) so that was a big disappointment. The first floor was completely bare because the museum was between exhibits so we proceeded directly to the third floor. The space was much smaller than expected with really no organization (time period, artist, location) to the work and was a hodge-podge of styles, textures, displays. Only some of the works contain identifying plaques that detail the story around the piece while the museum relies heavily on their mobile app to give you a self-guided tour.I thought this would be a great museum for kids but was definitely mistaken. There were maybe two interactive pieces and docents at every turn warning people from getting too close to the exhibits (including an over-sized wooden table and chairs exhibit that you can walk under but not touch. Right.). We saw the whole museum in under a 1.5 hours (closer to 1 hour) and headed out to the Gift Shop. Again, I thought I could find some kid-related books or art kits, puzzles, etc. but found nothing for my friend’s children who made the trip out to the museum. It was one of the tiniest gift shops I have ever been in and was a complete let down.",https://www.tripadvisor.com/Profile/Brooke_Hansohn
50,Making Modern Art Understandable,"If you want to get beyond Craig Damrauer's great summation ofModern Art = I could do that + Yeah, but you didn'tgo to the Broad. Make reservations, but standing in line isn't so bad. Get there early to get into the Infinity room. Reservations go fast. The layout of the museum and the pieces are amazing. It really helps to place the different era's of Modern Art in perspective. So, you can understand that no that is something I could not do even if it looks easy.",https://www.tripadvisor.com/Profile/j_otter_1111
50,Great Exhibits of Modern Art,"We arrived here about an hour early. I would suggest arriving earlier. We got in, but not before sitting inthe hot sun for a while after the opening time. Bring sunscreen, water and an shade umbrella.We were able ot get late afternoon tickets to see the Mirror Room--special exhibit. They gave us a text message while we were eating lunch to say our time was in 10 minutes! Scary, but we made it. So, if they say 4 hours, figure a two hour wait time and be prepared to be close by after that.We loved some of the art works in the museum collections. But I think my favorite part as a former museum educator was seeing the behind the scenes collection storage area. Neat!",https://www.tripadvisor.com/Profile/mama2potter
40,Reserve tickets ahead of time,"Checked online in the morning and they released tickets for that day, so got tickets for the day. It is actually pretty small - takes about 60-90 minutes to go through the whole free exhibit. The architecture is great, and you can see it from the outside. The main exhibit is on the 3rd floor. Take the stairs as you will get to see more of the building.",https://www.tripadvisor.com/Profile/msa23_2000
40,"The Building or the Art, Which is Better","The Broad is the hot new museum in town and there is a high demand for tickets. My brother managed to get ten tickets and we all spent the day downtown. The building itself has a unique façade of perforated concrete in a wave pattern. The main gallery space on the third floor has skylights that allow in natural sunlight. The two main ways up are an escalator though a tunnel and a glass elevator. The second floor has storage, some of which can be seen from the stairs going down. I had seen many of the pieces before in the Broad gallery at LACMA but there are many new pieces as well. The first floor has the special exhibits.The L.E.D. Infinity light room on the first floor was quite interesting, although you need to reserve your space early since only one or two people can view it at a time and for only about 45 seconds. You step into the room, the door closes, and you are surrounded by L.E.D.s hanging on wires surrounded by mirrors.While parking at The Broad may fill quickly, there is adequate parking surrounding.",https://www.tripadvisor.com/Profile/KennethL828
40,Arrive early,We didn't have pre sale free tickets so we arrived prior to opening.The crowd wasn't bad. We parkw down the hill at a flat rate and had a nice day.The museum is large enough to handle flow.The architecture alone is worth the visit!,https://www.tripadvisor.com/Profile/gatecrasher
40,The cool building is only the start,"Nice art, fun architecture all around. Get your free tickets in advance, or else the wait could be an hour on weekends. Smart tip: pay to go to the Cindy Sherman exhibit, and you not only see more great art, the line is shorter so you see more, faster. The admission price to the exhibit was well worth it.",https://www.tripadvisor.com/Profile/Ravenspadre
50,Great new addition to the LA Museum scene,"This new museum in downtown LA is fun and free. I really enjoyed the size, which is good but not overwhelming. Mostly modern art, very nicely displayed. It is free to get in, but they do regulate the flow so either get your tickets on-line ahead of time or expect to wait in line. When I went they had just opened, so I don't know how much of a variety there will be in the collection as time goes on but I know they have a lot of art. The building is built in such a way that as you go up the escalator, you pass part of the art storage area, which also has some art displayed. It's pretty cool to think that this is a private collection of the Broad's!Also, when I visited there was a cool installation of mirrors and light. That was also free but an additional reservation time which you could make when you entered the museum.I look forward to returning to this museum.",https://www.tripadvisor.com/Profile/NatAtHome
40,Contemporary Art inside out...,"Finally got to see this place! It took us almost a year to do it... We tried trying our luck before by just going there but the line was soooo looong... I suggest that you reserve tickets online. They usually open the reservation of tickets a month in advance.Parking is located at the basement. entrance is along 2nd street. Make sure to get a validation ticket to get $10 off of $22.There was a long cue for the advance tickets but we were able to go in quickly. Staff are friendly and helpful. Love the museum store too!We were not able reserve and see the Infinity room since we came in the afternoon. The special exhibition of Cindy Sherman was booked solid as well. (gives us another reason to comeback) - and make sure to reserve early!The main gallery is located on the third floor. All highlighted works of art can be found here. From Andy Warhol, Keith Haring, Jasper Johns and more...my daughter loved the blue balloon dog... Just a reminder though that there is a portion of the gallery that is not suited for kids due to the content... A lot an hour or two for the visit",https://www.tripadvisor.com/Profile/tameia
40,Like a college survey course on contemporary art,"The Broad is definitely worth a visit, but it's not nearly as satisfying as many other museums. It's like an art snack that is tasty but doesn't leave you particularly satisfied. The collection is impressive, but there is so little gallery space that all you get are a few works from any one artist, which can make it hard to really understand the artist's point or view, artistic arc, or breadth of work. Some artists' work--Ellsworth Kelly comes to mind--was too cramped in the space to give it its due. So visit, but know that this is not MOMA, the Met or similar. I probably will not return just to visit the museum, but (see below) I will go for a special exhibition in the future.However, if the Cindy Sherman special exhibition is still showing when you intend to visit (until October 2, 2016), you ABSOLUTELY should get tickets for that. It was an unbelievable show and was in every way just the opposite of my general review of the museum. Lots of work that really showed Sherman's career. AMAZING. Tickets are $12 in advance (and you should get them in advance online beginning the first day of the month before you want to go), and the price includes entry to the museum, so you don't have to wait in line to see the rest of the museum. If you don't buy tickets in advance, you can show up and wait in the special exhibition stand-by line; they do let people in if ticket holders do not show up, but not very many. Showings are every half hour.Finally, the museum shop was only so-so. The shop at MOCA across the street is much better.",https://www.tripadvisor.com/Profile/FussyGrl
50,Excellent Views,If you are planning a visit to L.A. do not forget to visit The Broad Museum of Contemporary Art. Excellent experience - beautiful collections fantastic architecture.,https://www.tripadvisor.com/Profile/Mary-Liarou-Barbaris
30,"Interesting place, not worth all the hype","The Broad is really a fantastic museum, maybe one of the best of the west coast. However, it really doesn't deserve all of the hype it has been receiving. It's not worth the wait, the reservation or the constant headache of trying to get in to the museum that every wants to get in to. There are lots of other places that are much more entertaining and better ways to spend your day in LA. Also, kids will be bored out of their mind at the Broad, keep that in mind.",https://www.tripadvisor.com/Profile/288tylerd
40,Fun Modern Art Museum,"The museum is free. They want to regulate the flow of people; so get tickets in advance. They are available online on the 1st of the month at noon Pacific time, for the following month. Not sure why some people stood in line for a long time, unless they didn't have tickets. Our tickets were for 2:00 and we got there about 1:45. We chose 2:00 so we had time to have lunch at Grand Central Market, see Angel's Flight and the Bradbury Building. All of them are within walking distance of the Broad.The works are from the private collection of Eli & Edith Broad. It has more than 200 artists and holds a wide variety of art, as you'll see in my photos. If you don't enjoy modern art, don't go. If you do, you'll like the museum. On thing I really liked was the space given to each pieces. There's lots of room.The Broad is across the street from Disney Concert Hall. Make sure you go there too. They have a docent tour and an audio tour. We opted for the audio.The museum is close to the metro and is a couple of stops from the 7th street station.",https://www.tripadvisor.com/Profile/SuzieeQ
50,Wow what a collection!,"This museum is spectacular. The collection is so large that the work shown on the 3rd floor is rotated. The architecture of the building is breathtaking. As you are heading up or down from the 3rd floor, you can view the stored pieces on the second floor through windows. We also visited the Cindy Sherman exhibit which was incredibly interesting and well curated. The tickets to the museum are free but you need to reserve ahead of time or stand on a line and just wait until they let you in. The Sherman exhibit was $12 but it also bought you access to the rest of the museum.",https://www.tripadvisor.com/Profile/CuriousTraveler6
50,Great family outing,"Fantastic space and exhibits. Some of the pieces are not appropriate for very young ones. But there are great conversation pieces for the whole family to discuss what constitutes ""art."" We then had an easy walk to the Grand Central Market for lunch.",https://www.tripadvisor.com/Profile/2019Tonig
40,Worth the long wait,"Great collection of contemporary art. And for free. You just have to wait long in line, it took us about 1:20 hrs. But the collection is worth it. You can also pay a fee for a reservation, which reduces waiting time.",https://www.tripadvisor.com/Profile/Tohamas
30,"Unique Museum, but not worth the wait or reservation","This is a unique museum with unique features and exhibits. I actually find them interesting and unique. I just didn't think it is worth the 1 hour wait, or worth making reservations, considering that the reservations spots run out fast. The good part is that it is free admission.",https://www.tripadvisor.com/Profile/gillurien
50,Groovy Artsy Fartsy Collection in a Magnificent Setting ?!,"We live in N Cali and are from NYC so we have seen our fair share of art museums and exhibits. This new museum and publically-shared collection is top notch and worth your time. Great exhibit with fairly deep representation of a number of important 20th century artists. Well curated with constantly changed pieces from their ridiculously large holdings (you can peer into their storage space in the stairwell) the staff was helpful and it is one of best modern art collections by a single collector, in a public space that I have experienced. Go. Trust me,...go and enjoy a few hours away from all that damn LA traffic ?!",https://www.tripadvisor.com/Profile/BigDaddyAlan
40,Very inpressive,Feels new. Its very much contemporary art collection. there was an amazing photo exhibition by Cindy Sherman which was so creative and I really enjoyed it. Start at the top and work your way across all the rooms. Need at least 2 hours,https://www.tripadvisor.com/Profile/Loomi
40,Very artsy morning.,"The Broad was a nice view into modern art. The Cindy Sherman exhibit was quite interesting. Talented and bazaar. Seems like the original ""selfie"" started a long time ago. Beautiful building. Nice flow to the exhibits. Fun and cultural day! Go if you are in town you won't be disappointed.",https://www.tripadvisor.com/Profile/Basays
50,Great day at the Broad,Went with my daughter and friend for my birthday. Didn't have reservations. Stood in the line where you could purchase tickets for $12/adult so it was quick getting in. Enjoyed it immensly.,https://www.tripadvisor.com/Profile/melissamac411
