50,Great park on any day! Located in a neighborhood very quiet! Neighborhood market right across the street!,,,https://www.tripadvisor.com/Profile/Yehbut
50,Great neighborhood park! Store located across the street!,,,https://www.tripadvisor.com/Profile/Yehbut
50,Local Neighborhood Park,,,https://www.tripadvisor.com/Profile/jerseygirl90409
40,"Nice Park, Primarily Locals ...",,,https://www.tripadvisor.com/Profile/dblmed
40,Cute park with clean bathrooms and ocean view.,,,https://www.tripadvisor.com/Profile/Yseut
50,Gr8 local park but not tourist attraction,,,https://www.tripadvisor.com/Profile/RLGalloworth
