50,Great Concert Venue,"Not only is the area beautiful but this venue offers great concert opportunities, where one can see from all the seats which is a real plus. Most of the venue is stadium seating but you can rent a seat cushion for $1...a real bargain. You are allowed to bring in your own food and drinks including adult beverages, that way you eat and drink what you choose. Most of the people are friendly and warm but there's always a few exceptions. Every city should have a place that's is as easy to get in and out of. There is a lot of walking so dress accordingly. If you're from out of town and have opportunity to enjoy a concert here take advantage of it.",LPF
50,One of my favorite places,"While living in Los Angeles from 1975-1990, I had season tickets. I am now living in the bay area but at least once a year go down to the Bowl for a concert. Last year was the Tchaikovsky Spectacular (one of the best) and this year we saw Beethoven's 9th Symphony. I live this place!!!!",ChowMom@sbcglobal.net
40,Amazing auditorium - wonderful atmosphere,We planned to visit the bowl for an evening concert and were both absolutely blown away by the magnificence of the arena. We arrived at about 6:30 pm and so it was still light and we had a view not only of the whole arena but also the Hollywood Sign in the distance behind the stage. We took a picnic as is allowed and promoted by the bowl and then enjoyed a wonderful concert and a great evening experience. I wore tee shirt and shorts and the evening was warm up until about 10 pm when a simple fleece jacket is all that was needed. We used Park and Ride from Culver city which once we found the pick up point was great method of getting to the venue. Only thing that stops a 5* isthe absolute shambles at the end of the concert with regards to the bus back to Culver city really they should sort it out urgently.,Ed D
40,Barry Manilow Concert,"Loved the show, had wonderful pre-show picnic with three couples and our teenage son up in the top observation level. Only drawback was a bad pre-made salad from the bbq and taco stand. The tacos were a hit, and the bbq pulled pork sandwich was terrific. The salad wasn’t fresh, not enough dressing (no extra dressing available), and just lacked flavor all the way around. Got some caramel popcorn for dessert that was tasty, and a few over-priced bottles of water from the market place. The key to dining there might be bring your drinks, get the tacos and bbq, and avoid the salad!",PaulG13
50,John Williams at the bowl,This is a must see and bring a picnic and enjoy before the show ... take a shuttle to avoid the traffic and always a special time and lovely setting,Ptemmen
50,a real salute to JPL,"what a great outdoor venue! It seats 17,000 folks. The huge screens make you feel ike you are on the stage with the performers. The program was fantastic!The only challenge is the parking area is no convenient for the ADA folks and there is a lot of walking for the ""walker"" crown.. No problems for wheelchairs. The is an elevator and escalator in the actual bowl area.",Vernon E
50,Jurassic Park at the Bowl!!!!!,Went with some friends and really loved it!!!!! Got to see one of my favorite movies with a live orchestra. It was amazing!!!!!,Hans
50,What a wonderful discovery,"The summer residence of the LA Philarmonic in the Hollywood hillsBoxes equipped with folding chairs and tables where you can enjoy a dinner before the concertThe program was excellent Peter and the Wolf, the musicians are in whiteAll in all pure joyAnd to get and leave so well organizedOne of the highlights of the summer in LA",zoe646
50,Dav Coz Concert,"To experience an evening of good weather, fabulous music, good picnic food, and atmosphere with family and friends is to be at the Hollywood Bowl! The acoustics are phenomenal and to seat facing the iconic Hollywood sign in the background is a photo moment. Parking is all around within walking distance and shuttles can be taken from all locations of pickup places...just check the website for that concert.",Jeane141
30,What happened? Packed in like sardines.,"I used to love going to the Hollywood Bowl to see a concert. The term ""magical"" was often used. Until my last visit. I went with my family and in-laws to see Into the Woods and we left at intermission. The show wasn't the problem. It was the seating. We had purchased good bench seating but we were so packed in that I HAD TO SIT SIDEWAYS. There were people sitting in the rows in front of us who couldn't lean back in their seats because there wasn't enough room. They had to sit forward in their seat. So disappointed in this venue. It is so difficult to get to and out of the venue AND now they don't even give you enough room to sit and enjoy the show.",Chantal D
50,any chance to see anything at this magical venue take,never disappoints as Los Angeles Philharmonics summer palace and additional concert surprises...unique is quasi-membership to Phil that guarantees same box for any series you pick. Parking/ingress-egress fluidity unmatched for such a storied giant so despite LA traffic always a delight..,Robb Cox
50,Great Outdoor Concert Venue,"Went for a concert while visiting LA and I can say that it is an awesome place to see a show. Great setting and the sound was excellent. I have 2 comments about the venue. 1). I'm surprised you're allowed to have bottles of booze there. The people sitting behind us dropped a bottle of wine and glass went everywhere and hit the back of my child. No injury, but people are going to get loaded and drop bottles, so was surprised by that. 2). If you take an Uber/Lyft it's a bit of a disaster trying to leave. They funnel all the risdshare traffic into one small area and traffic gets backed up. Took close to an hour to secure a ride home. Putting those items aside I still would go see another show there without hesitation.",Zman71868
50,Always great except for the traffic,"Have been many times and the experience is wonderful once you get there. Even the less expensive seats are great. If you go for the fireworks higher up is better. Tried a limo this time for a large group but that didn’t help. I haven’t been in Awhile so not sure if uber/lyft are the way to go.Many people use the park and ride busesParking is a nightmare but a tip is to park at American legion on highland and walk 3 blocks.The tschaikovsky festival fireworks were the best ever, with precise timing. The box seat people leave their seats.",davideddoc
50,Excellent evening at the Bowl with the LA Philharmonic,"We were fortunate to be visiting LA when they were having a night of Tchaikovsky performed by the LA Philharmonic Orchestra; this was accompanied by a fireworks show and guest appearance by members of the USC marching band. The fireworks display that corresponded to the performing of the 1812 Overture was an event to remember. The Bowl is a sensational facility; we were 2/3 of the way to the back, section M2. It was easy to hear and there are four giant screens to assist the visual experience. But the layout of the Bowl is amazing; set in a natural bowl in the mountains, it's a beautiful piece of work. And from our seats, you could also see the Hollywood sign in the background. Great evening.",MMB3828
50,One of the best inventions in L.A.,"If the Hollywood Bowl had not yet been invented, it would have to be immediately. This is such a landmark L.A. place, regardless of the type and nature of the event. Whether it is classical music, film music, Chopin, Carlos Santana, or Jazz, or you name it, it is such gorgeous way to take it in under the free sky. Every aspect is fantastic and kudos to the patient organizers and staff who remarkably efficiently process the masses of patrons – to get them to their box or seat, to offer dinner or quick bites at the Market Place or at any of the other food options (which one could also bring from home) … I’m always excited to go there!!Tip 1: Parking right there is not recommended; tip 2: even in the summer, it can turn remarkably cold …; and tip 3: if the sun still shines, this is a nice way to get sunburned…(Originally posted by me on yelp)",AMKaiser
10,Petty Power,"Went to the Hollywood Bowl last night. I'm not a visitor from out of town. I've been going to the Bowl for FIFTY years! The cooler I used last night is the same one I've used for at least ten years. I have two subscriptions, so I'm there a dozen or more times per season. Same cooler. Year after year. Last night, someone was standing there with a TAPE MEASURE and informed me that my cooler was 1/4 in ""too tall,"" so I couldn't bring it in. Dinner was inside that cooler, along with wine, water, cutlery, etc. They sent for a supervisor, who said that ""the rules"" are posted online. At the risk of being redundant, this cooler has never been challenged in the past. Foolishly, I asked why? I was told that it's a ""safety hazard."" How? It won't fit in the box. There were two of us in a box for four. I could have brought a microwave and a fridge and still had room. If there's heightened security because of the recent domestic terrorism, then tell me that I will no longer be allowed to bring the cooler. Instead, they left us to try to figure out how to get plates, glasses, food, etc. into the venue in tiny, ineffective plastic bags. I'd have to look at my tax records to see if my donation this year was $2500 or $3500 (I forget which), but that little exercise in petty power just cost them my donation.",LATraveller77
20,"Great place for music, just don't order drinks at your seat","Went to the bowl for a recent concert. Parking at the bowl is stacked so we always park at a lot and shuttle in.We were in the pool circle and you have menus on your seat when you arrive. I tried to flag down 3 servers to place an order. One even looked at me and held up a finger and mouthed one minute before walking off the other way. I will not return to the bowl, there are more convenient concert venues with better service.",gameluver
50,Get ready to take lots of pictures,"As the sun sets and the lights change on the stage, you might find yourself going camera crazy. That’s ok. Enjoy the show. (Hugh Jackman was truly The Greatest Showman.)",Kelly M
50,Amazing Place,"Amazing! Second visit, this time for a Cyndi Lauper concert. As long as special house rules aren’t applied, you can bring in your own food, beer, and/or wine. Check their calendar to ensure your event isn’t listed as “Special House Rules Apply”. Don’t forget drink ware and a bottle opener for your wine!Consider bringing a jacket or blanket, even in the summer. Unless there’s a heat wave, it can get a bit chilly once the sun sets behind the mountains.Take Metro to the Hollywood & Highland station. It’s a short walk but much better than driving.",Michael M
50,Hugh Jackman at the Bowl,"I haven’t been to the Bowl for years. It is still a fabulous place. You feel like you’re out in a forest with 17,500 of your friends enjoying a memorable performance. I would advise no one to drive there. Traffic and parking are a nightmare. I took a park and ride bus from Lakewood. You can order tickets for the bus at $7 per person and let someone else face the torture of the freeways on a Friday night. Once you enter the Bowl you pass several places to buy food or eat your picnic. Many folks eat in their seats. The show we saw was Hugh Jackman and it was a sellout. He is a consummate performer and puts on a fantastic show. I would recommend taking binoculars and a seat cushion as the Bowl is quite large and the benches aren’t very comfortable. There are some video screens so you can get a good look at the show. I’ve been to many classical concerts at the Bowl and acoustics are good. Remember it’s all uphill to get to your seats and a steep walk down later.",LindainLakewood
50,Must experience!,"If you love live music and outdoor venues, this is a must. The acoustics are superb, the seating is comfortable (similar to wooden park benches with backs).There are food stalls and a restaurant but you are allowed to bring food and drinks.Allow plenty of time for travel/parking/walking before and after. 17,500 people arriving and leaving at the same time can leave roads congested!",Netster11
50,Outdoor Music High,"The largest open air amphitheater in the US?! It’s awesome. Thousands of people enjoying music with a California summer breeze and terrific acoustics...accompanied by good food and drink, good friends...a terrific experience. LA Philharmonic is doing a great job. Wonderful to see and hear. Big screens for close-ups of performers captivating. Orderly entrance/exit. Go!",PlatinumHoney
50,Awesome venue,"If a concert coincides with your trip to LA, you should go - the sound is fantastic! Venue is very organised and staff are helpful.",gngj
50,Tuesday night concert...,"The Los Angeles Philharmonic was playing Carnival of the Animals, by Camille Saint-Sean’s, Jaunjo Mena, Conductor. The two soloists on piano were Katia and Marielle Labeque. This was a series of very short and sometimes vibrant pieces reflecting an animal in Symphonic form. Some of the ones I thought best were The Swan, a Cello solo by Robert deMaine. This was an elegant, slow moving and expressive Swan. Kangaroos, to watch the pianos played with arm movements that looked like Kangaroos hoping along the keyboard, was a delight. Tortoises, what else, but a plodding and straight forward and deliberate piece. Pianists, a piece set up Sean Hayes, the host for this work, as a serious one. Turned out to make a lot of musicians. We could see several Orchestra members looking as if they could not believe they were taking part in this. After the intermission, Symphonie Fantastique by Hector Berlioz was next. The Horn section came on stage as well a 3 Timpani. This was an exciting and loud work. It worked, it was a labor of thrills. The Bowl has stacked parking, we went to lot A, highest of all on the hill. An escalator is provided to take you down to your seats and back up the parking lot after. We had brought a picnic dinner and a small area was contained 4 tables in a very convenient location. Spoke with several others who had the same idea, and one who it turned out went to the same barber I did in Costa Mesa. Small World....",James Weaver
40,Celebrated Fourth of July with our son in the famed Hollywood Bowl,"An excellent concert with Nile Rodgers & Chic, the Los Angeles Phil, U.S. Air Force Band and DRUMline marching band from Florida. The atmosphere was electric, the fireworks spectacular even for us visitors from Berlin where the world's biggest fireworks display takes place on New Years Eve.All in all a thoroughly enjoyable evening.",Leslie C
50,Fun Concert on a lovely summer nite at the iconic Bowl!,What a great concert with Barenaked Ladies and Hootie and the Blowfish! We had a 5-person box all to ourselves and danced to the music!We brought a picnic from home and enjoyed beverages purchased at the Bowl!We even met the band! Love this iconic venue!,Maureen M
50,Abba concert,"Everything was fabulous! The music was invigorating, eating under the stars, and being outside was all a treat for a special evening!",btga91812
50,Abba tribute concert!,Took the shuttle bus from the Chatsworth train station to avoid the nightmare parking:-) Brought a picnic and wine and had a great time!,Live2trade
40,"Fabulous Place To See A Concert, Parking is The Worst.","We have been to the Hollywood Bowl many times. It is beautiful. Located near the Hollywood Hills and the Hollywood Sign, it seems it is craved out into the hills. It is so pretty.The place is pretty big, so there are bad seats. There are seats so bad you can not see much of the stage, so keep that in mind. The boxes are the best, but pricey. The boxes are seats of 4 each with a table in the middle and surrounded in wood. You can bring your dinner and enjoy. Behind the boxes are rows of seats, some great, some pretty bad. Behind that are the bench seats and none of them are good. They are just too far back, but they are pretty cheap so I have sat there when on a strict budget.Parking at the Bowl is the worst. It is just awful. It is stacked parking and good luck getting out and on the road even 45 minutes after the concert ends and no you will not be leaving early if you are in stacked parking. There is other parking to be had, but there is not a lot. Some restaurants will give you parking and shuttle you there if you eat there. All in all, parking is not going to ever be a good time.The sound at the Bowl is great. You are able to hear, even in the back. The stage is beautiful. It is all outdoors. There are a few places to get food and you can eat it there or take to your seats. You can bring in your own food and you can even bring in wine. If I were you I would get there early if you really want to enjoy a meal and relax before the show.Most shows end by 11:30 pm because of the homes nearby. They also tend to start on time.Another issue with the Bowl is the long walk to your seats, up ramps, up stairs, down stairs. If you have issues with walking it can be a real pain. It is a long walk.The Bowl is just beautiful though and we always go back. Despite its issues, the concerts there are great. If you ever get a chance to go there when they have fireworks, do that. Have a great time.",elizabethlascheid
50,Great Venue,"Lived here my entire life, seen many concerts and had never been to the Hollywood Bowl. Came across a Groupon for a concert and thought here’s my chance. Took a Lyft from hotel and was dropped off super close. The vibe was awesome. People were tailgating outside in the casual atmosphere. We got to the top for our entry gate, had no issue with security and entered facility. Purchased a bottle of wine (cool) and a sweatshirt. Made the incredibly steep trek to our seat. The iconic Bowl’s shell-like structure and amphitheater is a must see venue. The view is just incredible. The concert was great. Good thing I brought binoculars. Crowd was friendly and not obnoxious. The con is leaving the facility. We ordered a Lyft and if it wasn’t for GPS we would have never found it, but we did and all was well. Will definitely return however will purchase better seats.",menhb
50,An evening with Andrea Bocelli,"It was a fabulous evening under a low cloud cover with great music. It would have been a perfect evening if not for the traffic and parking nightmare an evening at the bowl represents. We even tried using a shuttle from the Dolby center- but they were running 45 minutes behind! Allow LOTS of extra time before the concert begins to park and get to the venue. Otherwise, what a great theater! I had not been there in over 40 years!!! It has changed, and all for the better. The escalators are a good perk. They even have kind of a 711 store where you can buy a can or beer or wine, a bag of chips, candy, etc.",Karen R
10,A great venue some years ago has turned into an absolute crap,"We've been to Hollywood Bowl many times, and used to like the place. But it has turned into an absolute crap. The parking lots (Lot B and others) close to the Bowl that used to be available on a first come basis, now only available for people who purchase passes online. The traffic is horrendous. It has always been bad, but it was moving. Now it literally DOESN'T move. Expect putting your car into ""Park"" while in traffic and spend about 50 min. to get through the last 0.5 miles to the Bowl. Oh, and BTW you CAN NOT bring a basket with wine and snacks with you anymore. Instead you are now forced to buy unedible overpriced crap. BEWARE: You can't even bring in wine and food, that you purchased on their plaza, but before you go through metal detectors. BTW: the lines through the metal detectors are a total joke: disorganized and the attendants seems to be asleep. Also note, that the Bowl keep changing the ""rules"", but it's impossible to find information in advance. So after spending at least 2 hours on getting to the fricking place - you can be told something at entrance that you didn't count on. Like ""you can't have bottle opener with you"" (yes, not the Swiss knife, but a portable bottle opener). But of course you can go back and check it in at the desk and then spend another 40 min. getting bac - What a bunch of clowns!!! Needless to say that you have a good chance to have your evening ruined. In my humble opinion, the Bowl has become an absolute disaster, simply the worst venue in Los Angeles. Go to the Dorothy Chandler Pavilion (LA Opera), Staples Center or Disney Hall. You will enjoy it much better!",Emil L
50,Iconic Venue - Tips and Tricks,"Do not park at the Bowl! If you are from out of town, your best bet is to stay at a local hotel and walk to the venue, or take the metro and walk to the venue, or take ridesharing and walk to the venue. In most of the Bowl lots, cars are parked in stacks of 6 or more so it can take hours to get out.If you are local, the best option is to take a park and ride bus from one of the park and ride lots in various locations. Those bus tickets are inexpensive and can be bought in advance or just before getting on the bus.Once inside the venue, there are several good food choices, although lines are long and prices are high as you would expect for a concert venue. If you are sitting in the expensive seats, you can pre-order fine dining in advance or order from a menu after arriving.",Eric G
40,Iconic venue.,"Iconic venue and a LA happening before the show.Most shows, even the lame movie nights or plays sellout due to the picnicking scene. ( not designed for theatre performances nor movies).Finally gave up season tickets due to declining performers ( see movie nights above). Now I go for specific independent concerts.Always scalped tiks available online.Decent acoustics—not great. Average and overpriced foods available.Pool, garden or terrace boxes for 4 or 6 people. Bench seating further up the hill.Horrible parking—don’t do stacked parking! I always park down the hill (street or public garages).",Summerasalifestyle
40,I am so glad that we decided to visit,"The setting, bandshell, lighting and sound were excellent.We took a shuttle from the LA Zoo and were dropped off near the entrance. The gates weren't opened yet and the masses of people were worse than any other venue I've ever been to.We were told that we had 30 minutes after the show ended to make it back to our bus, which didn't seem like enough time considering the crowd.Our instructions to find the return bus were ""stay to the left all of the way out, go through the tunnel and take the first stairs on the right"". Staying to the left didn't lead to the tunnel, so we had to climb through a fence. The tunnel was almost a stampede. But we found our bus.I lost my phone and gave the operations office a number to call if it was found. When I called them in the morning, it had miraculously been turned it.I absolutely loved the concert and being at the iconic Hollywood Bowl, however crowd control inside and outside was totally lacking and annoying.A HUGE thank you to the kind folks (are you from Ojai?) who turned in my phone!",eusnna
30,"Great venue, horrible entry/exit","I attended the Mixtape Concert on Sunday, May 26th. The venue is absolutely amazing and I thoroughly enjoyed the concert.HOWEVER, the process of entering and exiting is horrendous! I traveled from Indiana to attend the concert with my sister and was mind-boggled by this disaster!We arrived at about 6:00 since the concert tickets stated that the concert begins promptly at 7:00 with the main act. At 7:00 there were thousands of people still standing outside waiting to get in. I have never been to a concert that entry was such a disaster!! We finally got in at 7:30 and thankfully the concert didn't begin promptly at 7:00 otherwise they would've had 1000s of unhappy concert goers. Exiting the venue was just as crazy!!",Jamie M
50,Little Mermaid 30th!,"We had a night I will never forget here! Sure a lot of that is due to the event itself (getting to be 3 rows away from the man who wrote the music of my childhood, Alan Menken, at the Little Mermaid 30th Concert). However, I have been to outdoor venues in my home town and not had as good a time as I had here.It was really easy to walk here from our hotel on Hollywood Blvd. I wouldn’t suggest driving/ubering/public transit since that seemed like a mess. But walking was a fun way to meet other people, felt safe because tons of people walk as well, and you get your exercise! It took no time at all to get through security and find our seats. The place is huge but we never got lost! We were in the pool section which was fantastic for getting up close with the performers but it was a bummer to totally miss the projections of the show or the movie on the giant screen. That is a trade off you will have to decide on. I wouldn’t trade what we had but it is worth noting. The price of the tickets was also super fair considering how much it costs us to sit that close in places like Vegas. Also worth mentioning that it does get cold so layers and blankets are a must! If they do another round of Disney live to film shows we plan on returning!",Christine S
50,Hollywood Bowl Disabled Parking,Hollywood Parking for the Disabled/Placard. Call (323) 850 2125.Someone can reserve a spot for you in Lot A or Lot B (which is the closest parking to the venue). Prices vary.,NeyNey
50,been ther,Beeen going here for many years and love the place Open air music fun for everyone involved . I go at lease 5 time a year.,ruhs1969
