50,Great shopping,The new section has a lot of great shops.All the top brands are all right here.Good restaurants in and outside of the food hall.We’ll be back for sure.,https://www.tripadvisor.com/Profile/923scruffym
40,A Rebirth,"Del Amo Fashion Center has become the place to go for top end stores, easy access, plenty of parking and as a central location with plenty of restaurants. Having an AMC movie complex as part of the Fashion Center just adds to the draw. The owners have moved from north to south in redeveloping and cleaning up the Fashion Center which had started to show its age badly. Now, the facility competes with anything in West Los Angeles or the Valley. The owners are continuing the massive face lift at the south end of the complex and when finished will be a gem for the South Bay, although the north portion that is completed makes it the place to go for shopping and entertainment.",https://www.tripadvisor.com/Profile/IvanK67
50,High end shopping mall,"This huge mall has been remodeled and now has a high end look with some high end stores. Nordstrom and Macy’s are the two anchor department stores. Coach, Michael Kors, Kate Spade are a few of the more high priced stores. There are also more moderately priced stores-Chico’s, Old Navy, H&M. Lots and lots more.",https://www.tripadvisor.com/Profile/CarolynK173
40,Black Friday Visit,Visited the mall on Black Friday. Whistler the mall was busy it wasn’t overcrowded. Excellent selection of shops and much better than the previous malls I’ve visited in the Los Angeles area.,https://www.tripadvisor.com/Profile/michellewZ8953MN
50,Lovely mall,"It’s a very lovely and entertaining mall. Moreover, it is very clean. You can find what you want to shop so easily.",https://www.tripadvisor.com/Profile/MaggieT4
50,Top notch mall,"We enjoy coming to this mall for both the ambiance and the shopping. There's a wide variety of shops (H & M, Dick's Sporting Goods, the Disney store, Lush, Alex and Ani, Brooks Brothers, White House Black Market, etc) plus food court and an array of restaurants in the outdoor area. The mall also has varying styles. It's interesting to walk from one end to the other and see it transition styles. My favorite part is the outdoor mall. There's a fountain and lights strung up. It's quite nice to sit out there and people watch.",https://www.tripadvisor.com/Profile/tink8009
50,First time visitor,This mall is really clean and nice. Seems very safe and has great stores! Would definitely be going back when we come and visit. Beautiful Christmas decor is already up and it is so cozy!,https://www.tripadvisor.com/Profile/briannleahw
50,Mr,Great place to spend time for lunch with multiple options and a walk in the mall for shopping. It has enclosed areas as well as open areas. Same choices for restaurants too,https://www.tripadvisor.com/Profile/730mahendrap
50,My Wife Would Love This Place,"I went hunting for some cosmetics for my wife on my last day in the US, and this place was the perfect joint for having Macy's, Nordstrom, JC Penny and a range of other smaller shops meaning you can generally find what you want in this mall !!",https://www.tripadvisor.com/Profile/glenbethel
50,Large Mall with The Big Dept Stores and Food,"We all know there are too many malls in some parts of the US and big department stores are suffering, some are just thin on stock as a result. So if you want something in particular you can be unlucky. We found (as tourists from Oz) this was one of the better ones. Macey, Nordstrom, JCPenney are there along with a Sears but we didn't go in the last one. Also great food at Lucille's and a BJ Brewhouse. Liked the food, atmosphere and prices in both of them and in fact visited them both twice. Also a Barnes and Noble and a big cinema. Plenty of parking, including a big undercover area for those days when you don't want to leave your car in the sun (as a tourist I can confirm that two hours in a hot car does chocolate no good at all) No review of a mall can cover everything and we were just looking for clothes but I rate this as one of the best in the district for normal shops (best outlets was probably San Clemente)",https://www.tripadvisor.com/Profile/JRNSydney_Australia
50,Love this place,I always find everything I want here. A lot of the items that I want to order online and pick up are available at this place.,https://www.tripadvisor.com/Profile/LizzX3
50,Shopping Paradies with movies too,"You can find anything at the Del Amor Fashion Center. Great fashion of course, but food and movies too. And of course a Barnes and Noble and lots of smaller specialty shops too.",https://www.tripadvisor.com/Profile/fancynancynator
40,Great mall,This place is spaced out which is great. No narrow hallways where people have to fight each other to move through. Some malls are not as stroller friendly as Del Amo.Best part about Del Amo is the DAVIDsTEA store. I had been to Teavana before but the selection from this store is great! There is so much to choose from!,https://www.tripadvisor.com/Profile/jaydeesox
20,Mall access,"Mall is a bit too unorganized! Hard to go in and out. If find this place hard to go in to get one item and leave due to parking lot location, entrance and the movement of all the sores due to its renovation.",https://www.tripadvisor.com/Profile/LynetteChavez
40,Much Nicer than before,Many high end stores now since they began remodelling.Parking is easier with lots that tell you how many spaces are on each floor.,https://www.tripadvisor.com/Profile/rachaelg223
40,Great mall with too many upscale places,"This place has it all. Lots of places, tons of people and some unique things. Food court has some pretty neat but expensive places. The restaurants aren't great bargains but the food is unique for some. Enclosed and air conditioned. Parking is tight during pe am hours.",https://www.tripadvisor.com/Profile/ECL
50,"Huge mall, nice restaurants","This mall has pretty much everything you'd wish for. Good restaurants, all the big brands, nice outdoor area. Definitely come here!",https://www.tripadvisor.com/Profile/hannasavannah
50,Love the shopping mall,Ilove the mall it's amassing the place is huge you have a lot of baraitys todo you can expend the hole day and still can get I'm done,https://www.tripadvisor.com/Profile/K7744ZVjuanc
40,Huge mall,"Liked all the variety they have for clothing stores. Some pricy, some not too pricy. The restaurants are a plus after a long day of walking and shopping.",https://www.tripadvisor.com/Profile/GtechVelasquez
50,A Day at the Del Amo!,Amazing day at the Mall for shopping and eating. Later went to the movies! Really enjoyed myself! Then I ended with coffee from Starbucks!,https://www.tripadvisor.com/Profile/Y5009MFjessicag
50,Shopping,This area has many many clothing stores plus a food court and some restaurants around the edge and nearby.,https://www.tripadvisor.com/Profile/10234
50,"Great mall, about 30 minutes from LAX and 30 minutes from Annaheim","Between LAX and Anaheim you can find this excellent shopping mall. It's really a great place to shop, all the major brands are available and also plenty of food options around. Some shops are located on the outside of the mall, which really is OK, as they are connected, only thing is you do not walk covered and cooled by AC.",https://www.tripadvisor.com/Profile/ThomasEMM
50,Recently renovated mall with every store...,"A visit to this mall makes for a great day of fun browsing, shopping, eating and entertainment (AMC Theater). There are stores and restaurants for every pocket level. Renovation makes it very attractive and design includes plenty of resting spaces.",https://www.tripadvisor.com/Profile/letviarza
40,Lots of good stores and plenty of food when you are hungry,"There is always parking and I have not considered it too crowded here. Also my boyfriend was so excited that in the food court was a PINKs hotdog restaurant. His favorite hot dog of all time. So plenty to eat and then shop again. I love H&M store here and have found some good deals. I also love the BookOff store and can find lots of books for a very low cost, like $1. DVDs can be found too. Dicks sporting goods is opening soon. That will be a great addition.",https://www.tripadvisor.com/Profile/Sailing_Sweetie
50,Shopping,"Great day to walk around & enjoy the weather. Also, GreAt 4th of July sales. I felt safe and lots of restaurants to choose from also they had a theater so after a long day shopping you can relax watching a movie ...",https://www.tripadvisor.com/Profile/munozmar
50,Huge Indoor and outdoor mall,"Del Amo Mall s almost complete with the construction on the south end. This is one humunges 2 story Mall in Torrance. I love shopping there because I can find almost anything I need or want. It's a great place to get out and just walk around. I can get my 10,000 steps very easily without even trying. They have shops galore and a huge food court with all kinds of different types of food. Pinks hotdogs are even there now.I love to go to Lucile's for dinner, then go walk off my 10,000 steps.",https://www.tripadvisor.com/Profile/torrancecal
50,Wear comfortable shoes,"Lots of great shopping, but the mall is huge. Not sure if it can be covered in one afternoon, but sure worth a try!",https://www.tripadvisor.com/Profile/lesliek1565
50,"Beautiful, Busy Mall",This mall is something of a diamond in the rough for this neighborhood. The newer parts of the mall are just so pretty and you could walk/shop all day here easily. There are so many restaurants and stores to check out.,https://www.tripadvisor.com/Profile/hizzysimz
50,Everything,Perfect place to meet friends and have meals and coffees and go shopping. Also Ralphs Walmart and Japanese market is close so convinient!,https://www.tripadvisor.com/Profile/Adventurer536594
40,Great selection,You can find just about anything here. Great selection of stores to choose from. Food court has a lot to offer as walking this mall takes a while. Parking was convenient and close to enterance.,https://www.tripadvisor.com/Profile/Jodee68
40,A Happening Place Once Again,"Del Amo Mall had seen some hard times - many outlets have closed, but have staged a revival these past few years. Now it's better than ever with many upscale outlets as well as increased dining places all over the place.Good parking can be hard to find especially weekends and holidays but there will always be parking if one doesn't mind walking for a little bit.",https://www.tripadvisor.com/Profile/ScottLB
40,Show stopper .......................,"THey re-did almost the whole mall, the section that is completely done is the North side. I like the are that is open by AMC, BJ's on the east side .....Plenty of parking ~ many handicap spots. Restaurants , shops, In my opinion there is something for everyone. Don't tell but a great place ~~ just to take a walk & get a snack at the food court.",https://www.tripadvisor.com/Profile/YardSaleLdy
50,Great place to shop!,Indoor and outdoor shopping. Lots of variety in stores and restaurants. Many unique stores. Beautiful seating areas to just relax.,https://www.tripadvisor.com/Profile/LindaT1946
50,Great place to shop and eat.,"Del Amo Fashion Center has many of my favorite stores to shop. The place is huge! It also has many really good restaurants located on and near the property. It can get busy, but since it is so big, there is also plenty of parking there.",https://www.tripadvisor.com/Profile/melaniehI7929UG
50,Great neighborhood mall,"Great neighborhood mall, they just renovated the mall 1 - 2 years ago, now it become very upscale with great brands to shop, I especially enjoy the sport-shoes shops: footlocker, finish line, etc.",https://www.tripadvisor.com/Profile/david5757
40,So much to offer,This is a REALLY big mall with so much to offer. We stayed across the street at the Marriott. Stopped by and had lunch and walked around and didn't get through all of it. Something for everyone.,https://www.tripadvisor.com/Profile/Jedimasterkush
50,"Wow, Nordstrom",This mall has indoor and outdoor shopping areas. It is the best mall I have ever been to. The Nordstrom store is so bright and clean. This Nordstrom is my wife's favorite store to shop in the South Bay area. They also have a large selection of men's and children's clothing apparel and accessories for me and baby.,https://www.tripadvisor.com/Profile/jarods917
40,Good,Mall is very big and a bit confusing to get around. Seems to be kept neat and clean. Plenty of parking as well.,https://www.tripadvisor.com/Profile/rfine562
40,Dinner with Friends!,Went to the mall to have dinner at Din Thai Fu not sure if I spelled that correctly. This mall have changed so much and they made really beautiful and inviting. The store selection in this mall has a really good mix from mid range to low range. Didn't buy anything since our main goal in there was to dine but did check out the mall while waiting.,https://www.tripadvisor.com/Profile/Alaindl
50,Excellent !!!,It's an excellent place to do shopping . Name a brand it's available . It's good place to eat too. Ample of cusine options available. The mall has many entry &exit points . Do remember your directions so that u don't get lost .,https://www.tripadvisor.com/Profile/513sangeetas
50,A Specta ular Mall!,"Del Amo Fashion Center is a great place to shop, eat or just hang out. Stores and restaurants are continually being added. If you haven't visited, don't deprive yourself any longer.",https://www.tripadvisor.com/Profile/cindaherring
50,Shopping and dining!,"Lots of brand outlets here like UniQlo, H&M, Sephora, Bath and Body Works, Victoria's Secret and my favourite store Q. There's also a food court and a stall for my favourite cinnamon roll - Cinnabon - yum!",https://www.tripadvisor.com/Profile/TAROTZAMM
40,great shopping,found some really good deals in Jcpenny and the mall was nice and clean we enjoyed it and shop there again,https://www.tripadvisor.com/Profile/rblossoming15
50,"Excellent place to shop, eat, banking and many more at this place.","Find everythings you need for daily life here. Shop clothings, shoes, sporting good,supermaket, bank,stock brokarage company.Huge area but you will find easiery this place. I allway go and do almost everything here.",https://www.tripadvisor.com/Profile/kazuhikou2013
40,New wing is nice,"I never used to go to this mall, but after they built the new wing with Nordstrom and a few other stores it became more interesting. They have Zara, Uniqlo, Lululemon, Banana Republic, H&M. One thing that is missing is an Apple store.They opened a Din Tai Fung in this wing, and that alone is worth the visit if you like Taiwanese dumplings. Frida's Mexican restaurant is also a decent dinner spot. I haven't tried the other restaurants, but they look inviting.The movie theater is pretty cool because it's clean and doesn't get very crowded unless you're watching on opening weekend. The food court is also very nice - they have a great selection of the standard eateries, plus others that are unique (Bibigo, for example).",https://www.tripadvisor.com/Profile/800MartinG
20,Bad even for a mall,Even if you like malls this place has been going down hill for a long time. Great if you are a teenager with no where else to go but thats about all.,https://www.tripadvisor.com/Profile/mattkurth
50,Everything and more!,"I was recommended this shopping complex by my Lyft driver because I wanted somewhere to shop that was nearby my hotel (I stayed in Gardena).This place had EVERYTHING. The big stores, as well as some awesome restaurants. If ever I needed to shop in this neighbourhood again, I'm definitely coming back.",https://www.tripadvisor.com/Profile/justshirlay
40,A Great Mall,"I like the seating areas that were added for the people to socialize, rest or to reenergize. The food court has ample and variety of food options. Nice anchor stores and added public parking structures. It's very convenient for me as I live only a few blocks away.",https://www.tripadvisor.com/Profile/roghadal2016
50,This mall is the best!,"They even have valet parking! They have a really nice Macy's store and I liked a store called ""Typo"".",https://www.tripadvisor.com/Profile/brendae153
50,Mall Heaven,"We visited Del Amo over 3 days ..each day 6 hours ..its called AWESOME.........shopping overload at its very best,,,,,,,,,,,,,,,,,,,,,,A TOURIST MUST SEE AND SPEND",https://www.tripadvisor.com/Profile/Mavros66
40,Big Mall,"This is a wonderful mall. Located a little out of town, this mall has all to satisfy one's need. Spend a whole day walking thru the many stalls and even ended up purchasing stuffs for the little ones + loved ones for Christmas.",https://www.tripadvisor.com/Profile/jimmywongsingapore
30,Del Amo Mall,"Lot of construction going on at the moment, but things are definitely looking good, plenty of very nice shop's and things to do.",https://www.tripadvisor.com/Profile/X3006PJmichaelb
40,Torrance a great place to shop.,"Great place to shop, eat and see a movie. You can do it all here at the Del Amo Fashion center. Love it!",https://www.tripadvisor.com/Profile/K4443JUjohns
50,Shop Till You Drop!,"If you are looking for affordable & fashionable clothing, then this is a ""must"" go to mall. It is well worth the drive! Plus, they have Nordstrom's restaurantsthat serves delicious food and great cocktails! We had three appetizers that fueled us up to do more shopping!!!",https://www.tripadvisor.com/Profile/7books
50,Newly renovated and expanded mall,"This place has totally been renovated and expanded. They have added hundreds of stores Nordtrom, Michael Kors, L'Occitane, Kipling, Papyrus, StrideRite, Swarovski, ZGallerie, Vera Wang, Starbucks, UniQlo, Zephora, Godiva, Popbar, too many to mention. In addition to their Disney store and Macy's. They have a food court Sbarro, Panda Express, Teriyaki place, Blaze, Genghis Kanh, Stoneover, etc, They will soon be adding korean: bibigo. Outside by the AMC theatres they have PFChangs and Las Vegas Buffet and RA Sushi bar.",https://www.tripadvisor.com/Profile/adrianan476
50,Huge re-modeled mall,"Whatever you may be shopping for, you'll find it in the Del Amo Mall!! It's so large, some stores are difficult to find. Be sure to bring your walking shoes. They also have a great food court that they're still adding to and a few great restaurants on the outside of the mall, If you're interested in shopping the entire mall, you may want to schedule a couple of days.",https://www.tripadvisor.com/Profile/66renaet
50,Love This Mall !,"This mall is newly renovated and is of great size with many different stores to choose from. Most of the stores are inside the mall. However, there are some that are outside and I enjoy that part of the mall tremendously. Some of the main stores are Macy's, Joanns, JCPenney, Sears, TJ MAXx, Marshalls, Burlington Coat Factory and Nordstrom's. There are also numerous specialty stores.There is also a Dick's Sporting Goods that will go in soon. Hopefully before Christmas.There are many new restaurants to choose from and some of them are Great Maple, Ohana Brothers, Pinks, Lucille's, Blaze Pizza, PF Changs, Lazy Dog and BJs to name a few. One of our favorites is Ghingis Khan (sp?)",https://www.tripadvisor.com/Profile/deanas430
50,Excellent Shopping,Del Amo Fashion Center has just completed a complete overhaul and added a bunch of new shops. The food court has been redone and offers a great atmosphere to grab lunch while out shopping.It is a huge mall with a lot of unique shops.,https://www.tripadvisor.com/Profile/986nickb
40,Work in progress,"The new section on the north end has turned out very nice and I'm looking forward to what they do to the south end. If you want to walk the whole mall before the stores officially open, you're out of luck. You have to go through Macy's in the middle and it's closed until 9AM on Friday-Saturday, 10AM on Monday-Thursday and 11AM on Sunday, so before then, you have to go outside, cross the street and re-enter the mall on the other side. Would be nice if they would have some sort of way to walk the whole mall before Macy's opens and not have to go through Macy's. Maybe because they're a major anchor store they have an agreement that it won't happen, but it sure would be nice.",https://www.tripadvisor.com/Profile/janad63
50,Last minute fashion shopping,"It was the last day of my holiday & because I totally love the clothing here in the USA I thought to spend the day browsing in a pleasant, not too crowded shopping Mall.This place was suggested by Aloft El Segundo staff, so I Ubered to my destination.The Mall was awesome, modern, bright, not overcrowded and the choice of shops, especially in the outdoors area was most interesting.I topped off my experience with a yummy chicken terryaki from the food court.If you are looking for a relaxing and joyful shopping day, this is the place.",https://www.tripadvisor.com/Profile/psykh
40,Lots of choice of shops,We loved our afternoon here. There is such a variety of shops for all ages and gender. I bought a lot in the time we spent there and the food and drink choices around were great! Lots of free parking and maps around if you're looking for a particular shop.,https://www.tripadvisor.com/Profile/jordanannb
50,Best place for shopping,"After renewed,all shops and places is so nice.I love it very much.You got to shop here.hahaha.They all have new style ,nice and clean .I definitely come shopping here again for sure.",https://www.tripadvisor.com/Profile/Dedmae
50,Best hangout place,"Whenever I want to spend time indoor, this is my first preference. You get all here. Starting from outlets to movie to food. You name it you have the brand here.I am a big foodie. I get all type of options that my taste bud crave for.",https://www.tripadvisor.com/Profile/idotravel81
50,Pretty huge place,"You can find all sorts of stores here! Got my Nike sneakers - Macy's didn't have my size; NO problem, found it at another shop around the corner! Plenty of options to eat, watch movies and of course, shop!",https://www.tripadvisor.com/Profile/ideepakc
50,Huge place,This place is huge you can actually get lost in it. I think they have every store you could think of. It beautiful to walk around with plenty of light and outdoor areas,https://www.tripadvisor.com/Profile/428mt
50,Pretty amazing,"This s one of the biggest malls in California and is really amazing to see. They have all the stores you would expect, and also some very high end stores like Kate Spade. There are reasonably priced stores I had never heard of before, like Cotton. My daughter's,nieces and I had a fun afternoon there. Although we did not eat a sit down meal there the restaurants looked outstanding.",https://www.tripadvisor.com/Profile/desertminky
50,Del Amo Mall....You've Come a LONG Way!!,"I used to frequent this mall back in the 80's and 90's before moving to Las Vegas. I came for a visit recently and all I can say is....MIND BLOWN! The update on the mall, while sad in a nostalgic way for me, was done very well. Actually, stunning. Modern design, more upscale shops.... you can't even recognize the old bones that were shaved down and repurposed. Well done.I love the fact that there is now a Nordstrom here as well. Back in my day, one would have to go all the way to South Bay Galleria or even South Coast Plaza for a Nordstrom. But no longer. Everything you need shopping wise is all under one roof now.The northern end of the mall has pretty much completed it's renovation, so renovation of the southern end is probably the last step in this redevelopment process. Another thing that I found was great was the fact that there is an outdoor promenade wing. The landscaping is beautiful and is anchored by an AMC movie theater and Lucky Strike Bowl.Good for you Del Amo. You've come a long way! Definitely going to be a shopping destination for me whenever I'm back in Torrance!",https://www.tripadvisor.com/Profile/VictoriaAllen
40,Great Mall,"My husband and I have stopped at this mall twice now. We drive down to Torrance to hit the Target (by Del Amo) and Marshalls since we don't care for the Culver City mall. The prices at the Westfield Culver City Target seem higher, plus the mall is too crowded for our liking.I would like to point out, that on both of our trips, we arrived at Del Amo Fashion Center at opening time on a weekend. Parking was great at that time, but by the time we left in the early afternoon, the lot gets too busy.The mall itself is quite beautiful and so bright with much natural light.There are a good mix of shops at various price points. We especially enjoyed the movie theater. Our absolute favorite shop is Book Off, we have picked up so many discount DVDs and books here! If you love music, check out the $1 CD section.Other great stores are the Marshalls, lots of good deals to be had here. I am also a fan of the Old Navy for basic staple items, you can usually pick up some good discounts here as well.Haven't dined at any of the restaurants here. I did notice that at 1pm on a weekend day, the food court is packed and there are a lot of long lines.We do like this mall a lot and will surely be back!",https://www.tripadvisor.com/Profile/NYCaliKara
