50,Museum of Modern Art.,"Art that enriches, they have a free auto tour that helps you to appreciate some works even more, it was a wonderful walk, you need at least 2 hours but if you can give the visit more time to take advantage of the best.",https://www.tripadvisor.com/Profile/lilianasmith
50,An amazing place,"When we planned to visit LA The Broad was one of those must see attractions. We followed the advice and arrived early with our pre-booked tickets and avoided the queue. This is probably the best advice I can offer also. The queue to get in without pre-booked tickets was huge.The exhibition space is well planned and, if you follow the route set out in the guide you will see everything. The gallery also has a paid exhibition every so often and if you can, buy tickets for this also.You will find, when busy its full of people taking photographs with the exhibits and some people get quite annoyed if you spoil their shot which kind of spoils the mood here which is normally really good.The staff are helpful and knowledgeable and well happily answer questions should you have any.",https://www.tripadvisor.com/Profile/DonotDreamJustTravel
40,Get Tickets in Advance OnLine,"Very nicely done, get there early as it gets very crowded toward the noon hour. As soon as you enter make sure to make reservations for the infinity room. Layout is a little confusing but everybody is very helpful. Audio tour is interesting but several areas did not work. All in all a good two hours",https://www.tripadvisor.com/Profile/DBKuper
40,Overall nice,A bit small and the main attraction of the mirrors is only nice and might be with a long waiting time. Overall nice and free so totally recommended.,https://www.tripadvisor.com/Profile/ophirf4
50,Very nice exhibition space,"Very nice exhibition space. Superb setting for a remarkable, varied collection, very well highlighted. Online reservations a few weeks in advance allow you to visit this museum, free, in good crowds ...",https://www.tripadvisor.com/Profile/Nanez09
50,Perfect Spot for Modern Art Lovers,"""The Broad"" is an apt name for this museum as it presents a wide array of modern art pieces. Spanning many decades and various disciplines, there's something for everyone - of almost any age - to be seen here. Plan ahead for getting tickets (even if they're free) to see specific installations. You'll need at least two hours to do the visit justice but I'd suggest three or four to really enjoy it.",https://www.tripadvisor.com/Profile/doUcopy
50,Interesting place,"If you like contemporary art, then you must visit here for sure. Stylish building. Interesting exhibitions and exhibits",https://www.tripadvisor.com/Profile/NotGonnaDieNotGonnaD
50,Don’t miss!,Incredible. Well organized given amount of crowd. Get advance pass. Really great place. Across from LA Museum of contemp art. Good two fer,https://www.tripadvisor.com/Profile/438danieln
50,The Broad,Please go and enjoy this amazing free museum in LA. has so much to give plus is a great wait to rest from the heat.,https://www.tripadvisor.com/Profile/Yenyok
50,Gorgeous,Stunning architectural museum. Exhibits are on the very contemporary side. Onsite restaurant Otium is one of the best food experiences I've had. A must see if you are visiting downtown or near the financial district. Moca conveniently located across the street as well.,https://www.tripadvisor.com/Profile/kodimykodi
50,"Great pieces from the past, and interesting modern exhibitions under 1 roof.","Free entry to see some great pieces of what would normally be someone's private art collection, this generous family set up the museum so that it was free to all visitors, You need to still book your time slot as it gets very busy and the ""stand by"" line can be long. This museum was custom built, and walking up and down the stairs you can 'sneak peak' through the glass walls into the storage facilities containing the rest of the museum's art.",https://www.tripadvisor.com/Profile/763MelissaP
40,Great time wandering around ogling the famous modern art,"Enjoyed all the colorful & thought-provoking galleries, especially the Kusama exhibits. The building itself (and elevator) are really neat, too. Friendly people working at the Broad.",https://www.tripadvisor.com/Profile/leklekblue
50,"Very popular, totally worth it... great contemporary art in a stunning setting","I've been here a few times since it opened and always leave happy. It's just a great museum with an open floor plan and excellent natural light. The building's exterior... which at first looked to me like a 1960s parking garage with its pre-formed concrete panels... is really growing on me and it's lit up beautifully at night. Inside, the art is always interesting and in my opinion, puts MOCA across the street to shame, although that museum is still worth visiting. I live right next door and see daily how many people come through here... definitely make a reservation if you can. What's interesting to me is how young the crowd is here for the museum... that's probably what I like about the Broad the best. It really is attracting the next generation of art-lover (along with your typical older museum-attendee) and that's always a good thing.",https://www.tripadvisor.com/Profile/andrew-s-wood
40,Quick museum visit,"Parking is under the building, easy to access but expensive. We had tickets (free from website) so only a short wait to get in at opening time. Line for the infinity mirrors filled very quickly so make a reservation ahead of time. There were a lot on staff on hand and they were all pleasant and helpful. The art exhibit is only one floor the day we visited and so it was fairly quickly navigated. There were some rooms with exhibits that I would not take a child as they had some disturbing images of slavery. More than you would want to explain !",https://www.tripadvisor.com/Profile/CRM13
50,Brilliant but get there early,"Exceptional collection of contemporary art. If you would like to view the ""infinity mirrored room"" installation, get there early and join the waiting list before taking the escalator up to the main area of the museum.",https://www.tripadvisor.com/Profile/nNnNnNNnNNnNNNNNNNq
50,Wonderful experience,The museum exhibition is the extract of the modern art. Do not hurry and do not miss William Kentridge 2nd hand reading. The building itself is architecture gem and worth visiting.,https://www.tripadvisor.com/Profile/DamirS203
10,BE AWARE; INFINITI ROOM,"Don’t go to the BROAD even on a Tuesday and expect to see the Infiniti room - once you enter the museum, then you can put your name in - we went on a tuesday at 1:30 (it opens at 11 or 11:30 and all slots were gone - could not see it. Terribly disappointing. Seems like a way to get guests to spend the whole day waiting and hoping there will be a cancelation. Nothing on the website that made me expect anything like that. Apparently people line up 30 min before the museum opens in order to be the first in to secure a spot. BEWARE!!!!!!!",https://www.tripadvisor.com/Profile/daniellee_11
40,Buy tickets in advance. Expensive visit,"We avoided long lines by going through a somewhat cumbersome online process. We were disappointed to discover that the exhibit we went to see required another payment, and that parking was $27! Also, we were running late for our timed entry (traffic getting there is appalling: 90 minutes to go across town after lunch!), but calls to the museum went to a recording that asked us to leave a message.",https://www.tripadvisor.com/Profile/mrsirin
50,This is now my favorite art gallery in Los Angeles,"I am not a big fan of very contemporary art. However, the combination of the art and the magnificent architecture is magnetic. I loved the place. In this setting the work by Jeff Koons, and Andy Warhol stood out.",https://www.tripadvisor.com/Profile/MkMD11
50,Remarkable artistic experience,"I'm not into contemporary art myself, but Broad is next level artistic, warm, true cultural center. I liked the Pop art of the 1960s and the collections and works by Roy Lichtenstein, Ed Ruscha, and Andy Warhol, but truly enjoyed the 1980s especially Keith Haring works. The highlight of the visit to me was the infinity mirrored room. Although the time inside was limited at 45 seconds, you got the feeling of being alone with millions of stars, quite exquisite. I would recommend it to every true art lover. Make your visit flawless by making sure you have a time reservation before you get there, both for the main entrance but also for the infinity mirrored room",https://www.tripadvisor.com/Profile/peseva
50,Entertaining,"Pre-booking your tickets will save you a lot of pain on entry, and we were glad we did. The staff were friendly and professional and there are some exhibits of the very highest caliber when it comes to modern art from masters like Warhol and Koons. Downtown LA is starting to get its vibe and The Broad is a. If part of this.",https://www.tripadvisor.com/Profile/Mrbasman74
30,Fun museum for modern art lovers,"This is a fun museum to visit, but mostly for modern art fans. It's interesting architecture is a plus. The main exhibit is on the top floor only. Definitely a modern art experience. You can pay $20 extra to visit a small exhibit of more modern art on the main floor if so inclined. The infinity room was cool but about the size of a closet. Only two people at a time can go into the room. It took about 2 hours after signing up to see this one little room.Waiting seems to be the main theme at this museum. I cannot really recommend this museum except to modern art enthusiasts.Also, just too much waiting for such a small exhibit.",https://www.tripadvisor.com/Profile/jefflv999
50,ONE word - AWESOME!,I went with my family. My brother lives in LA and comes here a lot. I can only say this place is TOTALLY amazing and always changing so never bored. I will say the gift shop is quite expensive. I would buy something if it was more reasonable but the experiences you have can not be beat!,https://www.tripadvisor.com/Profile/triptikon
50,Very interesting,We caught an Uber there and walked straight in. Very interesting. Very good layouts and some excellent photo ops. A nice way to spend an hour.,https://www.tripadvisor.com/Profile/peterm608
50,Great Free Museum in Los Angeles,"I visited The Broad on my last vacation to Los Angeles, and it did not disappoint.It is a great contemporary art museum that is free to the public. So I highly recommend that you make an online reservation to visit as this will cut your time in the queue to get in.When I visited in February 2020, I was able to see artwork from Mark Bradford, Christopher Wool, Andy Warhol, and more. I was also able to see a series of films, one being from Shirin Neshat. The film was interesting and it really caught my attention.Another great addition to the museum is the Yayoi Kusama Infinity Mirrored Rooms. It was really amazing, but be ready to wait to get in. You have to checkin to get in the room and you are sent a text of when it's your turn. I do reccomend you occasionally check with staff at the entrance of the room to check on your wait time. Also, due to the long line of people the time you get to spend in the room is limited to a few seconds so have the camera ready!A parking garage is available for visitors, and you can get a validated ticket from museum staff for a discount on parking. I believe I paid $17 for three hours.Overall it was a great visit, and I would definitely go again for new exhibits.",https://www.tripadvisor.com/Profile/75FA
50,impressive showcase,"The Broad is that rare modern art museum where the design has been conceived to showcase the art rather than the architect’s ego. The bright, airy interior is a work of art in itself, rising from an expansive ground floor through a wonderfully tubular escalator into a free-admission main gallery of carefully curated masterworks. Signature kitschy sculpture by Jeff Koons (including his balloon dogs and porcelain Michael Jacksons) are given their own room, adjoining work by Ellsworth Kelly, Andy Warhol, Robert Rauschenberg and other masters. The main attraction is a mirrored “infinity room” by Yayoi Kusama, a light show viewed through portholes that’s the sober equivalent of an LSD trip. The ground floor is given over to rotating exhibits of first-class provenance, most recently (Winter/Spring 2019/2020) a first-ever career retrospective of exiled Iranian artist Shirin Neshat. Always worth a look.",https://www.tripadvisor.com/Profile/KirkE266
50,Superb contemporary art,"This beautiful Museum in the Heart of Los Angeles, exceeded our expectations. The exhibits were beautifully displayed with knowledgeable docents to guide you through the museum and give you background and context. Parking was easy and you could spend many hours here touring.",https://www.tripadvisor.com/Profile/bradinmn
50,Great museum,"Book ahead and visit! The museum website is an excellent introduction to the building and the collections at the Broad. The museum is friendly and welcoming. Its collections are very impressive. We loved the wildly ranging sculpture works from Jeff Koons, especially the Buster Keaton statue, but also the massive prints on display. While there are many pieces of interest in the museum, the ones by Mark Bradford grabbed most of our attention. The pieces are complex and multi-layered. The enormous ""Deep Blue"" of mixed media on canvas depicts the tragedy and devastation in Watts. See them all from a distance and examine them up close. They are remarkable works of art. The building itself is striking and inviting.",https://www.tripadvisor.com/Profile/waterandmore
50,Truly Fabulous,"The Broad experience is truly fabulous in many ways.Booking – you can either book online in advance or if you can drop in and join the queue – I suggest booking. The museum is easy to reach, parking is equally easy. Staff are very friendly, efficient and the facilities are spotless. Inside, “traffic” is managed very well, there is no overcrowding in spaces. The museum website is remarkably informative, even giving current wait time with no reservation. The website also features times for Free Public Tours, which we sadly did not have enough time to take advantage of.The architecture is remarkable both inside and out, equal to the magnificent art housed within. I especially like the natural light and the way the space and light work beautifully with the works. I am in awe of the collection and curatorial skill. It feels like there is a respect and love for the work.Depending on your budget, you can enjoy the wonderful permanent collection gratis or you pay to see the temporary exhibits.The only thing that would have made our visit even more fabulous would be a tea or coffee shop on the premises, as those in close proximity were not the best. I look forward to our next visit!",https://www.tripadvisor.com/Profile/ChromeCorgi
50,Very Impressed,We traveled to LA last month and visited the Broad. My family and I were very pleased. Tickets are free to most of the gallery and the exhibits are beautiful. It’s is a kid friendly museum.,https://www.tripadvisor.com/Profile/ManuelC4942
50,Lovely museum,We were able to gets ticket by visiting the website and selecting the date and time you would like to visit. It was a plus we got tickets as we visited on the weekday rather than the weekend.,https://www.tripadvisor.com/Profile/jhm4317
50,A Must See!,"My friends and I visited this awesome museum. Great architecture, unique art displays, very aesthetic .... just some of the features of this museum. What truly enriched our experience was the smart, knowledgeable, enthusiastic staff, who were ready to share their knowledge about the art work or the artists. I could have spent the whole day there, although its not a large facility. Thanks to the Broads for this admission free facility and the opportunity to see and appreciate contemporary art.",https://www.tripadvisor.com/Profile/mkkCalifornia
30,Simple,I was excited to come here as I have heard great things. There are some great art pieces here including the famous big chair/table set. It is free and you can go without tickets. I thought it was just okay. My favorite part was the Mirrored room. Very cool but very quick which is understandable.,https://www.tripadvisor.com/Profile/Dayzers_
50,Modern and contemporary art,"The place is a wonderful mix of great architecture, modern art exhibitions, american art and great picture opportunities.",https://www.tripadvisor.com/Profile/danielmicu
50,Must see!,This has been one of the best showings of late 20thand early 21st century art in the USA. Broad had a fantastic eye and collected with breadth.,https://www.tripadvisor.com/Profile/865lorettaf
40,Interesting Modern Art Museum with Free Admission,"Interesting collection of modern art. You can spend a pleasant hour or so in here. Best of all is the free general admission. However to avoid standing in a long line, order your tickets in advance on their website and you can select a specific time to enter. Make sure you get your parking ticket validated before returning to the adjoining garage.",https://www.tripadvisor.com/Profile/TravelingSoccerLoon
50,Great Evening and Free,We signed up for the free tickets to the third floor galleries. We spent over an hour enjoying artworks by different artists.,https://www.tripadvisor.com/Profile/Weimerunnr
50,Cool,What a great way to spend a couple of hours enjoying great artwork and displays. Make sure you get tickets first. They are free. Also then grab a cool dinner somewhere downtown. Enjoy a great family day out.,https://www.tripadvisor.com/Profile/allnines1414
50,Outstanding,"It is exactly the case when something exceptional is offered free of charge. The collection is unique and outstanding: Murakami, Warhol, Ruscha, you name it. To avoid the queue which is whimsically long irrespective of day of week, book a spot online. It is absolutely free: you just need to arrive by the chosen time. The Broad is located right across the street from the Walt Disney Concert Hall, so it is possible to see both attractions in one day.",https://www.tripadvisor.com/Profile/Elle_Ventrouge
50,"If you like Modern Art, this is for you!","I visited the Broad on New Year's Day. I was advised before leaving for my trip to CA to get tickets on-line. Since Wednesdays are free, I still got an advance reservation time and this saved me from waiting in a very long line for those without advance reservations. Once inside, there are numerous galleries devoted to the ""giants"" of American Modern Art, including Warhol, Koons, Jasper Johns & Basquiat. A special work of Yayoi Kusama is on display and you need to sign up ahead of time to get a viewing slot as only a few can be admitted at any given time.Worth the extra hassle!",https://www.tripadvisor.com/Profile/317KathyM
50,Shirin Neshat Retrospective,"Since studying moving image at University I've been a big fan of Shirin Neshat's video and photographic work. Getting to see it in situ in the beautifully curated retrospective at The Broad was inspirational and humbling.The gallery itself is home to a brilliant permenant collection with works by Andy Warhol, Barbara Kruger and Jeff Koons.It is free entry but the queue is enormous - I went on a weekday and it still reached the whole way round the building. Highly reccomend buying a ticket in advance for whatever special exhibition is on like I did. This means you can skip straight to the front and go right in.",https://www.tripadvisor.com/Profile/BebeDrew
50,Some of the most valuable art in the world for free,"The collection is outstanding. The architecture is unique. The size is just right. It's free. This museum if perfect for people who are obsessed with contemporary art (like me) and for people who are casually interested. I took a friend who is not particularly enthusiastic about art, and she said it was fantastic.I did not have a reservation, but arrived around 10:30 am on New Year's Day and got into the museum around 11:15 am.",https://www.tripadvisor.com/Profile/MikeyImaginary
20,"Nice art, but nasty service and not wheelchair friendly","We were in LA for a few days and signed up for a 12:30pm entrance to the Broad. As we had recently seen Love is Calling in at the ICA in Boston, we wanted to see Kusama's Infinity Room at the Broad. They have a really terrible process - first you have to get a ticket for an entry time to the museum, then go to an ipad area to sign up for the infinity room. We had one person in a wheelchair who was pushed aside in line by the customer service person. Once we finally entered, it was at least a 2 hour wait for the Infinity Room with a long line at the ipad so we spent most of our time in line. The person in charge of the ipad was very unfriendly.In addition, the ""accessible"" bathroom was not really wheelchair friendly and required 2 people to help hold the door to the stall. The Broad should take a lesson from the ICA in Boston - give an entry time to the exhibit online. At the ICA, it was very smooth with little wasted time in line.",https://www.tripadvisor.com/Profile/barbf59
50,Stunning art in stunning construct,"It was a unique opportunity to admire the greatest modern and contemporary art works. Such a tremendous range of artists are presented with some of their best pieces on view.Mark Tansey is well represented with great creations. We spent time in front of his intriguing Achilles and the Tortoise. It symbolises the hectic pace of technological advances versus the slower growth of nature exemplified by a fine pine tree. Amongst famous figures, it shows Princess Diana planting a tree and Albert Einstein in the midst of an observing group.Jeff Koons's Jim Beam - J.B. Turner Train is marvellous. In stainless steel and bourbon, it refers to the famous bourbon marketing whereby bottles sold had a toy piece of their transport train. If enough of the whiskey was bought the whole train could be yours.Another highlight was Yayoi Kusama’s Infinity Mirrored Room with its infinity of stars.",https://www.tripadvisor.com/Profile/permia
40,Great exhibit for art lovers and non art lovers,I wish I had more time to spend here but we got last minute tickets on a very busy holiday weekend. It was a short walk from the Biltmore (our hotel). I forgot to reserve tickets for free general admission and we almost did not go. When arrived the line looked like 100 people deep two hours to close. But we found out that was the free ticket stand by line. We paid for the $10 tickets and walked right in. We were sad we were to late for infinity room reservations. But there is a line for the mini infinity exhibit inside. A must do!,https://www.tripadvisor.com/Profile/wanderlust32772
50,Inspiring,Great looking building and also the art on display was very worth the visit. Especially as it was free! A must do if you're in downtown.,https://www.tripadvisor.com/Profile/TPAT75
50,Wonderful,A beautiful space inside and out. Exhibits rotate with some permanent items. Enjoyed Mark Bradford pieces immensely. Shirin Nashat photos were very interesting and worth the $20 ticket for this special exhibit. We are lucky to have this museum.,https://www.tripadvisor.com/Profile/busyflying
50,Awesome!,"We visited the museum and we really enjoyed it. The best part? It was free! If you are in downtown LA, you need to go. We went around 5:30 pm and waited in line about 30 minutes. It was worth it!",https://www.tripadvisor.com/Profile/JoanV116
50,Fascinating Art Museum,"We spent just under two hours at The Broad and needed more time to do it justice. The ""guard"" in one room took the time to familiarize us with the works of Mark Tansey, which was very helpful. Definitely recommend this museum.",https://www.tripadvisor.com/Profile/RioVistaPatty
50,Great design,"The Broad in downtown LA looks like a cheese grater design on the outside but the green mole hills on the pavement are something, weird but a great design.",https://www.tripadvisor.com/Profile/TeamWard
40,Great collection of modern art,"They have a lot of works by Jeff Koons, as well as some works by Andy Warhol, Robert Rauschenberg, and other famous modern artists. They also have special exhibits and a museum store.",https://www.tripadvisor.com/Profile/robertmL1495PA
50,Love Boutique Museum,We love visiting here. The Broad Collection is so worthwhile as is the building. This museum is a ton of fun for our family and we loved that we got into the Kusama Infinity Room as well as to see into the other Kusama piece that is on site right now. Beautiful building too.,https://www.tripadvisor.com/Profile/Thegoodegg
30,"Fantastic building, so-so art",Title says it all. Go just to see the fantastic building. The art has some interesting stuff but little that I'd consider museum-quality. Maybe it's just me - other people seemed to like it.,https://www.tripadvisor.com/Profile/JetDesigner
50,"Eli & Edythe Broad giving, giving, giving",Why do people look at me funny when I tell them how magical downtown Los Angeles is? I'm just going through and looking at ALL the good things my friends in this city have put together and it gets overwhelming. This beautiful museum at the edge of the current downtown financial district is a must see while around the Walt Disney Concert Hall (one (1) block up/down the street).,https://www.tripadvisor.com/Profile/andrewjamesa2019
40,Don’t forget to queue for the Infinity Room,A wonderful collection of Lichtensteins. And don’t miss Yayoi Kusama’s infinity room on the ground floor.,https://www.tripadvisor.com/Profile/dissolvedgirl
