50,BRILLIANT and FREE!!!!,"The Annenberg Space for Photography is one of the most wonderful places to open in Los Angeles in years. It celebrates the magnificent art of photography in ways you could never imagine. The space shows 3 to 4 exhibits a year...it just concluded the National Geographic exhibition with incredible photographs through the years - including the Afghani Girl - that iconic cover that we all know. The space runs a short film explaining the exhibit and it is free to the public Wednesdays through Sundays, closed Mondays & Tuesdays. I highly recommend this for locals and visitors alike.",https://www.tripadvisor.com/Profile/DonAdelle
40,Something a Little Different,This smallish museum is located in a complex of office buildings. Admission is free but validated parking is a modest $3.50. In July 2014 show and films were about country music performers and their photographers..,https://www.tripadvisor.com/Profile/SockFour
50,"BEST KEPT SECRET IN LOS ANGELES, AND IT'S FREE!","It all started when I saw signs on light standards on Olympic Boulevard that said, ""Who Shot Rock and Roll?"" After driving by them for about a month, I wondered, ""Who DID shoot Rock and Roll, and what does that mean? So I went home and googled it. OMG! It was the Annenberg Space for Photography, hidden among the tall office buildings in Century City. They offer periodic FREE photographic exhibitions that are beautifully curated with state of the art multimedia presentation as well as evening events. There is usually a very interesting and informative short movie with each exhibit. I've been to three now, Who Shot Rock and Roll, The Power of Photography, National Geographic: 125 years, and the newest one, Country: Portraits of an American Sound.. Each time, I have taken family and friends with me, and no one has ever been disappointed. My suggestion: Go early, allow a couple of leisurely hours there, and then shop and have lunch in Century City. Tom Colicchio's Craft is practically next door...",https://www.tripadvisor.com/Profile/kathiek611
50,"Great building, interesting layout-Enjoyed!",The exhibit of Folk & Western artists was well done and the video with Kenny Rogers was excellent and just the right length. It was fun to pick out old favorites and hear them on the jukebox. Parking was just $! on the weekend and very convenient. The mall is close by with the well stocked food court.,https://www.tripadvisor.com/Profile/19022013
50,Unexpected place to find art,This little space is in the middle of Century City - hidden amongst the office building. I saw an amazing Helmut Newton Exhibit here that was very comprehensive. I look forward to returning when they have something else relevant. I believe that they are currently showing an exhibition on country music that did not appeal to me.,https://www.tripadvisor.com/Profile/travelingworkingmom
50,If you love photography...,Then go here. I have seen excellent shows here. Well worth the time. The parking is right down below and though you pay it's very easy to deal with.,https://www.tripadvisor.com/Profile/janew79
40,Great hidden secret,"This ""space"" has great exhibits of photography on many different subjects. I have seen photo collections on rock stars, National Geographic specials, fashion icons and more. On the weekend there are No traffic hassles, but get directions on parking.",https://www.tripadvisor.com/Profile/suz91101
30,Take away the hyperbole,"If you read the reviews here, you'd think this would blow your mind away. Its fine, some interesting video presentations on photography, but its just a bit limited, and if you read what's here, I think you could end up with too high expectations. Fine way to spend an hour if you've time free in Century City though",https://www.tripadvisor.com/Profile/Waldea
50,Great exhibits,"Annenberg is one of these little gems that we have here in Los Angeles, tucked away in Century City.Check for the most recent exhibit, I think they change about every 3 months.Fantastic way to spend the day, and afterward we walked over to Westfield Shopping center for lunch and coffee.",https://www.tripadvisor.com/Profile/shanas758
50,One of my favorite places in L.A.,"I'm somewhat of an avid photographer, but I don't think you need to be to appreciate this place. It's free to enter and they have a constant rotating collection of contemporary photographers.",https://www.tripadvisor.com/Profile/DollaYo1
50,Amazing experience,"We visited the exhibit, ""The Power of Photography: National Geographic 125 years"" - and it was a truly eye-popping display. Total immersion in overwhelming images and multimedia presentation. This was the best photography exhibit I have ever seen and I look forward to seeing more exhibits here.",https://www.tripadvisor.com/Profile/WestwoodTrekker
40,A hidden gem,I've been to the Annenberg Space for Photography several times and have always been blown away. Their curation is excellent and the space is perfect for photographic exhibitions. I highly recommend it.,https://www.tripadvisor.com/Profile/98stephaniec
50,Best Free Thing In Los Angeles,This is a fabulous gallery with rotating exhibits. We've seen three different exhibits over the past 18 months and have enjoyed all of them. Most of the exhibits take about two hours to experience everything. There is usually a short movie that goes along with the exhibit.Tip: Don't wait for the final weekend of an exhibit or you will have to wait for quite a while to enter.,https://www.tripadvisor.com/Profile/BThomas2218
50,If you love Photography you must go,I collect photography and am in love with this beautiful space. It'd not an all day museum visit - more like one hour of the greatest stimulus! Go!,https://www.tripadvisor.com/Profile/sanukphoto
50,Wonderful venue with incredible photos...,"First of all it is FREE. Parking with validation, under the building is $3.50 during the week and $1.00 on weekends.The venue is set up to be viewer friendly. Kids and adults will enjoy the exhibits. They change about 2 to three times per year and are extraordinary. Don't miss the movie/slide show that runs continuously in the center of the gallery.There are even photos in the restroom area.A very special place to visit.",https://www.tripadvisor.com/Profile/carolelynns
50,Good Venue for Art and Photography,"Last Sunday, I visited the Annenberg Space for Photography and caught the last day of the National Geographic photography exhibition. Fantastic display of photography from around the world. Extremely well organized and beautifully displayed. Absolutely amazing photography !!! The exhibition became crowded, however, after a short time, due to the relatively small area of the exhibition. I have heard that it is much less crowded during the weekdays. There was no charge to see the exhibition and parking was only $1 ! I will definitely look for more exhibits at this venue.",https://www.tripadvisor.com/Profile/alanmhersh
50,Definitely worth a visit,"We were able to enjoy the National Geographic photo exhibit during our stay in L.A. The building and grounds are beautiful, parking was easy and the exhibit was really just the right size. I wish we hadn't had to endure the large and noisy school group that was there that day but it was still a wonderful trip and I look forward to seeing another offering in the future.",https://www.tripadvisor.com/Profile/JenK992
50,Definitely Worth the Trip. Easy Parking (sort of...),"I heard the National Geographic exhibition was terrific. I decided to head there today because tomorrow is the end of the exhibit. The physical gallery is small...but the display was beautifully executed. I've heard about other fine exhibits they've had. I would return. This exhibit showed so many fine photos on well lit high definition televisions.Because it was the last weekend for this publicized show, it was crowded. I suggest going to a show earlier in the cycle. I waited 25 minutes to get in....and it was cozy in the galleries.Parking is easy and accessed off of Constellation Blvd between Ave of the Stars and Century Park East. It took a while to get in as security was checking everyone's trunks. I was also told that someone who had their dogs in the car was told to leave. Lucky me today because I didn't have my dog with me. Don't bring your pets. They aren't allowed in the parking structure. Make sure to get your ticket validated at the gallery. On the weekend parking is only $1.00. It was very confusing when I was leaving because I couldn't find a pay station as they have in malls. (I was told to pay at the pay station.) The machines at the exits take credit cards.There is no entrance fee to the photo gallery.",https://www.tripadvisor.com/Profile/OBD2142
50,National Geographic,Seeing the amazing display of 500 photos was overwhelming. The fresh way of displaying these photos made the experience so much more enjoyable. It is wonderful that the museum is free and even validates parking.,https://www.tripadvisor.com/Profile/280melissab
50,Exhibits always worth the effort,"We have been to many exhibits here, but the 125 Years of National Geographic is our favorite so far. They have managed to fit thousands of images into the tiny gallery by using monitors, film, and interactive touch screens. If possible, try to visit during the week when it is not as crowded. One of the very few free gallery/museums in the city, they even validate your parking down to $1. Only through April 27, 2014, so see it if you can!",https://www.tripadvisor.com/Profile/Mah_Murrini
50,Favorite art destination in LA,"I've been here twice now for different exhibits, and both times were amazing. See the national geographic photography 125 year anniversary exhibit before it's too late!",https://www.tripadvisor.com/Profile/R3ctivision
50,Priceless experience that only cost $1,"This is a wonderful place for everyone from professional photographers to people who just like to look at pretty pictures. The staff was very friendly, the building and surrounding areas are beautiful, it's FREE to get in and validated parking is only $1 in the garage!! You couldn't ask for a better weekend activity.I recently attended the exhibit celebrating the 125th anniversary of National Geographic and thought it was amazing (runs through April 27th). They've displayed so many iconic pictures on walls and LED screens, as well as included some short films and interviews with the magazine's photographers. I'm looking forward to visiting again and seeing other special exhibits here.",https://www.tripadvisor.com/Profile/MayaD888
50,Wonderful!,"Went to see the ""125 Years of National Geographic"" exhibit ... Stunning! The layout and interactive displays were great, and the location of the museum is perfect. I can't believe it is free and they will validate the parking garage so it's only a buck. I definitely will return!",https://www.tripadvisor.com/Profile/A_So_Cal_Local
50,national geography exhibit is a must see,Loved this incredible exhibit of photographs spanning so many themes with unparalleled imagery. The documentary movie is exceptionally informative and the exhibit is presented in such a riveting and unique way.,https://www.tripadvisor.com/Profile/looshi
50,Just Do It! Visit this wonderful place,"Whether you are a photography enthusiast and hobbyist like me or an indulgent partner of one like my SO, do plan a trip to the Annenberg Space for Photography. First it's free, and the parking in the underground garage is only $1 (with ASP validation) on weekends. More important, it is a place focused entirely on the essence of communicating through photographs -- and they do it very, very well.Do NOT miss the current exhibit -- through April 2014 -- celebrating the power of National Geographic photography over its 125 years of publication. Rather than a static display of a few dozen matted and framed prints, this glorious multi-media experience features more than 500 top-notch images by the very best professionals on several multi-panel flat screens programmed to change just about the time you have absorbed each one of the 2-4 on that display. You can cruise through, or -- much more likely -- you will stand mesmerized in front of one panel, soaking in each beautiful or disturbing or funny or moving image until you realize its cycle has begun to repeat.Just when you think you have had enough standing, you can choose to watch a video featuring six of the photographers, their images and what drives them to travel the world to capture them. A second, shorter video shows how and why ASP and National Geographic created the exhibit as a multi-media experience.This was my first visit, so I can't vouch for past or future exhibits. But I plan to come back, and probably many times!",https://www.tripadvisor.com/Profile/oscar505
50,Magnificent National Geographic Exhibit,"First of all, the Annenberg Space for Photography is a great venue and easy to get to. Abundant free parking and easy navigation from parking to the exhibit.No admission fee, donations welcome!Upon stepping into the darkened exhibit room, it all seemed overwhelming at first, but the magazine covers drew us in until something just grabbed each one of us in some emotional way. They mix video with hardcover photos and the experience is worth every minute of your time. You can't help but walk away in some state of change.",https://www.tripadvisor.com/Profile/goadventures
50,Extraordinary.,Extraordinary. Now showing Nat Geo photographs in the most exciting and innovative way. Be sure to watch the documentary. Plan to go twice...it's free and parking is only $1.,https://www.tripadvisor.com/Profile/Lilybay
50,Great place!,"If you like photography, this is a great place to go in LA. I have been coming here for years, and every time is fun and enjoyable. All the exhibitions are nicely set up, there is continuity and it is a story telling that makes sense, guiding the viewer throughout. The videos are also an interesting part of the program.Friendly staff at a nice location with easy and cheap parking, and all of this is FREE admission!!",https://www.tripadvisor.com/Profile/KTITA
50,for photograpy enthusiast,This space has a changing exhibit regularly so one should check the website to see what will be showing. There is regular bus service i know of from los angeles and santa monica that will take you here. There is no cost for visiting here. The site regularly showcases premiere photographers from around the globe. If you become hungry a short walk away is the westfield mall where you can get food.,https://www.tripadvisor.com/Profile/Hoben01
40,The National Geographic exhibit is superb.,The 400 plus images and the documentary provide a beautiful exhibit and explanation of the operating philosophy of National Geographic. I will visit the Annenberg again to view this exhibit.,https://www.tripadvisor.com/Profile/BKC2003
50,Fantastic photos,"The Annenberg Space for photography is an intimate state-of-the-art setting that showcases photography. The current exhibit is on National Geographic and its photos on war, animals, people, nature, etc. The National Geographic exhibit is the best exhibit that has shown at Annenberg to date. There are 30+ LED monitors, photographic essays, and videos. It takes about an hour to go through the exhibits and watch the video. Entry is free. Garage parking is $1 (after 4:30PM on Wed-Fri, all day Sat-Sun) or $3.50 (before 4:30PM on Wed-Fri). If you are up for lunch before or after your visit, then eat at Clementine in Westwood (1751 Ensley Ave, Los Angeles) which is 0.6 miles walking distance away. It also has a tiny parking lot. It has great sandwiches, ginger limeade, and baked treats.",https://www.tripadvisor.com/Profile/krawner
40,Helmut Newton Exhibition July 2013,"Saw some of Helmut Newton's most famous, iconic high fashion photography spanning his illustrious career in this rare exhibition. The loop movie and video clips added depth and historically dimension to the whole show. It gives you an idea of the fashion development and the climate Newton was working with then. Lots of stilettoes, fierce make-up, gelled- big hair, big shoulder pads and very tall statuesque models.The Annenberg Space of Photography does great work to showcase quality work.The drive into Century City can be daunting with all that traffic though. The view is stark, clean line, highrise office building with lots of open spaces in the courtyard. Bring a warm wrap. It gets rather chiilly when the wind kicks up.",https://www.tripadvisor.com/Profile/3Kells
50,Spectacular photos in a stunning setting,The photographs currently exhibited in the space are exceptional. They also have documentaries you can sit and watch which are well worth the time. This exhibit can be visited more then once (it's free) so you can appreciate everything it has to offer.There is a wonderful gift shop down the hill from the Annenberg called skylight Studios. It has above average items as well as a book signed by Steve McCurry.,https://www.tripadvisor.com/Profile/travchef
30,the Annenberg,"Interesting location and set up. Unfortunately the day I went there was a nude display and not appropriate for children. However, the location was very engaging for those who enjoy photography. The artists vary and so does the theme. Parking is underground and distant.",https://www.tripadvisor.com/Profile/travelingranmaFresno
50,Awesome exhibit,The Annenberg Space for Photography is a must visit for all people interested in photography. It hosts different exhibitions and is small enough to not be overwhelming. The displayed pictures are supported by videos (in the case of the current exhibit - a biography of the artist and snippets of shots his wife made giving a glance into his private persona).,https://www.tripadvisor.com/Profile/Xabbu
30,Unusual,"The Annenberg has a very difficult space for hanging photographic exhibitions, and the parking is difficult for first timers. They do some interesting exhibitions, and some of the documentaries they make in conjunction with the exhibitions are excellent, such as the one they did on war photographers.",https://www.tripadvisor.com/Profile/Fotodaze
30,Interesting Photography,"This is in a small building in Century City. It is hidden behind an office building, so we had some trouble locating it. There is no close parking. I would not make it a destination, but it is worth a visit if you are in Century City to visit the mall or have an hour to spare while doing something in the area. The collection was interesting and well laid out.",https://www.tripadvisor.com/Profile/MargieLA
50,"Brilliant, and free to the public","This one of those hidden gems that you won't believe when you get there. Stellar photography exhibits that rotate about every three months. Presented in a way that only the Annenberg Foundation can. And unbelievably, free to the public. Most people don't go to Century City for leisure, but this is definitely worth the trip.",https://www.tripadvisor.com/Profile/131Joanne131
40,"interesting small, variable exhibits","Quite limited, but enough photography to satisfy—check what the exhibit is (online) before ya go. Parking is OK, if you can understand the rules.",https://www.tripadvisor.com/Profile/equally
50,Fabulous exhibits in a wonderful space!,"This place rocks! The exhibits are all very well thought out and positioned. Always thought provoking! I haven't yet attended the guest speaker series, but I sure would love to!",https://www.tripadvisor.com/Profile/PatriceD97341
50,Spectacular Views Inside and Out,What a wonderful treat! The exhibit was really inspiring and dramatic. No expense was spared in the presentation of these photographs. The view of the Century City Buildings standing on the steps of the Annenberg is really breathtaking. This is one of the best deals in Los Angeles as the Space entry is free and parking is only $1.,https://www.tripadvisor.com/Profile/terrieerlich
50,picture perfect,"a fantastic museum experience in the midst of century city office buildings.Have seen several exhibits but especially lloved the WHO SHOT ROCK AND ROLL. The location is so lovely, overlooking a surprise mini park in the midst of all the concrete and glass",https://www.tripadvisor.com/Profile/janieB1123
30,space not suited for photography,"it was a movie theatre space converted to a photography space....the largest room here is devoted to showing videos, hosting speaking engagements and music concerts...the 'photography' exhibition space is relegated to hallways where one must stand just a few feet away from the images...lighting is sub-par...photographs are even displayed near the bathrooms...parking in the structures and finding your way around the complex can be a nightmare...they could have found so many better buildings to house a photography space, which would allow better accommodations and mostly importantly - better viewing!",https://www.tripadvisor.com/Profile/TheOriginalSamiam
50,Great for Photo Buffs,This viewing space has photo shows that change every few months. Some are good others great. The location is a small stand alone building in Century City right between all the tall office buildings. No charge for admission and discounted parking. Plenty of places for coffe and lunch in walking distance. Takes less than 3 hours so plenty of meal time left. Very nice experience and free!!,https://www.tripadvisor.com/Profile/AlanB911
50,Wallis goes out of her way to provide us the BEST!,"This ""space"" is fantastic! Every exhibit I have seen has been moving, educational, informative and visually perfect to make its' point!Nothing else to say, this is the bottom line and it's free, Wed.-Sundays.You cannot go wrong coming here if you want to open your eyes, see, learn and experience photographic excellence.",https://www.tripadvisor.com/Profile/Disarma
50,If you love photography ...,"... this is the place for you! No matter what the exhibit subject matter is, the quality of the photography, the multi-media presentations, the curation of the shows is top notch down to every well thought out detail.This is a place I will always return to time after time for each new exhibition. Their stunning multi-media video presentations always have the same effect on me. Jaw dropping awe. At times I have watched the video presentation for some shows a second time to just let it soak in.Just when you think it can't better - it does ... Admission is free!",https://www.tripadvisor.com/Profile/B0hdana
50,Bite-sized exhibitions!,"All too often a visit to a large gallery or museum becomes tedious, as the scale and amount of art on display is simply overwhelming. Add on miles of trudging around and generally poor and expensive food, drink, and parking as well as high entrance fees and it can be a mixed experience.Hats off then to this great little facility which resolves all of these issues. With validated parking costing $3.50 max (and only $1.00 at weekends), several good value cafes and restaurants adjacent to the gallery, and the exhibitions focussed and concise, this hits all the spots!We went to see the spectacular ""No Strangers"" exhibit, a stunningly vibrant look at cultures around the world, which, despite all unforgettable appearances to the contrary, simply highlight how similar we all are worldwide. The photos were superbly printed, and the accompanying video informative and entertaining. The free audio guides are another welcome plus. In all, in a city full of things to see and do, this should be up there as a must see. Oh, and did I mention it's free?! I'll certainly be back.",https://www.tripadvisor.com/Profile/526CharlesM
50,Who Shot Rock and Roll,Unreal exhibit - Who Shot Rock and Roll! This is the only place on the West Coast that will be hosting this exhibit. 50 plus years of Rock and Roll photography. Starts with Elvis at 17 and works its way through all the greats and eras. Make sure to stop in and see. Its FREE and make sure to watch the documentary in the center room as well.,https://www.tripadvisor.com/Profile/Amermaiden
50,What a shot!,How ubercool is this place......righteous musicians captured by equally talented photographers.The two come together and viewer is on the journey and along for the ride---it's such an exceptional show a true rarity.Really do not miss this experience--you are transformed back to a day in history where so much in the world was unfolding and how music was the reaction by the youth.It's captivating and you feel as though the photographers have shared personal experiences with you. You are soaring in their universe and it's awesome.If you go on a weekend the parking is under 2.00--the museum is free--head phones and all.The space outside the center is a mesmerizing view of the city.....wow-- thank you,https://www.tripadvisor.com/Profile/JoyS400
40,Great exhibition space and exhibits,"We went this past weekend for the ""Who Shot Rock & Roll"" exhibit. We had been to Annenberg before, and love the small setting. The space does not leave you wondering for hours like a huge museum.The Rock & Roll exhibit is great, and I highly recommend it. You should plan for an hour to an hour and a half for the entire process. You can pace yourself through the exhibits and then take time out to watch the video. Be sure to have your QR reader ready on your phone to listen to the actual photographers discuss their shots.Finding the place can be a little hard, but follow the small signs for parking and follow everyone else to the exhibit. On the weekends you should allow at least 30 minutes to wait in line, but thankfully Century City is deserted at that time so you won't have traffic.You will find yourself looking to come back for their next exhibit!",https://www.tripadvisor.com/Profile/lfcox
