50,Vast and bustling,,,https://www.tripadvisor.com/Profile/permia
10,YELLOW TAXI drivers are STEALING from you.,,,https://www.tripadvisor.com/Profile/L4132CCronj
50,Cruise ship central along with a terrific battleship!,,,https://www.tripadvisor.com/Profile/Cavydad
50,NCL Star Cruise Embarkation Process,,,https://www.tripadvisor.com/Profile/MoKan51
50,Not the easiest to find,,,https://www.tripadvisor.com/Profile/G6571ETmichelep
10,Getting on the cruise ship,,,https://www.tripadvisor.com/Profile/viv2367b
50,Boating in The Los Angeles Harbor,,,https://www.tripadvisor.com/Profile/francisp404
