50,Excellent tour!,I went along with the group. But wow is a tour worth it of the casino. Amazing history and it’s really fun to see where some of the LA HIGH LIFE crowd have partied over the years. I believe they have had after Oscar parties here for years! Now there is a bucket list adventure!,https://www.tripadvisor.com/Profile/Laneemarie
50,Fun tour and a very cool building,We did a last minute tour here and it was one of the highlights of our day on the island. The building is a must see with a cool theater and ballroom upstairs. There is a short film and it is really interesting. Our tour guide was also friendly and fun! Highly recommend.,https://www.tripadvisor.com/Profile/tLynn18
50,Take a deep breath and be ready to walk thru HISTORY!,We took the tour which takes you behind the scenes and we were amazed at the history we walked through. Everything was amazing and how the built the building was so interesting!,https://www.tripadvisor.com/Profile/Porsche-the-Traveler
50,"It's not a Casino, it's a Casino","This beautiful building full of US and Catalina history is a theater and a ballroom. We really enjoyed the tour and harbor views from the top. I learned that this is not a place to gamble, the word was Italian for place of entertainment. Who Knew?",https://www.tripadvisor.com/Profile/karlad976
40,Day tour to Catalina Island,"Beautiful island, especially the Casino. My advice is to reach there early in the morning so that you have enough time to explore the interiors, which we did not have time to do.",https://www.tripadvisor.com/Profile/Weexplorers
50,Fun visit and historical tour,"The “casino” is really a beautiful historical theater and dance hall, just amazing and worth a quick tour. We had Franky as our guide, he was adorable!",https://www.tripadvisor.com/Profile/mayamrsG
40,Historical amazing property,Feels like ghosts of big band eras are still roaming the ballroom. Fabulous facility that is totally underused.,https://www.tripadvisor.com/Profile/4SIGHT
40,Casino,We had a fun time taking the full tour Of the famous Catalina Casino. We has a chance to so a little dance too.,https://www.tripadvisor.com/Profile/Roving772845
50,Great Tour of the Casino,We did the Discover the Casino tour and had a great time seeing the theatre and ballroom. Amazing decor and a great guide in Phil.Would definitely recommend if you have time - 50 minutes in AM or PM.,https://www.tripadvisor.com/Profile/rosco1957
40,An Unusual Building,"This building on one end of the bay is not a casino but a cinema and theatre. This has been the focal point of Catalina island since it opened in the late 1920's. This has been the venue of great entertainers, live theatre productions and films. This building having been lovingly restored typifies the Art Deco style and is a glorious reminder of Catalina's past where so many film stars had holiday homes or used to frequently visit.",https://www.tripadvisor.com/Profile/GordonW318
40,Amazing Tour,The $20 tour is well worth the price. Amazing architecture and great stories from Frankie from Avalon! The only downside was that they stopped showing movies there just 2 days before our arrival!! I hope they bring them back!,https://www.tripadvisor.com/Profile/366kellim
40,Worth a visit,"This 45-minute tour (""Discover the Casino"") is not cheap at $19.95 plus tax, but the casino is definitely worth a visit. My wife and I enjoyed a tour with Frankie of Avalon. While we thought Frankie was initially too repetitive on the point of taking pictures right away and not wandering away from the group (""We'll leave you, and there's no way out . . .""), he was knowledgeable and humorous. This is a very educational tour, and we learned A LOT. Frankie even provided ballroom dancing lessons.",https://www.tripadvisor.com/Profile/GradingMachine
40,Toured the Casino,"Enjoyed an hour-long tour of the Casino. Learned its history, including who built it and why; the famous people associated with it; and the architectural and acoustical basics about the place. Had a nice view of Avalon Harbor from the top floor. Frankie, our guide, knew enough stories to keep us entertained. Tour was late getting started but Frankie made up for the lost time. Enjoyed the back stage and behind the scenes access.",https://www.tripadvisor.com/Profile/shiredweller50
50,Beautiful Historic Tour!,Beautiful historic site on Catalina that you cannot miss seeing! The history was absolutely fascinating and Tour Guide Mark was fantastic! Largest movie theatre and ballroom in the world! Don’t miss it! 🎉🎉🎉,https://www.tripadvisor.com/Profile/IrishShark
50,Great behind the Scenes Tour,We went with a small party of 4 behind the scenes of the Catalina Island Casino. It was very interesting to see and hear about the construction and decoration of this iconic building. Paul did a great job showing us around and telling us lots of anecdotes about both the theatre and the dance hall.,https://www.tripadvisor.com/Profile/kandi75
50,Cold but worth it,"We visited in the rain and even then it was cool and fun to see. If you aren’t seeing a movie, and just want to see the casino (no gambling casino), you have to either book a tour in person at the Casino and wait to go inside (all other doors are locked until the tours ends). Or maybe book online in advance. Tour guides can be weird, so be warned. Frankie is eccentric, likes to talk about “ladies” and “dancing with ladies”. Other than that, very cool place to see and walk around. The history is very interesting and the architecture just as rich as Hearst castle.",https://www.tripadvisor.com/Profile/GriffinC894
50,Casino,"Don’t expect to game, this is a wonderful theatre and huge ballroom with wooden floor, and the guide was very interesting and funny. Great moment to discover the history of Catalina Highland.",https://www.tripadvisor.com/Profile/brunow712
50,Amazing Dancefloor,"We took the tour of this casino, which means gathering place in Italian. It had a 1/2 acre dance floor and large theatre. The history of this place and art deco design made it a must-see on Catalina Island.",https://www.tripadvisor.com/Profile/AnniversaryVoyager
50,Don't miss this! The history is amazing.,The highlight of our visit to Catalina Island was the tour of the Casino. Everyone should get a chance to whisper in the theater which is said to have perfect acoustics. Stepping onto the wood floor of the round ballroom almost gives you the shivers thinking about all the people who danced there and bands that played in it. Next time we will do the even longer tour. We loved it.,https://www.tripadvisor.com/Profile/460crisw
50,Beautiful historical building!,"Beautiful historical building! Loved the basic Casino tour with Tony ""from Avalon"" when we go back will do the ""behind the scenes"" tour to see more of the building!",https://www.tripadvisor.com/Profile/129jeannab
50,Must see,"We took the ""Behind the scenes"" tour. It was an fascinating 90 minutes your. Our guide Rebecca was amazing. The theatre, Ballroom, changing room and all stories were so interesting. Thank you Rebecca.",https://www.tripadvisor.com/Profile/CoffeeMust
50,Step into the elegance,Iconic Catalina. The tour is well worth it to enjoy the beauty of the building and the guides are a hoot!,https://www.tripadvisor.com/Profile/sjm5749
50,behind the scene casino tour,"The behind the scene casino tour was well worth it. So many interesting things your learn and see. It is really amazing - the whole story how it was built, what is was and is used for. The tour guides are so knowledgeable of facts of Catalina. Food tour was first favorite, behiond the scene casino tour was second",https://www.tripadvisor.com/Profile/jl4man2019
40,Lobster Trap,Good place for beers & sea food. Clams are delicious. Food is good.Not a complaint but tv’s could be in better spots. Lots of blocked views by walls that don’t go to the ceiling.,https://www.tripadvisor.com/Profile/GoPlaces28564628827
40,Back in Time,"We caught the new Lion King movie in this wonderful theater in the main level of the casino, which was built in 1929. The large 1000+ seat theater was a great venue to view the movie. Experiencing it with a large audience and hearing their reaction made it all the more enjoyable. The murals on the walls are fantastic both inside and outside the theater. We’re able to walk to the theater from our hotel in the heart of town.This building was built before accessibility for the disabled was important so there are some challenges for those in a wheelchair. For example I did not see any special seating area, although I did not look, and there was a step in the men’s room which would require assistance for someone in a wheelchair.However, I highly recommend visiting this place on your visit to Catalina. The senior rate for tickets was $13. Not sure of any of the prices or how this would change for other films.My one regret is that we did not take a tour of the upper level of the building, which is the large dance floor area.",https://www.tripadvisor.com/Profile/rcc55-sd
50,OUR FRIENDS MADE US GO!,"There was so much beach and fun to experience and we were only there for three days, two nights. We didn't think we wanted to take the Casino tour.....but our friends, JaneO and Bill made us. And we are so glad they did! The gentleman that gave the tour arrived on Catalina Island in 1958 and graduated from high school there. The stories he could tell about the Casino, the big bands, the big names and how he could dance and had all ages on the tour dancing with him. Thank you Catalina for preserving the magnificent building, the art deco tiles, the 22 carat gold embossing and art.",https://www.tripadvisor.com/Profile/ohcherryoh
50,impressive,"we didn't have enough time to join a guided tour of the building, but even the exterior of the building promises very interesting landmark.",https://www.tripadvisor.com/Profile/bestsZagreb
50,Wow! The Casino tour was great!,We got free tickets to see the ”Discover the Casino” 40 min tour through our Helicopter and Hotel package at the Pavilion Hotel. I’m SO GLAD WE WENT! We had no idea the history and that the Casino is still in working condition! The lower level is a stunning Movie theatre ( a different movie is shown once a week) and the top is the largest circular Ballroom in the world! Highly recommend this informative tour! You have to see the interiors for yourself and the view from the Ballroom Balcony up 12 stories looking out onto the Avalon Harbor is breathtaking!,https://www.tripadvisor.com/Profile/Mrs_TopCow
50,Great visit,Joe - the tour guide- showed us an behind the scene tour at the Casino. Good job. Absolutely worthwhile talking the time to visit this building,https://www.tripadvisor.com/Profile/svogel-001
50,Do not miss the Catalina Island Casino Tour!,"This tour takes you back to the old days of Catalina Island and her Hollywood guests. The history of the casino is fascinating, with a theater that boasts perfect acoustics and a location that offers gorgeous views of the bay. I learned that the term ""Casino"" means gathering place in Italian, so there was never gambling there. Our guide, Rebecca, was fantastic. Ask for her if you can....and boy, can she sing!",https://www.tripadvisor.com/Profile/JessieMom
50,Excellent tour,My husband and I went on this tour having never been. It was so very interesting. Frankie was so much fun. He's been on the island since the 50's so he has a boat load of info to share. He also taught me to ballroom dance in 30 seconds. Lol! We highly recommend this.,https://www.tripadvisor.com/Profile/singingdeb2016
30,Didn't get to go inside...,...but the architecture and history are interesting. Pretty murals at the entry. You can't go inside anymore except when there's an event for which you have a ticket.,https://www.tripadvisor.com/Profile/caliartist
40,The Casino is not what you think it is....,"As the title says, the Casino is not what you think it is, we thought is was where people went to gamble. According to our guide, not true. there has never been any gambling is the building.If you are going to do a Casino tour, I would recommend the one that is called, Behind the Scenes Tour. Definitely worth the 90 minutes.Lastly, but important was Frankie, our tour guide who was funny and knowledge and kept the tour very informative and light hearted.",https://www.tripadvisor.com/Profile/435seanc
50,4th of July Vacation,"My family rented a home in Avalon, Ca for the week of 4th of July. We were happy to hear playing at the movie theater in the beautiful Casino theater was Spider-Man a new movie that just came out!So nice to view the beautiful art and decor inside.The screen seemed out dated. The quality was not worth the cost of the movie ticket. There were huge imperfections on the screen. Sad to see this. Have been to this theater many times. It was never like this. This was my husband's first time to the island and theater. They made some upgrades to the food and drinks. But the money needs to go to the picture quality. It's a movie theater in a beautiful room. The sound only seemed to come from the front. Sounded strange. Again in this big round room I am sure there is a way to have better surround sound.Tuesday is ""discount"" day, $10 and once we arrived we were told it was cash only. After waiting almost an hour before they let us in I was happy I had the correct amount of cash for five people. No were on their website did it say cash only. No signs posted in their ticket windows either. We walked out the day before to make sure Spider-Man was the movie playing for sure.",https://www.tripadvisor.com/Profile/AmyM1990
40,Treasure of Catalina Island,"The Catalina Island Casino was never a gambling hall as we would assume, but a world class ballroom and state-of-the art theatre. The name came from the Italian definition which means gathering place. Our tour guide who grew up on the island and used to dive for clubs in the 50’s, was lively, passionate and truly engaging. The building is art deco and worth seeing for the interiors and the views from the ballroom. The Casino is used for special events, but I believe they are missing an opportunity to use it and the theatre which the technology for sound was so innovative, the creators of Radio City Music Hall adapted it. Well worth visiting.",https://www.tripadvisor.com/Profile/mdinonno
10,NON-CASINO CASINO,There is no gambling or anything else at this casino. They have occasional shows here. It was a waste of time to walk over to visit.,https://www.tripadvisor.com/Profile/williamn3333
50,Movie fun!,We saw Jumbo at the theater inside the Casino. They have an organist that plays prior to the movie. Very beautiful and a piece of history on the island. You should take a tour of the Casino if you like history....,https://www.tripadvisor.com/Profile/sunloverscatalina
50,Classic,The Casino is an absolute MUST see while in Avalon. Art Deco design and still after all these years a classic. Take the tour. It's memorable.,https://www.tripadvisor.com/Profile/Goodness4you
50,Toured and took in a Movie!,WOW! First time we backstage toured this place and it was FANTASTIC! Tour Director was extremely knowledgeable and fun to listen to. Wer came back in the evening to watch a movie! Highly recommend!,https://www.tripadvisor.com/Profile/CHFTIZ
50,Worth your money!,"This was my second time taking the 90 minute tour of the Casino. I went with my boyfriend and we ended up getting the same tour guide I had with my family 2 years ago, Rebecca. You can tell that she loves her job and enjoys every second of it. Such a beautiful building filled with so much history. I would do this tour again in a heartbeat!",https://www.tripadvisor.com/Profile/sarahe_sanders
50,Take the “behind scenes” tour,"A must see while on Catalina. The theater and ballroom are beyond imagination. Take the “Behind the Scenes” tour. Tickets are available at the Casino box office, but reserve online if visiting on a weekend to ensure a spot. There is a SCUBA museum on the harbor side of the Casino: very interesting and informative. And in case you are wondering, it is not a Gambling Casino. Look up the meaning of ‘casino’ in Italian.",https://www.tripadvisor.com/Profile/RomonaAndLyle
50,Twilight Champagne Tour,"Booked the Twilight Tour at the Casino for our last night in Catalina. Started with popcorn and viewing the beautiful theatre, before heading upstairs to the promenade for gorgeous views of the bay and ocean at sunset. Finished in the stunning ballroom with wine, cheese, fruit and dancing to big band videos playing on an enormous screen. Frankie of Avalon (tour guide) was lovely. A lot of fun and our group had all ages, with everyone seeming to enjoy it.",https://www.tripadvisor.com/Profile/X9893YKlisaw
50,Iconic Structure,We did not have time for the indoor tour but spent some time outside to enjoy the architecture. It is equivalent in height to a thirteen story building and is very beautiful. Next time on the island we will book the formal tour.,https://www.tripadvisor.com/Profile/LiketoeatCincinnati
40,Anniversary cruise,My husband and I were here as one of our port stops of the cruise. We did this tour and this is such a great place that is still in business today. Very detailed art work in the autotorium. We didn’t get to see the ballroom but hopefully we can go here again to see it.,https://www.tripadvisor.com/Profile/JoyY573
40,Catalina Island Tours,"Well organized and well done tours that give you a good overview of Catalina. Some are a bit pricey.Highly recommend the Twilight at the Casino tour. Not only is it interesting with the history but ""Frankie from Avalon"" is a magnificent host and makes guests feel welcome and comfortable. A true gentleman. And he knows that gals yearn to dance so he does his 10 second swing lesson with them and has them floating on clouds in no time. Husbands, boyfriends, and significant others, you will have to step up your game.",https://www.tripadvisor.com/Profile/dancb2017
50,Take the Tour!,"The best way to see the Casino is to take the tour... there are three I believe, the standard, the backstage and the nighttime. I took the backstage and thoroughly enjoyed and learned a lot about the history of Avalon and was able to take some amazing pictures!",https://www.tripadvisor.com/Profile/RustyThree
40,A landmark,"A historic building which can be seen from many parts of the island including at sea. It is a casino in name only as it is now a theater, ballroom and tourist spot. Although I didn't have time to take the tour, the building is a one of a kind to see even from the outside.Stunning architecture worth a visit to see.",https://www.tripadvisor.com/Profile/Randy2353
50,Cool Building with Tons of Character,This is the main landmark for Catalina Island. Cool old historic building with lots of stories to tell. Offer daily tours and even show movies at night sometimes. Worth the visit.,https://www.tripadvisor.com/Profile/JLars34
50,Beautiful Ballroom,The building is art nuvio in beauty. It can hold up to 500 people for large events. Has a wrap around outside patio. The view is unbelieveable. The movie theater is a must see.,https://www.tripadvisor.com/Profile/OnAir474199
40,"A casino, but no gambling.","Built by William Wrigley as ""a gathering place"" (casino in Italian) opening in 1929, it is an architectural delight. Take a tour to see the beautiful theater - shows nightly at 7:30 - where the walls are covered in murals depicting early CA in art deco style. If you go on Friday or Saturday night, you can hear music played on the historical Page organ, always ending the mini-concert with ""Avalon"", popularized by Al Jolson. Upstairs is the ballroom, where bands still play as they always have and the huge dance floor has hosted many a gala event. The views from the walk-around balcony are spectacular.",https://www.tripadvisor.com/Profile/347carolec
50,Avalon Theater is inside the Catalina Island Casino,We walked around the outside of this eye-catching building while exploring the island. We noticed that there were fliers advertising first run movies at the Avalon Theater. It took me a moment to figure out that the Avalon Theater was inside the Casino. You might want to look up the Avalon Theater on TripAdvisor for better information about the theater itself!,https://www.tripadvisor.com/Profile/LoveToTravelTerrie
50,Great art work and an interesting tour.,"This historic structure was built in the 1930’s and it has been maintained and preserved in excellent condition. We found out the only way to see the movie theater and the artwork is to take a tour, as it is not open to the general public except for movie shows at night and dates when the ship is not in harbor. The tour was very informative and gives one a touch of the island history and the special town this has become. Our tour included one of the first all-electric buses for the island and it rode very comfortably and very quietly. Another option of renting a gasoline golf cart to do a self-tour of the town and immediate island, but you will not be able to tour the Casino unless you take the formal island tour.",https://www.tripadvisor.com/Profile/4cents-worth
50,45 minute Casino tour,"I don't often take tours of historic buildings, but this was worth it. Our tour guide, Rebecca, was very knowledgeable and had plenty of stories to add interest (as well as an excellent singing voice).",https://www.tripadvisor.com/Profile/Corax1977
50,Magnificent Historical Building Tour,"We booked a 12:45 pm tour and was it ever worth it. We were given wonderful information about the building of this magnificent casino. We found out about the outside entrance murals, ceilings in the foyer, state of the art movie theatre with the organ that still gets played before movies. We sat in the theatre and watched a short filmabout the theatre. We then went upstairs to see the various projectors used over the years. We walked up the large ramps to the top floor to take in the wonderful dance floor. We were thrilled to then go outside on the top floor balcony to take in the great views of Avalon and the bay and island. We had two guides and they did a fantastic job.",https://www.tripadvisor.com/Profile/kpatters
50,Behind the scenes casino tour,"Yesterday I visited Catalina Island, I booked the behind the scenes tour (1.25hrs roughly) Joe was our guide of a small group of about 15 people. His knowledge and love of the place was amazing! The way he conducted himself was outstanding and made you want to know more and more with each new part of the casino we explored. Joes knowledge of the artwork and finer details was second to none. I had a wonderful time learning the history of not just the casino but the island and the Wriggly family. An absolute must visit!!",https://www.tripadvisor.com/Profile/laurajade08
40,Interesting History,"It was interesting to learn about the history and construction of the building and the art deco design. You really get a ""wow"" moment when you walk into the movie theater and ballroom.",https://www.tripadvisor.com/Profile/Travelerinfo4you
50,Beauty,What a beautiful place. Worth the trip to get a look into the past. Wrigley really went overboard building this structure. This was part of the island tour we took from our Carnival Cruise Ship. Well worth the price. The theater does not need a P.A. system as the acoustics are perfect.,https://www.tripadvisor.com/Profile/Randy6272
50,A beautiful place,A beautiful place and a must see. The building is a fabulous art deco design. The architecture is stunning and unusual. The murals are beautiful.,https://www.tripadvisor.com/Profile/Passport477074
50,Spectacular edifice,"This grand dame structure has a black walnut interior with gold stars on the ceilinf. Built in 1927, it is the ultimate in luxury. The ballroom floor is one of the largest in the world. Views from the balcony are breathtaking. It is worth a tour.",https://www.tripadvisor.com/Profile/sharonwestmd
30,Interesting,"Well preserved theatre, a credit to the volunteers,long walk to get to it if you are on a walking stick. Impossible to get a cab as it was the off days of the week?.. it rained so we got quite wet.",https://www.tripadvisor.com/Profile/307viva
50,Theater,Unbelievable that you can tour this amazing structure and then watch a movie in the evening. Do this one.,https://www.tripadvisor.com/Profile/lunarooney
40,The movie theater and architect of the building was amazing.,It was fun to see a movie in this building. The seats are very close together and not much leg room but the building is wonderful.,https://www.tripadvisor.com/Profile/michellem691
50,Beautiful Walk into the Past,"We did not take a tour, but it would probably be a good idea to appreciate the architecture and history of the building. We went into the old, massive movie theater prior to the movie and enjoyed several pieces of music on the 1929 pipe organ. It is definitely worth a walk to this old casino house.",https://www.tripadvisor.com/Profile/retiredandtraveling5
