40,"Great collection, but limited docent help","An excellent cross section of speed related displays , but the lack of docents limits the value to those who could benefit from more information. The collection includes vehicles from a variety of racing genres. If you are into racing this is a must see. When we went it was free, but there may be a charge . Check out the website before you go as the exhibits change as there are a lot of items and limited space.",https://www.tripadvisor.com/Profile/thecarfamily
50,Drag racing Final 2012,Traval from Ontario Canada for the Pomona NHRA Full Throttle weekend of racing.Saturday was very cold did not bring enough cloths to the warmer side of California.The races are loud and fast but good for marriage.City was small and friendly just like home.We will go to race again hope the weather holds up.,https://www.tripadvisor.com/Profile/JanineW330
50,...um....WOW!!,"If you happen to find yourself in Pomona and have some time to burn, be sure to walk into the Wally Parks museum. Wally was the founder of drag racing and its earliest aspects of safety, so this museum is a must see if you like cars and drag racing as a whole. There are full displays of the actual cars that ran back in the 50's and right up into today. If you can imagine it, you will see it at the museum.Do yourself a favor and drop in for a peek. I planned just to glance, and walked out two hours later.Just FYI...if you have ever seen the trophy that is given to drag racers who win national events, its a bronze statue of a man standing next to a drag slick tire.....the man is Mr. Wally Parks.",https://www.tripadvisor.com/Profile/hoshsaidso
50,Awesome!!,"If you are into drag racing....GO! Lots of super cool nostalgia stuff, and right close to the race track. In fact! Park there and take the tram to the track!!",https://www.tripadvisor.com/Profile/HercMech
50,Racing Nostalgia!,"No matter who you are, if you appreciate car racing, this museum is filled with interesting memorabila and information.Love it!",https://www.tripadvisor.com/Profile/TyBisme
50,SUPER PLACE!,"I have been there three times...it is really, really cool! They have more than drag racing history....there is land speed record and motorcycle history here as well....GO SEE IT!",https://www.tripadvisor.com/Profile/DantheMountainMan
40,Cars galore !!,Love cars ? You'll find enought to fulfill all your dreams. For special events they bring in a parking lot full of more cars !!,https://www.tripadvisor.com/Profile/Boone5269
50,History in a building,Great displays of vehicles and memorabilia. Items change so come back and see what you missed the first time!,https://www.tripadvisor.com/Profile/WAMO32
50,Car guy paradise,Great collection of historic cars in the hot rod field.,https://www.tripadvisor.com/Profile/schubeb
50,MONTHLY CLASSIC CAR SHOW,"TWILIGHT CRUISE, Free entrance to Parking Lot at the NHRA museum, Free Classic Carshow and free entry to the museum. ON THE 1ST WEDNESDAY of each month, 4pm to 8pm. Grab a Burger and a Beer and enjoy",https://www.tripadvisor.com/Profile/peetas_11
50,Fun to go through,"As car enthusiasts, it was very interesting to see all the cars and memorabilia that this museum houses.Would definitely recommend going through this.",https://www.tripadvisor.com/Profile/vanessak758
50,Worth the drive north,"Located on the LA fairgrounds, this place is a must for any ""gearhead""! I loved the old dragsters, some of which I built models as a kid. The entire staff is very friendly and will answer just about any question.If you like any kind of racing, then this place is for you. If you like drag racing, this place is a must-see when in Los Angeles.",https://www.tripadvisor.com/Profile/markmcguire25
50,Outstanding collection of historic race cars,"We spent half a day visiting the museum, Outstanding collection of historic race cars, show cars and memorbillia. Staff are very helpful, telling stories about various cars. A Wide variety of merchandising to purchase. If you a car nut and visiting the area do not hesitate to visit this museum.",https://www.tripadvisor.com/Profile/LIL32Brisbane
