50,THE best way to explore Mt. Wilson MTB trails,,,https://www.tripadvisor.com/Profile/Xenon71
50,The only way to shuttle Mt. Wilson,,,https://www.tripadvisor.com/Profile/karlekuhn
50,Big smiles Redbox - JPL CIA Gabrielino Trail,,,https://www.tripadvisor.com/Profile/BaconCeviche
50,Excellent Shuttle Service to the Top of Mt. Wilson,,,https://www.tripadvisor.com/Profile/MtnBykGirl
40,Mt Wilson,,,https://www.tripadvisor.com/Profile/jbdbsb
20,Furthest Thing from a Downhill Day EVER!,,,https://www.tripadvisor.com/Profile/weinerdrizzle3000
50,Great time exploring Mt Wilson,,,https://www.tripadvisor.com/Profile/erik586
50,Great service...Super Friendly,,,https://www.tripadvisor.com/Profile/markcT7697TV
10,No show,,,https://www.tripadvisor.com/Profile/vernvern2018
50,Mt Wilson MTB backdoor,,,https://www.tripadvisor.com/Profile/jamesv8
50,"Great riding, easy shuttle",,,https://www.tripadvisor.com/Profile/Q8414VZandrewm
50,The individual and personal tailored experiences with family of 5 on the mountain was first class!,,,https://www.tripadvisor.com/Profile/GreggF442
50,Great mountain biking experience in the San Gabriel Mountains,,,https://www.tripadvisor.com/Profile/712kelly
40,First hike - my back yard!,,,https://www.tripadvisor.com/Profile/mjhlee
50,MTB Adventure's goes above and beyond,,,https://www.tripadvisor.com/Profile/vjculture
50,New Year's Day 2017,,,https://www.tripadvisor.com/Profile/shannone2017
50,Mt Wilson Darkside shuttle,,,https://www.tripadvisor.com/Profile/289kca
50,The ticket to a great day on the mountain!,,,https://www.tripadvisor.com/Profile/710keith
50,Excellent access to a new world of trails,,,https://www.tripadvisor.com/Profile/IsaacW260
40,Great Mt. Bike trip!,,,https://www.tripadvisor.com/Profile/ej322016
50,Always a great time,,,https://www.tripadvisor.com/Profile/danvarela75
50,Darkside ride. (Under trees hence the aka Darkside),,,https://www.tripadvisor.com/Profile/759vons
50,Enduro-licious! Best MTB shuttle in SoCal.,,,https://www.tripadvisor.com/Profile/95edd
50,So thankful for their service,,,https://www.tripadvisor.com/Profile/vjculture
50,Awesome!,,,https://www.tripadvisor.com/Profile/J_Dub866
50,"Great service, great riding, great value",,,https://www.tripadvisor.com/Profile/drpeebo
50,5000 feet of down and 150 feet of climbing on the Mt Wilson trail.,,,https://www.tripadvisor.com/Profile/mtbmoto
50,Mt. Wilson Shuttle,,,https://www.tripadvisor.com/Profile/Getaway240387
50,Adventure Above the Clouds,,,https://www.tripadvisor.com/Profile/leahd212
50,Always a great ride,,,https://www.tripadvisor.com/Profile/gregoriod831
50,First ride on the dark side,,,https://www.tripadvisor.com/Profile/atv62pete
50,The best $20 a mountain biker can spend!,,,https://www.tripadvisor.com/Profile/AfshinB650b
50,First Ride With Mateusz Suska,,,https://www.tripadvisor.com/Profile/Mrgreen4u
50,Big Mountain Riding in Los Angeles,,,https://www.tripadvisor.com/Profile/U1422RFnickp
50,Chilao Epic Was EPIC!,,,https://www.tripadvisor.com/Profile/scottbbradfield
50,An awesome opportunity to ride one of the best trails around San Gabriel vally,,,https://www.tripadvisor.com/Profile/mati321
50,Amazing downhill run,,,https://www.tripadvisor.com/Profile/J363ZTscotth
50,Amazing Shuttle service,,,https://www.tripadvisor.com/Profile/Strec17
50,This tour company is THE BEST!!!,,,https://www.tripadvisor.com/Profile/Otrain
50,Great Trails...,,,https://www.tripadvisor.com/Profile/markcT7697TV
50,Best Mounting Bike Riding in San Gabriels,,,https://www.tripadvisor.com/Profile/dhbullit2003
50,"This is a great ride, very nice to be taken to the top for the ride down",,,https://www.tripadvisor.com/Profile/M6983LTtomm
50,"Best all-mountain ride in SoCal, listed as top ten in the US.",,,https://www.tripadvisor.com/Profile/95edd
50,Get out your A game,,,https://www.tripadvisor.com/Profile/sc0ttbeal
50,"Rim Trail, a.k.a. The Darkside",,,https://www.tripadvisor.com/Profile/roberthO5304MA
50,Great adventure every single time.,,,https://www.tripadvisor.com/Profile/S3595MHneilm
50,Mt Wilson run,,,https://www.tripadvisor.com/Profile/ericgX1245GX
50,Most fun you can have on a mtn bike,,,https://www.tripadvisor.com/Profile/tonybardin
50,Great adventure,,,https://www.tripadvisor.com/Profile/ccb887
