50,Great Venue,There for the Jazz Festival. Love the views from the balcony upstairs. There is an elevator on the side of the building for those who cannot walk up three steep ramps.,https://www.tripadvisor.com/Profile/429LauraB
50,"Absolutely Gorgeous...and Historical, too","Our tour of the historic Catalina Island Casino, consisting of an Art Deco theater and ballroom (no gambling at this prohibition-era place of entertainment), was quite entertaining. The facility is truly gorgeous and well-maintained, and the tour guide kept the history engaging. In the evening, you can watch a current movie, with a pipe-organ concert headliner, although we did not have time to do that.",https://www.tripadvisor.com/Profile/AprilY72
50,Don't miss this!!,"Take the tour, tour the museum and end the evening with wonderful musical entertainment and movie!! Lots of history here!!",https://www.tripadvisor.com/Profile/seamstressm
40,Worth a Visit if You're in Avalon a few Days,"I wouldn't put this at the top of my list for places to visit in Avalon, but it is a very interesting place with some fun history. We did the backstage tour and it was enjoyable, though not very memorable.If you enjoy quirky movie theaters, they still show movies, twice on Wednesday and Saturday, and once every other day. We didn't see a movie there, but imagine it would be a unique experience.",https://www.tripadvisor.com/Profile/ethanjdelano
50,Behind the Scenes Tour!,"Pay a little extra and do the behind the scenes tour, so worth it. You get to see a little bit of everything, from the theater to the grand ball room, the dressing rooms, projectors, etc. Our tour guide was very good, lots of cool info.",https://www.tripadvisor.com/Profile/ElkGroveChris
50,Amazing must see and tour,"One of our favorite sites and places to visit as we come to the island on the boat. This fascinating and historic structure is awe inspiring for all ages however old movie buffs and historians will like it most. Let yourself get caught up in the art, the beautiful fan and the rich history.",https://www.tripadvisor.com/Profile/palenakamikale
40,Fascinating,I liked hearing about the history of the casino and will go back for a full complete backstage tour. No I can't write more about this,https://www.tripadvisor.com/Profile/RosalieP_12
40,Classic architecture and lovely setting...,"O.K., I've done a variety of shows at this place. It's a bit long-in-the-tooth in terms of maintenance however it is a classic structure, a lovely location and worth a visit. They have added some film and tour ideas to their offering. Lots of scuba activity in back of the casino where you can rent gear and shore dive off of stairs leading to the water. (Used to have to go over the rocks.)",https://www.tripadvisor.com/Profile/thomassG3669AB
50,Impecable,"This is a must do when on Catalina Island. The building is so beautiful, rich with history and art! We only went on the 30mins tour but maybe next time we will go on the one hour to see more of the Casino.",https://www.tripadvisor.com/Profile/nursejoan
50,Very nice to explore,My wife and I had the opportunity to stay in Avalon on Catalina Island and while were were there we visited Catalina Island Casino. We enjoyed a jazz concert while there as well took a tour through the casino with one of the long time locals. We learned an incredible amount of history about the hotel and its close connection to Hollywood royalty in its hay day.I highly recommend visiting Catalina Island if you ever get the chance.,https://www.tripadvisor.com/Profile/S8472TQdaveh
50,Casino tour,Ten dollars for tour worth the money for first time visit. Buy ticket at casino not online save yourself three dollars.just show up a little early nice walk to casino from downtown,https://www.tripadvisor.com/Profile/R3026LIrichardl
40,Catalina island 9/2014,"I took Catalina express from Long Beach to Catalina. Remember to book ticket on line, if not we always wait for at least 2 hours, Book two nights for a house at 219 Decanso st thru CIVR. The house has 4 bedrooms, 3 bathroom., spacious enough room and beds for 8 adults. There is no AC, only fan for every room. House is clean, have kitchen with microwave, stove....The location is very convinient, one minute to Von market and two minutes walking to the beach and center of island.The restaurant Lobter trap is rated #1, but the food is salty. The Blue ocean restaurant have a limited choice including hamburger and hot dog for dinner, Jack Daniel restaurant for breakfast and lunch but nothing to compare with IHOOP.The beach is crowded and a lot of rocks, We should wear water shoes while swimming. The water is warm.The Zipline is expensive $125 each person and must be booked ahead of time. Other activities mostly for children. Diving lesson behind the old casino for beginners.I would recommend this island for one day trip only.",https://www.tripadvisor.com/Profile/bien5529
50,Casino point,Wonderful diving & snorkeling spot for all ages & levels.Year round best spot for water sports participants & onlookers.Family friendly. Nature lovers points of interest.Fun for all ages & budgets.Get there for free on Catalina Express on your birthday !!!,https://www.tripadvisor.com/Profile/Natalya24
50,Beautiful Art,"So unique and beautiful. It reminded me I was in another country. Would of liked to take the tour inside, but ran out of time.",https://www.tripadvisor.com/Profile/carleneh2013
50,Catalina Island,"If you are in southern Ca, don't miss this. It's a great day trip. There are camp grounds, hotels, restaurants, and a golf course. . All reasonable priced. Take the open air tour bus. It takes you all over the island. Golf cars, and bikes are available for rental, by the day or hour. They even have a heard of buffalo on the island. You can get a ferry from almost any port in southern Ca.",https://www.tripadvisor.com/Profile/DulcelelecheAngel
50,Diving,"A protected marine park is at the Catalina Island Casino (Casino Point). There are stairs that lead down into the water, which is awesome during high tide. Not so awesome in low tide; however better than crawling over the rocks. A very large grouper calls this park home. Wander around to the right to find the Jacques Cousteau memorial plaque. Venture around to find the two wrecks that are hidden within it's boundaries.",https://www.tripadvisor.com/Profile/michelleg592
50,Must See-Beautiful Architecture,"Such a pretty building, iconic in every way. The tours are only at set times, so be sure you get that sorted out before you walk all the way down there and then get disappointed to find out you just missed it (like we did).",https://www.tripadvisor.com/Profile/TravlingAZGirl
50,Not to be missed!,"The beautiful Casino (not a gambling casino) is a must-see. Before you enter the building you will find great tilework and paintings in the arched entryway. There are spectacular Art Deco paintings and architectural details inside the theatre, and the walnut paneling in the lobby is amazing. They show one movie a week, and if the movie interests you in the slightest I recommend you buy a ticket. Go an hour early to the movie on Friday, Saturday, and Sunday and you will be treated to a man playing the pipe organ in the front of the theater. You can also tour the casino, there are two available, we've only gone on the shorter casino tour that costs $10, which includes the impressive second floor ballroom.",https://www.tripadvisor.com/Profile/Gilbert00
40,First port of call,"Had a wonderful time in Catalina, took the golf cart ride for a 1 hr trip around the island. Walked the tourist area and enjoyed ice cream cones before catching the tender back to the ship.",https://www.tripadvisor.com/Profile/moryan67
50,The Beautiful Catalina Island,"It has been awhile since we visited the Island. It has a wonderful and quaint village, it is so enjoyable to walk about the area.the Beautiful Building that is now a ""casino"" was attended by my parents in the 30's, and my brother took his date there for their Prom dance in the 40's. All the Big Bands played there. It was a grand place in it's day. We plan on going again in September I would love to see the Wrigley grounds, I hear the gardens are beautiful, the best way to see the attractions is to rent a golf cart, if you go with another couple the cost is not bad. I will update you when I get back.",https://www.tripadvisor.com/Profile/joannm816
40,"""A Deco masterpiece!""","This tour is a good way to orient yourself on the history of Avalon when you first arrive. The short film is informative, and the theatre and ballroom are gorgeous and impressive.",https://www.tripadvisor.com/Profile/Mcmor
40,Beautiful Building--Tour Left Something to Be Desired,"The Casino building is beautiful and we highly recommend touring the interior, but do take the ""behind the scenes tour"" if you can. The regular tour is very hurried--we were told we couldn't even use the restrooms (not that we needed to, just giving an example :-)) b/c there was no time and everyone had to ""be out before the next tour"" which, I believe was over an hour later. We started in the lobby of the theater for a very quick overview, then on to the theatre for a short documentary about the Casino and the Island; up to the mid -level area, via multiple ramps, briefly, and then into the ballroom and out to the balcony. This tour should really be 45-50 minutes.I didn't get the impression the guide really wanted to be there giving the tour--someone who loves what they are doing can make all of the difference. Having said that, we still recommend taking the time to visit this beautiful building.",https://www.tripadvisor.com/Profile/laurensaunt
50,No Slot Machines,"Not a gambling hall but a magnificently designed building in the grand style of the twenties. Take the tour. Massive, stunning grand ball room and theater are still in use for special events and weekly movies. Museum below is quaint and non-commercial and presents a good history of Catalina and its visitors. Views from the waterside walkways behind the building are not to be missed.",https://www.tripadvisor.com/Profile/seamusb
50,Take the Tour,"It was never a gambling facility, but this historical building is a spectacular architectural masterpiece. Take the $10 tour to enjoy the history, the theatre, and the views. When you see the ballroom with its massive Tiffany chandelier, you are instantly transported back to the days of glamour. We definitely want to plan to attend one of Catalina’s big events, like their jazz festival. Our tour guide was Porschia and she was not only an inspired guide, but a terrific chanteuse. You'll get to take amazing photos from the outdoor walkway at the top with wrap around views of Avalon. Gorgeous!",https://www.tripadvisor.com/Profile/StarLady99
50,Great Museum,"There is a very small museum on the side of this building. It had a great history of the island. Showed the many celebrities who used to come to the island years ago, Charlie Chaplin being one if the main characters. Lots of great photos. It was very inexpensive, only about $5 or $7 to enter. Well worth it.",https://www.tripadvisor.com/Profile/debtaylor
40,"It's not a casino, it's a theater.",It's a beautiful building! You can take a tour of the building or go watch a movie in the evening there.,https://www.tripadvisor.com/Profile/Shera1115
40,A unique building,"We took the tour, including the movie theatre. It's art deco at its most dramatic. Well worth the price.",https://www.tripadvisor.com/Profile/Consumerguy1
50,Lovely Art Deco,"Bought tickets online a month in advance - and the tour times changed! Double check times when you arrive on island so you don't miss it. Luckily we caught the Behind the Scenes tour and loved the theater, ballroom, and other private rooms. Guide was informative and funny. This is the crown jewel of Catalina, so everyone should go on one of the tours to see it!",https://www.tripadvisor.com/Profile/kristio329
40,30 minute tour,"The casino is such a focal point of Avalon that we decided we really wanted to take a tour and see the inside. The behind the scenes tour was already sold out for the day so we settled for the 30 min. tour. We got to see the beautiful movie theatre and lobby and the incredible dance floor upstairs. Our tour guide was very knowledgeable, we learned a lot about the building and Avalon, but like everyone we encountered at the casino, could have been just a little more friendly.",https://www.tripadvisor.com/Profile/29kindergartencuties
50,Great place to catch a flick,"*Notice* It is not an actual casino! While staying on the island for several days, we decided to go check out the ""casino"". I didn't really do my homework before I went there, so I was actually hoping to get some gambling in. I was pleasantly surprised to find out that it was a movie theatre and not a real casino. We went ahead and caught a movie while we were there and it was awesome. They only play one movie (they only have one screen) and change it once every week or two. It has a old theatre feel and is pretty cool. The theatre itself is huge and allows for large crowds to watch the movie. Don't be late though, doors close 30 minutes and the movie starts and they do NOT let anyone in!",https://www.tripadvisor.com/Profile/MikeH574
50,Grand old building,"If you are interested in movie theaters, ballrooms, or Art Deco, this is a must see. Take the tour and see the theater and the ballroom inside this lovely building. It is very picturesque inside and out. Most of it is all original and extremely well-preserved. It isn't hard to imagine 1940's big bands performing there with the ballroom filled with dancers.",https://www.tripadvisor.com/Profile/Squidhead
50,Behind the scene's tour,"Outstanding tour, if you have the time a must do. The movie theatre is fabulous and to learn the true meaning of the word Casino.",https://www.tripadvisor.com/Profile/Sue19571961
50,One of THE Architectural and Historical HIGHLIGHTS of Catalina,"A simply beautiful 1930's Art Deco Gem... recently revitalized and now a protected historic monument 'not to be missed' on Catalina.A picture focal point, and monumental landmark of central Avalon, be sure to take a tour (the longer more intensive tour) of the building. Also ensure that you take a stroll around the out side of the building being sure not to miss the amazing main entrance - high styled Art Deco - and walk around the shoreline 'back' of the building.Also don't forget to make a stop into the Historical Societies retail shop on the waterfront side of the building. Great product with proceed going to the maintenance and preservation of the building.Our visit was one of THE highlights of our day on Catalina...and we will be back to the island and to the casino again!",https://www.tripadvisor.com/Profile/brianwickens407
50,HISTORIC...UNIQUE,This building has a spectacular design. Back in the WWII era...2 or 3 bands with thousands (yes thousands..) would be dancing upstairs while a movie played in the lower level theater completely oblivious of the upper level activity....,https://www.tripadvisor.com/Profile/roeservices
20,Disappointing,"What was described as a casino, was nothing more than a movie theatre and very small museum that had nothing but recreated photos from the past which you pay $5 to see, took me less than 5minutes to go all the way through. As for the ""Casino"" as I entered the front doors, I was greeted by a less than happy to see me employee who asked for my ticket. I told him I was just here to see the casino and he let me know there was no casino and that the building was only open for tours 3 hours each day. After that, it becomes a movie theatre.One of your review questions asks ""Was there food available for purchase?"" Yes, there was movie theatre food and drink available for purchase during the showing of the movie. If purchases were being bought with a credit card, the purchase had to be over $10, otherwise you had to pay in cash or they would not sell the purchase items to you. Very disappointing!",https://www.tripadvisor.com/Profile/ggnickelimages
40,Beautiful historic building,"Returned to Avalon for our 26th anniversary and finally toured the Casino. Gorgeous inside with a very informative tour. Nice views from the balcony. Recommend seeing one of the movies there too. I have to say though, Avalon has certainly changed. The cruise ships come in twice a week (Mon & Tues) which changes the whole vibe. We noticed lots of ""workers"" hanging around with their families. Takes away from that vacation feeling. It's just was not as pleasant as it was years ago. We found Two Harbors to be more enjoyable if you can afford to get there from Avalon.",https://www.tripadvisor.com/Profile/Donatella-Bingbong
50,Art Deco Wonder,I love the decor and the way the building is so much of its time. I have to visit it every time I visit Catalina,https://www.tripadvisor.com/Profile/alisonh27
50,Historical Enjoyment,"A quick vacation to Avalon, Catalina Island/CA brought new historical information & tile art wonders. Thrilled that many sights could be seen by foot or golf carts. Definitely a bucket list item...so much to see & so little time that I will be adding it to my bucket list for a return trip to enjoy many more of its wonders.",https://www.tripadvisor.com/Profile/sheilad909
40,"Very informative, lots to see behind the scenes","The best part about this tour of the Casino included a trip upstairs to the grand ballroom -- it was an amazing space with the circular ceiling, recessed floor and various lighting elements. It would be great to come back here at night - during a snazzy event.",https://www.tripadvisor.com/Profile/PDG2
40,Avalon Casino,"Interesting videos of the former movie stars that frequented the island along with Indian artifacts, 1 section of the museum in the casino was being renovated. Entry is $5 per person although birthday people get in for free, just show your ID.",https://www.tripadvisor.com/Profile/30fredt
40,Amazing Building BUT it is not a gambling Casino,"I would recommend doing the walking tour of this building (this builidng is 7 floors so be prepared to walk alot :) Also note this is not a gambling casino. We learned upon arriving that casino in italian means ""place of gathering or of entertainment"". The movie theater inside is neat as well for something to do.",https://www.tripadvisor.com/Profile/Christine2120
50,take the back stage tour,"I have been traveling to Catalina for over 50 years. We have family history there. Many people never take the back stage tour of the Casino. The history and tour are amazing. Catalina has such a rich history, it's a great tour.",https://www.tripadvisor.com/Profile/dougrh
10,Amazing building really really aweful guide,"I was in Catalina in February with a group from the travel industry. I had been to Catalina a couple of times before and had enjoyed a movie at the Casino on one visit. I love the building and so was very excited to see that part of our agenda was a tour of the Casino.The building was not a disappointment, I loved it, however the tour guide Joe was horrendous. It started on the walk from the hotel to the Casino a few of us walk quicker than others and three of us reached the tour guide first. We introduced ourselves to him and said the full group would be there in a minute or two. He nodded and started his tour. When someone asked if he could wait for the rest of the group he ignored them by talking over them.Joe certainly knew his history but his rudeness spoiled the whole tour for me and most the others when we discussed him after the tour. He rushed us through like cattle and all his lines were a “spiel” that he had done a 1,000 times before. During the tour his spiel included some attempts at humour, really? Having knowledge does not a tour guide make, personality does, and this man has zero personality. I work with tour guides every day, Joe would not last one tour with our company, he would be fired.If you can take the tour from someone other than Joe, take it the Casino is beautiful, if Joe is the only option, skip it.",https://www.tripadvisor.com/Profile/Saskwatches
50,Must See,"Let's face it--this is a small island with not a lot of sights so going to see the Casino is worth an hour of your time. Casino, before Las Vegas, was a dance ballroom so there is nor never was gambling here. Make sure you pick up the booklet called PASSPORT at the pier with the food shacks on it-this will get you tickets at half price for this and other sights on Catalina.Check times for the half hour tours so you can see the theater and ballroom plus photo's from the 40's. Without the tour, it's just a large building.",https://www.tripadvisor.com/Profile/dmahler
50,A must see,"If your on Catalina - make the time to see this timeless beauty of a ball room. Take the tour it's worth the time, especially if you enjoy architecture and nostalgia. Catch a movie in the theatre below.",https://www.tripadvisor.com/Profile/Islandwoman2014
50,Catalina island was clean & lovely !!!,"Visited 14/04/2014Arrived here with the cruise ship ,carnival cruise...we had time to explore this island until 4 pm.I don't know why this island is part of 4 night Mexico tour as its got nothing to do with Mexico !!!We did our own thing here, walk down the beach front to descano beach, paying by the casino,which is a museum now,we didn't venture in,but had a look in the window.It was a 15 min walk to the beach,nice bar for some drinks,no coffee served!! .The beach club charged $70.00 USD for two deck chair,you got chair and some water for that.I saw 2 couple there only,don't think it was a great money day for them.Why so overpriced !!! A fair & decent price would attract more guest then NO guest !!!The beach was lovely clean sand,not the best ,I've seen else where better!!! Water clear with large stone in the water..There is nice clean toilets and a cute gift shop !!After all this we ventured back to the main area ,where heaps of shops are for dining at.looks like heaps of guest were dining there.Some lovely shopping to be done here.We choose not to do any tour via the ship recommendation ,as we have done water sports and land activities in the pass,so just happy to do our own thing...You stay here at some cute little hotels amongst the shops area or maybe higher up in the hills...Overall it was a lovely island to visit and you can get transfers here from mainland Los Angeles area, not just from a cruise ship.CiaoELISA. Australia",https://www.tripadvisor.com/Profile/Elisams5
40,"When is a casino, not a casino?","When we fisited Catalina Island, off the coast of California, we were told to make sure we took the Casino tour. Then they said, oh, it's not really a casino, I mean it is but it isn't. Anyway, we took the tour and they really pack in a lot of information for just a half hour tour. Really cool place with a fascinating history. The tour guide is a native to the island so born and raised. He shared so much with us and presented the historical information in a fun and entertaining way. From the theater all the way to the ballroom, a great tour. Follow it up with a tour of the museum downstairs. Both are well worth your time. Oh, make sure you get the coupon book from the ferry as there are discounts included for this tour.",https://www.tripadvisor.com/Profile/Mmcbrayer
10,Disappointed,Can't believe we have to pay to just look inside the casino. We didn't have time for a tour but were not even allowed to peak in? The guy in the box office was not very helpful.,https://www.tripadvisor.com/Profile/71peggyg
40,historic murals and interesting circular building,"Without taking a guided tour, you can see great views of Avalon Bay and, inside, the magnificent murals. The exterior architecture is amazing and shows up beaufifully in pictures.",https://www.tripadvisor.com/Profile/johnsbigb
50,Was amazing,Me and the wife was recently on a carnival cruiseand we went to the the island and rented a golf cart for an hour to drive the scenic route of the island and it was amazing can't beat it and we went to the casino to check it out and was beautiful love it the island views was my favorite a must see,https://www.tripadvisor.com/Profile/hungrymand
50,"Catalina on your Birthday (its free, kinda)","Catalina Express was offering free trips to Catalina on birthdays, so I took advantage and went yesterday. Great trip, fast and comfortable. Got to Catalina and realized that there is NO shade anywhere, so bought a hat. Forgot sunscreen (WEAR sunscreen). I was a lobster at the end of the day. Ate lunch at Bluewater Cafe on the water. Really good food, reasonably priced. Then went to Lloyds icecream and candy shop, very popular. They sell Dreyer's ice cream, okay, but not many flavor choices. Some shopping on the main street, but very small shops. Take a walk on the side streets and you will see cute cottages for rent. Maybe great for a family or bunch of friends to rent for a few days. There is lots to do, couldnt pick all of them being there only one day. Went on glass bottom boat. Always fun, and only $14 for seniors like me. They now have parasailing -- THATS an adventure! Lots of snorkeling and scuba opportunities, full rentals. Run around Avalon in a rented golf cart, take a tram tour around the island and see the wildlife including Bison. Just a fun day (or two).",https://www.tripadvisor.com/Profile/lvemaui08
50,Beautiful property,"We passed on a tour of the Casino, in favor of seeing a movie in the Casino Theater. It was awesome. The Staff at the Casino are so nice and helpful too.",https://www.tripadvisor.com/Profile/779maris
50,Nostalgic and informative,We went on the 90 minute tour....well worth it! Lovely viewsand interesting tour by Joe. Need walking shoes and energy forthe ramps.,https://www.tripadvisor.com/Profile/Furrawn
