50,New York State Of Mind,,,https://www.tripadvisor.com/Profile/U2867QKpaulj
50,Liked it,,,https://www.tripadvisor.com/Profile/827martinob
40,Fun outdoor shopping,,,https://www.tripadvisor.com/Profile/Live-n-theMoment7
40,High End Outdoor Mall,,,https://www.tripadvisor.com/Profile/PlatinumHoney
50,fun sipping & shopping,,,https://www.tripadvisor.com/Profile/RachaelLeigh
30,Nice place for a snack and window shopping--way overpriced but it is Malibu,,,https://www.tripadvisor.com/Profile/gjfromwa
40,Lovely open air mall,,,https://www.tripadvisor.com/Profile/HowellyBear
40,Don't Let the Name Fool You,,,https://www.tripadvisor.com/Profile/tamarahammer
40,Great for spotting the famous doing the ordinary things,,,https://www.tripadvisor.com/Profile/GGCag
40,Nice for lunch,,,https://www.tripadvisor.com/Profile/Jackson321
30,Local place,,,https://www.tripadvisor.com/Profile/MikeinMalibu
30,Quiet spot,,,https://www.tripadvisor.com/Profile/flatlandermanitoba
40,High end shops; nice restaurants,,,https://www.tripadvisor.com/Profile/SLS006
50,Shopping and dining in paradise,,,https://www.tripadvisor.com/Profile/JoseF98
40,Attractive Shopping Center with Plenty of Parking,,,https://www.tripadvisor.com/Profile/JayBS661
50,What a lovely place to spend an afternoon...,,,https://www.tripadvisor.com/Profile/MeMeDaVinci
40,Lovely place to spend an afternoon,,,https://www.tripadvisor.com/Profile/Hexy
50,"It’s a shopping center with boutiques, restaurants and gift shops",,,https://www.tripadvisor.com/Profile/Cavydad
40,Great place!,,,https://www.tripadvisor.com/Profile/gloria_morato
40,Enjoyable to walk around!,,,https://www.tripadvisor.com/Profile/JessicaF694
40,Eclectic,,,https://www.tripadvisor.com/Profile/Usia2014
30,Family lunch,,,https://www.tripadvisor.com/Profile/GlenBeach
50,Great hangout for shopping and food,,,https://www.tripadvisor.com/Profile/louisw426
40,Stop Here on your way to the Beach,,,https://www.tripadvisor.com/Profile/ChanEvan
40,"Great selection, very crowded",,,https://www.tripadvisor.com/Profile/katies94
50,A Must Visit for Great Shopping,,,https://www.tripadvisor.com/Profile/hayleybf69
40,Cute,,,https://www.tripadvisor.com/Profile/PFC15
30,Interesting break when exploring Malibu,,,https://www.tripadvisor.com/Profile/DonnaD741
30,Lunch stop along the beach,,,https://www.tripadvisor.com/Profile/beachbreezeseeker
30,Boutique Bathers and coffee,,,https://www.tripadvisor.com/Profile/dorothyt457
40,Kinda Funny as it's not Country and certainly not a Mart!,,,https://www.tripadvisor.com/Profile/WVMom49
50,Malibu Standard,,,https://www.tripadvisor.com/Profile/tessalovestravel
30,Check the cinema out,,,https://www.tripadvisor.com/Profile/Andyuk100
50,a place to enjoy and eat well,,,https://www.tripadvisor.com/Profile/ccristalli
40,Tourism,,,https://www.tripadvisor.com/Profile/GlenBeach
40,Keeps growing,,,https://www.tripadvisor.com/Profile/worldwide002
40,Window Shopping unless you have $$$$$$$$,,,https://www.tripadvisor.com/Profile/sjs07f
50,So beautiful,,,https://www.tripadvisor.com/Profile/665vickic
40,Fiercely Malibu,,,https://www.tripadvisor.com/Profile/ruuthee
50,"Excellent Restaurants, Shops, Picnic Tables, and Play Area for Kids!!",,,https://www.tripadvisor.com/Profile/ladeela
30,Must see,,,https://www.tripadvisor.com/Profile/Fiftop
40,Fun stop,,,https://www.tripadvisor.com/Profile/shannany2015
40,Beautiful Shopping Center with High End Shops,,,https://www.tripadvisor.com/Profile/tnorton19
40,Fun to walk around!,,,https://www.tripadvisor.com/Profile/Launan49
40,If your in Malibu fun to stop,,,https://www.tripadvisor.com/Profile/SteveB689
40,in Malibu @ the Mart ...,,,https://www.tripadvisor.com/Profile/dblmed
40,I like this place,,,https://www.tripadvisor.com/Profile/982BarbaraS
40,Quite a relaxed place,,,https://www.tripadvisor.com/Profile/BigBrank
50,Quiet and exclusive,,,https://www.tripadvisor.com/Profile/neetawilfred
40,People watching. Small dog spotting. Fancy cars.,,,https://www.tripadvisor.com/Profile/travelredcard
30,Ok for a couple of hours,,,https://www.tripadvisor.com/Profile/Jen-JMelb
40,Funky cool,,,https://www.tripadvisor.com/Profile/stephensPerth
40,Lots of boutiques and cafes,,,https://www.tripadvisor.com/Profile/KMO0106
50,Nice place to walk around,,,https://www.tripadvisor.com/Profile/btrevino1
50,Great Stop on a Gorgeous Day,,,https://www.tripadvisor.com/Profile/jendickinson
30,Just a another mall,,,https://www.tripadvisor.com/Profile/AnthonyE376
40,Nice place to stop and walk around.,,,https://www.tripadvisor.com/Profile/roadwarriorguru
40,Fun Place to Visit and People Watch,,,https://www.tripadvisor.com/Profile/SirTravelLover
30,Shopping and eating,,,https://www.tripadvisor.com/Profile/0libbyt
40,Malibu Country Mart,,,https://www.tripadvisor.com/Profile/268se
40,Sweet Hideaway,,,https://www.tripadvisor.com/Profile/RooActon
50,Always on our radar!,,,https://www.tripadvisor.com/Profile/TXRanney76
40,One stop shop. Great people watching!,,,https://www.tripadvisor.com/Profile/Williamsland
30,It's...fine...,,,https://www.tripadvisor.com/Profile/MalibuMomma
40,"nice outside ""mall"" with chain and trendy stores",,,https://www.tripadvisor.com/Profile/SandraBaja
40,Great way to experience Malibu like a local,,,https://www.tripadvisor.com/Profile/Dav2525
30,Chillin in the 'Bu.,,,https://www.tripadvisor.com/Profile/Elwood_Seattle
40,"Outdoor shopping, quite place with nice green surrounding !",,,https://www.tripadvisor.com/Profile/ne_suhail
30,"nice, small, interesting",,,https://www.tripadvisor.com/Profile/ferdferd
50,A must see north of LA - quaint yet super sophisticated clientele and shops,,,https://www.tripadvisor.com/Profile/BP254
50,Absolutely loved it,,,https://www.tripadvisor.com/Profile/aristadrive
40,Relaxing shopping experience.,,,https://www.tripadvisor.com/Profile/rengem
50,Absolutely love the Malibu country mart,,,https://www.tripadvisor.com/Profile/568katrins
40,"Fun little shopping area, affordable and luxe",,,https://www.tripadvisor.com/Profile/Cinderbox
40,Rodeo Drive Malibu Style,,,https://www.tripadvisor.com/Profile/motorhead01
40,Pleasant Shopping Village to Shop & Eat,,,https://www.tripadvisor.com/Profile/travel_junkie05
50,Nice relaxing space to shop & eat,,,https://www.tripadvisor.com/Profile/LindaG968
50,Spot the stars,,,https://www.tripadvisor.com/Profile/99amym
40,Nice place to eat and shop,,,https://www.tripadvisor.com/Profile/Jackie178
30,Have lunch outside and possibly spot a celebrity,,,https://www.tripadvisor.com/Profile/MullerFamily826
30,Nice area to walk around and dine/shop,,,https://www.tripadvisor.com/Profile/MadelineS784
50,Great Shops and Eats in Malibu,,,https://www.tripadvisor.com/Profile/elizabethl831
10,Pass on this,,,https://www.tripadvisor.com/Profile/Bubbles0000
