40,Interesting Car Museum close to LAX,,,https://www.tripadvisor.com/Profile/Fredbloggs2014
50,A great place to visit,,,https://www.tripadvisor.com/Profile/64Valiant
50,Sunday: Ride in three Cars day,,,https://www.tripadvisor.com/Profile/dashdashdashdash
40,Quality collection of classic cars,,,https://www.tripadvisor.com/Profile/reggie300
50,Brother In-Law Car Lover,,,https://www.tripadvisor.com/Profile/Fearless52621020071
50,Best secret in town.....,,,https://www.tripadvisor.com/Profile/Sharjah
50,A great collection of vehicle history,,,https://www.tripadvisor.com/Profile/Wanderer802867
50,A MUST visit place,,,https://www.tripadvisor.com/Profile/mehereinthepool
50,Fun museum,,,https://www.tripadvisor.com/Profile/lv2trvlSanDiego
50,A Fun Car Museum,,,https://www.tripadvisor.com/Profile/JamesRobinsonLowe
40,Fun in El Segundo,,,https://www.tripadvisor.com/Profile/kimsuek05
50,Greta place to see vintage cars,,,https://www.tripadvisor.com/Profile/BGL46
50,Super Fun!,,,https://www.tripadvisor.com/Profile/LivPurple
40,An Unexpected Delight,,,https://www.tripadvisor.com/Profile/jerminator67
50,Great for Events!,,,https://www.tripadvisor.com/Profile/loritastic
50,Hidden gem!,,,https://www.tripadvisor.com/Profile/SarahE1342
50,Great little museum,,,https://www.tripadvisor.com/Profile/corvette2005
50,Go for a ride and view an excellent exhibit of older cars.,,,https://www.tripadvisor.com/Profile/4cents-worth
50,Absolutely worth it,,,https://www.tripadvisor.com/Profile/Z6066SNchrisc
50,Beautiful Cars!!,,,https://www.tripadvisor.com/Profile/BobBecki
50,What a great collection - a hidden gem,,,https://www.tripadvisor.com/Profile/simoncW6763NR
10,closed for private event,,,https://www.tripadvisor.com/Profile/S676QHcristinac
50,Delightful Family Afternoon,,,https://www.tripadvisor.com/Profile/maryjos833
50,Very cool hole in the wall,,,https://www.tripadvisor.com/Profile/kevinmY8576VE
50,Cars and more,,,https://www.tripadvisor.com/Profile/barry1817
40,Great Collection,,,https://www.tripadvisor.com/Profile/6_Speed_Automatic
50,Great place to spend some time!,,,https://www.tripadvisor.com/Profile/T7626PBjoea
50,Fantastic Collection of Cars,,,https://www.tripadvisor.com/Profile/BobandJosie
50,A Fun Afternoon!,,,https://www.tripadvisor.com/Profile/142lp
50,Hidden gem for auto enthusiasts,,,https://www.tripadvisor.com/Profile/W1798XGericb
50,"Excellent historic car museum, go on a Sunday and take rides in restored cars",,,https://www.tripadvisor.com/Profile/horwitzvta
40,"a quik stop..but, it very worthwhile",,,https://www.tripadvisor.com/Profile/jhatwo
50,Car freak central,,,https://www.tripadvisor.com/Profile/Creeping_Death_LA
50,VERY GOOD AUTO MUSEUM,,,https://www.tripadvisor.com/Profile/DarylJ552
50,Fantastic collection!,,,https://www.tripadvisor.com/Profile/39tessf
40,Mostly older classics,,,https://www.tripadvisor.com/Profile/brucep460
50,Fun Day,,,https://www.tripadvisor.com/Profile/robertbP5095PR
50,Great Fun,,,https://www.tripadvisor.com/Profile/crzydac
50,A hidden gem,,,https://www.tripadvisor.com/Profile/W4Peter
50,Very interesting,,,https://www.tripadvisor.com/Profile/gordonr302
40,Worth a gander around and if you are lucky...a ride,,,https://www.tripadvisor.com/Profile/nancyjesca
50,They are Passionate about the Museum,,,https://www.tripadvisor.com/Profile/NickellFamilyTravel
40,Nice little museum to visit,,,https://www.tripadvisor.com/Profile/selvync2014
50,Something Nice in a Random Spot,,,https://www.tripadvisor.com/Profile/billiamaquaace
50,A Hidden Gem,,,https://www.tripadvisor.com/Profile/264mguler
50,Great experience showing how U.S. history influenced the Automobile business,,,https://www.tripadvisor.com/Profile/donnat666
50,Make time to visit this place,,,https://www.tripadvisor.com/Profile/112Lee
50,An other kind of museum,,,https://www.tripadvisor.com/Profile/Henning252
50,Nice Time,,,https://www.tripadvisor.com/Profile/ddudasik
50,Best Car Museum in Los Angeles---next door to LAX---and NO crowds!,,,https://www.tripadvisor.com/Profile/like_national_parks
50,Fun auto field trip,,,https://www.tripadvisor.com/Profile/TRmichaels
50,Hands On Car Museum,,,https://www.tripadvisor.com/Profile/BoboTravlr
50,"Fun, Fun, Fun and your Daddy's got your T-Bird to stay",,,https://www.tripadvisor.com/Profile/RidingTheCusp
40,Great Cars in small town museum with a great feel,,,https://www.tripadvisor.com/Profile/Pellenils64
50,Car lovers must see!,,,https://www.tripadvisor.com/Profile/beaubrant
50,A great collection,,,https://www.tripadvisor.com/Profile/Banerman
40,Well wroth a visit,,,https://www.tripadvisor.com/Profile/vahehg
50,Exceptional,,,https://www.tripadvisor.com/Profile/Kauai-Biz-Traveler
50,Good place to spend a hour and see history,,,https://www.tripadvisor.com/Profile/26garyb
50,Fun place to visit on Sunday,,,https://www.tripadvisor.com/Profile/lmmarley
50,Always a treat,,,https://www.tripadvisor.com/Profile/314billw
50,For Those Really INTO Cars,,,https://www.tripadvisor.com/Profile/Markian
50,Memory Lane,,,https://www.tripadvisor.com/Profile/CAW256
50,Great hands on car museum!,,,https://www.tripadvisor.com/Profile/jackiernc1
40,Took you back in time,,,https://www.tripadvisor.com/Profile/CoralO8
50,Car Show,,,https://www.tripadvisor.com/Profile/tink8009
50,One of my favorite places in all of L.A.,,,https://www.tripadvisor.com/Profile/ourquirkytravels
50,GREAT AUTO MUSEUM AND RIDE IN AN OLD CAR,,,https://www.tripadvisor.com/Profile/707clayg
50,Great Automobile Museum,,,https://www.tripadvisor.com/Profile/nickberd
50,Ride in a classic on Sunday's,,,https://www.tripadvisor.com/Profile/Robert7772015
50,Wonderland of antique cars!,,,https://www.tripadvisor.com/Profile/sbducky
50,What a great museum!,,,https://www.tripadvisor.com/Profile/lucyv28
50,Fun,,,https://www.tripadvisor.com/Profile/patty9270916
50,Special event,,,https://www.tripadvisor.com/Profile/kelleyh572
40,"Fun, if you like old cars",,,https://www.tripadvisor.com/Profile/markw596
50,Excellent Venue,,,https://www.tripadvisor.com/Profile/F4123GUbrianm
50,Very cool museum. You can actually sit in the cars!,,,https://www.tripadvisor.com/Profile/TerryElvers
10,Good way to spend an afternoon,,,https://www.tripadvisor.com/Profile/CindyM1989
50,Hidden El Segundo Gem,,,https://www.tripadvisor.com/Profile/BeachJoan
50,A Great Unpretentsious Experience,,,https://www.tripadvisor.com/Profile/tympani
50,"Great collection, albeit small museum",,,https://www.tripadvisor.com/Profile/Ace90266
40,Good museum for car enthusiasts,,,https://www.tripadvisor.com/Profile/Avrilx
30,"Okay collection, but small",,,https://www.tripadvisor.com/Profile/adamsE5726RZ
40,Great car collection.,,,https://www.tripadvisor.com/Profile/625laurenn
50,"Visit, take a tour and/or a drive in these beautiful cars",,,https://www.tripadvisor.com/Profile/barbaraf472
50,you can touch history!,,,https://www.tripadvisor.com/Profile/TwoFourTheRoad
50,"woo-hoo, a HANDS ON museum",,,https://www.tripadvisor.com/Profile/scottrA3361XW
50,Very strong luxury car collection!,,,https://www.tripadvisor.com/Profile/SteveE778
50,Near LAX Nice Car Museum,,,https://www.tripadvisor.com/Profile/CalifSue
30,Ok if you have time,,,https://www.tripadvisor.com/Profile/heumanntouch
40,Suggested Donation is worth every penny,,,https://www.tripadvisor.com/Profile/Ts04935
50,Go on a Sunday,,,https://www.tripadvisor.com/Profile/2Alaska09
50,Wonderful!,,,https://www.tripadvisor.com/Profile/A8198UIroberts
50,Classic car's,,,https://www.tripadvisor.com/Profile/997medhatt
40,Here's a chance to ride in an antique vehicle,,,https://www.tripadvisor.com/Profile/rkj1111
50,Fabulous cars and off the beaten track,,,https://www.tripadvisor.com/Profile/GandC71187
40,"Fun, Fun, Fun",,,https://www.tripadvisor.com/Profile/beetrvln
50,Great place to spend a few hours,,,https://www.tripadvisor.com/Profile/SNEVMAN
30,Very good but comparatively a little overpriced,,,https://www.tripadvisor.com/Profile/John-Tropi
50,ADM ...a Ride Back in Time,,,https://www.tripadvisor.com/Profile/457EstherK
50,Great Car Museum in LA (Not Peterson).,,,https://www.tripadvisor.com/Profile/DissDog
40,This is a cool collection,,,https://www.tripadvisor.com/Profile/ianbeavis
40,Fun to ride in old cars,,,https://www.tripadvisor.com/Profile/xsteves
40,Nice short stop,,,https://www.tripadvisor.com/Profile/MommaMia21
50,Interesting Museum,,,https://www.tripadvisor.com/Profile/Joan1914
50,A birthday surprise.,,,https://www.tripadvisor.com/Profile/Kljack19
50,hidden car paradise,,,https://www.tripadvisor.com/Profile/ShacharD
10,too high priced and very poor attitude of 'workers'.,,,https://www.tripadvisor.com/Profile/E1708BIkarenl
50,"Superb collection, unique experience!",,,https://www.tripadvisor.com/Profile/TripTravelling
50,Ride in a Classic Car - Only here!,,,https://www.tripadvisor.com/Profile/CharleySays
40,Vintage car exhibit,,,https://www.tripadvisor.com/Profile/Edj06484
40,Pretty neat!!,,,https://www.tripadvisor.com/Profile/Nattysimps
50,Small but wonderful.,,,https://www.tripadvisor.com/Profile/jroberto
40,Cars that are regularly driven.,,,https://www.tripadvisor.com/Profile/LuckyPhil21C
40,"A great collection, if not gigantic",,,https://www.tripadvisor.com/Profile/johnc_19
50,Wedding at the ADM,,,https://www.tripadvisor.com/Profile/YardSaleLdy
50,Ride in Museum's Cars on Sundays,,,https://www.tripadvisor.com/Profile/debralynnet
40,Great antique car museum,,,https://www.tripadvisor.com/Profile/amm101
40,Lots of Charm,,,https://www.tripadvisor.com/Profile/EllicottDiner
50,Ride in the museum's cars,,,https://www.tripadvisor.com/Profile/114JamesP114
40,Excellent place for car lovers,,,https://www.tripadvisor.com/Profile/JohnCalebF
50,Worth the trip,,,https://www.tripadvisor.com/Profile/albemarletraveler
50,"If you like cars, especially Packards you must go",,,https://www.tripadvisor.com/Profile/HyattHilton
50,Interesting and cheap fun!,,,https://www.tripadvisor.com/Profile/badgergirl68
30,Ok... It says donation but recommend $5 each.,,,https://www.tripadvisor.com/Profile/Kristy318
50,BEST Place in town to host a event!,,,https://www.tripadvisor.com/Profile/Koollet4600
50,Unique and Special Experience,,,https://www.tripadvisor.com/Profile/KarenH644
50,Oh WOW !!!! Do not miss this treasure !,,,https://www.tripadvisor.com/Profile/NYU62
50,AussieBruvSis - Rare wonderful find,,,https://www.tripadvisor.com/Profile/AussieBruvSis
50,Could have stayed longer,,,https://www.tripadvisor.com/Profile/13ChrisV
40,Nice museum. Great cars,,,https://www.tripadvisor.com/Profile/Denverperson
50,A hidden gem in Los Angeles - what a find!,,,https://www.tripadvisor.com/Profile/MWG2
50,Another hidden secret in El Segundo,,,https://www.tripadvisor.com/Profile/RjF-LA
50,nice sunday outing,,,https://www.tripadvisor.com/Profile/reeel-deezinuh
40,Quaint museum near LAX,,,https://www.tripadvisor.com/Profile/Mango4610
50,Drive Off in a Museum Showpiece!,,,https://www.tripadvisor.com/Profile/christina_onthe_road
50,A hidden gem,,,https://www.tripadvisor.com/Profile/PCLewis
50,Enjoyable!,,,https://www.tripadvisor.com/Profile/gramma-of-10
50,An Unexpected Treasure Close to LAX,,,https://www.tripadvisor.com/Profile/pierrekiwi
50,Really Friendly!,,,https://www.tripadvisor.com/Profile/DMC697
30,Disappointing,,,https://www.tripadvisor.com/Profile/station
50,Music,,,https://www.tripadvisor.com/Profile/SL805
50,Come and see my 1935 Morgan 3-Wheeler!,,,https://www.tripadvisor.com/Profile/amercorp
50,who knew?,,,https://www.tripadvisor.com/Profile/E6735JJpaull
50,"Ride in authentic classic cars on Sundays and tour a unique collection of automobiles in the museum, Tuesday thru Sunday",,,https://www.tripadvisor.com/Profile/catnewman
