30,"Good art, badly lit","They have good art, and some excellent art, but the top inch or two of most pictures is hidden in shadow. The museum uses thick frames, with spotlights on the ceiling almost directly over the pictures, so shadows hide the top of each picture. Most museums have multiple spotlights farther away, to ensure the whole picture is lit.I also agree with the reviewer who noted highly reflective glass on too many pictures. If they can't use non-glare glass, they need to ensure a plain background opposite the picture, so we can see the picture without reflections of something else.",tripyrr
50,Excellent Degas Collection,"Overall, a great presentation of various works by European masters, but the Degas collection caught my eye. Many pieces by this famed impressionist - more than I've seen in any US gallery except maybe the MMA in NY. Very relaxed, uncrowded - definitely a must see museum when in LA.",aspen5
50,A Must-See for Art Lovers and Those Hoping to be Art Lovers,"This lovely little museum in Pasadena holds an extensive collection of Degas, Renoir, Gauguin, Cézan, Monet, Picasso,Rembrandt,Van Gogh and others. On the lower level of the museum is an excellent collection of sculpture from South and Southeast Asia spanning 2000 years. The smaller size of the museum makes for an intimate tour that can be completed in 1-2 hours. A delightful water/sculpture garden and the Garden Cafe make a nice spot to relax. The cost of admission is reasonable and students with ID are admitted for free. Parking is on the grounds and is free. The staff is helpful and knowledgeable about the collection..",Ionagirl
50,Who knew Pasadena had a world class art museum,"I've passed by here millions of times, and finally decided to check it out and I was thoroughly impressed. LACMA can be such a chore, and takes all day to not see much art. Norton Simon is small, and chock full of masters, without a lot of people. Shaded parking, important in Socal. Pleasant little garden, and located within walking distance of Old Town Pasadena. All the makings of a cultured, stress free afternoon.",Jenny
50,"Great, manageable-sized art museum with outstanding pieces","Amazing that this collection has such a great couple of pieces by so many famous painters/sculptures through so many genres, as well as excellent pieces from Southeast Asia. This is not an overwhelming museum where fatigue can set in. Instead it is very easy to see almost everything they have in 2- 21/2 hours and not feel rushed.Definitely an uplifting experience and a good place to spend a rainy day.",Karen and Doug S
40,WONDERFUL MUSEUM!,"The Norton Simon Museum in Pasadena, CA is located not very far from Old Town Pasadena, where you can shop and stroll and enjoy tons of restaurants, etc. The museum offers free parking and has a small sculpture garden outside. Inside, there is a lot of interesting art work for you to take in. There's also a lower level, on which there is even more art. Should you want a snack, they also have a little cafe as well as a gift shop. This is a perfect activity for a rainy or very hot day, because you'll be inside. It's easy to spend the whole afternoon here, they really do have some very nice art pieces. I'm no art expert (far from it!:), but I was here for around 3 hours. I can see someone who is really into art spending a whole day here. They must offer work shops or art classes, because in one of the rooms there was a group of people with an instructor, painting or drawing. I would recommend this place to anyone who has a open mind to art, it's worth visiting.",Tina C
50,Be uplifted!,We spent a few hours of a rainy afternoon with so many of the greatest artists on the planet you had to come away uplifted and appreciative. Rodin sculptures greet you as you enter each century has a glorious collection of paintings beautifully displayed with indirect light. The staff are helpful and unobtrusive. The gardens unfortunately were not open due to the rain but we will see them next time. The cafe offered an peaceful outdoor patio to enjoy a snack and talk about all we'd enjoyed. A great way to spend an afternoon in Pasadena.,Debbie D
50,Pasedena Art Night,We were lucky enough to see this museum for free as part of the art night events. It was crowded with a good mix of people. The staff were very courteous. We were latecomers so it was a quick visit.The testimony is that I would happily revisit and pay the entrance fee.These were the two artefacts I loved I am sure you will find ones of your own,Safari606660
50,Art Can Blow You Away,"The Norton Simon collection has to be one of the world's finest, and tucked away as it is just west of downtown Pasadena, and perhaps a bit of a secret as well. We toured a limited number of galleries, but only because we were so overwhelmed by the quality of the exhibited pieces. We started with an Impressionist gallery, seeing pieces by famous artists which we hadn't seen before. Apparently the Simon must not lend a lot of their pieces to other exhibitions, but that's fine with me because looking at a gallery with 12 paintings, eleven of which I would die to own was revelatory.The first gallery had pieces by van Gogh, Cezanne, Vuillard, and Matisse among others. They were wonderful examples of each artist and seeing them for the first time was exciting!The next gallery was more contemporary with Braque, Picasso and others, one of which was Lyonell Feininger. His piece in this gallery was so stunningly beautiful that we took a lot of extra time looking at it again and again. It had both a depth and a lucidity that I was unable to match in any of the subsequent rooms. As we were leaving the museum, we were drawn back to view it yet again.Another feature of this extremely well-designed building was an ability to see several galleries ahead, and what drew us through those rooms to the last one in this wing was a distant view of a huge installation by the American contemporary artist Sam Francis. Just getting to it was a thrill. The installation was three huge canvases, one perhaps twenty feet across by ten or twelve feet high. On an adjoining wall were two more very tall but thin canvases hung side by side but identical in composition, so all three had been done at the same time. I loved the freedom of these pieces, and their vivid colors as well.We were finally lured away by the equisote outdoor gardens and pondside cafe where we enjoyed without guilt some delicious and creative pastries. The Norton Simon is a genuine treasure - thank heavens our son lives in Pasadena as I think I will be visiting this shrine many more times! Bravo, Pasadena, for this arresting structure and its incalculably fine collection.",William N
50,A gem!! Both the museum itself and the gardens!!,"Similar to the Guggenheim museums around the world, the Norton Simon art collection is a museum on a human scale. You can visit it in a could of hours, and be able to take it in, without getting tired or dizzy. It has some amazing pieces of art. On the sculpture side, for example it has, from the piece-de-resitance Bird in Flight by Constantin Brancusi, to a couple of Giacometti works, a number of Henry Moore scuplture, Auguste Rodin, Barbara Hepworth, Degas, Aristide Maillol. The painting includes important pieces of some of the classics such as Rubens and Rembrandt etc, but I was amazed by the richness of the late 19th and 20th century paitings: Van Gough, Renoir, Degas (quite a few), Manet, Monet, Cezanne, Pisarro, Picasso, Kandinski etc. There is a nice cafe outside, from where you can admire the nice pond and the gardens, which contain a number of sculptures by Moore, Maillol, Hepworth. LOVED IT!",yakshaver
50,Must see for art lovers,"I've been to Norton Simon museum 3 times and every time I find it fantastic. I especially like the impressionist art collection, you can find many Degas statues and paintings, love his ballerinas. I loved it so much that I bought reprints from the gift shop and framed them. Besides Degas you can find impressionist and post-impressionist paintings by Manet, Corbet, Renoir, Corot, Van Gogh, Cézanne, Gauguin and my favorite Claude Monet. There are also sculptures by Rodin. Entrance is $12.",Tsion A
50,Even though overcrowded - it was fantastic,"I loved every minute of it and would definitely go there again. Till the end of the day there were many people but it still allowed me to admire fantastic works. Only Louvre and Rijksmuseum impressed me with a comparable amount of classic painters, Impressionists, post impressionists, etc.",Chihiro L
50,Great museum packed with surprises,"Although not a huge museum it is very good. It has many impressionists and different from all others in having Asiaa art, mainly statutes/carvings from temples that you won't see anywhere else.",Jan K
50,Perfectly splendid collection- do not miss,The Norton Simon is one of the finest private museums in the world. It is a must see - a superlative collection- where to begin? The Rodins and the rest of the incredible sculpture garden - a breathtaking Zubaran still life- the impressionist and post collection especially Degas and Van Gogh are worth the visit alone. Terrific Manets- splendid works in the Galka Scheyer collection- the Blaue Ryder and others- Rembrandts- and on the lower level South Asian artworks including a magnificent Chola bronze Siva Nataraja. Extraordinary and too many delectable works to be listed in a few words.,castlegreenph
50,Second visit as good as the first,"It had been a while since we had been to this museum, but we had some time to kill with friends and decided to go back. Our return visit reminded me again that this is a jewel of a museum, something like the Courtauld Gallery in London or the Phillips Gallery in Washington. In other words, a small museum containing a collection of extraordinarily high quality art. Definitely a must visit if you have a free afternoon in Pasadena!",SteveandMolly
50,Don't miss this hidden gem!,"Small by some museum standards, Norton Simon is certainly a crown jewel. A smattering of a variety of artists like Renoir, Rembrandt, Van Gogh were all represented here. Beautifully displayed with appropriate lighting and captivating plaques with a paragraph about each painting. With four wings there is enough here to warrant the trip. Parking is plentiful unless you are later arriving. A lovely garden cafe overlooks the sculpture gardens.",Karen M
50,This is a gem!,"Make a point of visiting The Norton Simon Museum while you are in Pasadena - there is a shocking amount of world class art right here in this little jewel box! Monet, Degas, Rodin, Renoir, Canaletto, and so much more. Walking distance from Old Town Pasadena but with easy parking as well, it's easily accessible. It's a small museum that you can see in a couple of hours, and that will leave you feeling like you have been around the world.",Buckeyetoyou
50,Amazing collection,"This relatively small museum has an amazing collection of impressionist painters as well as the old masters. In addition to Van Gogh, Manet, Monnet, Picasso, just to mention a few, three Rembrandt paintings are on display! In the basement is a fantastic display of Indian and Asian sculptures and objects. Convenient and pleasant cafe that offers shaded seating in the sculpture garden.",Bernard V
40,Great intimate museum,"We had a few hours in Pasadena and chose to spend out time here...it was a good choice. Quite a varied and interesting collection of painting and sculptures.Really enjoyed the Van Gogh, Rembrandt and Monet works.",mrt1955
50,Amazing collection of 16th-20th century European art,Easy access to museum. Impressive display of some of the most accomplished and well-known European masters. Hard to believe this was one man's collection.,travelbuddas
50,Incredible Museum. Well worth an afternoon,"We spent a rainy day at this museum. Besides the absolutely breathtaking artwork, beautifully displayed, there is a wonderful outdoor cafe area where you can have a glass of wine out by a pond. This place is a gem.",LaurieandBrent
50,Top notch collection,"Covers a lot of art history in a small but elegant Frank Gehry building with an exquisite sculpture garden. Highlights include a Raphael Madonna and child, a virtually unknown Henri Rousseau, a mesmerizing Zubaran still life, and a bold and beautiful Ribera of flower vendor with enormous calla lilies. It's a destination museum you can spend hours enjoying.",Brother B
50,Norton Simon Museum,"The Norton Simon is central to Old Town Pasadena has easy parking and a very reasonable admission cost. The Simon has a beautiful collection of Degas, Renoir, Monet, Van Gogh among others. As you enter the museum you will experience a Rodin sculpture garden. If you need a break you can enjoy a snack in the rear garden. Recently, we saw the largest collection of Picasso prints. Unfortunately, although Norton Simon owns these prints they are on exhibit for a short time and they go back into the volt until the next time.",marta469
50,Amazing,"I live in Pasadena since 2014, and drive past the museum on a daily basis.I can't believe I hadn't visited before. Simply: Amazing. I had the privilege of admiring Picasso lithograph exhibition before it closed. A unique experience. Also the impressionist collection is awesome.I will return many times.When visiting Pasadena you must go!",Luchoap
50,Europe comes to Pasadena,"From the moment you step foot in this beautiful and rare museum, you'll feel as if you've been transported to France both in the atmosphere and the art work. It's a must see if you're in LA.",LeslieFM
50,Great museum,Norton Simon Museum has a great collection of impressionist and other paintings and a beautiful restaurant/sculpture garden. We enjoyed the small Van Gogh exhibit very much.,Marcia C
50,A Little Bit of Paris,"The approach to the entrance contains many of Rodin's most famous bronzes. inside, one of the best collections of Degas works. Amazing display of post-war Picasso lithographs on display, giving a window into his process and experimentation. The outdoor cafe is charming.",rewillett
50,Wonderful Paintings and a Beautiful Sculpture Garden,"The Norton Simon Museum is one of those small gems not to be missed. An eclectic, but fine collection of art from the Renaissance to the 20th century, it is set against the backdrop of Monet’s garden at Giverny, reimagined and rich with 19th and 20th century sculptures. The lower galleries house South and Southeast Asian paintings and sculpture.Museum highlights can be enjoyed in a two-hour walk through the museum, but if you have the energy and the will, plan a longer stay.",Jeff C
50,A Small But Powerful Museum,"The Norton Simon Museum is a perfect visit because it does not overwhelm with corridors of exhibits. Instead, it's a well-curated collection that will provide several hours of pleasure.",edlexin
50,Many treasures in this museum,Although this museum is smaller it is filled with wonderful art pieces. Nice way to spend an hour to two hours.The garden was closed but it looked lovely.,Sue B
50,A great Museum with an Art collection way above its size,An excellent selection of paintings from diverse artists and historical chapters in the history of art.....The painting s are of high quality from Masters who's work is renowned world wide. Beautiful sculpture gardens add to your visit.,Lizzie-beth-745
50,A Gem of a Museum!,"I took my lovely bride to the fine place of culture last year. It was really worth the time and effort! The parking lot is large and always has a parking space. Getting in is very easy for this old gimp.We went mostly to see the collection of Old Dutch Masters. To say that I was impressed would be a serious understatement.Also the gift shop was extremely clean, well ordered and had lots of neat goodies. I was able to do a lot of Xmas shopping there. For small gifts for friends and other nice folks.Anyways I most highly recommend this joint to refesh ones soul. While in the area.",David L
50,Gem of a Museum,"This was my third visit to this museum. The art Norton Simon amassed is beyond incredible. I've read his autobiography and was anxious for another visit to this museum. Make sure you see the film of his life. This museum also holds many art expert lectures that are not to be missed; ask when you buy your ticket. The museum shop is excellent. I have too much to say about this lovely museum, so all I can concisely say is it is simply not to be missed.",Gloria B
50,An Uncommon Art Museum,"An afternoon at the Norton Simon Museum is one well spent. The galleries are expansive and the central garden is beautiful. The 2D interior works are displayed in a way that draws the viewer into close examination. What is uncommon is that the most significant 2D works in the collection are covered in non-reflective glass. On a practical level, this reduces the cost of insuring masterpieces. Gallery staff noted that visitors either love or hate this means of display. I fell into the former category because the works were much more accessible. There was no objection when I stuck my nose within a couple of inches of a Van Gogh, Picasso or Monet. Such close scrutiny allows for a careful examination of brush stroke and technique. You will also find, of course, the requisite gift shop and cafe on site. A great way to spent a chunk of a day in L.A.",Larry Malone
50,One of the most beautiful museums,The museum has a great location. Is incredible the collection that the museum owns. All the staff is really helpful.It is recommended to give plenty of time to each one of the rooms. The gardens are beautiful.,Honey B
50,School project!,"Great place to visit, specially with your children. You will have fun taking pictures outside with the statues",Edith H
50,A very nice museum in,"We stopped by the museum knowing they have a number of Van Goghs on loan, including the bedroom. The museum has different rooms for periods from the 15th century onward plus a floor for Asian Art and a sculpture garden. I had expected to skip the earlier periods which often focus on religious art but in fact there was almost none of that. These periods, also comprised some fantastic portraits and landscapes.A thoroughly enjoyable 2 hours, although you could probably spend much longer if you are a true art lover.",grizzly_travel
50,Amazing collections,"This is a smaller museum but elegant and well laid out. The Rodain sculptures are particularly amazing. On my visit I saw many of the greats, Picasso, Cezanne, Manet, etc. the gardens are lovely and well worth a visit.",michelle d
50,A 1/2 day museum,"The Norton Simon is a great 1/2 day museum to introduce your kids to fine art through the ages. There are ongoing exhibitions and unique pieces, and it is all displayed in modern rooms with indirect light. Certainly worth the low cost of entrance. Gardens are also nice.",Jerry T
50,Beautiful !,"So much to see, this building houses some of the most beautiful pieces of art. On some days you may see students on field trips, but the place is big enough for everyone. Easy to get to off major freeway, ample parking. Admission price is very low compared to other museums. There is also a wonderful out door garden with many shady spots. Would highly recommend a trip, you won't regret it. Museum is located at end of Old Town Pasadena, take a walk down Colorado Blvd.",mimi482
50,Don't Miss This Gem at Any Cost,"Packed full of priceless treasures. For a few dollars, one can see the world's finest artists from the Nineteenth and Twentieth Centuries. A feast of Impressionist and Post Impressionist works, especially those of Degas, Van Gogh, Manet and many others. Degas' 'Little Dancer' is always the high point for us....we go say hello to her every year. There are other galleries too and a section of Oriental and Eastern Art Forms. DON'T DARE MISS IT! Delightful small gardens at the rear.",John L
30,Local Museum with Excellent range,"This is a local small museum with excellent Asian statuary, modern European and classical European collections",Scott L
50,Beautiful Pasadena Art Museum,"Free parking, lovely grounds and nice art collection. So glad we made time for this during our trip. Only $12 admission fee for adults. In lovely Pasadena, no less. We especially loved the Asian exhibits. Too bad the outdoor sculpture garden was closed because they'd had too much rain.",russandmarti
50,The small little but pleasant and precious. A lot of famous paintings to see.,"The first Friday is free admission to go to this museum, but parking space is limited. You can see Van Gogh, Renoir, Picasso.. so may more. You can view them in closed up without peeping through glass box. I really love this precious little museum and a lot of collections. You will not be disappointed.",A H
40,beautiful place to spend a day,"I have found my many visits to the Norton Simon to feel magical. It begins with the sculptured, grassy walk to the entrance and the surprise upon entering to see that the museum surrounds a wondrous outdoor sculpture garden with a lily pond. It is a haven - you'd never know the busy 210 is running by on the other side of the wall. I've seen many wonderful exhibitions; one of the most memorable was a Van Gogh. The museum store is definitely worth a visit; great selection of art books and gifts. There is not a restaurant, but there is an informal serve-yourself café in the garden. Remember that Pasadena summers get blisteringly hot and you will not find cool solace in the café.",VKN_11
40,Amazing,Amazing collection of artists. Well worth a visit. You can spend an hour or an afternoon there. Unfortunately they are not opened in the morning and only on limited days. Be sure to check their schedule.,eeclaire1
50,Amazing Pasadena Museum,"This museum seems small but it has an incredibly important collection of art. It also offers concerts, food and a lovely garden. The docent led tours are exceptional. You should schedule a visit around one of these.",Katrina1222
50,A fantastic art mueum with a beautiful garden.,We went with another couple and spent several hours seeing some of the finest art on the west coast. It is week worth several hours of your time.,Stu W
50,Pasadena arts day,"I hadn't been to the Norton Simon in years so I was glad to go back and see Rodin's Thinker on the lawn, the lovely gardens and the fabulous art - Van Gogh exhibit was there. This museum is very user friendly and easy to maneuver through.",Crystal B
50,"World Class art, but right sized","The Norton Simon Museum has some really great pieces of art, but it is not overpowering and exhausting to visit because it is right sized. In a couple hours at a leisurely pace you can take in and appreciate everything, with maybe another hour to stroll through and absorb the sculpture garden. Absolutely worth the time and effort to visit.",dven8
40,Worth the time and effort to visit,We were in Old Pasadena waiting for our flight out of Burbank later in the evening. We were visiting Old Pasadena are and were were glad that we decided to walk down Colorado Blvd to this museum. We spent a few hours and loved it. Not big like a Getty museum but large enough to have a nice variety of art to attract different tastes. The museum was peaceful but fairly crowded the week after Christmas. The building is modern and the grounds are nicely kept. It was a nice way to spend some time before catching our flight home. We would recommend this museum to family and friends.,AaronI
50,There is more to Pasadena than the Rose Bowel parade,"This is our second visit to the Norton Simon. It is a jewel. From the Degas statues to the early Monet seascapes to the Van Goghs up to the old Dutch masters, yes including Rembrandt, and through to Picasso the collection is amazing. Especially when one considers that it was amassed by one collector and his foundation.And when you think you are done, take a break and go into the sculpture garden with its lily pond. Grab a snack and a drink and enjoy a zen moment.We drove 2 hours from where we were staying in Southern California to visit the Norton Simon and 2 hours back. The best review I could give is to say that when our excursion ended my wife turned to me and said ""I'm glad we went.""Oh, when we return to Southern California next year, and the next...., we'll take the 2 hour drive again to visit the Norton Simon no matter how crazy our relatives think we are. It will be like visiting a beloved old friend.",Leslie b
50,Well worth the trip !,"We drove down from Ventura . I was originally from San Gabriel Valley and hadn't visited in years and am wondering what took us so long. Excellent impressionist paintings with wonderful Van Goughs. I never got to the other european art I was so intrigued with the impressionists, Picasso's lithographs and the drop dead asian art.Very helpful staff and small but nice gift shop. Parking is plentiful. A great place to visit if you love art and art history. Rodin's The Burgers of Calai were in front as you enter, doesn't get better than that !",DD633
30,Nice modern building and grounds,"I don't have an eye for art, but I still enjoyed our visit to this museum. It was a walkable distance from the Pasadena Marriott Hotel. Wings of the museum are setup by time periods. The modern art wing was of no interest to me. I tend to stop and read each description so I was tired by the time we finished 2 wings. But, we did head downstairs to see the sculptures. There is a nice patio cafe for refreshments.",Rita B
