10,Hugely disappointed,"My friend and I had tickets for Melissa Etheridge, Keb’ Mo’ and Taj Majal on August 1 at 8:00 and decided to use the Park and Ride from Lakewood transportation option, as the Hollywood Bowl advertised on their website. The website stated that buses would be leaving at 5:40, 6:00, and 6:30. We arrived at 6:15, just in time to see the 6:00 bus leave. We were in a group of about 30, ready for the 6:30 bus, EXCEPT IT NEVER SHOWED UP. The two Hollywood Bowl support staff, Abraham and Norma, in their polo shirts with “Hollywood Bowl” clearly embroidered on, were wonderful in trying to find out what was going on, through phone calls and texts to their supervisors, but to no avail. At 7:35 Norma received word that the bus would be arriving in five minutes. However, by 7:55, she told us that the bus was not going to show after all. WE MISSED THE CONCERT AND THUS LOST THE COST OF OUR TICKETS. This is completely unacceptable. The Bowl needs to be called out for this. Our ticket price should be refunded!!",Kathleen H
50,4th of July Concert and Fireworks,"Best decision to book tickets to see the Go Go’s at the Hollywood Bowl on the 4th of July!! The concert was great and the venue was amazing. We had a great view from our seats and were amazing at the amazing sound that surrounded us. The Navy Band, LA Phil Harmonic and fireworks galore! Even our 17 and 22 year olds loved it! Wish we lived closer so we could make it an annual tradition! This was a highlight of our trip!",Dawn F
50,Outdoor Music High,"The largest open air amphitheater in the US?! It’s awesome. Thousands of people enjoying music with a California summer breeze and terrific acoustics...accompanied by good food and drink, good friends...a terrific experience. LA Philharmonic is doing a great job. Wonderful to see and hear. Big screens for close-ups of performers captivating. Go!",PlatinumHoney
50,Best picnic with a soundtack,"I cannot belabor the value of this unique LA experience. Because the weather is fabulous year-round you're safe to get tickets to the outdoor concert series and picnic here under the stars. The musicians they book, the acoustics, the lighting and ample giant screens mean that everyone has the best seat in the house. This is something NOT to be missed.",Lale W
50,The place to be for summer concerts!,"This is a really fun venue, especially during the summer concert series. You're listening to music you love, you're outdoors, under the stars. Many of these series events allow you to bring your own food and drink, so a picnic with friends fits right in. Parking can be tough, so a little patience is required, or catch the bus, tickets can be found at ticketmaster for around $12.00 roundtrip.",Chris D
50,Outstanding Musical Event at Hollywood Bowl,"Attended the Harry Potter Goblet of Fire movie at the Hollywood Bowl. Whilst the movie was projected on a number of large screens, the music was provided by the Los Angeles Philharmonic Orchestra. A lot of audience participation during the performance combined with the Family Picnic atmosphere made this a very memorable night - the warm weather helped.",Kevin M
50,BEST Outdoor Music Venue,"Our family and a group of friends & their kids went to the Grease movie Sing-A-Long, which was a LOT of fun (who can complain when Sha Na Na is the opening act?!?). But this isn’t a review for the Grease show. This is for the Hollywood Bowl itself.Besides the fact that the Hollywood Bowl is in a city with year-round amazing outdoor weather, and besides the fact that there’s a fantastic view of the Hollywood Sign from the bleacher seats in this legendary historic venue that has hosted everyone from the Beatles to Tom & Jerry (not to mention the remarkable LA Philharmonic under Dudamel), I absolutely LOVE that the Hollywood Bowl allows (if not encourages) guests to bring their own food & drink. Bringing a picnic with sandwiches, some chips, crackers, cheese, &, of course, wine &/or beer, sitting in 72degree clear evening weather, eating & drinking with friends as you wait for some great show to start... even before the show starts, it’s ALREADY a magical evening. You know it’s a next-level great time at a concert when the actual show itself is just the icing on the cake, when you could go home BEFORE the show begins & still consider it a wonderful night.And if that isn’t enough, another great thing about the Bowl? During their summer season, tickets for some shows are under $10-15, and I think most, if not all, summer season shows have tickets as low as under $20, so not only is it a must-see place to catch a concert, it’s a very affordable must-see concert place (especially factoring in that you don’t have to spend outrageous amounts of money on arena food/drink).",SpencerP0721
