40,Worth just taking a walk around it to admire the architecture,We arrived too late to catch one of the tours (which we think look a bit expensive anyway) but really enjoyed just looking at the architectural detail one can see on the outside of the building plus the very ART Deco entrance Hall.,https://www.tripadvisor.com/Profile/BobandJosie
50,Very interesting and educational,"When people hear of the Catalina Island Casino, they instantly think of a gambling experience. Totally not the case. This is well worth the time to hear about and see for yourself. If time permits, take their behind-the-scenes tour to get even more info.",https://www.tripadvisor.com/Profile/wgriff1
50,Walking Tour was Great!,"An easy walk from town, it was well worth taking the 45 minute walking tour. It includes watching a DVD about the history of the casino. The casino is a beautiful space inside and out. You won't get to look inside without the tour. with",https://www.tripadvisor.com/Profile/shelm1
50,beautiful building,We say a movie on half off tuesdays. What a beautiful building. It was a fun night out in a very special place,https://www.tripadvisor.com/Profile/corrines848
50,Go behind the scenes. Wonderful experience!,We did the behind the scenes tour with our amazing tour guide Rebecca! She was fabulous and we could feel ourselves drifting back into time and imagining the history and stars like Norma Jean Baker and Ronald Reagan who walked in those same steps. The casino is a special time in history that is unparrelled.,https://www.tripadvisor.com/Profile/stevenj353
50,Beauty and a movie!,"While exploring our eating options, we stumbled upon an opportunity to enjoy a movie-Star Wars: the Force Awakens as a special treat after eating and with no extra charge! We have been to the Casino several times and find it fascinating. THIS, however, was the first time we got to see a movie in the beautiful theater in the lower level of the Casino. The theater seats 1,184 and is glorious in it's art deco decor and is a real treat just to see. We were too late to enjoy a performance from the pipe organ so will have to (get to!) schedule this for our next trip. Don't miss it!",https://www.tripadvisor.com/Profile/402dougd
40,Nice tour - very informational history of the island,"My wife and I enjoyed this short tour. Takes about 20-40 minutes depending if you want to read every word, and study every picture. The museum provided a very interesting history of the island. Not being from California, we knew virtually nothing about Santa Catalina Island. This tour will tell you why it is named so, who came to it, who owned it, and a few other interesting tidbits. We enjoyed it. I cannot comment on the value of the tour, as our hotel gave us free tickets to get inside.",https://www.tripadvisor.com/Profile/mcchuck2014
50,nice museum there.,Museum had a lot of pictures and information on many famous people. Things I didn't know. Didn't get to visit the theater but planned to the next time.,https://www.tripadvisor.com/Profile/Departure808739
40,Icon on beautiful Catalina Island,"Not a real casino as we now know it but an iconic place with old fashioned artwork, theater and lots of history. The ceilings artworks are so beautiful. Be sure to visit the gift shop for fun posters of iconic actors and actresses. Tickets are $12 per person which includes a 40 minute tour of the ""casino"" with beautiful art work and a short movie.Guides are very knowledgeable and enthusiastic. We enjoyed the short movie that we saw at the beginning of this iconic building. You watch the movie in the beautifully kept up theater. There is so much beautiful artwork to see on the ceiling and walls.After the movie, we were taken up to the grand ballroom where we could only guess what it must of been like so many wonderful years ago. You will feel like you have gone back in time while inside the ""casino"". Was a beautiful day with gorgeous views of the water nearby.",https://www.tripadvisor.com/Profile/Charlene351
50,Movie at the Casino,Epic! Art Deco ALONE worth $30. to look at! ! Movie's show daily 7:30pm. This place feels like we're living alongside an alternate universe; add if one slight misstep could Jane you living in a completely debate. The ambiance wad palatable!!,https://www.tripadvisor.com/Profile/SuzHuz
50,Great Surprise!,You just have to take that walk. We honestly thought it was a gambling casino. Not at all. Casino means gathering place. Beautiful Art work surrounds this lovely building full of art history. Check out the Museum and book store. We went in the evening when the sun was going down. Beautiful photos. The walk continues to a beach resort area. Loved it!,https://www.tripadvisor.com/Profile/603mitzis
40,Tour the casino,"First you have to realize that the casino is not a ""casino"" that most people associate with the word. It's a theater and ballroom and it's gorgeous. We didn't see a movie there, as they were playing one we'd already seen, but we did go on the tour and learned the history of the building. Beautiful.",https://www.tripadvisor.com/Profile/Cheryl6662013
50,Casino didn't always mean gambling hall,"This place has an awesome theatre and ballroom. This was never a place to gamble. There are two tours available, I recommend the behind-the-scenes tour if available. The short film about the casino is shown during the tour and very interesting. We were there on 12/31 and they were preparing for a New Year's Eve ball that looked like it was going to be spectacular. If you've ever been to Radio City Music Hall, you can tell it was inspired by the Casino's theatre. The tour guide was friendly and knowledgeable. The tour was about an hour. I recommend visiting the casino.",https://www.tripadvisor.com/Profile/Ivan58_10
50,Great $12 Tour!,"We had previously been to Catalina Island for a quick day trip, but we didn't think to take the tour of the casino.My husband and I had a few days to spend on this stunning island, so I was really looking to get inside the casino and explore.We picked up our $12 tour tickets for the 40 minute tour.Fun fact, the casino was never actually used for gambling, it was more of a glamorous dance hall and theater.Our guide was very knowledgeable and enthusiastic. We really enjoyed the mini movie that we saw in the beginning about this iconic building. You watch the movie in the beautifully kept up theater. There is so much beautiful artwork to see on the ceiling.After the movie, we were taken up to the grand ballroom. I could envision the glamorous events of yesteryear happening when I stood on the dance floor.Definitely see this if you are visiting the island. You will have some great photo opportunities from the balcony of the casino too.If you have time, there is a small museum below.",https://www.tripadvisor.com/Profile/NYCaliKara
50,Let's go to the movies!,"The Catalina Island Casino was the perfect place to experience a movie. While it doesn't offer IMAX or 3D versions of films, it gives something rarer - the taste of a bygone era. The movie we saw was mediocre; the setting was incredible. I wish we'd allowed time for the casino tour.",https://www.tripadvisor.com/Profile/CandySandwich
40,Iconic Building,"I had seen photos of the harbor of Avalon and the famous casino building, but it is much more impressive seeing it up close.You can see movies there.",https://www.tripadvisor.com/Profile/ct-cruisers
50,Amazing historic building,"We took the tour and were amazed by the building and the history. The tour guide, Susie, was charming and very motivated to do a great job talking about the place.",https://www.tripadvisor.com/Profile/47MER47
40,interesting to look back in the 20's-30's california attration,rode the bikes from the pier paid for the tour( short one) Tour guide was very happy to be there and seemed to enjoy sharing the information. Interesting Big building and a throw back to the earlier days,https://www.tripadvisor.com/Profile/SpearsTx
30,"The Casino says ""Catalina""","A 40 minute tour of the casino for $12 a ticket. Tours are 11am, 11:45am, & 2pm. I loved the tour and being inside the Casino, but it felt a bit rushed. When you're taking photos or wanting to admire or read the posters they have the tour guides are already shooing you out to the next part of the tour. It is such a beautiful space, but really only informative on the paintings on the outside. There are no stairs in the venue, but there are ramps which is really good for those who are not able. The top is the best part for photos.",https://www.tripadvisor.com/Profile/kisssmee
50,Beautiful architectural accomplishment,"Don't miss this fantastic achievement, built by the Wrigley fortune and a centerpiece of the island. The organist plays weekends before the movie, a gorgeous four-keyboard instrument.",https://www.tripadvisor.com/Profile/whereiscookie
40,Meeting Place,"Casino means ""Meeting Place"" as this place totally is & was. Many under estimate the importance of architectecture, when designing a Large Building space. THIS IS AN EXAMPLE OF INGENUITY & Creativity! Spacious & delightful views from all angles! Inside this Ballroom is the Best 360 view of Catalina/Avalon! Imagination is turned into reality! The times of Intellectual Melding is near gone, but if the walls could speak... listen closely. A must see for the Nostalgic traveler.",https://www.tripadvisor.com/Profile/165catherinel
40,Be warned if you're in a wheelchair!,"The casino tour is very interesting..beautiful building and beautiful view from this building...BUT, the person who sold us our tickets and the guide at the casino never told us that there are only tall ramps from one floor to the next, no elevator for public use. My husband had to push me up EIGHT ramps to the 8th floor casino ballroom during the tour. What strength! Not sure we would have taken this tour if we had known. If someone had a power operated wheelchair, the decent would have been scary! Be forewarned!",https://www.tripadvisor.com/Profile/CandaceR9
50,Rebecca,"This was one of the most interesting, stunningly beautiful, fantastic tour I've been on. Rebecca is so knowledgeable, so much fun she made a tour of the could be boring, utterly fantastic!",https://www.tripadvisor.com/Profile/855cjs
50,A must visit,It's a true experience to attend the cinema at the Casino. Attended once during Silent Movie Festival and the organist played the famous organ at the crucial times during the silent movie. Wow!Tuesday nights are the discount nights and movies are around half price! Great clue. The inside walls and ceilings are a spectacle.During the day visit the Museum or take a tour. Well worth it.,https://www.tripadvisor.com/Profile/foileyer1
40,Casino,Great walking tour of theater and ballroom. Lots of history. Tour also included museum on ground floor.,https://www.tripadvisor.com/Profile/P2118GXjoanneb
50,BEAUTIFUL CASINO,"We were on the Carnival Imagination cruise; stopped for us to get off at Catalina Island. It was really super! Love the art deco!!! Yes, it cost us; but it was super! I'd go back again to the Island, but I wouldn't pay the price. The surrounding Casino was beautiful and the air was really great!",https://www.tripadvisor.com/Profile/karenrY2536DB
50,Very fun for taking pictures,Very cool Art Deco building. I was in the Casino for a Jazz concert not a regular tour. I was able to walk around and explore on my own.,https://www.tripadvisor.com/Profile/capttml
50,This building is MAGICAL,"I can NEVER get enough of this building. It is stunning! I am an ""art decco freak"" and enjoy the ""lines"" of this building. It is a MUST SEE when you are on the Island.",https://www.tripadvisor.com/Profile/X3719IHlindag
50,Must see! Amazing history and beautiful artwork,We went on the tour and were impressed by the Casino. Would highly recommend. Interesting architecture and stories. Also we saw a movie in the Casino and would highly recommend that. Get there early to see organ player friday through monday.,https://www.tripadvisor.com/Profile/jscoops
50,Beautiful building with a fascinating history,The little museum is great and the tour of the casino was really informative and fun. The longer tour was sold out but the short tour was still excellent. I will definitely go back to do the tour again.,https://www.tripadvisor.com/Profile/HBW-K
40,Lovely building,"Adds beauty and charm to photos of the area. The building houses a museum, movie theater, and ballroom, each of which have entry fees.",https://www.tripadvisor.com/Profile/jscof
50,Take the tour!,"I joined the rest of my group, who all wanted to take this 45 minute walking tour, and to my surprise, it was fun, beautiful, and very informative...don't miss it!",https://www.tripadvisor.com/Profile/ahottoddie
40,guaranteed NOT to loose $$$4,"when is a ""casino"" called a ""casino"" where you can't loose money? only on the Island of Catalina!......seems ""casino"" in Italian means ""gathering place""!",https://www.tripadvisor.com/Profile/papasmurfTucson_AZ
50,Beautiful Historical Landmark,The mural inside are breathtaking. Must visit this spectacular building while visiting Catalina Island.,https://www.tripadvisor.com/Profile/MithilaNepal
50,Awesome Jazztrax 2015,Our 1st time to Catalina Island and the 2015 Jazztrax Festival. The Casino sound was great for all the musicians on stage. Also enjoyed the beach venue for the 1st jazz act. Saw a large group of scuba divers at the back of the casino suggesting a good place to try the waters.,https://www.tripadvisor.com/Profile/ontheroadat62
50,Spectacular Building,"This is a must see while in Avalon, the art here is amazing the whole building is breathtaking! It was raining while we were here we got very lucky there were only four of us on this tour, most times I have been to Catalina the tours have been sold out. Our tour guide was on point and truly has a passion for the Island.",https://www.tripadvisor.com/Profile/Lissette1962
50,Wonderful place,"Not too far from Los Angeles, on the California coast, this is a quaint little island, used mostly for summer holidays. People move around in golf carts or bicycles.We landed in Avalon, and travelled the island on a narrated scenic bus drive.We went all the way up to the canyon, from there you get breathtaking views.Down by the pier there are a string of trendy boutiques selling quality crafts. I didn't see junk souvenirs like in many other places.We spent the morning there and had a lovely time. A place to come back to.",https://www.tripadvisor.com/Profile/Nonnita02
40,Insightful tour of historical landmark!,"Though we have visited Avalon before, we decided to take the Catalina Casino tour this time and absolutely loved it. Our guide, Rebecca, was funny, insightful, and engaging! We enjoyed learning about all of the history behind this landmark - and we would definitely recommend that you take the tour! It does involve a little bit of walking, but the views from the top will make it worth the trek! Additionally, if you can spare the time, definitely take in a movie at the absolutely breathtaking theater ... We wish we had had the time, but look forward to doing so on the next visit! Thanks, Rebecca, for making our first tour of the Casino a very memorable one :)",https://www.tripadvisor.com/Profile/334vidyav
50,Unbelievable building,"Saw a great concert upstairs, beautiful building, warm late summer evening overlooking the harbor. Couldn't ask for more.",https://www.tripadvisor.com/Profile/241JimS
40,Walk over to the Casino whether you take the Tour or not,The building is awesome and worth checking out. The murals outside are beautiful. There is a place to scuba dive off the back.,https://www.tripadvisor.com/Profile/Dawn92106
50,Beautiful,The Moorish architecture is wonderful with all the arches and the entrance. Art deco is the decor on the inside and also at the entrance. We sae the Jazz trax festival here and spent 3 days inside.,https://www.tripadvisor.com/Profile/SoilDoctor
50,Gorgeous and so interesting!,My favorite evening was the night I took myself to the movies at the old Casino and then took the long tour the following day. This is a really astounding structure and the story that goes with it is so interesting. I'd recommend you do the full tour so that you can see the ballroom on the top floor. It's pretty impactful.,https://www.tripadvisor.com/Profile/SparrowFox
50,Amazing Piece of Architecture,I have bee dreaming of seeing this place for myself for many years. I am so glad that I finally made it. This structure is Amazing and it's position on the island facing the sea is just Breathtaking!This was indeed my Highlight and worth my entire trip from the East Coast!,https://www.tripadvisor.com/Profile/Mytyia
30,"Gift shop was nice, not a lot going on here","Its a nice view, and there wasnt much happening when I went but I bet with events starting up it will be better.",https://www.tripadvisor.com/Profile/areoleh
50,Smooth,We had a smooth ride and on time round trip to Catalina Island. Friendly crew and clean accommodations. Can't complain.,https://www.tripadvisor.com/Profile/B2181PPdavidt
40,Unique Facility with a Great Story,"On a day trip to Catalina I had reserved tickets for the Casino tour in Avalon. The tour was well worth the money ($11 prepaid) and Rebecca did a fine job of bringing this historic entertainment center to life. A beautiful theater and an amazing ballroom highlight the 45 minute tour. There is great history here from Wrigley's concept and construction of the facility to the big band dances that accommodated 3,000 dancers. If you're going to make the effort to go to Avalon take the time for this tour. I suggest prepaying online especially on days when cruise ships dock --quite a crowd.",https://www.tripadvisor.com/Profile/ScottR625
40,"Tour of Casino, a 1920's Wonder",Rebecca was our tour guide on 10/6/2015. She was very well informed and engaged with the folks on the tour. Highly recommend the tour.,https://www.tripadvisor.com/Profile/V4620VVthomass
50,"wonderful tour of the casino, didn't realize the word casino means entertainment not gambling","I love everything about Catalina Island, seems like you are in an other part of the world but really just as close as your backyard.",https://www.tripadvisor.com/Profile/980yolandar
40,Catalina Casino,We took the tour and really enjoyed it. There is a lot of history to learn about the island that I had no idea about.The parties they must have had there! They place is really nice.The theater is incredible. The place is trimmed in real gold and silver with Tiffany lighting and fixtures.,https://www.tripadvisor.com/Profile/339rhondab
50,A jewel of history and class,"This is one of the most recognizable buildings in California, if not in the western United States. It has been in movies, advertisement, and has hosted some of the most famous big bands of the century. Many festivals and events have made this an amazing venue. There is so much to see inside, that the daily tour is very well worth the money. If you go to Catalina Island, don't miss this place. Go watch a movie, take the tour, go to an event, and take a picture. You'll always remember this place.",https://www.tripadvisor.com/Profile/CarlosLdelaRosa
50,So beautiful!,"We were lucky enough to get a free tour for our birthday - but even if you have to pay, this tour is worth it. This building and especially the ballroom are amazing. You will learn a little history and feel like you are stepping back in time. Don't miss this!",https://www.tripadvisor.com/Profile/We3luv2travel
50,The movie theatre is the best place to visit.,We were surprised that you can't place bets at this Casino - just dance! You have to go up fairly steep runways to reach the dance floor. The murals in the movie theatre were beautiful.,https://www.tripadvisor.com/Profile/242ellenk
50,Casino stands for a place to gather and entertainment so do not expect gambling.,Santa Catalina Island Tours offer a very informative tour of the history of the Casino. It is very beautiful. The movie theatre is amazingly elegant where you can view a current movie nightly.,https://www.tripadvisor.com/Profile/ckahla
40,THE Must See Avalon Attraction,"This Art Deco / Mediterranean Revival style monument is worth spending some time at. Take a tour, take some pictures, take in a movie, and take a dip!- The City of Avalon Dive Park is right outside. Ask when the organist will be rehearsing and go see a movie that evening, they'll let you in 1 hour early to enjoy the music!",https://www.tripadvisor.com/Profile/CareyG555
50,Beautiful building!,The Avalon Casino is such a glorious old building! We had the pleasure of seeing a first run movie in the working movie theatre.,https://www.tripadvisor.com/Profile/506RebeccaW
50,Don't bypass the Casino!,"A must-see on your visit...take the time for the 40 minute tour of this landmark, BEAUTIFUL building which includes the movie theater and dance hall, where all the big names came to party and dance the night away back in the days of old Hollywood.",https://www.tripadvisor.com/Profile/mstoochie
50,Lots of history,"What a beautiful building and such rich history from the average ""joe"" to movie stars. Rebecca was an amazing guide. We missed out on the longer tour, but I highly recommend that one. Get your tickets early in the day, tours sell out",https://www.tripadvisor.com/Profile/sandra608
40,Wonderful tour of an amazing place,"Unfortunately, our travel plans did not allow for us to actually see a movie or other performance here, and we left regretting it. The Casino is an very unusual building with a fascinating history, and our tour guide did a great job of helping us to understand the architectural features of the place.The 40 minute tour was just about the right length for us. We saw the lobby, theater, and ballroom and went out onto the balcony. All have stories behind them that make this a very interesting place to visit. There's a nice view of Avalon from the balcony.Note that the ballroom is above the movie theater and on the tours, you walk up several long ramps (think of the type in older baseball stadiums) to get there. My wife walks with a cane and managed okay, but it might be a challenge to some people. Wheelchairs can go up the ramps though a companion to help push might be desirable. They do not use the one small elevator for the tours and I do not know whether they'd make an exception for a handicapped person.Before or after your tour, you might want to see the small museum in the basement, around the right side of the Casino. We found it quite worthwhile.",https://www.tripadvisor.com/Profile/94741233
50,I recommend attending a concert of the fabulous Pipe Organ,"We go to Catalina Island every year around Labor Day. It is one big party! Among the attractions I so enjoy is the Pipe Organ in the Casino. The organist is one of those rare musicians who can play the 85 year old vintage organ. He is amazing to watch. There are about 4 keyboards and many pull out knobs that mimic brass, percussion, strings, etc. He plays tunes from the era of the organ so you can imagine what it was like before the talkie movies. The casino is a museum in itself. The movie theater plays contemporary films and there is only one large hall, but we go for the organ concert and usually leave when the film starts if we don't like the particular film playing. This is truly a unique experience. There are so few of these organs that can still play left in the world and I hope that Catalina always supports the upkeep of their wonderful Casino and organ. It is a treasure.",https://www.tripadvisor.com/Profile/suzanochka
50,The 40 minute tour... wanted more : ),"Our tour guide Rebecca was amazing. Great voice (she sang a few songs!!) and handled our group like a pro. A few people brought there 1-3 year olds (BAD IDEA) that disrupted her, but she handled it great! An amazing tour... crazy history!!!",https://www.tripadvisor.com/Profile/Richardriverajr
50,Don't miss the casino tour,"Had a fantastic tour with Rebecca. Very interesting history and stories about both casino and island. Also about the construction , great place and tour by Rebecca.",https://www.tripadvisor.com/Profile/P1119WHbarbaras
40,Imagining the celebrities of the 1920s and 1930s at Depression-proof Catalina.,"We took a docent guided tour of the Casino, theatre, ballroom and behind the scenes dressing room. The building is well maintained and the original design is a gorgeous example of 1920s Art Deco in California.",https://www.tripadvisor.com/Profile/pamelatC3755PC
50,Beautiful historical site,"I never imagined that building could be so beautiful on the inside. I thought it was just going to be an old theatre - wrong! Definitely worth the tour. And it's free on your birthday! Lots of history, gorgeous wood, interesting architecture. Rebecca was our guide, she had plenty of knowledge and a great singing voice too.",https://www.tripadvisor.com/Profile/Noelle310
50,Casino Ballroom Tour,"Take the tour! It is worth every penny. The Casino Ballroom is so tall it looks over the Bay and not only provides spectacular views, but makes for a perfect place to hold that very special event. It is truly a beautiful place and great tour guide.",https://www.tripadvisor.com/Profile/CathyZ246
50,If you are in Avalon you gotta see the Casino!!!,What an incredible building!!! You must take the tour! Bring your camera and take tons of pictures. The museum and gift shop is a must. The little restaurant just outside has great fish and chips. Be sure to look back at Avalon when you go out on the deck next to the ballroom and take a picture. Amazing!!!,https://www.tripadvisor.com/Profile/rohart2
