50,"Great, small museum.","This is a lovely museum that has a nice selection of artwork to represent the different periods - Renaissance, Classic, Impressionist... Perfect for someone like me who gets easily overwhelmed by large museums",AWilt
50,I love this place,So lovely indoors and out. Amazing how many world famous paintings are on display. Wonderful Henry Moore and Rodin statues in the garden. Also has free parking for the museum with an adequate parking lot!,Connie B
50,A Gem of a Collection,"Norton Simon's collection is just wonderful ! It rivals any museum and it is beautifully displayed. In particular the South Asian collection downstairs is amazing. My particular favorite thing to do is go on first Fridays 5 - 8 pm when it is free entrance and sketch in the various galleries. A sketch meetup, Freehand Sketching in Pasadena and L.A., often does this.",Sheri S
50,Surprised By Its Excellence,"An amazing art collection, very well displayed and all in all just a wonderful experience. We knew the collection had some masterpieces, but were floored by how many wonderful paintings by some of the top names. The Degas dancer statuettes are wonderful, the garden and grounds with their many statues (several by Rodin) and the Asian art downstairs all add up to a wonderful experience. A great place to spend an afternoon.",IdahoKid
50,"ART, ART, ART","The Norton's entry, gardens & galleries present some spectacular sculpture and paintings. This is one of the more relaxing and educational art museums around.",Ron Y
50,A must to see,This is a number 1 site in Pasedena. The Lotus Garden is also a grand place. The Lincoln letter is here to view and the gardens are spectacular.,KayPhoenix
50,First class collection of European paintings and bronze sculptures,"This must be one of the finest art museums in California. The collection includes very fine paintings by Rembrandt, El Greco, Tiepolo, Picasso and others and a sculpture garden of large French bronzes. The garden has a lake of water lilies in imitation of Monet's garden, an ideal environment for relaxation. There is cafe in the garden. Do not miss the collection of Asian art in the basement.",Olga P
50,A Day With Masterpieces,"This is truly a world class art museum. Take time to wander and see and stand before Rembrandt, Van Gogh, Picasso, Matisse. An exquisite sculpture garden offers shade and contemplation. Downstairs galleries offer the finest in Buddhist, Hindu, and Jain sculpture A very well appointed museum store has a trove of books and prints.",JMROAK
50,Excellent Art Museum,"After watching the Rose Parade most of my life on New Years Day, I have always wanted to go thru the Norton Simeon Museum. While staying in Pasadena, we took a morning to go. Free parking. The grounds are beautiful with Rodin bronzes. The museum is a modern smaller building, mostly on one floor. Courtyard with gardens, pond, and more sculptures. Fabulous European masters paintings, many Impressionists such as Van Gogh, Monet, Picasso ,as well as Rembrandt , Renoir , Degas, and hundreds of others. We went through it in a couple of hours. Very enjoyable art museum. Loved it.",Valerie066
50,What a gem!,"What a wonderful collection for a relatively small museum! We saw beautiful paintings by the like of Degas (a LOT of Degas), Van Gogh, Renoir, Rembrandt, Picasso and more.",Lori Y
50,Exquisite collection for its size,"It's a medium to small sized museum but don't let that fool you. It might have some of the best examples of different artistic styles, whether in oil, watercolor, ink, stone, marble, or wood that you'll find.",GuyFromPasadena
50,Old World Art in the heart of Pasadena,"One of America's finest private museums, just off of Colorado Blvd. in Downtown Pasadena, reasonable, world-class works of art.",SteveHoke
50,Well worth the visit.,"Outstanding collection of 19th and 20th century art. Almost every piece was really worth studying. we didn't even check out the basement or other wing, we were very satisified with the one wing and garden area.Really one of the better art museums I have visited, in a short time we saw a lot of great paintings and sculptures.",larry929
50,Beautiful,"I went here to review some paintings for a college assignment I had for Art class. The works of art they have in here are incredible and the outside grounds are just so beautiful and serene. You must visit if you are a fan of art, even if you're not, you will appreciate the picturesque landscaping they have outside.",grrracie
50,Lovely,Have visited the Norton Simon several times. I love seeing the Degas sculptures. The range of art displayed is wonderful,Pasa5
50,"The Best, and Very Best!","As, I was a student, i was able to get into there for free. Ah, beautiful Picasso and Van Gogh paintings. Beautiful Hindu Art too! Downside, LOTS OF SECURITY! But hey!",Emmanuel G
50,Small and beautiful,"Inside and out, this is a beautiful museum. I love their selection of 19th and 20th century artists in particular, and their changing exhibits are always interesting and well done. Outside is a delightful area to stroll, sip an ice tea or have a bite. And it is close to Old Town Pasadena and the freeway. A great addition to any day.",134paulinef
50,Not to be Missed Museum,One of the best Museums in Southern California...highly recommended. Be sure to check their hours. I visit the museum each time I am in Pasadena...nice gift shop as well.,Offthebeatenpath011
50,Precious jewel of a museum,"This jewel of a museum is close to the freeway and a busy boulevard, but with the exquisite landscaping you'd never know. The collection is broad, spanning about 5-6 centuries, Renaissance to Modern. The gardens surround the building, and since the building is H-shaped, you feel enveloped. There are several entrances from the gardens to the museum.",professoressadarte
50,Take your time and enjoy,I spent 5 delightful hours at the Norton Simon Museum and highly recommend purchasing the audio guide. You will learn a lot.,Karen R
50,Must go,Every art lover who visit Pasadena should visit this place. It's very peaceful when they do not have any special programs. Sometimes they do have free admission events too. Check out their calendar. Love it :-),Cma P
50,"Rembrandt, Rubens, Cezanne, Manet, Monet, Picasso, Degas, Rodin, Moore.... Need I say more!","This museum is a good one to visit f you are with those who can't be in a museum for a whole day. I believe 2 to 3 hours will give you enough coverage. Trust me, bringing 2 teenage boys whose idea of an art museum is not really a ""fun"" thing to do... this is a perfect spot.If you love art museums, this is perfect as well. Within a span of 2 hours, you can be up close and personal with excellent art work from the masters. Without the throngs and throngs of people you would see in the Louvre, for example. Hence, you can take the time to sit and enjoy. There are in general two floors. The bottom portion had Southeast Asian artwork, while the top floor has European art pieces.It also has an outside garden, great spot to have some coffee or snacks. Beautiful garden with big statues by Moore. They also have pieces of Rodin and Degas (not in the garden). The teenagers hang out in this area and enjoyed it.Once you are done here, then take the short drive to old town Pasadena and have dinner, explore, etc. So if you are in Pasadena, take the time to come here as well. Adults are $12/each, 18 and under free. Students with ID free as well. So a perfect price to see the art masters.Would definitely recommend!",rrkkjones
50,A Must See,"Love museums? Then you will find your heart's desire in Pasadena, at the Norton Simon. Chock full of famous artists' works, paintings and bronzes, plus antiquities. Don't miss this one.",Jody W
50,Interesting Collection and Grounds,"The courtyard was a big draw for art students, with numerous outdoor sculptures surrounding the center pond. Inside, there were wonderful, non-mainstream pieces, beautiful, but not typical (see pictures).",james i
50,A great way to spend a few hours in Pasadena,"This is a wonderful museum. There are many gems here both in the permanent collection and in the temporary exhibits. It is also very affordable, children under 18 get in free and parking is free. You will need several hours to see everything. When you need a break head out to the sculpture garden for a moment of rest. It is very beautiful.",Travellingmeand3
50,Art in Pasadena,Outdoor sculpture garden is quite interesting. Art-lovers will appreciate the collection. I like to spend an hour or two here. Food for the soul.,Patrice
40,a nice way to spend the afternoon,The outdoor sculpture garden is very nice but may be too hot for some. The art collection is quite impressive and I enjoyed spending the afternoon wandering the halls. There is a large variation in the types of works displayed which was also enjoyable.,Leslie K
40,"Very nice, perfect size","Wonderful museum, just the right size with a bunch of the ""greatest hits"" - Picasso/degas/Rembrandt/Rodin/Moore/etc. perfect for a 1-2 hrs stroll. Nice garden would have been better without all the freeway noise behind it, but otherwise a lovely visit.",desertduffergolf
50,A World Class Museum,"Norton Simon assembled a truly great collection of asian antiques, along with an exceptional Degas bronze sculpture collection, plus an indepth art collection that spans many centuries. The building and grounds are compact and pleasing. This is a gem collection not to be missed.",john w
50,You Can't Go Wrong with this Museum,"I always recommend that people visit the Norton Simon when coming to visit Los Angeles and/or Pasadena. There is an assortment of art and styles presented, but not overwhelming to the point that you feel the need to leave after a short time inside. The surroundings are not as institutional-feeling as some museums and galleries give off, which is refreshing, because the environment complements the art, not drastically contrasts from it. It's a wonderful date spot, as well as for families. Just be sure that you don't bring water inside, you will have to give it to an employee to dispose of it. But that's standard for art museums, I think. Have a great time!",marybelle08
50,Quick Trip to Norton Simon,"This is an excellent small museum. I have reviewed shows here and did a feature on sdwoodruff.WordPress on the recently returned (and originally looted) Cambodian Temple Wrestler sculpture. Fine garden with sculptures and a lilly pond. Frequently rotating exhibitions and excellent Indian sculptures, mostly looted in the 19th century. The gallery has artistically shadowed lighting. Renaissance classics, impressionists, Picasso and others. Not expensive and a $9 senior entrance fee. Outdoor front court loaded with an impressive forest of Rodins.",Pacodawg
40,Comfortable atmosphere - nice collection,"Plenty of parking and reasonable admission prices (kids are free) made this an interesting choice for a summer afternoon. The museum was very comfortable and never felt crowded. I took my 12 year old son here in order to expose him to the arts. My hopes of getting him interested were dashed as he quickly tired of seeing so many paintings of ""weird looking people"". Nonetheless, I enjoyed the breadth of the museum's collection. The Rembrandts and the Van Goghs were particularly appealing. The museum is pretty heavily weighted with the Impressionists - particularly Degas. I'm not a huge fan but if you are, you will be delighted. I understand the gardens are nice too but my son wanted to leave so didn't get to those. Nonetheless, not a bad way to spend an afternoon and only $12.",Derek R
50,A Feast for the Eyes,"This is a lovely museum, both inside and out. Many great works of art are housed here, but it isn't so vast that you'll become overwhelmed. Which is why I like it here so much. You can easily spend an hour or two, or more depending on the time you have. There is also ample outside area to wander about, with statues and sculptures. The gift shop is not to be missed, small but filled with a wide variety of books, posters, trinkets and such. Plenty of free parking on site.",Tylersnana55
40,A beautiful relaxing afternoon at the Norton Simon Museum,"The museum is in Pasadena, an easy ride from Glendale.I liked the way they arranged the art by centuries. It is a small museum so you are able to see all the paintings in an easy relaxed manner. The cafe outside is so inviting. It is surrounded by trees, plants, and water. Just beautiful! The food and drinks are healthy and very good. They also show a movie which tells the story of Norton Simon and his collection. Make sure to read the info next to each painting, very informative.",ponsie2015
50,"Superb setting, outstanding collection",The museum has an excellent range of art with particular strengths in Asian sculpture and a knockout Van Gogh that is worth the trip. Be sure to make time to enjoy the exquisitely landscaped sculpture garden and lily pond.,cranberries0928
50,Outstanding collection in beautiful setting and facility,"This is a great local museum located in the western part of Pasadena.The museum features an amazing collection of Degas, Rodin, Henry Moore and other similar artists. The Impressionist collection is very good and the sculpture garden is excellent. The garden features some interesting and unusual vegetation as well, all well-maintained.We found the curator's information to be consistently excellent as well.Audio curator's comments were available, but we chose to pass given that we had all day to visit.During our visit, a special exhibit focused on the development of the color blue in art over the centuries. Very well done.Don't miss Rodin's Thinker, which is on the front of the Museum. It's not obvious how you get to it - we asked one of the staff when we saw it in the brochure. You simply walk on the lawn around the building.",Lyle B
50,Still the best curatorial information. Thank you,"Always wonderful! As always, the best curatorial work in the country! The information available about the pieces from the permanent collection and the special exhibits. We were intrigued by the information on the impact of chemical advances on the availability of stable blue paints. As always, enjoyed our time in the museum and learned something fascinating painlessly.",laurelhurst56
50,Top of my list!,"I have visited the Norton Simon probably 3 times in 20 years. After my August visit, I want to return annually. It is just great! From the impeccably laid out and cared for grounds, which begin at the street and parking areas, to the sensational sculpture garden courtyard, the use of trees and plantings and water is wonderful. The collection's main stream is European from 14th to early 20th. The collection on display is large enough to be deep and wide, but not so large but what you can plan to visit most everything in a day. The Asian collection is excellent and well focussed. Modern art is not covered well enough to be a contender. Do not plan to zip through in an hour. Whether you read the excellent text next to each work, or listen to the super recorded commentary, expect to spend more than 2 hours even if you take some shortcuts. The store offers high quality, matted digital prints at moderate cost - I think of virtually anything in the collection. On-line they offer archival quality scans of their collection, and by offering high resolution download, it puts them far out in front of the others. It is incredibly generous.",Fringe_Gatherer
50,Great Frist Museum,"On the advise of a friend, we visited the Norton Simon Museum. Without knowing it, it was the first time I went to an Art Museum with my 16 year old son. We really enjoyed ourselves, including taking a break outside at the concession stand just enjoying the weather. The collection is so diverse and amazing. If you find a period you like you can just stay or move onto something that strikes your fancy from impressionists to Dutch Masters. I was especially taken by the van Goug.",Giant_Stride_SCUBA
50,World class collection,"An outstanding collection of art covering virtually every century. Large number of Degas, Henry Moore and Rodin sculptures displayed both indoors and out. Can be toured in a few hours.A wonderfully accessible collection of some of the world's finest art in a modern setting.",Gary F
50,Visit Visit Norton Simon,"Norton Simon Museum is in a great location. It is very easy to get there. Is is will-organized and has a great variety of art work. Parking was convenient and provided easy access. Collections include Asian, European, Modern, and Contemporary.My visit was before Sept., 2014, but that is the earliest time available for me to check.",Granna2012
50,A little of everything,"Great museum, not too big so it won't take you hours to see everything, has a lot of big named pieces too. There is an outdoor cafe, smallish, compared to the one at the Huntington, but there is a nice little garden you can eat outside in as well.",Varesha108
50,Very interesting and beautiful,This is an indoor/outdoor museum and can be done in one trip. There is a great cafe in the garden to get a light lunch.,Michele K
50,Boutique museum worth a journey,"beautiful inside and out. A really diverse and wonderfully displayed collection. Airy rooms, very special pieces, don't miss Degas collection",Watersprite91
50,Great Museum with big name collections,"When you go to Pasadena, one of the must do's, is to take a couple hours to go to the Norton Simon. One does not expect to find such a beautiful museum with such a great permanent collection of Masters. Everyone I have ever taken there is delightfully surprised.",Swisscss
50,What a gem!,"I had a little free time while in Pasadena for a conference so spent a couple of hours in the Norton Simon museum. What a great choice! The museum is relatively small so you can see it mostly in a couple of hours without your head exploding (which is what I often feel like at really big museums). I didn’t know anything about the museum when I went in so had no expectations, but was very pleasantly surprised. The museum has a small but excellent collection spanning the past 500 years. Each section had representatives of the major masters of the time so it was a whole art history course in the span of a couple of hours. The emphasis was mainly on continental western Europe – mainly from the Netherlands through Italy with almost nothing from Britain or eastern Europe. The first section was on mostly religious art from the 1300s-1500s and included many of the major styles and representatives of artists I have seen from Europe including Botticelli, Raphael and El Greco. The next section on European art from the 1600s and 1700s included representative paintings by Rubens, Rembrandt and Canaletto, among others. The next section on art from the 1800s apparently is the largest collection of impressionist and post-impressionist art in southern California and I would believe it. All of the major artists are represented including Monet, Renoir, Cesanne, over 100 painting by Degas and at least three or four that I saw by Van Gogh. Truly an excellent collection and a great way to see representative paintings by many famous artists in a small space. There also was a gallery of modern art that I could not relate to very well but seemed to be good. Downstairs there was a collection of Asian sculpture, mostly from Thailand, Burma and India, and there was an outside sculpture garden that included Asian art as well as contemporary pieces and bronzes by Rodin. The exhibition on blue pigment was very interesting. Truly a gem and just a short walk from Old Pasadena.",Stephen G
50,Great curated pieces from the Masters....,One of my favorite museums with a lovely permanent collection from Monet to Degas. Small museum but worth the time. Beautifully curated and first Friday of the month is always free.,venicegirl05
40,All the works were beautiful of course,Very beautiful museum that you can walk through and not be rushed. Quiet atmosphere. Wonderful art collections they also have a garden setting where you can order coffee or tea and snacks. Some days are free to enter. Parking is free and it is easy access off the freeway. Should be a definite visit,Rosemarie H
50,A stunning Museum,"The Norton Simon collection features many period works, including some Van Goghs and other impressionists. The Grounds are also lovely, incorporating a sculpture garden well worth the walk.",Mary M
50,Fabulous Museum on beautiful grounds.,The Norton Simon Museum was marvelous. It was difficult to tearmyself away from the exhibits and go on to others which were also difficult to leave behind.,mocheB20A
50,A Great Place For Art,Beautiful buildings and grounds. Nice cafe too. The museum had a good selection of art objects and was very well arranged. Easy to see each item.,mgsinger
50,Not to be missed,An excellent collection of Impressionist paintings. Especially strong Degas offerings. There are also some 17th masters such as Rembrandt. There is an amazingly strong collection of South and Southeast Asian art as well. Also some great Moore sculptures in the garden.,lislander
50,Worth the trip. Excellent contemporary exhibits with some Euro masters thrown in,Best part was excellent descriptions of art on the wall. Easy to read and enjoyable. Whatever team wrote them had a good sense of humor too. The sculpture garden was very enjoyable as well. Not a long walk from Old Town Pasadena where there are many restaurants.,lakemary1204
50,Do NOT miss!,"Absolutely world-class in every way. My favorite periods happen to be the old masters and the impressionists and choice exemplars appear here in a beautiful space. We visited on a Saturday afternoon and it was surprisingly uncrowded, another plus. The food at the outdoor cafe is surprisingly good and it's a delightful place to rest before you move on to the rest of the museum.",Consumerista
50,Second visit,This museum is a must-see if visiting Pasadena. We spent four hours looking at the special exhibition and walking around the garden with its water feature and lovely statues.,HolidayOrganiser
50,A spectacular museum,"This is an outstanding museum with a comprehensive display of art. I saw many famous pieces that I had only previously seen in books or on TV. Quite a treat. (The museum cafe, however, was awful!)",Elon B
50,Great Variety,Nice blend of time periods from Renaissance to Contemporary art. The museum has a couple outdoor elements which balance the museum experience and allow for a nice setting to recharge.,JeffereWest
50,Great LA museum.,Love this museum!!!! It's overlooked and that means it wasn't very crowded on a Friday night. The collection is great and I love the sculpture gardens!,GivemeaTfortravel
50,First Rate,Lovely Saturday spot! Visited this weekend and so enjoyed the museum and sculpture garden. Even lunch in the garden was delightful. The Degas collection alone is worth the price of admission.,AcornFoodLady
40,Norton with kids,"We visited the Norton Simon on a weekday with out-of-town guests. Since we live close, it was more of an experiment to see how the children would do at a museum before dragging them around London. They (3 & 5) walked around and looked at the works of art for about an hour. They were more interested in the outside sculpture garden than the inside, which featured 3 famous pieces from France at the time. The museum itself is nice and it wasn't too crowded. Get there early for less crowds. Parking was free, which is nice for Pasadena. Don't forget to see the Mulberry Tree. You can almost see the paint drip off the canvas.",irsh21
50,The Best Big Little Museum,"Norton Simon has the best of the best, but not too much of any one thing. You get an overview of many styles, periods, and media but no room is huge, crowded or overwhelming. It's the perfect size to do in an hour or two, and you feel enriched and educated and cultured. The outdoor cafe is a lovely place to sit and enjoy tea or a meal, and the landscaping.",Suzanne S
50,Magnificently Minimal Museum,"This is a jewel-box art museum, one of the best in North America. A fine collection of Impressionists, European and American; a nice outdoor garden/cafe with simple lunch foods at a reasonable price; some great reproductions of their honored sculptor, Rodin. It's an easy art-feast at which to spend a couple of hours or more.",GrannieFrannie007
50,Great things come in small packages!,"This is not a large museum, but that is one of the things that makes it so appealing. It is well curated and the collections are laid out so that you can follow European art from about the 1500's forward. Each piece has a well detailed description of the art and artist - really puts each piece into perspective. The collection of French Impressionists is especially nice given the size of the museum and they do have quite a few Degas'. The Asia collection is downstairs and also quite impressive for its size. The garden courtyard is beautiful and a nice break from being indoors (you could easily spend many hours). Right now they also have a special exhibit on the technology and development of paint and how it affected the ways artists could paint - unusual and interesting! Even my husband (not a real art lover) enjoyed this exhibit. A lovely and relaxing way to spend an afternoon.",betterontheroad
50,Peaceful museum,"This is a small art museum, but often has special exhibits. It always feels peaceful to me. The parking is close and free. Admission is free the first Friday of the month from 5-8 PM",Bea M
