50,Well worth the visit,"Hands down, my favorite place in LA!! Street vendors have tasty food!! The Alley Dog holds it down for tacos w fresh tortillas! Come ready to bargain! They have everything from cosmetics to electronics and everything in the middle! Great LA vibe!! Fair parking rates off Maple ace.",https://www.tripadvisor.com/Profile/marcosv341
30,Cheap shopping,"It's like traveling to a foreign country and going to their tourist flea market area. Santee Alley is just a small part of the Fashion District. Calling it the Fashion District makes it sound like an upscale part of Downtown LA but it's in a not so great part of downtown and you definitely don't want to walk around the area alone. The shops have a lot of the same items for cheap. They will also bargain with you. I was hoping to find some knockoff versions of super expensive purses but apparently the guy only shows up once in a while carrying the knockoffs to sell. If you are looking for cheap souvenirs or items, this is the place to go. Parking is between $5 to $10 bucks depending on where you park. You can also try to get meter parking. Make sure to have cash on hand (dollar bills) in case you need to use the restroom because it costs $1 per person to use the bathroom.",https://www.tripadvisor.com/Profile/TravelingParent1
40,Shop Till You Drop,Had a great time shopping here! Great deals & tons to choose from. Will definitely be returning for some winter shopping!,https://www.tripadvisor.com/Profile/CLopes2012
50,Downtown LA ...Great Shopping..,I am reviewing my Must Dos for LA and if you like Clothes and Shoes this is a must do!! Great Place to Buy Items to bring Home!,https://www.tripadvisor.com/Profile/Dee7SarasotaFL
10,Do not go here,"Don't go here. Do not go here. Why are you still reading this, just don't go there. Okay, imagine a rubbish knock off market in inner city Leicester - it's worse. It is not ""charming"" the ""festival"" atmosphere is like wondering off the main route of Nottinghill Carnival at about midnight. You will not see fashion or student designers. Do not go here.",https://www.tripadvisor.com/Profile/tcp1002017
40,"Interesting, something to see for sure","Seems like hundreds of little shops mostly selling the same things. There are some very good deals on things like hats, sunglasses, and watches, mostly knock offs. It's more than just an alley. There are shops for block in all directions from the alley. There are very few public restrooms and the ones that do exist are not very clean.",https://www.tripadvisor.com/Profile/daverich
30,"A must see, like a forign bazaar","Weekends here is like being in the Casbah. people and umbrellas everywhere. Hawkers selling their goods, stalls packed with people and music blasting. A real blast",https://www.tripadvisor.com/Profile/csimmamps
40,Looking For a Gown,"Love, love Santee Alley for ball gown shopping. My husband is in the Marine Corps, so I need a new gown every year. Santee Alley is your one stop shop for the dress, shoes, jewelry, and other accessories. Make sure you start very early in the day and wear comfortable shoes. There's a lot of walking. Take cash, you don't want to run your card at all of these little places, plus they usually give you a deal if you have cash. I gave four stars due to the cleanliness, not really a place for small children and strollers.",https://www.tripadvisor.com/Profile/Cleojd88
30,Rainy Day Shopping,"Well, i can say i've been here before and had way more fun last time because it wasn't pouring. It was cold, rainy and miserable when we went, but i do love shopping here! Some good deals if you know your prices.",https://www.tripadvisor.com/Profile/tsander4
50,Los Angeles visit to the Alley,I was looking for something special and I found it! You can never go wrong at the Alley......took flyaway from airport straight to this area. Check in hotel then started walking. Street after street of shops.,https://www.tripadvisor.com/Profile/sneadAtlanta
40,"Walking, shopping, walking, shopping","It was my first time to the ""Alley"". We only had one day but it was fun! Bring a bag to carry your ""finds"". Yes, there were a lot of similar items but there were many different items too. Like any crowded place, mind your wallets/purse. Lots of shoes, clothes...lots of stuff. On a side note, there were even pinata's down another street LOL It was my first try on the hot dog loaded with everything which was actually pretty good. Wear comfortable or good footwear. Lots to see, easy to get confused on where you are. Parking is not the greatest :-( but bargains galore. I wish I had one more day!!",https://www.tripadvisor.com/Profile/pbjellysandwich
40,Alley Shopping Frenzy for the Ladies ...,"I take out of town visitors to Santee Alley for the fun frenzied shopping experiences that ladies seem to love. The girls get right into it all with booth after booth of women's goods of all types. Some name brand but most is off label, but that's OK as the prices are bargains. Not much for the guys, maybe T shirts. Fun excursion. ...",https://www.tripadvisor.com/Profile/dblmed
20,"Lots of people, lots of the same",Very crowded!! Don't bring a stroller or your children if you can avoid it. Booths and booths of imported nonsense and mostly junk. I wouldn't trust any cosmetics as they are probably counterfeit. There are some permanent stores off the alley way and I hear that you can score some pretty good deals there. I did not. I do regret not stopping at one of the hispanic food trucks nearby - oh the wonderful smells!!!,https://www.tripadvisor.com/Profile/BethChicago
30,THERE'S WOMEN'S APPAREL & ACCESSORIES GALORE!,"This place is loaded with Women and children's clothing and accessories, toys, men's shoes, women's stripper-type stilettos & fake jewelry, etc. The prices are usually non-negotiable (""I gotta make a living, too"").This place is huge and hot in the summer heat of Los Angeles near Olympic and Pico Blvd. It's very popular with the Latino communities and their young ones. Bring an umbrella for shade and maybe a folding chair, too, to rest your tired, swollen feet!There is no place to sit and rest in The Alley, except a restaurant/bar where you must purchase something to eat and/or drink. You can listen to music and use the toilet there also.My favorites are very cold beer, fresh-cut cold fruit in a cup, and street food.The Santee Alley vendors close at 6:00pm, but sometimes the clubs feature live music in the evenings.",https://www.tripadvisor.com/Profile/ldianap2014
40,Lots of bargains and a fun day,"You will get a lot of bargains from new 3 piece suits to clothes and electronics toys ,purses for the ladies and go hungry there is so many food trucks and they are so tasty lots of tacos and hotdogs . You will have a great time and a good way to spend 2-3 hours",https://www.tripadvisor.com/Profile/989renem
40,Outdoor Flea Market with Bargains,"My daughter and I went to Santee Alley to do a little shopping. The place was huge with vendor after vendor! There were tons of clothing places, but not really any named brand items. There were a lot of stalls selling high end make-up such as Mac for dirt cheap. I'm sure they were knock offs, but it was still fun buying the stuff at such a bargain.",https://www.tripadvisor.com/Profile/dylan98
40,Well that was fun!,"We had heard about the fashion district and just wanted to check it out. We accidentally got started in the fabric district (costume designers dream) and then went over to the Wholesale only section (whoops, don't go there) and finally made it to Santee Alley. It was a lot of stuff!!! Some is the same but some is not. We found some gear for the Dodger's game, beach wear and crazily enough, a prom gown for next year. If you like browsing to look for your own ""treasures"" and have a few hours to kill, this is a great place to go.",https://www.tripadvisor.com/Profile/awallacenevada
50,Love this place! !,This place is awesome! It is a few blocks of vendors and stores through the alley way and sides of the street.. they have all types of different things for sale $1 jewelery bundles of socks and t shirts.. and lots of cool little things.. a Great way to spend a lazy Sunday just walking around! The atmosphere is crazy..people every where willing to bargain and there mexican tacos and hot dogs are delicious!! If you go make sure to wear comfy shoes and don't agree to the first price you see..some other vendor more down probably has a better deal!! Happy shopping!,https://www.tripadvisor.com/Profile/scillas2015
30,"Lots of the same stuff, disappointing.","Lots of imports, lots of the same things, cheap items, sort of like Harwin Street in Houston. It's called the Fashion District, however, I'd have rather been on Rodeo Drive! I would not go back here.",https://www.tripadvisor.com/Profile/rtmidland
50,Amazing shopping and deals:,"I love this place they have some of the greatest deals for the best price, search around befor you buy, because some of the venders have better deals than others. Some will allow you to nicker for and even lower price. Ask and if they say, ""No"". Dont be offerened, but what if they say, ""Yes"" then you will be glad you at least asked. They are merchants and they want to get rid of their product, because if they don't they will make no profit. Know you always a choices where one will say no some one will say yes.",https://www.tripadvisor.com/Profile/CharmellD
50,GO! if you love shopping,"What an amazing place! You can find all the latest trends in clothing and shoes! You can also bargain...Make sure you do, you can usually get a few bucks off. For the ladies and makeup lovers... they have all products, Mac, Smashbox, Naked Cosmetics etc...... and you can buy in bulk.Its alot of walking so make sure you wear comfortable shoes (Or just buy a pair like I did)......",https://www.tripadvisor.com/Profile/MzYYZ
40,worth it,after reading some of the reviews i was expecting great deals and a really sketchy vibe. I didn't really get too much of either. It's pretty safe. I brought my kids (ages 15-6) and felt totally comfortable. I did get ripped off on the parking. I found some ok deals but only on some tshirts and sunglasses. i'm not a brand snob so i wasn't interested in paying $25 for a $95 shirt. But it was fun. it reminded me of shopping in a mexican market with all the chaos and pushy vendors - which to me was fun.,https://www.tripadvisor.com/Profile/280joeb
40,"Lively and interesting - great prices, not-so-great service","The alley's atmosphere itself was very fun and full of energy, bustling, and very busy. There were a lot of fantastic deals too good to pass up, however you'll see a lot of the same exact things at many of the stalls for varying prices (I bought false lashes for 3 for $5 only to find the same ones later at a different stall for $1 each). Make sure to look around before buying - don't feel pressured to buy something when many of the other places offer the same thing for less. Also, many of the people working did not seem interested in giving a good customer service experience so much as making the sale in general. Some were very helpful and knowledgeable and polite, others were on their cellphones and were rude. Hit-and-miss really. Overall as an experience I would recommend going and picking up some things for cheap anyway, it's an interesting atmosphere and fun way to pass some time if you enjoy thrifty shopping.",https://www.tripadvisor.com/Profile/mindyhhh
50,We had a blast,Went prom dress shopping. Got both dress and shoes at a very reasonable price (don't forget to bargain). Looks great! Fun day. We'll be back next time we are in LA.,https://www.tripadvisor.com/Profile/Whozyamama
50,Even if you are not a shopper come anyway,"This place has just about everything you need from household blankets, .rugs, apparel and fashion at very low or bargain prices. But even if you have no plans to shop and I highly doubt you'll not end up buying at least something, come visit and observe the true grassroots of how American dream begins. Every merchant is out to chase that dream. After visiting this place you will have some sense of how these merchants are all from different heritage all blending into one as Americans. Each American with a native tongue and . have English as a second language. It's pretty cool.",https://www.tripadvisor.com/Profile/Indiana_Jonesse
20,Nothing like Canal Street,"We are regulars on Canal Street in NY because we love to buy knock off handbags and sunglasses for our kids, so Santee Alley was a big disappointment. We didn't see a single store that sold knock offs, and the store owners seem scared to even talk about it. Finally a street hawker walked by and asked if we wanted Chanel or Louis Vuitton, but we had to go up in a dark parking garage to see just a few choices. Felt more like buying drugs than shopping. All in all, the place is just a huge flea market. Not what we had hoped for.",https://www.tripadvisor.com/Profile/hall160
50,bargin shopping over load!! must see!!,"Being from the east coast I'm not impressed by much.. We have some grat shopping until I came to shantee alley! Upon arrive in the fashion district we emcourted all the wholesalw spots, which are great if u are a seller! We got bumped grabbed a few tacos from a truck and figured we were n yeh wrong part! As we approached we encoutred many street vendorsmwith all your favorite cosmetics names unknk in love I got 3 lip gloss for 10 bucks!! We were on a role from then on no lie i spent 230 USD and got clothes good quality! Shoes !! Socks and all!! We did not even see it all! Will be going again just to shop! Deals galore!",https://www.tripadvisor.com/Profile/992nicolec
50,Love this place!,"Santee Alley is an ""experience."" There are all kinds of shops selling from soup to nuts. My husband and I were looking for luggage...at one shop we asked the price and it was $40...I asked if we get a break if we buy two ....$35.00......we picked out two and then I said, ""So was that $30 each?"" and he said ""Yes!"" So you have to barter in some shops....or stalls.....since there are ver few shops.Parking is the pits...and even though there are men waving flags to get you into their parking place with signs that say $3.00....it's $3.00 for the FIRST TEN MINUTES! The parking meters sell the spaces for $4.00 an hour and take credit cards. We drove around and around wasting time trying to find a decent space and finally decided on using one of the $4.00 an hour meters which was a block away from Santee Alley......Santee Alley is in the heart of the fashion district and there are many other stores and shops around with various goods.",https://www.tripadvisor.com/Profile/556shirleyr
40,Mad house shopping area,"This was my first visit to Santee Alley to do some photography there. It's a mad-house, wall-to-wall people (we were there on a Saturday) with lots of little shops and food vendors. A fun area to walk around and check out all the people and shops selling all kinds of (cheap?) merchandise. Lots of characters there, too.",https://www.tripadvisor.com/Profile/TravelsWithStephen
50,Great for Prom dress,Looking for our first Prom dress we thought we would give Santee Alley a try. Well actually Santee Street. There must have been over 50 dress stores all together. It was a fun Mother/daughter day out. Parking was easy in paid valet parking areas. Not nearly as scary as I had heard.,https://www.tripadvisor.com/Profile/Aussiegirl002
30,"Great people watching, not so great shopping","although I enjoyed the trip to Santee, probably won't be back. Lots of very inexpensive clothes but mostly very casual. The teens enjoyed the knock off fashions and costume jewelry and trendy inexpensive handbags but there wasn't much that interested me.People are super friendly, there was limited street parking and quite a few paid lots so parking wasn't too difficult but was probably hard the later in the day it got. The Tacos trucks were delish and there were interesting food choices. The people really run the gamut although being LA there the predominant group is Hispanic. Lots of families and young people out for shopping and fun. I enjoyed myself but due to the lack of items that interested me, wouldn't return unless I was bringing a friend or shopping for teens.",https://www.tripadvisor.com/Profile/mykidssherpa
30,Crowded,"We went on a Sunday afternoonVery crowdedStuff for sale repetitive and lowish quality.As my son said, sort of like the Hong Kong markets but not nearly as interesting.Best part a few streets up - maple st - if you love fabrics- I have never seen so many fabric stores with such an amazing range in one place.",https://www.tripadvisor.com/Profile/linbinpin
30,fun little cluster f,"This is basically a swap meet but not as great. There are clothing shops, make up stands, toy stands and electronic places that are literally all identical. It was really hard to find anything of really any style or necessity. I think DTLA is trying to make this place like super suave and selling it but it really is just a crowded moderately inexpensive street market. If you want anything mexican or cool but a little overpriced I would just head over to Olvera Street, or anywhere else. It's not terrible though to kill like 1-2 hours of some light shopping. The food trucks and fruit stands were probably the best part. :)",https://www.tripadvisor.com/Profile/kath1031
40,Feels Like Mexico,"Santee Alley is 3-4 blocks of clothing, electronics, food, toys, and fabulous people watching. you can walk its length in an hour or so, get a taco or six at one end and see all kinds of things for sale. Not an everyday experience, at least for me, but intriguing and fun. Culturally diverse folks on the street. Interesting photo opportunities, but be respectful...not everyone likes having their picture taken by strangers.",https://www.tripadvisor.com/Profile/CaFrancophile
50,A pleasant experience!,"For years I've been afraid to take the short 30 minute trip to scary downtown L.A. But what a surprise and delight!! My friend and I went 3 times in one week, shopping for 2 weddings and a luau. We not only found everything we needed from dresses to fabric for blankets and the bacon wrapped hot dogs... Oh my!!!We were treated with great kindness everywhere we went, especially Kimya at Mina's clothing store at 916 Santee St. She was a doll!! She even offered us cookies and went out of her way to talk and laugh with us, we were surely visit her again and again! We had great service from the owner at D&R Party Collection at 950 Santee St.If going on a weekend, go early, when they open is best, because it crowds up!! On the weekday was great but the freeway traffic was bad. Parking can be expensive, 3-10 dollars. But definitely try the hot dogs with the works!",https://www.tripadvisor.com/Profile/KJC155
40,Good deals,"Went here some years ago. It's not very neat, just a typical market with stalls everywhere. Good deals on shoes clothes jewelry and phone acessories. (As someone mentioned alot is like what you get at forever 21 and Charlotte Russe etc).Worth the trip of you want to bargain hunt and eat cheap.",https://www.tripadvisor.com/Profile/Aisha147247
30,It's different--for sure!,"We went there on a Sunday to do some light shopping and basically to see what is Santee Alley.Parking hawkers are on the street waving you in to park--you will not have to fret about where to park as they are quite visible on most of the streets.You probably cannot try on the clothes as very few booths have a dressing room so come dressed with a camisole under your top if you want to try on a shirt or dress.After a spell, you will see the same items so do not hesitate to do a bit of bargaining. Some of the clothing my daughter purchased looked like stuff you can find at Forever 21.We left after two hours as the crowds got thick, it was hot and the novelty was gone.Look, this is not for everyone but if you are not fearful of new experiences visit the garment district just for a slice of life that is not available in your town.",https://www.tripadvisor.com/Profile/lkmama
30,Enormous Flea Market,"We spent two full hours browsing the street from end to end. This reminded me of an enormous open air bazaar that you'd find in Mexico or the Dominican Republic. We weren't really in the market to buy anything, but it was fascinating to look.Almost everything is ridiculously inexpensive. I looked at about a dozen shoe stores, but every shoe was labeled ""Made in China"" so I didn't make a purchase. A friend bought two souvenir T-shirts for $3 each, which look nice. I wonder if they'll last through one wash cycle.A couple of shops sold men's 3-piece suits for $49 !The women's and little girls' clothing looked so interesting ... lots of colorful items caught my attention, and again it was all very inexpensive. I didn't find any shop that looked like it would have a dressing room I'd be comfortable changing clothes in though, so I didn't try anything on.Hip hop and Latin music booms from some of the shops, sometimes so loud that it repels customers who aren't deaf. Other shop owners try to persuade customers to come inside, which was a turn-off.The wonderful smell of hot dogs grilling permeates the air in a couple of places and it's almost impossible not to succumb to temptation. You can also pick up an ice cream bar or frozen fruit bar.This is worth the walk just to absorb the sights and sounds and smells of the Santee Alley.",https://www.tripadvisor.com/Profile/FancyFree55
10,No thanks,"If you enjoy feeling like you're being stalked by pick-pocketers or not knowing what the actual sales price is for watches, sunglasses, yoga pants, hot dogs wrapped in bacon, suits, prom dresses or fake silk suits ... this is your place!",https://www.tripadvisor.com/Profile/OhiOkie
30,open air bazaars,If you are looking for cheap clothing this is the place to come on the weekends. Getting here is easy via public transportation. The clothing runs the gamut from casual wear to business clothing. Feel free to bargain here. Make sure to have some cash on hand because some of the vendors are not able to take credit cards.,https://www.tripadvisor.com/Profile/Hoben01
50,BARGAIN HUNTERS DELIGHT.,"Before you shop anywhere else,come here first and bargain your [--] off.Quality is better than Thailand clothes and food stalls are every where. Best hot dogs in the U.S.A. We found a lot of great deals on Nike shoes,baseball jerseys and new era caps that were $20.Be aware that restrooms are charged at 25 cents above a roof car park.(don't ask me why)When you are done shopping and have to catch a cab,may work out better to walk to a main road away from the crowds and then ring a cab as it will be too difficult for the driver to find you.Spent $1000 for 4 kids and 4 adults and that was good quality clothes that we searched really hard for.Try to schedule a minimum of 2 days for shopping here.The 1st day to get use to it and the next days too shop hard. Good luck.",https://www.tripadvisor.com/Profile/Ryzi_13
40,This is a great spot.I can't believe there is no review,"Search LA Fashion District. This is one of the areas to get just about everything at cheap knock off prices. The Santee Alley is like a cheap person's bazaar. Surrounding streets are fun too. Costume jewelry, sun glasses, men and women clothing. The quality is average or below but the atmosphere is truly different. It is very safe area. Shops close at 6:00pm . Easy and cheap parking - $3 to $5",https://www.tripadvisor.com/Profile/Tommy745
30,Depends,"If you like bargains on cheap clothes, junk and bling then this is for you. It is very crowded and dirty.",https://www.tripadvisor.com/Profile/jegnm
30,Reminded me of shopping in Asia.,"We had some fun shopping in Santee Alley in the Fashion District in Los Angeles. It reminded us a lot of shopping in Asia, where it is cheap cheap cheap, but the quality isn't great. There was also a lot of fake name brand stuff, and it was repetitive. Don't get me wrong, it was fun to wander and ogle at all the stalls, and I got a cool t for $2. Good for souvenir tshirts and hats.",https://www.tripadvisor.com/Profile/fezzie1
40,Shop 'Til You Drop,"Love, love, love this place! We stop by every time we're in L.A. You can't beat the deals here. Try wandering off the alley, too. Some of the shops on the perimeter have even better deals. One downfall is that the restrooms are few and far between.",https://www.tripadvisor.com/Profile/KniteRiter
50,Bargain! And the dirty dogs are a must!,"Its worth it, if you buy wholesale(quantity). If you buy 1 pair of jeans you'll pay 10. When if you buy 5 pairs you'll pay 5 dollars each! Hope this helps.",https://www.tripadvisor.com/Profile/Cindyperales
50,Its a hoot!,"In the alley you are not sure what country you are in, its a cross between Mexico and China. You can find all sorts of bargains and lots of stuff that you don't want but fun to look at.",https://www.tripadvisor.com/Profile/marynaturelover
20,you're better off shopping at the mall.,"we went here because all the fuzz about all the great deals. parking is about $5. a lot of the places are for wholesale only. although there are shops where u can buy clothes, shoes etc. I was hoping to find good deals on clothes but I was dissapointed when I found a dress I had bought At the mall for more than I had paid.I also saw a dress I had seen at the mall for $5 more. basically tops are $15-20, dresses are around $30. shoes $30+ basically the same thing as going to forever 21 & Charlotte Russe etc. plus you'll avoid the overcrowdedness of this place & you'll be able to try the clothes on since this place is like a flea market with just a bunch of stands. I don't think I would come here again. Fyi the clothes for men/guys are so out of fashion.",https://www.tripadvisor.com/Profile/gabyrocha0
