50,They have a huge 6k movie screen,"This place, first of all, is free. Great photo exhibits as well as films regarding their exhibit. Parking on Sundays is $1. You pretty much have to park there as it’s close to the big mall in Century City but it’s a big walk. They showcase artists, musicians, athletes, etc. huge photos on all the walls. Must see",https://www.tripadvisor.com/Profile/Go580299
40,Fabulous space,Great exhibits. Well curated interesting shows. They have an excellent gift shop. It is a nice place to stop after Century City mall,https://www.tripadvisor.com/Profile/shazjhb2016
50,"Thoughtful, skillful presentation of coherently-curated special exhibits","I have visited the Annenberg Space for Photography many times over the years, often bringing friends and family with me. It has never failed to surprise first-time guests, first with its modest size (I guess the name makes it sound like a full-fledged LA-scale museum) and then with the remarkable quality of its exhibits. There will be only one at a time, mind you: they change the entire place to best serve each exhibit in turn, and each exhibit might only run for a few months. If you see something that interests you at the Annenberg, plan your visit immediately or you might miss it.And whatever it is, if the description intrigued you, don't miss it. I have been moved to tears of grief, transcendent awe, open laughter, a deeper appreciation for life in all its glorious complexity and nuance. Each exhibit is different from the previous ones. All of them, the ones I've gone to, have been amazing.One challenge: getting there and finding parking. Give up. Just park in the parking garage underneath the big building that looms over the modest Annenberg Space for Photography. I don't remember what they charge, but just pay it. There is no cheaper parking within a reasonable walk anywhere in Century City. Still, the weird parking is 100% worth it. (and the garage itself is perfectly fine, btw, don't worry)",https://www.tripadvisor.com/Profile/AngelenoNic
50,Favorite photography gallery in L.A,"Since the first time I came I always keep a close look on what's going on in the gallery.. always incredible exhibitions, everything is very well-explained. Love this place!",https://www.tripadvisor.com/Profile/Stavi2014
50,The Most Hidden Gem in Los Angeles,"If you visit this iconic facility on the weekend parking is free. Hard to imagine but it is TRUE. The photograph exhibits change throughout the year and admission is free. A bonus beyond belief. The exhibits are interactive, a video recaps the subject matter and the photographs are beautifully displayed plus the narrative is enlightening and powerful. Don’t go solo because you will want to share your experience with someone. And across the street at the Plaza are dozen of restaurants and eateries.",https://www.tripadvisor.com/Profile/cafegirlreva12
50,Photos that take you places!!,"We watched the ""walls"" photography exhibit.This is an amazing platform which brings the perspectives of multiple talented photographers into a single place.They had a short video presentation with insights of the photographers as well.Please do visit. Entry is free and parking is validated. Plan to spend couple of hours.",https://www.tripadvisor.com/Profile/252adityan
50,continues to be a grand experience,"current exhibit is ""walls"" this place always challenges the visitor. it is not just a place to see pretty photos or obscure art. it generally includes exhibits that focus on photography and society. the space is excellent. staff helpful. there is a central gallery where they show videos about the exhibit, and they are always provocative in some way, asking the viewer to engage with the art and artists, as well as the subjects.parking is entered from Constellation Blvd off Ave of the Stars. museum validates. it can be confusing for the first-time visitor, because the museum is basically in a huge office complex area, but staff will guide you. on the plaza level, where the museum is entered, there are restaurants open on weekdays.for architecture fans: as you approach the museum, consider the Century Plaza Hotel and the twin Century Park Towers, all by Minoru Yamasaki, who is most famous for designing the World Trade Center towers. The twin towers are an engineering marvel, if you look at them closely.also, if you are into shopping, the century plaza mall is nearby, with many high-end stores and some good restaurants.",https://www.tripadvisor.com/Profile/812jeffreyk
50,"If you like great photography, you'll like this place!","Free entry to great photo shows with varying themes. Staff is welcoming. Introductory videos to help you have better experience. Parking available. Shows are so good, I sometimes go twice.",https://www.tripadvisor.com/Profile/Travelmabelle
50,Gives you a new perspective of what walls are for ...,"This is my second visit to the Annenberg Space for Photography. The title of the current exhibition (open until December 29,) is ""Walls: defend, divide, and the divine."" I saw some ads showing pictures of the Berlin Wall and I wanted to see them; they brought back some memories from my younger years behind the Iron Curtain.It turns out that the curators had a much more ambitious plan for us. We got a taste of all kind of walls from the Great Wall of China to some grave South American prisons, including the existing and future walls that separate us from Mexico or walls of the Middle East, separating Israelis from Palestinians.Note that in the video center you can watch a (high-resolution) show that goes through all of the exhibitions' pictures with a short narrative. If you prefer a more individual, personal experience, just walk around and examine the pictures at your preferred pace. The experience is both educational and meditative. I can highly recommend it.",https://www.tripadvisor.com/Profile/Cosmopolitan736554
50,Small but fabulous space with GREAT exhibits!,I've been to two exhibits here in the last year and have loved them both!! The exhibits are incredible well prepared and presented and when you consider that admission is free and that they validate parking to $4.50 it's a no-brainer to go.,https://www.tripadvisor.com/Profile/Dijou
50,The Best Photography Museum,"The exhibits are always changing, but each of them ( and I visit there frequently) are excellent. If you are interested in photography it is a Must! You need to park your car at the address location ( which is a large office building), go through the building to the museum which is located in the courtyard. Don’t forget to ask for the parking validation at the museum.",https://www.tripadvisor.com/Profile/Tirzahaviv
50,Annenberg Space for Photography,What a wonderful treat! The exhibit was really inspiring and dramatic. No expense was spared in the presentation of these photographs,https://www.tripadvisor.com/Profile/sairam2113raj
50,History of Hip Hop,"A very pleasant experience of seeing an impressive exhibit on the history of hip hop completely for free. The only minor difficulty was figuring out where the parking to the exhibit actually was, but this was quickly resolved. Overall a nice concept and nice place.",https://www.tripadvisor.com/Profile/vdshkolnikov
50,Visual History of Hip Hop,We went to the Annenberg to see the visual history of hip-hop exhibit. It was phenomenal. My son enjoyed seeing the visuals and listening to some of the hip-hop music from the headphones. Well done historical narrative and photographs of hip-hop.,https://www.tripadvisor.com/Profile/kgo669
50,Worth the visit,"Visited on a Sunday morning for the Hip Hop exhibit, and thoroughly enjoyed it. There was ample parking in the garage (which was validated at the front desk), no admission fee, and while it was crowded, we were able to take our time to see all of the photos and memorabilia, as well as the short film in the center of the space. We were here for about 90 minutes total and were able to walk across to the mall for lunch.",https://www.tripadvisor.com/Profile/amart71
50,Love the Annenberg,"I've seen two exhibits: Who Shot Rock n Roll, and an animal exhibit. Both were amazing. The films were also fun. Free admission and cheap parking, also 2 blocks from the Century City Mall. A great afternoon. My only complaint would be that the space itself is a bit small - I found myself wanting more material in the exhibits, but what they provide is awesome.",https://www.tripadvisor.com/Profile/leecI8243FE
50,Well worth the visit,This was a great experience. There is no entrance fee and parking on the weekend with validation is only $1.50. We saw the exhibit about the photos taken through the evolution of Hip-Hop. There was a great 20-minute documentary included as well. You could also have a free audio tour for the exhibit. I would definitely allow at least an hour for this museum. It was well worth the trip.,https://www.tripadvisor.com/Profile/BDarst
40,Free admission and validated parking,Nice little museum at the Century City towers. A place to visit if you are in the area. Just across the street from the Century City Mall.Changing exhibits. Saw “The Visual History of Hip Hop. Many portraits of Hip Hop artists. There is a short documentary that included discussion from many of the photographers who’s artwork was displayed.Loved the contact/proof sheets where you can see the evolution of the perfect shot.,https://www.tripadvisor.com/Profile/clairef246
50,Impressive exhibitions here! Worth a visit!,SO glad I finally visited about two years ago and have been wanting to go back ever since. I saw their Sink or Swim: Designing for Sea Change exhibition on climate disaster and design solutions for the various problems associated with flooding etc. Absolutely blown away with the quality of the exhibition.,https://www.tripadvisor.com/Profile/K1737YZjohnh
40,Changing Exhibits,"This is a free exhibit with great photography. I wouldn't make a special visit, but if you are in the area--especially if you work near here.",https://www.tripadvisor.com/Profile/cookpias
50,Small Space Big Ideas,"The AS4P is a rather small space filled with great photo exhibits. The photos, beautifully shot, reflect the ideas, culture and lifestyle of the birth of hip hop. Your visit likely lasts only an hour at best but the outdoor spaces are beautifully landscaped and you are a short block away from the Westfield Century City mall. On weekends your validated parking is only $1.50 so it makes it easy to catch a nice meal at the mall on your visit.",https://www.tripadvisor.com/Profile/BoboTravlr
50,A great space for photography,If you love viewing photographic art or the work of other photographers this is the place for you. During my visit they were displaying work from a number of photographer that told the story of Hip Hop through photography. It was excellent!! A brilliant place if you love the medium or not.,https://www.tripadvisor.com/Profile/an-old-pup
40,Good but small photography museum- but it's free! Located across street from Westfield,"Really nice space for photography exhibits. Not too large, but big enough to host a substantial exhibit. From what I could tell there is just the current exhibit and no permanent collection, so check the website to see what's showing to see if you'd be interested. Currently it is a photography of hip hop which was really interesting and they do a good job of making it immersive and themed. Really cool huge photo on the outside with luminaries of hip hop and then inside they give you a laminated page to detect who's who from the hundreds of faces in the crowd. Frankly it has become an immersive hip hop museum. The Saturday I was there there was a young and diverse crowd- I'm sure this show is bringing in some people who otherwise wouldn't have been introduced to the Annenberg.Free entry, which is very rare and welcome. I believe parking might be free on the weekends. Or if you are at Westfield Century City it's literally across the street.",https://www.tripadvisor.com/Profile/SanFranciscoTravlr
50,Great Place for Photography in LA,This is a great spot for photography. The Annenberg Foundation has invested in its future and the future of photographic preservation. Check out the calendar to see what show is on. Well worth the trip.,https://www.tripadvisor.com/Profile/Alexander_Designs
10,Disappointment,Many of our friends urged us to go to the Annenberg photography museum. We checked the website to confirm opening times and days of the week. We arrived at the parking garage and were told that it had been closed for several weeks to install a new show.They need to publicize the fact they are CLOSED and when they will reopen. This isn’t the easiest place to get and is pricy.,https://www.tripadvisor.com/Profile/123texastraveler2016
50,Annenberg Space - Photographic Excellence,We try to attend each of the special exhibitions at the Annenberg Space - because they are very current & display Photographic Excellence. The recent Cuba exhibition was outstanding & the current Joel Sartore exhibition documenting Animals is breathtaking. The Annenberg Space provides a no cost entry - Super accolades!,https://www.tripadvisor.com/Profile/dblmed
40,"Small, but very cool!","Though not on the ""must do"" lists, we stopped here on the way to a campus visit at UCLA. The Photo Ark exhibit is very well done, and we especially enjoyed the movie, as it gave a behind the scenes look at how the project was produced.",https://www.tripadvisor.com/Profile/weberas13
50,What a great spot!,Went to see Joel Satore's Photo Ark. The fact their exhibits are free is icing on the cake!! Beautiful space and great exhibits.,https://www.tripadvisor.com/Profile/dianebQ5995ZE
50,Art AND Cinema photo op!,Small exhibition space but very interesting exhibits. We were here for the Photo Ark exhibit. Gorgeous photos. It is small inside though so if possible come during the week and not on the last day of an exhibition (we learned). There is a large part inside dedicated to screening video so we saw the documentary about the exhibit (also VG). And did you know? This art space is in the shadow of the Fox Plaza building (aka Nakatomi Plaza from Die Hard). Whoah.,https://www.tripadvisor.com/Profile/LAWoman_2011
50,Amazing!,"I took my daughters (12 and 14) to see the National Geographic Photo Ark exhibit and we had such a wonderful time! The space is well laid out, easy to navigate and in a beautiful space. One of my daughters is hard of hearing and they had hearing assistance devices which helped her access the documentary they were showing. We will definitely be going back here to see more exhibits in the future.....FYI - parking is in the building and they validate so it was very inexpensive. And the museum is FREE!",https://www.tripadvisor.com/Profile/mercedesv714
50,what a a treat...National Geographic Photo Ark,what a great experience and free to enter. A perfect family experience. I plan on going back this week to entertain the kiddos.,https://www.tripadvisor.com/Profile/SherryG487
30,Unique exhibitions,Unique exhibitions. The intro films (usually 20 mins) are a must. Small and manageable museum. Parking is easy.,https://www.tripadvisor.com/Profile/conniemccreight
50,worth it. #Free,saw an amazing National Geographic exhibit here. Small venue which really gives you a taste for an artist. Urges you to research more and dive into what they were showing. Being free and having a fast moving line even on busy days I would say very much worth the visit.,https://www.tripadvisor.com/Profile/Geebee06
50,Beautiful space with quality exhibits,"This is one place to put on your list of things to do while in LA. Free admission gets you access to an attractive gallery that includes world-class photos and a small theater. When we visited in December 2018 we saw Joel Sartore's Photo Ark. The exhibit included a fascinating short documentary of Sartore's work as well as, of course, photos of animals from around the world.There was a photo booth that allowed patrons to take photos with their favorite animal superimposed. Fun for adults and children, and because of it's size, you can get through it with small children before they lose their patience. Highly recommend!",https://www.tripadvisor.com/Profile/LHD1967
50,Photo ark,Great documentary on Joe Satore. Fabulous photos but not enough! Very photographic site. Parking discounted and entrance free,https://www.tripadvisor.com/Profile/lindatA8671PO
50,Fascinating and Unique Place,"Unfortunately, the exhibition we saw is ending soon in January 2019 and I don't know what comes after it. However, I think a lot of effort went into the curation of this one, so I expect the same, exceptional quality. Finally, the visit is free; if you are in the neighborhood it is a place definitely to visit.",https://www.tripadvisor.com/Profile/Cosmopolitan736554
50,World Class exhibits!,"Free entrance to a beautiful photo exhibition that is constantly changing. Parking in the garage for a very nominal fee. Clean, safe, modern campus where you can take lots of pictures of the soaring skyline. The photo exhibit is always fun and moving. Good for kids, if they are patient and calm.",https://www.tripadvisor.com/Profile/A1742TFscotts
50,Absolutely wonderful every time!,Annenberg is a free venue with free parking...they have the most unusual interesting thought provoking and timely exhibitions...this is a phoptographymuseum and there is always a 20-30 minute film which accompanies and explains the why and hows...my husband and I have been going for years now and have yet to ever be disappointed...inthe back room depending onthe exhibition sometimes it is turned into a Cuban bar or photo booths...and they usually have a virtual reality headset you can try on and experience...another dimension to this great space...,https://www.tripadvisor.com/Profile/84trudig
50,Your life is a Collection Of Art from Nature to People and places.,Every year we see many Brilliant Shows offered by the Annenburg.Exceptional Photography by various Artists always bring us a new perspective on life. Great way to spend a day in LA amoung some of the great architecture that surrounds the Space.,https://www.tripadvisor.com/Profile/SolarTonyV64
50,Special Exhibit only,There is no standing collection. The Photo Ark currently on display is fantastic and a must see. It is a project that everyone should learn about.,https://www.tripadvisor.com/Profile/RetiredNLuvinIt_11
50,We really enjoyed this place,"There are rotating exhibits throughout the year with the current exhibit being The National Geographic Photo Ark, let by photographer Joel Sartore. Joe is trying to capture every living species of animal on camera. There was a 15-minute movie on Joel about his quest with footage showing how he captures his subjects. In addition were many photographs on display of his subjects.This venue is located at 2000 Avenue of the Stars in Los Angeles CA. We drove to the location and parked in the garage right on the property. Admission is free and they will validate your parking for a charge of only $1.50 for the entire day. This place was amazing, well put together and very affordable.",https://www.tripadvisor.com/Profile/SFtravelbugs
50,Always a fascinating exhibit...,"While I would happily pay admission to this world-class center for photographic art, it is one of the great FREEBIES of Los Angeles. Extraordinary exhibits ignite the imagination & stimulate the mind. Truly one of the city's gems...",https://www.tripadvisor.com/Profile/have_time_wil_travel
50,Always an Amazing Experience,"I LOVE the Annenberg. I've been several times (Digital Darkroom, No Strangers, Life, and more)... It never disappoints. The photographs are stunning, but my favorite part is always the video accompanying the exhibit. I'm so excited for the Joel Sartore exhibit coming up and am looking forward to the lecture series, which I haven't yet been to! Highly recommend this museum.",https://www.tripadvisor.com/Profile/globetrotting-elissa
50,Always a good show,"The Annenberg is a smallish space, but they use it well. The shows are always interesting. Go on a weekend, the traffic will be much easier to deal with. Parking is validated, but the guard will require you to open the trunk of your car. There is a cafe, some restaurants there, and the Intercontinental Hotel is across the street ($$$$$$). Admission is free.",https://www.tripadvisor.com/Profile/jeanjeni2003
50,"Not an Ostrich, the latest exhibit - is a must see!","I love all their exhibits and my favorite was No Strangers. But the current one , Not an Ostrich, features photos from The Library of Congress and it is like history lesson for America. The video go me choked up with both pride and shame.",https://www.tripadvisor.com/Profile/suzi355
50,Photo Exhibit From The Library of Congress....AWESOME,"Many of the photos at the exhibit are rarely seen. Be sure to take the time to watch the 20 minute video. You also have the opportunity to do a ""story corps"" recording for the Smithsonian. Recommended.",https://www.tripadvisor.com/Profile/logjamb
40,Not an Ostrich Exhibit,Really enjoyed all the photos from the library of congress. Venue is small and was very crowded. That was the downside. But it was free and parking was only $1.50. Can't complain about that! Definitely worth seeing.,https://www.tripadvisor.com/Profile/JoeyDog
50,Excellent Venue and Exhibits,A spacious and inspiring facility with open air and light for a full experience. My frequent stop for any exhibition or installation they may have.,https://www.tripadvisor.com/Profile/ElderberryKombucha
50,The Best Photography Exhibitions in the best space,"The Annenberg is hands down the best curated and most alluring space for photography exhibitions in California. They must have a HUGE budget. Each exhibition is accompanied by an incredible professionally produced documentary that runs continuously, and they will even validate parking, so along with the free admission, it's a lovely way to spend an afternoon. Shows I have loved included the National Geographic 100th Anniversary, Helmut Newton, Refugee....actually, I drive 2.5 hours, and have never left feeling unsatisfied.",https://www.tripadvisor.com/Profile/WesSDCA
40,Well worth visiting if you are in the area,Interesting excerpts from the Houses of Congress Library and a very informative film on key moments in the history of the US and how photography captured and influenced these (probably of more interest to non-Americans). Not sure I'd make a major excursion just to see this but we were staying in the area and were really pleased we visited. If you are trying to strike a deal with teenage children then the proximity of the very good Westfield Century City shopping centre could be a good bargaining chip.,https://www.tripadvisor.com/Profile/TomGSt_Albans
40,Compact Photo Gallery - free but beware high cost of parking,"This little gem of a gallery is tucked in between high rise office buildings in Century City. It will be a hike from any garage you can find. Be prepared to pay up to $35.00 to park. Maximize your stay by eating at a nearby restaurant that might offer validation -most of the reasonably priced spots are only open for lunch. Or park at Westfields Shopping Mall in Century City, shop and eat there, then walk over to spend 20 minutes or so in the photo gallery.",https://www.tripadvisor.com/Profile/highlandbride
50,Always interesting,"I love the Annenberg Space for Photography. As a photographer, there are always interesting and artful exhibitions that make me think and expand my ideas.",https://www.tripadvisor.com/Profile/C5159CDkathyr
50,Wonderful presentation of National Archives Photos,"This is a wonderful place. We were there for the exhibit of 500 photos from the National Archives and they are memorable. Lots of large blow ups and lots of classic photos shown in shuffling electronic frames.The only negative note is the anodyne film introducing all this in which American history is laughably displayed. Some of the greatest photography in the collection is about the abuse of labor, the great depression, and war -- but it gets an issue avoidant bland treatment.The museum is adjacent to a lovely park like space with lots of places to sit. If you come on a weekend, bring a picnic as the cafes are closed and it is a great place to eat before or after visiting the museum.",https://www.tripadvisor.com/Profile/Janettravels44
50,Fabulous,"Attended a National Geographic exhibit here with family and friends. The exhibit was so well orchestrated, we're still talking about it a few years later.",https://www.tripadvisor.com/Profile/DrDLA
50,great photography museum,love the way shows are curated at the Annenberg and the films they produce to accompany their shows are always stellar.,https://www.tripadvisor.com/Profile/aluweho
50,21st century photography exhibit,"Annenberg is FREE, they VALIDATE your parking. The exhibit always shine lights on interesting topic. They also have an surround view theater and an awesome kitchen (not that you can cook there but its really nice). The shows are well curated and it always leave you to think more after you went.",https://www.tripadvisor.com/Profile/mochamind
50,Worth a visit for sure - especially if you like photography,Be sure to check out the featured exhibit however I really enjoyed my walk around the gallery here and their gift shop is great too. Its nice to have a space just for photography in LA.,https://www.tripadvisor.com/Profile/MooshLA
10,Disappointing To Say The least,We went to the Annenberg to see the exhibit of photographs from the Library of Congress. (We found out about the exhibit from the AAA magazine.). We were very disappointed to find out the exhibit was nothing but a slide show and not the actual prints.,https://www.tripadvisor.com/Profile/SteveTignor
