40,Great state park.,,,https://www.tripadvisor.com/Profile/lilianasmith
50,A Nice Diversion,,,https://www.tripadvisor.com/Profile/Indiana_Jonesse
40,Really interesting,,,https://www.tripadvisor.com/Profile/eurydice2017
50,Recommended,,,https://www.tripadvisor.com/Profile/jennivii
50,"Nice historic ranch, easy hiking, scenic views",,,https://www.tripadvisor.com/Profile/cinchud
50,"Easy, beautiful hiking...",,,https://www.tripadvisor.com/Profile/Bitely
40,A great visit,,,https://www.tripadvisor.com/Profile/StevenM46
50,One of my favorite hikes,,,https://www.tripadvisor.com/Profile/Dreamer772006
40,Good Park and tour of the home,,,https://www.tripadvisor.com/Profile/SPD4Train
10,Terrible Guide for the House Tour,,,https://www.tripadvisor.com/Profile/longhorn74
50,Beautiful scenery,,,https://www.tripadvisor.com/Profile/brennaed
50,Fun day watching polo and touring Will Rogers’ Ranch House,,,https://www.tripadvisor.com/Profile/mbrothers50
50,Love this place,,,https://www.tripadvisor.com/Profile/gr8fish2017
50,Great Stopping off point on way to Malibu,,,https://www.tripadvisor.com/Profile/424bradleyv
40,relaxing,,,https://www.tripadvisor.com/Profile/barbarabuilder
50,Heaven for Will Rogers fan,,,https://www.tripadvisor.com/Profile/CobbCoGA
50,Great hiking!,,,https://www.tripadvisor.com/Profile/84trudig
50,great park with history,,,https://www.tripadvisor.com/Profile/GypsyMiki
50,Love this park,,,https://www.tripadvisor.com/Profile/sisal08
50,What a great park!,,,https://www.tripadvisor.com/Profile/pamelaao2018
50,Excellent Park!,,,https://www.tripadvisor.com/Profile/220kenq
50,No better place to picnic,,,https://www.tripadvisor.com/Profile/LeeTom547
50,One thing to LOVE about LA,,,https://www.tripadvisor.com/Profile/W9171FFmichellec
50,Really Neat park,,,https://www.tripadvisor.com/Profile/Dennancy
50,A Gem!,,,https://www.tripadvisor.com/Profile/jonathb5
50,"Easy hike to the top, and wonderful, historical tour of Will Roger's family house!",,,https://www.tripadvisor.com/Profile/EAKtraveler
50,Don’t miss it,,,https://www.tripadvisor.com/Profile/839tamsinw
50,"Lovely view of LA, the mountains and the beaches",,,https://www.tripadvisor.com/Profile/Kellyclan50
50,Must Visit if you like hiking and history,,,https://www.tripadvisor.com/Profile/652bobp
40,Very good!,,,https://www.tripadvisor.com/Profile/briandQ3255VQ
50,House tour was great!,,,https://www.tripadvisor.com/Profile/O89UPdavids
50,House tour,,,https://www.tripadvisor.com/Profile/daviddgs123
50,Wonderful Piece of History,,,https://www.tripadvisor.com/Profile/littlemissmaggie
50,A Park That Has Something For Everyone.,,,https://www.tripadvisor.com/Profile/elizabethlascheid
50,Peaceful Dog Walk with Great Views,,,https://www.tripadvisor.com/Profile/Howyclarke
50,Amazing views,,,https://www.tripadvisor.com/Profile/peggille
50,From George Vreeland Hill,,,https://www.tripadvisor.com/Profile/GeorgeVreelandHill
50,"Quiet, peaceful, very relaxing spot to get away",,,https://www.tripadvisor.com/Profile/jeanjeni2003
50,Energetic trail workout,,,https://www.tripadvisor.com/Profile/Mtrob326
50,Beautiful,,,https://www.tripadvisor.com/Profile/isahomberg
50,Nice change from the beach,,,https://www.tripadvisor.com/Profile/travgal0766
50,WOW,,,https://www.tripadvisor.com/Profile/234normal
50,A lovely hike just off Sunset Blvd.,,,https://www.tripadvisor.com/Profile/DeniseWakeman
40,Pretty outdoor area,,,https://www.tripadvisor.com/Profile/buffalojim67
50,Humorous History,,,https://www.tripadvisor.com/Profile/NancyF406
50,Great trails to walk your dog! Awesome historic site!,,,https://www.tripadvisor.com/Profile/Yehbut
50,Loved the tour of the Ranch House,,,https://www.tripadvisor.com/Profile/CharlieMickKeith
50,Home of Will Rogers,,,https://www.tripadvisor.com/Profile/bonniemasonj
50,Heaven Along Highway 101. Mountains and coastline,,,https://www.tripadvisor.com/Profile/TonyFi18
50,Amazing!,,,https://www.tripadvisor.com/Profile/60seattle
50,Thank you Mr. and Mrs. Rogers,,,https://www.tripadvisor.com/Profile/ProfessorCharles
40,Just go as the hike is not difficult,,,https://www.tripadvisor.com/Profile/G3743BSdaniela
40,"Really nice, not too hard hike up to Inspiration Point",,,https://www.tripadvisor.com/Profile/195susanr
50,Easy walk to great views with a bit history,,,https://www.tripadvisor.com/Profile/arr_1k
50,Great place to hike and clear the mind,,,https://www.tripadvisor.com/Profile/MagnumPI808
50,Heavenly Horseback Ride,,,https://www.tripadvisor.com/Profile/Summervacationeer
40,Hidden in Plain Sight,,,https://www.tripadvisor.com/Profile/DeanPok
40,Perfect family picnic and hike spot,,,https://www.tripadvisor.com/Profile/735carolynm
40,Nice little park,,,https://www.tripadvisor.com/Profile/AaronsTravels
50,By all means take the guided Ranch House tour,,,https://www.tripadvisor.com/Profile/DiscJockey
50,"Too bad it is closed Mon., Tue., and Wed.",,,https://www.tripadvisor.com/Profile/DCody
40,Will Rogers Family Ranch 1922-1944 to Today with the Last L.A. Polo Field,,,https://www.tripadvisor.com/Profile/B5026OSjohng
40,Lots of interesting things to do,,,https://www.tripadvisor.com/Profile/SHP2
40,Fun outing,,,https://www.tripadvisor.com/Profile/tomy857
50,great place to spend an afternoon.,,,https://www.tripadvisor.com/Profile/MimiY_13
50,Good hiking trails and views of LA and Malibu,,,https://www.tripadvisor.com/Profile/waltersN6914XQ
30,I couldn't find the Klingon Bird of Prey!!,,,https://www.tripadvisor.com/Profile/davec110
30,Attended a picnic,,,https://www.tripadvisor.com/Profile/ohliz
40,A Hidden Historic Gem,,,https://www.tripadvisor.com/Profile/460terryb
50,"Park, hike, horses, hour tour",,,https://www.tripadvisor.com/Profile/KatherineHPat
50,"Backbone, history, polo, trails and views---WRSHP has it all",,,https://www.tripadvisor.com/Profile/Summerasalifestyle
50,Historic Site with Hiking Trails and Awesome Views,,,https://www.tripadvisor.com/Profile/RikiUSA
40,A Nice Tribute to a Great American,,,https://www.tripadvisor.com/Profile/lsutigre
40,Inspiration Morning Hike,,,https://www.tripadvisor.com/Profile/jcast27
50,Could have spent a whole day,,,https://www.tripadvisor.com/Profile/PKBadger
50,A lovely walk & fascinating history,,,https://www.tripadvisor.com/Profile/fitbug2010
50,Hidden Special Park in Pac. Pal. ...,,,https://www.tripadvisor.com/Profile/dblmed
50,Lovely Hike above the City,,,https://www.tripadvisor.com/Profile/Ken0739
50,A Favorite for years,,,https://www.tripadvisor.com/Profile/britneylynne2015
50,Beautiful,,,https://www.tripadvisor.com/Profile/theladyknownascady
50,Historic Home,,,https://www.tripadvisor.com/Profile/charles6346
50,Picnic and Polo,,,https://www.tripadvisor.com/Profile/LivinTheDream90272
40,country in the city,,,https://www.tripadvisor.com/Profile/RobH105
50,Great hike with a Amazing View at the top! Tour of Will Rogers's home too!,,,https://www.tripadvisor.com/Profile/calgal405
50,Worth the drive,,,https://www.tripadvisor.com/Profile/justmyimpression
50,Beautiful Vista's,,,https://www.tripadvisor.com/Profile/JohnNV51
50,BEST Views in ALL of LA,,,https://www.tripadvisor.com/Profile/mercedesv714
50,On Route 66,,,https://www.tripadvisor.com/Profile/travelguru-su
20,Mostly an Outdoor Park,,,https://www.tripadvisor.com/Profile/VEC24
40,Humorist's gift to California and the world,,,https://www.tripadvisor.com/Profile/Cos39
50,"For moderate hikers, this is great",,,https://www.tripadvisor.com/Profile/arbella8
40,Step Back to a Cowboy Movie Great's Ranch,,,https://www.tripadvisor.com/Profile/ChristieC665
40,Nice place for a short hiking tour,,,https://www.tripadvisor.com/Profile/154stefanr
40,Will Rogers was a Fascinating Person,,,https://www.tripadvisor.com/Profile/K2075BPmichaelr
40,New Years Day family walk,,,https://www.tripadvisor.com/Profile/vmcconville
50,Champagne and horses...need I say more?,,,https://www.tripadvisor.com/Profile/HBWillsy
10,Event Closed the Access Road,,,https://www.tripadvisor.com/Profile/VEC24
40,love it,,,https://www.tripadvisor.com/Profile/mamahoglet
40,Nice park to visit,,,https://www.tripadvisor.com/Profile/thomassG3669AB
40,Nice place,,,https://www.tripadvisor.com/Profile/pinkmaro
50,Will Rogers,,,https://www.tripadvisor.com/Profile/CBWorldWalker
40,Great hike,,,https://www.tripadvisor.com/Profile/73christinal
50,Enjoy what LA's residents love to really do.,,,https://www.tripadvisor.com/Profile/Deniseka
50,Will Rogers Historical House,,,https://www.tripadvisor.com/Profile/parksfam
40,Great spot for locals and tourists!,,,https://www.tripadvisor.com/Profile/Ohiofamily
40,Cowboys Rule,,,https://www.tripadvisor.com/Profile/rsth
50,Great hiking close to Santa Monica,,,https://www.tripadvisor.com/Profile/lbsmith
50,Amazing!,,,https://www.tripadvisor.com/Profile/F1213ZIjohnm
40,"Beautiful views, easy to find.",,,https://www.tripadvisor.com/Profile/LindsayB35
50,Home and the Range,,,https://www.tripadvisor.com/Profile/3Dphotographer
40,"Good trails, great views",,,https://www.tripadvisor.com/Profile/CrisPopenoe
40,"Quaint site to visit quieter, gentler time",,,https://www.tripadvisor.com/Profile/Lascassaslass
40,Transport Yourself to the Early 30s,,,https://www.tripadvisor.com/Profile/FrequentTraveller034
50,"Wonderful place to picnic, hike, learn history",,,https://www.tripadvisor.com/Profile/dance4fun2
50,"Unique State Historic Park, 5 stars",,,https://www.tripadvisor.com/Profile/Redpatch7
50,The house tour alone is worth the trip!,,,https://www.tripadvisor.com/Profile/577MichaelK
40,"Beautiful hike, fun house tour.",,,https://www.tripadvisor.com/Profile/margob290
50,Beautiful,,,https://www.tripadvisor.com/Profile/jsT7320UP
40,Peaceful retreat in the heart of West Los Angeles,,,https://www.tripadvisor.com/Profile/LightPro
40,Nice park in LA,,,https://www.tripadvisor.com/Profile/Flawanderingwoman
40,"Expensive to park, be prepared",,,https://www.tripadvisor.com/Profile/fallcolors2
40,A Walk in the Park,,,https://www.tripadvisor.com/Profile/AnaCasanaSeattle
40,"Early ""Hollywood"" History and a Present Day Retreat",,,https://www.tripadvisor.com/Profile/thomasdosborneii
50,I didn't expect to like it but I loved it!,,,https://www.tripadvisor.com/Profile/larryw799
50,Tranquil setting wonderful history,,,https://www.tripadvisor.com/Profile/nurse024
40,Great view of the pacific,,,https://www.tripadvisor.com/Profile/robinharly
40,"A neat combination of Americana, hiking, views and natural parkland near LA",,,https://www.tripadvisor.com/Profile/65Rambler
50,Wow this is a great park,,,https://www.tripadvisor.com/Profile/tonysenior
40,Great quiet retreat and views close to town,,,https://www.tripadvisor.com/Profile/Vao_Fefe
40,a good place to go,,,https://www.tripadvisor.com/Profile/mflickermd
40,Beautiful park and Horse-riding stable -but watch out for rangers!,,,https://www.tripadvisor.com/Profile/socaltravelmom_fun
50,A perfect intown getaway.,,,https://www.tripadvisor.com/Profile/WJClinton
40,"Lovely Park, Fun Polo Matches",,,https://www.tripadvisor.com/Profile/Boston-LA
40,A pleasant place to hike.,,,https://www.tripadvisor.com/Profile/LordSakana
30,Interesting if you like Will Rogers,,,https://www.tripadvisor.com/Profile/osusieq
