50,Fabulous art and sculpture,,,https://www.tripadvisor.com/Profile/janeclough1
30,Local art for Sale,,,https://www.tripadvisor.com/Profile/richardsC7805SY
50,love this gallery,,,https://www.tripadvisor.com/Profile/835dayav
50,"Great, friendly environment to share and buy original artwork",,,https://www.tripadvisor.com/Profile/353courtneyr
50,Beautiful Affordable Art,,,https://www.tripadvisor.com/Profile/MelG520
50,Love the quality and affordable art at Artspace,,,https://www.tripadvisor.com/Profile/ClaraB554
50,"love Love LOVE this place - Awesome Art, GREAT price...",,,https://www.tripadvisor.com/Profile/mgaedeke
50,great affordable original art worth exploring,,,https://www.tripadvisor.com/Profile/cdla
