30,If you're in San Pedro with nothing to do...,"Well, I got a Groupon for this ship and I'm glad I did. After seeing the magnificent USS Iowa, the Lane Victory doesn't really compare. It's waaaay out at the end of the harbor all by its lonesome. The regular cost is only $5.00 and it's really worth to see for an hour or so at that price. We walked around and looked at all the things that are meant to be seen, but then it was done. Parking is free and there is plenty of it--but unfortunately, it's mostly because there aren't that many people there taking a tour. It's worth the drive during nice weather because you cross the St. Vincent Bridge and it's gorgeous, but I definitely wouldn't put this on a bucket list or anything. Many TV shows and movies are filmed on this ship and that was interesting to discover.",https://www.tripadvisor.com/Profile/hbgirl-forever
50,Great Day at Sea!,"If you have the opportunity to take this 1 day excursion you will really enjoy it. Plenty of free parking and short walk to the ship. Once onboard there are areas set up with lots of fresh pastries and coffee, juice & bottled water. There is plenty of seating throughout the ship so you can enjoy the smooth cruise out to sea. You have the opportunity to view different areas of the ship at your leisure as well as take a guided tour of the engine room. I highly recommend this tour as there is a lot of history behind the running of this ship. Around noon you arrive just outside of Catalina Island where they set up a great buffet of chicken, tri-tip, salads & fresh rolls. As you enjoy your meal you may have a chance of seeing dolphins as well as throughout the cruise. Bring binoculars, as there is so much to see. Many boats coming and going from the mainland to Catalina Island. Once lunch is finished and you head back home the ship makes an announcement that they have found a spy on board! About 1/2 hour later a mock aerial attack takes place. This is the highlight of the cruise watching the dogfight take place in the air. Plenty of photo opportunities. After that as you head back into the harbor the LA Firefighters greet the ship with a huge water display from one of their boats. Absolutely beautiful. There is a museum onboard where you learn so much history as well as a gift store. There are plenty of volunteers with a vast knowledge of the history of the ship. Bring a jacket as the early morning can be brisk as well as when heading home. And flat shoes as some of the stairwells are quite steep. There are dancers on board dressed in that era. You will not be disappointed with this full one day excursion.",https://www.tripadvisor.com/Profile/Lynette51
50,An overlooked gem of history,"Put this ship on your list. Great history, spectacular museum exhibits, great for families and a good place to sit and watch the ships go by. This is a must visit for anyone who loves ships.",https://www.tripadvisor.com/Profile/GenotheViking
50,Was really fun,when I went there it was really fun. But I had a hard time of finding the museum. I had a really fun time. It is affordable. And the staff Is nice,https://www.tripadvisor.com/Profile/scubasean1023
50,Take the cruise!,"This is a not to be missed attraction. A living piece of history, well cared for by a few who sailed on her or a ship like her during WWII. This is a wonderful day out. The trip takes you by Catalina near Avalon. It provides a very nice lunch. You have the run of the ship and a bridge tour is informative. As are the history museum below decks. The engine room is a living, breathing example of some interesting technology and mechanisation of the day. It is run with TLC and the old girl feels as she has a soul. We were entertained by a mock dogfight from the Condors of Van Nuys, flying AT-6 vintage airplanes. We even had gunners firing at the enemy aircraft. Don't worry, they don't use real ammo. There was a very important ceremony for fallen Merchant Marine Vets and a wreath laid on the ocean, honouring them. The Swing Cats band played 40s music and were wonderful. The ladies in the band did some wonderful vocals and harmonies. They have soldiers dressed up in uniform, myself included. Some were dancing swing steps. Chaplain Erik Cliine did a first class job and his dad rode along with us and he and I shared some fun stories of our lives. This is very important history everyone should see and understand. They sail 4 times in the warm weather months. If you can't make it out on a trip, see the ship at her berth and take your time. The cruise departs San Pedro at 0900 and returns about 1630 hours. It's a wonderful day at sea or a simple visit. You'll never forget it. We are thankful for the soldiers and seamen who protected us aboard the Lane Victory and are very fortunate to have her still very much alive and cared for. Every contribution and fare is valuable and goes toward preserving and operations.",https://www.tripadvisor.com/Profile/johntrak
50,Museum at sea,"We went on one of the summer cruises on this floating museum. The cruise was delightful. There was a continental breakfast for starters, music with dancers in period costumes, an aerial dog fight and tours of the hot and steamy engine room. The buffet lunch was very good with a more than ample selection of all we could eat. Water all day was complimentary and soda and beer up to four per person, no charge. We cruised Catalina and took a harbor tour past the IOWA. This was a full day and run by volunteers.",https://www.tripadvisor.com/Profile/HollyD638
50,Full day of fun,"The Lane Victory is now berthed at pier 43. We found out about this historic ship from a short aticle in a travel magazine. It seemed a bit pricey, but once on board it became apparent that a great deal of thought went into showing the ""crew"" the life aboard a WWII/Korean War ship. The museum, gift shop (strong on history), the band in WWII uniforms, the actual crew in historic uniforms, all came together to make a full and busy day. The crew did some great displays of jitterbug dancing. The condor squadron (WWII planes) flew overhead in a mock straffing run and the guns onboard were fired to repeal the attack. There was a continental breakfast and full lunch. We did a sail-by of Avalon, Catalina and when we returned to port, were greeted by 2 byplanes with smoke tails. This cruise is only offered 4 times during the summer, so you have to hope on before she starts sailing. There are several hotels to stay nearby so you needn't drive on the day of the sail.",https://www.tripadvisor.com/Profile/dugan_charles
50,One historic day at sea,"The tug boats slowly backed us away from the pier and our one day voyage back in history began. We enjoyed some coffee and pastries as we roamed the main deck and wondered at the masts, booms, and cables that loaded and unloaded cargo. The hatch above cargo hold #4 served as a bandstand and the entertainers, dressed in khaki uniforms of the era, sang songs from an earlier time. As the day progressed, we were told that a German ""spy"" had escaped from captivity and had radioed our position to enemy planes. WW II fighters roared alongside and overhead, simulating their attack as our guns fired and our ""hits"" created smoke from the planes and yells of victory from our throats. A delicious buffet lunch was served as we cruised slowly by Catalina Island. The two museums revealed a large, working engine relocated from the movie ""Sand Pebbles,"" several WW II Jeeps, many ship models, flags, and equipment from the wars. Back on deck, we explored the guns and chatted with other passengers, and tasted the fresh sea air as we cruised back to port. Our safe return from the successful defense of our ship warranted a welcome from a fire fighting boat with all hoses spraying in a beautiful pattern. Wow! What a day!",https://www.tripadvisor.com/Profile/dwharper2
50,Hard to find,"I think the SS Lane Victory has been moved to make room for the Iowa but we felt it was worth the search to find it. While we enjoyed roaming around the ship, the museum on board has a vast amount of information and artifacts. We would love to take one of the cruises.",https://www.tripadvisor.com/Profile/LuanneS8737
50,Great fun on a World War II Cargo Ship,"This is a real WWII Victory Ship build in 1945 in San Pedro. It served in WWII, Korea and Viet Nam. It is manned by volunteers. The boarding went smoothly and they served a continental breakfast on board the ship. The cruise was from 7:30 am to 4:30 pm and went out near Catalina Island. They served an excellent buffet for lunch including tri-tip, chicken and a pasta dish. Also they included fruit and salads. After lunch there was a mock attack by enemy fighter planes. The simulated firing of anti-aircraft guns on the ship using compressed air for the sound of the guns. It was very realistic. There was a band on board playing 40's music all day. They have these cruises 3 or 4 times per year. I would hightly recommend it for all ages.",https://www.tripadvisor.com/Profile/fcd4usc
50,SS Lane Victory - The hidden gem of Los Angeles (San Pedro),"Definitely worth a visit for two basic reasons 1) To immerse yourself in the memories recreated within this brilliantly restored World War II Merchant Navy vessel and secondly, to meet the marvellous crew who either served on the SS Lane Victory or have a marvellous passion in helping visitors to view the ship and its history through their eyes.We spent about half a day on board (though you may personally spend less), and were given a thorough and totally informative tour of the ship - even as far down as the bilges! I would recommend good shoes as you will be going up and down steep ladders here and there.The ship is actually in seaworthy condition as from time to time it takes parties out for various activities (wedding parties for example), though we did not take such a trip. Perhaps the greatest curiosity on board, is the toilet seat framework/arrangement that is positioned so that you would sit over the sea to the side of the ship! This relates to a heroic rescue attempt of thousands of Korean refugees and others.It may seem odd, but one of things I liked best was the ability to roam almost freely. Back here in England a similar visit would be far more restrictive.The ship is in effect a floating museum and I would highly recommend a visit if you are able to do so. It is located within the Port of Los Angeles.",https://www.tripadvisor.com/Profile/kernow01
