30,Open air street market in downtown LA,"This is the LA version of open markets that you see around the world in Morocco, Instanbul, Mexico, etc...vendors packed in one next to another selling their goods of all different types. Much of it is clothing but there is almost every type of item sold. Don't go looking for name brand items though - lots of knockoffs and lower priced versions of different goods. We went on a weekday in the late morning and the market (about 3 blocks long) was packed full of people. If you don't like crowds then it may be uncomfortable. The main language spoken appears to be spanish but people were kind and friendly, but I would be aware of my surrounding. An interesting place to visit but not for the purchase of name brand goods. It is in the 'fashion district' but does not have much in the terms of fabrics and goods to make your own garments. I'm glad we went once, but unlikely to come back.",https://www.tripadvisor.com/Profile/charliespal2
30,Suitcase,"I've been going to Alley since the late 80s never seem to have problems,but the last time it was bad.Bought a suitcase from a vender paid $40 seem strong but when I went to transfer my items to that suitcase handle broke,I went back (same day,60min later ) he didnt want me to give me a refund ,he showed me a sign which was hidden NO Refund or Exchange wow but got an exchange that should cost me $20 Beware",https://www.tripadvisor.com/Profile/Awamoi
50,Great place to shop,"If you go just thinking the worst you will be fine, people scared me telling me was no safe to go with a baby!!! But we had a good time, we found what we were looking for and all good!!! Service was great! U are able to find from sport clothes to wedding dresses!!",https://www.tripadvisor.com/Profile/joparolo
40,Repetative,"Hundreds of shops and market stalls selling same (of mostly cheap) tatt. Can barter cost with most of them. Nothing ""high end"" lots of fake stuff. An experience.",https://www.tripadvisor.com/Profile/Metoyoutometoyou
40,SHOPPING SHOPPING SHOPPING!!!!,"Had a great time shopping in the garment district. You need a least a week to walk the whole district. I enjoyed EVERY second,",https://www.tripadvisor.com/Profile/KimelaM
50,Great gift & souveneir spot,Make sure you wear comfy shoes and clothes. There is allt of walking. Went with my 1yr old and 5 yr old. TAKE A PRAM. Visited from NZ so it was a definate experience. They do have everything. Highlights for me are the ball gowns and perfume stores. Bought t-shirts for souveneirs for only 4bux each and still good quality. Plan to spend the day there and you can find some cool things.,https://www.tripadvisor.com/Profile/lolasewa2913
10,Avoid at all costs if you’re a rourist,"This is a great place for prom and wedding dresses. Plenty of bongs, super tight jeans, and overpriced ugly T-shirt’s. Nothing for tourists here. Spent $18 to park just to walk around in a circle for one hour and buy nothing. Sports jerseys were low quality and I would’ve been fine with that if they would’ve had more options than just Mexico, Honduras, Spanish teams, and English teams. I have never looked more forward to visiting a place to be so disappointed. Even my three teenagers didn’t want to buy anything here and that says A LOT!",https://www.tripadvisor.com/Profile/Lindarplusfour
10,Brutal Fashion Shopping,"I love shopping, and love fashion, so was excited to explore the fashion district in LA and Santee Street. What a brutal disappointment! Sketchy places with many homeless. Dirty, garbage everywhere, and clothing stores garbage. Just a complete waste of my time. Skip this one!",https://www.tripadvisor.com/Profile/Live4Strength
50,They have it all...,"First off get there early it gets crazy. If you do t like crowds definitely go during the week. Open from 9am to 5pm they have tons of stuff. We bought my daughter's prom dress and would never buy one from another place. They have food vendors(hotdogs wrapped in bacon...yummm) churro's, corn and tacos all the food we had was great. Screen protector for my son's iPhone 10 bucks installed. They have clothes, makeup, jewelry, shoes. Parking is more on the weekends (7 -15.00) 3.00 and up on the week days. We enjoyed it so much we went back the next day. Just know it's busy....you CAN barter...and some places charge 1.00 the use the restroom(they are cleaner and worth it)",https://www.tripadvisor.com/Profile/JulieBandSteveB
30,Know What You Are Doing,"We were born and raised in New York and moved to LA in the 1980's and have traveled a lot so we are skilled at visiting and shopping in different kinds of atmosphere situations and neighborhoods. My wife knows several establishments here and when we have occasion to travel to LA after we moved out to Arizona we make a visit to this area. We have had friends who did not feel very safe when they visited one time and never returned. We find no reason not to return. But, we suggest you not bring attention to yourself with expensive clothing or wearing very visible expensive jewels. Pay parking is available and if you have a handicap card the meter parking is free. Meters take quarters or credit cards. They are hard to find. Restrooms are hard to locate.",https://www.tripadvisor.com/Profile/RichardS778
10,Not worth the time,"Santee Alley is and open air flea market that stretches over a few blocks. Most of the stuff I saw looked like low quality items, be it clothes, accessories, electronics etc. I can see how it may be interesting fun if you are a kid, or if you are looking for cheap shopping for a costume party. If you are not in one if those two categories there are way better places to go shopping for ""unique"" things.",https://www.tripadvisor.com/Profile/Cassilis666
30,Different type of experience.,"For one, please be informed that the shops close by 5.30 pm,nearer to 5 pm. Do not expect too much. It is not an air- conditioned mall,but streets & streets of small shops offering dresses,dress materials, luggages, hand bags, accessories etc. Shop keepers are generally friendly.Most places accept cash only.Quite crowded.you can go once,as for shopping , it is not worth it.",https://www.tripadvisor.com/Profile/Xenajay
40,Have low expectations and you'll have a great experience,"I used to make my mom drive me out to the Garment District in LA when I was a teenager so I could find different clothes that none of my friends were wearing. Fast forward about 30 years, and I found myself back in the area for an evening of fun with my husband. We took a walk over to The Santee Alley for some food and a little shopping with ZERO expectations. I didn't go thinking I would find anything. Frankly, I already know that everything here is some sort of knock-off of some other brand. The folks that run the booths here are earning a hustle.After we ate lunch at Baby Lobster (overpriced and cash only), we took a walk down the alley. My son had told me he needed a few things for his upcoming Halloween costume and low and behold, I stumbled on it mere moments after stepping into the alley! They had bandanas and wigs and hats and purses and wallets and cheap bluetooth speakers and fruit cups with chimoy and horchata and all the things that make a good swap meet or flea market. I also saw lots of fancy dresses for quince girls.It's totally overwhelming, but if you put yourself in the right place, you'll have a good time.I'd totally come back if I were in the neighborhood again.",https://www.tripadvisor.com/Profile/321christab
10,No worth it at all..don't waste your time,"We ride 1 hour to LA to visit The Santee Alley and definitly it's no worth it. Dirty streets full of horrible clothes, aparells, very bad quality electronics and make ups, ...The feeling was just as visiting a bad version of any Chinese market.I can't understand how some people's reviews can say this is a lovely place.",https://www.tripadvisor.com/Profile/adelvalle76
40,"Exciting, affordable finds here","Just remember that Santee Alley is no air-conditioned mall and this is not the shopping place of the perfumed set. But if you are willing to brave the crowd, then you may be rewarded with some exciting finds. Here you get low-priced fashion accessories from sun glasses (knock offs) to costume jewelries, hand bags, scarves and footwear. There are also clothes and surprise! They are usually trendy.There was a time that haggling was the norm but that is a thing of the past. But you might want to give it a shot and get the item you desire at a lower price. If you are budget-conscious, then this is a great place to buy gifts for family and friends.",https://www.tripadvisor.com/Profile/Icb2003
50,Simply loved it,"I love a good bargain and yes you can find them here! You have to really look for what you want, but the ambience and the shops were really relaxed and nice. Felt a bit like being in Mexico or another Latin American country, as most vendors were Hispanic.",https://www.tripadvisor.com/Profile/65yantingy
30,Keep Going; Nothing to See Here Folks,"The Fashion District is huge with Santee Alley supposedly being the heart of it all. There are lots of off street parking ranging from $5 to $12 depending on location and size of your vehicle. The parking attendants can be aggressive for your business; just try your best not to run over there toes as you drive by…. Santee Alley was like walking through a Swap Meet, the advantage here is that the vendors have a larger inventory of size and selections. Most stores are willing to haggle; not a problem if they don’t accept your offer, just go to the next store. My wife bought some shoes that was priced at $35 and was able to get them for $20. All in all, it was a cool experience if you have a couple of hours to kill. Otherwise, skip it and check out other cool places in Los Angeles.",https://www.tripadvisor.com/Profile/joel1316
10,Antithesis of Rodeo Drive,"This is an interesting experience, just not as I had imagined. Yes, it’s called the heart of the fashion district in LA, but there’s no fashion here. Yes, lots and lots of inexpensive clothes in shop after shop of open air selling booths, all looking like an advertisement for the synthetics industry. Probably some finds here, like prom or special party dresses for young girls, but it’s somewhat seedy rather dirty and on a Saturday, very crowded. Did not feel the inclination to try on anything or even walk into any of the shops. It is, however, something unexpected as a US shopping experience, but intriguing despite. Parking a nightmare, with hawkers eager to draw you into their hairpin lots, which is OK, but questionable safety-wise. Was disappointed because was looking for fashion finds. Nonetheless, it was interesting, just not as advertised.",https://www.tripadvisor.com/Profile/PlatinumHoney
50,Santee Alley fun,"If you are in downtown LA and want a fun shopping experience come down to Santee Alley. It's near the fashion district. There are so many treasures you can find. Most things do not have pricetag so be willing to do some shopping and haggle prices. Some shops owned by the same people are in several locations. So you might not see your size they will call the other locations and have things brought over to you. The whole area is filled with garments,accessories, and all kinds of knick knacks. It's a mixture of different cultures vendors selling their wares. One word of warning in any touristy area. Always be aware of your surroundings and keep your wallet or purse close and secured. Its right areas and can be prone to pick pockets. Always better safe than sorry. As you drive around the areas you will see people waving flags they are directing you to parking locations that are not always so obvious. Be prepared to walk a lot and stay hydrated. Lot of vendors also sell waters and drinks. There are also tons of fabric stores in the same area. Hope you have a fun trip.",https://www.tripadvisor.com/Profile/RichardVegas
20,Poor quality goods,"Went here with my two daughters looking for bargains. Overall I thought it was not worth our time. The merchandise was not good quality at all, parking was difficult and we had to fight traffic to get there. If I had it to do over again I would skip it.",https://www.tripadvisor.com/Profile/Lynn_from_WI
50,Great for Formal Dresses,My daughters and I make a trip to Santee Alley in the LA Shopping District every time they need a formal dress. There are many stores and great prices compared to retail.,https://www.tripadvisor.com/Profile/kkufa
20,Busy busy place,"We made a visit to the Santee Alley this afternoon and it was pretty chaotic. Parking was a mess due to the traffic of both people and vehicles. It was extremely crowded in this shopping area. In terms of what is offered, most of the shops sell pretty much the same type of things. It was definitely a blown up swap meat environment. What I did like were all the vendors selling delicious fruit cups, churros and hot dogs.",https://www.tripadvisor.com/Profile/chickabeegrrl
10,“Fashion-Smashion”,What a joke- there’s better crap in canal street in NYC. The stuff is all knock-offs and cheap flea market crap. Based on the reviews I was expecting more...also- very seedy. Don’t bother!,https://www.tripadvisor.com/Profile/jmac0126
50,Lots to see and shop,"This place is bustling with activity. Had a chance to sample and buy a couple of locally made items. Loved the items on sale, especially freshly churned macadamia butter. I regret not buying more.The food options here a good and affordable too.",https://www.tripadvisor.com/Profile/HRH-Siva
50,Shopping paradiso if you have the coin to do so...,"Was on the last few days of our holiday and was told to make sure we come to Santee Alley, unfortunately we were on our last 2 hundy and had to do budget styles. This was the wrong place to try budget because there were soooo many gems i wanted to buy lol so be sure you have kilo's free and coin to buy goodies from here. We stopped for a cool drink and hotdog...sorry the name escapes me but it was a mango flavoured drink and its was yummmmaaayyyy. Santee Alley is a must!",https://www.tripadvisor.com/Profile/Mafeenah
30,Experience the real LA,"if you are a female and want to shop for the newest fashion, this is the place to go! a bit hectic and chaotic but fun to experience it. just be careful with your purse and make sure you have a street hot dog!!!",https://www.tripadvisor.com/Profile/cristinacF1402EG
20,Pretty disappointing,"I was curious to visit Santee Alley and finally got there yesterday. I was thinking it was a venue for up and coming designers to sell their unique things. It is nothing like that. Yes, it is flea market style but that did not bother me. What bothered me was that everything being sold was JUNK as in crap that the vendors bought in bulk from China or wherever. Like anyone else,I like to get a bargain, however, the stuff being sold is very poor quality and there is nothing unique about any of the items being sold.It is stuff you could get in a dime store. That being said, if you needed pieces for a Halloween costume you would find luck here. Their are lots of wig stores and gaudy accessories which would be great for a costume party. There is a building blocks from the entrance of Santee Alley on Olympic that sells apparel and accessories to wholesalers only but is open to all on the last Friday of the month. Look it up and if you happen to be visiting then, this place would be worth a visit.",https://www.tripadvisor.com/Profile/O4806MQmeganr
30,Prom dress search,"Came to Santee Alley (garment district) to find my daughter a dress for her prom. There are a LOT of dress stores in the area so be ready to spend some time walking/driving around. Found a dress for her as well as her sandals for a third of what I paid for my other daughters dress years earlier. Lots of street parking but prices do change according to the time of day so if you're planning an all day shopping trip it might be best to park in those all day parking. Be careful as prices can be horrendous! ($5 for the first 3 minutes!) so make sure what you're paying for. Bathrooms are scare and not the cleanest on top of paying the $1 for each use so be aware. Other than that, bargains galore! I believe you can even ""haggle"" on some prices too!",https://www.tripadvisor.com/Profile/johntB2771CM
40,All about your perception,Santee Alley isn't like shopping on Rodeo Drive but if you temper your expectations you just might find a good bargain or two.,https://www.tripadvisor.com/Profile/itsthetravelguy
30,Not for us.,"We made the trip down here to hopefully do some bargain shopping. There is certainly things here very cheap however not really what we were after. For anyone after cheap makeup, hats and shoes its probably great. We did buy a few hats that were 3 for $10.If you are going to head down here stay within the shopping area. We ventured about a block away to get some food and it got very sketchy very quickly.As I said it wasnt for us but there is certainly a lot of things for sale down here - just depends what you are looking for.",https://www.tripadvisor.com/Profile/TraceyB788
40,Shopping at a discount,"We went here to shop some locals said it was a fun day to explore the garment district. They have pretty much everything there shoes, clothes, perfume, makeup, gowns and a lot of knock offs Gucci,Prata you name it.Glad we went to see it and buy a few things.",https://www.tripadvisor.com/Profile/DentalMom320
30,Just junk,Santee Alley was once a paradise of garment industry samples and seconds. Now it is a place where inferior garbage from china is sold for prices higher than amazon.,https://www.tripadvisor.com/Profile/DragonLady90292
50,A hidden gem,"This alley is FILLED with merchandise with lots of varieties to shop from ,tons of accessories, clothing, makeup, shoes, knock offs and much much more!!!I was so excited there, definitely a different shopping experience... i saw lots of the merchandise that i see in wish app or amazon.The alley is crowded but we didn't have any problems or troubles , and i bought some fun stuff and accessories from there.It definitely worth a visit.",https://www.tripadvisor.com/Profile/HD76HD76
40,Bargains aplenty and great drinks!,"Bring cash and be prepared to bargain with numerous vendors. Easily found parking at reasonable rates in garage very close-by. From cell phone cases to toys to Dodgers shirts to designer clothes and shoes, you can easily get lost here. Very crowded on weekends. Our favorite were agua fresca fruit drinks from Alley Dog. They sell large cups of watermelon, strawberry, mango, pineapple, horchata, and so many more refreshing fresh fruit drinks for $5 each. They have actual fruit in them, not just flavoring. These were so good we went back again later on our trip! They have several spots in the alley and also sell beautiful fresh fruit cups. These are worth the stop alone. Fun way to kill an hour or two and grab some souvenirs.",https://www.tripadvisor.com/Profile/DonnaD741
30,Same ole same ole,This really isn't the Garment district but more like stores that you would see in Tijuana. There are about six or seven stores that are repeated throughout selling the same thing over and over again.,https://www.tripadvisor.com/Profile/danielmT7958TD
50,Miniature Tijuana in a good way!,"Santee is a little bit of everything. Hispanic culture, great deals on fabrics, shoes, bags, clothing and the like. It's next to the flower district so you can get great deals on center pieces, table cloths and the likes. It's a party planners dream and then some. It can be hit and miss but the experience is worth it. It's also surrounded by the fashion district.",https://www.tripadvisor.com/Profile/susanweisinger
40,Must do,If you like shopping and picking up a bargain this is your place. Great for gifts if you want to take back souvenirs etc. make up is all over the alley and very good prices. Shoes handbags watches etc reminded me of shopping in Thailand. kids and family enjoyed it. You could do a few hours or a whole day. If you do a whole day do your research plan it out the area of fashion district is huge but the alley alone you could see in half the time.,https://www.tripadvisor.com/Profile/Abbyfryer
50,Fun Day!!,"We had time to kill before going to a Dodger game, so I looked online & came across Santee Alley! Awesome deals, people were very nice. of course its a flea market, so it was dirty in parts, but whatever! Parking felt a lil shady, but it was fine...Overall... if you like to shop & stroll- that's your place to go! I enjoyed it!",https://www.tripadvisor.com/Profile/554kerric
50,"Hectic, but plentiful",They literally have everything that you can think of within a one mile radius. People were everywhere. It is located in the fashion district and a little seedy but if you go while the sun is out you should be fine.,https://www.tripadvisor.com/Profile/Keepitcutecass
50,Find some cheap bargains,Like a big garage sale except all the items are new.The streets and the area are surprisingly clean.,https://www.tripadvisor.com/Profile/markallanemail
50,Good merchandise for competitive rates,We visited the Santee alley shops street and found variety of merchandise for very reasonable prices. Especially we found some traditional Indian ( Asian) finger rings for really good rates comparing to gift shops- jewelry shops in other places like Santa Monica- Las Vegas etc.,https://www.tripadvisor.com/Profile/Hospitality-Ajay
50,A must for shoppers,"You can find almost anything at this outdoor swap meet stuff for cell phones ,clothes, weddings dresses, suits,stereo speakers,lingerie,dress shoes, tennis shoes and lots of awsome street truck food and fruit cups and ice cream. They have a fashion district a floral District",https://www.tripadvisor.com/Profile/989renem
50,DIFFERENT TYPE OF MARKET,Love the Mexican hot dog.A shop run by two asian women where we chose the designs and she printed it was amazing. thank you so much because our families in Australia love it. There are perfume stores and they are not bad for the price you pay-they even allow you to hagle lol this is a great market place and shouldn't ever lose the authenticity of it.,https://www.tripadvisor.com/Profile/214pepef
30,Warning before you go...,"They only accept cash. With that being said, BEWARE of your transactions with vendors. If your purchase requires them to give you change, they may pretend they don't owe you any change. In my situation, I had bought some 8 dollars worth of snack and food and gave the female vendor a 20 dollar bill. After handing out my snacks to my family, I waited patiently for the lady to give me my change. I noticed she was busy so I politely asked if I can please have my change. She gave me this look like, ""what change?"" She hesitated, but eventually reached down her fanny pack and gave me the change. We ate the snacks within the proximity of the vendor, and it wasn't surprising that minutes later, she got into an argument with a woman about getting their change back. You know that guilty/liar look? Yea it was plastered all over the vendor's face but she still refused to give the change back. The tourist eventually walked away pissed and frustrated. I hope this was an isolated incident from an isolated vendor. Please be aware.",https://www.tripadvisor.com/Profile/ChueyChang
30,shopping shopping shopping,"I come here to buy cheap clothes, makeup, costume jewelry and just to spend the day while in downtown LA... there's some good deals but beware there are lots of rip offs as well.. after coming here for years I just shop at the same places in the alley.. every season there's new things so its always fun to see what's new..",https://www.tripadvisor.com/Profile/selenan2017
10,Go to your local swap meet.,This place looks like any other local swap meet in California. Their plus size clothing runs small and there is very little of it. It wasn't worth the trip here.,https://www.tripadvisor.com/Profile/LynellaJ
50,Fun Shopping Environment,"Very energetic area to shop. I love coming here to find the best pricing on Colognes and Perfumes, as well as haggling with the vendors. It's bordering the famed LA Fashion District where you can buy the best fabrics, notions and attire. My travel partner spends atleast a full day going store to store. Check out KK Distributors for Perfume - my favourite place in the Alley. Always be prepared to haggle to get the best pricing. I avoid weekends, and always go mid-week (early AM start) to ensure I avoid the crowds and get the best deals!",https://www.tripadvisor.com/Profile/432donaldc
40,Shopping all day,I heard about this place and end up going to it if you like to shop this is a place to go lots shopping areas and it down a alley lots of stuff to see and do just be prepared to walk for a couple of hours,https://www.tripadvisor.com/Profile/trayjr
40,"Cheap Shopping, but Worth the Visit","If in Los Angeles, Santee Alley is a must. The shopping is great and cheap. The food is good and the atmosphere is something that must be experienced.",https://www.tripadvisor.com/Profile/JohnRab
50,International Bazaar Here at Home Amazing Deals with Cash,"Every time I am in Los Angeles I have a blast going here. The fabrics are amazing, craft stores, leather goods and the like are fun to seek and purchase. Haggling is often part of the culture. It's like going to a swap meet or Tijuana shopping area or?? Some booths are there for years and others come and go. Not upscale items but you can always find something you don't necessarily need. Great prices on Swarovski jewelry. You just image that if you bought this at dept store you would pay 10X more often for the same items.",https://www.tripadvisor.com/Profile/susanweisinger
