40,A fun place for birthday parties and activities,,,https://www.tripadvisor.com/Profile/NickellFamilyTravel
30,Fun for kids on a Rainy Day,,,https://www.tripadvisor.com/Profile/ScottmanP71
40,This place is just the best for grandkids and.. ME!,,,https://www.tripadvisor.com/Profile/Ace90266
40,Great Spot for Birthday,,,https://www.tripadvisor.com/Profile/NickellFamilyTravel
50,Great for visitors and locals ( I happen to live borderline Manhattan Hermosa beach.,,,https://www.tripadvisor.com/Profile/rosemaryg957
30,Great Place But Dirty,,,https://www.tripadvisor.com/Profile/family0f5traveling
40,Great Place for kids with energy,,,https://www.tripadvisor.com/Profile/VictoriaK7
50,keep your children busy,,,https://www.tripadvisor.com/Profile/Barbj55
50,"Kids Love It, Parents Get Tired of It.",,,https://www.tripadvisor.com/Profile/104jamesg
40,Love the parents night out option,,,https://www.tripadvisor.com/Profile/AmberH809
40,fun for young ones,,,https://www.tripadvisor.com/Profile/DanielleM466
30,Ropes course and rock wall,,,https://www.tripadvisor.com/Profile/SeaJenniTravel
40,Fun for preschool through elementary school kids,,,https://www.tripadvisor.com/Profile/CAWorkingMom
