10,Disgusting,,,https://www.tripadvisor.com/Profile/sixxmom
10,Disgusting!,,,https://www.tripadvisor.com/Profile/sixxmom
40,Great park for family outings,,,https://www.tripadvisor.com/Profile/SMOgal
50,Nice park in mid Santa Monica,,,https://www.tripadvisor.com/Profile/Chingachgook
30,"Way too many homeless, hanging around in the park and the grounds.",,,https://www.tripadvisor.com/Profile/AARDVARKKILLER
40,Park is hidden in plain view ...,,,https://www.tripadvisor.com/Profile/dblmed
50,Great local park.....,,,https://www.tripadvisor.com/Profile/pandpCalifornia
50,Lighted Tennis Courts with Ball machines,,,https://www.tripadvisor.com/Profile/641sanjayb
