40,Variety to Boot!,"We love Del Amo mall and miss living in the South Bay as it was an easy go-to. Lots of great shopping options, Cinema and restaurants; the upgraded Food Court is great with something for everyone. HANDS DOWN the Genghis Khan there has THE BEST Mongolian Grill that we have had Anywhere! It was the first meal we had when we got back to Los Angeles! This mall is great to spend an hour or two or the whole day! The only reason I did not give it 5 Stars was that there was no Christmas Music or real 'Holiday Feel"" the last Christmas I shopped there. I love a mall at the Holidays and while I got my shopping done, it was not the festive event it could have been. Other than that, this mall has everything you need and still (I believe) ranks in the Top 10 most visited malls in America. Not bad at all!",https://www.tripadvisor.com/Profile/404panag
40,Got it All,We specifically booked our hotel close to the center because clothes shopping was our aim before heading home to Australia. As it turned out we weren't disappointed as we found everything we wanted and more. From all the great department stores to small boutiques and everything inbetween. spent 3 full days just roaming through all the stores and food was abundant here too. From some vendors scattered inbetween other stores to the large food court to outside stores and restaurants . Great experience glad we came.,https://www.tripadvisor.com/Profile/our56
40,Fine for a small town,"Good:pick-up service for orders placed onlineall the standard brands plus Sears, Nordstrom and Macy's in one placeBad:Too huge. You really need to walk a LOT. So if you see something, buy it, otherwise you'll end walking miles and miles to get back to that store.Macy's Women's Shoes & Bags section was a major disappointment. Very small, limited brands, limited options, limited sizes. Out of 10 pairs, they didn't have anything in my size and didn't even offer to order online and pick it up later on. The staff overall seemed uninterested in you as a customer. The bag section was just awful. Very messy, bags on top of other bags, very dusty shelving. Again, limited options.",https://www.tripadvisor.com/Profile/burntfalafel
50,one of the biggest shopping malls in south bay,they have so many stores for you to shop and very good restaurants as well.They eve have Starbucks inside the mall,https://www.tripadvisor.com/Profile/Escape26531194295
50,"Very nice, Very safe, Mall","This mall was a little tiny thing in the 1970's, and then it expanded across Carson Street, and for a while, held the title of the largest Mall in America. It has expanded again, has great theaters, lots of restaurants, and a good food court. I had my first sales job selling tools for Sears at this mall from 1970 to 1973.",https://www.tripadvisor.com/Profile/Freedom47648924159
40,Nice mall,"Clean, safe, HUGE mall. Lots of typical stores with some unique ones, as well. Animal friendly. A nice bit of greenspace in areas. Great food court, really pretty.",https://www.tripadvisor.com/Profile/jeanlL5878FI
40,Shopping,"Del Amo is the largest mall in the Los Angeles area. If you need something you can probably find it there. Shopping, eating, movie theater, you can find it all there.",https://www.tripadvisor.com/Profile/Jeane141
50,Beautiful and large with almost anything you could ever want or need.,"The shopping is wonderful. There are many stores and the major stores, Macy's and Nordstrom are beautiful. There is any cuisine you might want for dining while you shop or for any special occasion. Great walking mall too because it is very large.",https://www.tripadvisor.com/Profile/711lover
50,Fancy!,Biggest mall. Friendly place to walk and move around. lots of restaurants and the atmosphere is not stressful.,https://www.tripadvisor.com/Profile/erwin82
50,The best Mall Around,This place has it all from shopping to dining to entertainment. I highly recommend visiting this mall if you are from the area or visiting from out of town.,https://www.tripadvisor.com/Profile/blantz2018
50,Del Amo fashion square mall,"Beautiful and gigantic mallIndoor sectionOutdoor sectionRenovated into a fantastic mall withGreat restaurants, movie theaters, Dave & Busters, a niceFood court and lots of shopsIncluding Nordstrom’s, Macy’s, JC penny’s,Sears and Dicks",https://www.tripadvisor.com/Profile/mikenitake
40,All kinds of clothing shopping,"Great place you have Beverly Hills type stores, as well as Forever 21, and Uniqlo all in one place. Can be confusing to navigate. I like to enter from the outdoor ,shops and cinema area.",https://www.tripadvisor.com/Profile/507daniellev
50,World Class Mall,Very modern with all the name brand retail outlets and some small brands also. The food court is excellent with variety of selections. Very well laid out and plenty of parking.,https://www.tripadvisor.com/Profile/russypooh
40,"Stroll, Walk, Nosh, Shop","I frequent Del Amo Fashion Center several times per week to stroll, walk, nosh, shop, and even meet people. I wear a pedometer and count my steps, and feel comfortable racking up the count at this mall. Parking is ample, stores and eateries are plentiful. I often stop at one of the three Starbucks for a beverage, and Nordstrom's Ebar for a beverage/nosh. Occasionally, my husband and I dine at Luna Grill. The mall has stores I like (e.g., Macy's, Ecco, and Nordstrom) and is kept clean. When I choose to go to a movie with my husband, we prefer the AMC theatre at this mall. I have one issue that really needs to be resolved: dogs of all sizes, some of which I have seen poop.",https://www.tripadvisor.com/Profile/tapbelle
40,Great stores and a nice food court,"A very wide assortment of stores (probably the biggest mall in all of LA) and a good Food Court. It’s very popular so finding a parking space can be a challenge, but it’s worth it. Michael Kors, two Macy’s, Marshalls, Sports Treasures, Book-Off, Dick’s Sporting Goods, Lids, Cap City, Victoria’s Secret, Hollister etc etc to name but a few stores. So make sure you bring a lot of money and make the most of your visit. Prepare to stay for, at least, a couple of hours in order for you to take it all in.",https://www.tripadvisor.com/Profile/Fretel1891
40,Hip and Modern,Love this mall! They have plenty of stores and areas where you can just hang out for the whole day. I love the fact that there's an AMC too. Food court is spacious and they've added so much since their remodeling. I would definitely drive out of my way just to come here.,https://www.tripadvisor.com/Profile/theyellowtulip
40,Massive,"If you cannot find something you want or need here, give up. Immense, modern, clean and featuring both big and small stores. Some decent places to eat as well. Acres of parking.",https://www.tripadvisor.com/Profile/SB01
40,The number one mall on South Bay,The del amo mall was at one point heading down hill. Then the new owners decided to make it Number one. It is centrally located and has every store. Restaurant. Service and entertainment you need. Great parking as wellWe went to the movies Fun times clean theater,https://www.tripadvisor.com/Profile/NickellFamilyTravel
40,Del Amo is become a very great center of great shopping and dining.,The Mall has mostly been remodeled and has Entertainment for kidswith Dave and Busters. Many Restaurants to choose from. Nordstrom is One of the nicest stores.,https://www.tripadvisor.com/Profile/propertymanager1012
50,Huge and varied,This giant mall has undergone some radical improvements over the past 5 years attracting new high end stores Like Nortstroms. They've constructed a new 5 story parking structure with electric charging stations and plenty of handicap parking.,https://www.tripadvisor.com/Profile/130sandyp
50,Awesome shopping place,This place is simply out of the world with so many restaurants and shops for each one. You can shop till you drop. Awesome place !!,https://www.tripadvisor.com/Profile/varunmusc
50,Great mall,"Del Amo has a little for everyone, expensive stores, high end restaurants, lots of ice cream eateries, traditional stores, bargain stores, department stores. The remodel side is very impressive and inviting.",https://www.tripadvisor.com/Profile/766yelcor
40,Huge mall,"This mall is especially large even according to LA standards. I know I missed some stores because they have many hallways leading off of main areas. If you love to shop, this is your place.",https://www.tripadvisor.com/Profile/sdut2n
40,Stop and smell the roses,"If one has time, del amo mall is a great place to get some exercise and walk around. Del amo mall is bright and airy with great stores. People watching and window shopping can be entertaining at times while drinking your coffee or whatever drink you can purchase there. Stop and smell the roses people. You don't need to spend money every time you visit a mall. I've visited 2 malls in New Jersey this past week and they were depressing to walk thru. South Bay residents, we are pretty fortunate to have this gem.",https://www.tripadvisor.com/Profile/861lesliea
50,"Nice Mall, Great Variety","My wife loves this mall. It has an excellent selection of stores and restaurants and a very nice theater. Parking is a bit tight but, for the area, not too bad. When we visit the area we almost always hit this place at least twice and we come from a major city in Florida.",https://www.tripadvisor.com/Profile/jamesgj2015
30,Disappointed,"To be fair, I can only compare this mall against shopping in Florida and San Francisco. It was not what I expected and did not have many of the stores I was hoping to find.Thank goodness for Bath and Body works!",https://www.tripadvisor.com/Profile/WhensTheNextOne65
30,Shop and eats,"Used to be one of the best and biggest shopping center but have changed over the years. Improvements and updates are slow. Parking is a nightmare, especially during peak hours and forget the holiday season.",https://www.tripadvisor.com/Profile/justfuninthesunnsnow
40,Nice Mall,Great mall but horrible to park plan on walking . There are the usual stores but Macy!s is larger than most Macy’s. They have a nice food court but even better they nave Lucille’s Barbecue and a few really nice sit down restaurants attached to the mall. They have Starbucks and a few other coffee shops,https://www.tripadvisor.com/Profile/Bridgetpianos
50,"Wow, this is big. Prepare for a long walk.",This is a super mall. Take care not to get lost in the miriad of shops. Lots of food options for the journey around the mall. Make a day of it in here.,https://www.tripadvisor.com/Profile/WilliamH290
50,Great for a walk,While DAFC is a beautiful mall we really enjoy it for taking our weekly walks. The length of the mall is perfect and you get to window shop along the way.,https://www.tripadvisor.com/Profile/BoboTravlr
40,Premiere Mall in the Southland,"The Del Amo Fashion Center is easily one of the premiere shopping destinations in all of Southern California. Featuring major retailers, (such as Nordstrom and Macy's), some exceptional eateries, (i.e.: Din Tai Fung, Lucille's, Lazy Dog Cafe, etc.), an AMC cineplex, and a slew of specialty stores, this mall really has it all. It is located 10-15 minutes south of LAX, in the L.A. suburb of Torrance, which is consistently ranked among the safest cities in America. There is plenty of parking, but be sure to wear some comfortable shoes, as this is a large mall and calls for a lot of walking. Also, several major hotels are located within walking distance, as is Restaurant Row, which is just across a massive street (Hawthorne Blvd.).",https://www.tripadvisor.com/Profile/Bruinsmith
50,Greatest Mall in SoCal,"Since Simon & Company purchased De Amo Fashion Center and sunk about $400 million, DAFC is the premiere mall again that it once was in the 70s. Great shopping experience!",https://www.tripadvisor.com/Profile/patN4603JI
40,Get your steps in,"A very big mall in Torrance. Ample parking and easy access to entries. All the major brand stores you expect to have, a nice food court, and a fresh and clean appearance make this mall attractive.",https://www.tripadvisor.com/Profile/I245FWmikeb
50,Handy to LAX,"We day a lay over in LAX on our way to London.We took Ubers to and from the mall and made two trips there.The range and number of stores is trenendous, do you likely find what you’re looking for and somethings you were not looking for!The mall is well supplied with food options, but be prepared for a good hike as this is one of the biggest malls in California.Check the opening hours before you come and work around them. There’s a directory available on Simons website.",https://www.tripadvisor.com/Profile/Nadar7
50,Great mall and great area.,"Its a Mall, but a big one with everything that you could possibly need. If not then there is a Target a block away. Trending and has everything for every member of the family.",https://www.tripadvisor.com/Profile/rhondad176
30,Better than it was,Overall its much better than it was. Very big and lots of stores. Some empty places still and parking this time of year can be rough. I can't believe there is valet parking now here. Crazy!,https://www.tripadvisor.com/Profile/J6063CWjamess
40,Lots of shops and restaurants. Huge mall!,We came here to get out of the house and do some shopping. Del Amo is a huge mall with a wide variety of stores for people of all ages. You can easily spend 3 hours walking around shopping and eating here.Parking was great and it wasn't crowded for the Saturday after Thanksgiving.,https://www.tripadvisor.com/Profile/DaveDuff
50,FANTASTIC!,"The Del Amo Fashion Center has been transformed over the years and in such a great way! Great shops, restaurants, etc.",https://www.tripadvisor.com/Profile/Ace90266
40,A huge mall,"This shopping mall is really huge, and you can find almost anything here - from food to fashion, from books to sporting goods, from department stores to a post office.It is so huge, that it is not easy to navigate - I think I visited some areas twice, and completely missed other areas.",https://www.tripadvisor.com/Profile/ANGELOV230
50,Brilliant choice of shops,Endless choice of shops 😍 so much to see and do and some brilliant places to grab a bite too! If your in the area it’s definitely worth a visit! It’s got something for everyone :),https://www.tripadvisor.com/Profile/jemimajane93
50,Wow it is amazing,"I had not been there for a while and went last weekend with my daughter. It is amazing, it has been completely redone and has every store you can imagine. The lighting and decor is beautiful and the perfect combination of indoor and outdoor shopping experience. The selection of restaurants is perfect and there is something for everyone.",https://www.tripadvisor.com/Profile/ninot203
40,Huge,"This mall is scarily, exhaustingly huge, and that is not necessarily a good thing. It's also not easy to get to, but, once you're there, it's a shopper's delight. I liked it better before Macy's murdered Bullock's.",https://www.tripadvisor.com/Profile/califcasl
40,depends which part of the mall,"one of the oddest malls around, like an example of the bifurcation of the US, one side is dead man walking with Sears, the other with Nordstromei guess you can argue something for everyone",https://www.tripadvisor.com/Profile/douglaswilliamm
50,Excellent choice of stores,We enjoyed our visit here - there’s a wide range of stores and good places to eat. It’s open late and was easy to park.,https://www.tripadvisor.com/Profile/karencA6283NY
40,Everything here,"This is a great place , so many places to shop and a lot of restaurants. Hard to even tell you which is the best. You can go from Asian to Italian to traditional steak house. This is an excellent place to find anything you need. One of the largest malls in the US. Only issue is sometimes the crowd on weekends is not the greatest. Seen some fights here from out side the area. Most local go during he week , especially the movie theater or early on weekends. The Torrance PD don't mess around and try to keep it a family friendly place but they can't catch everything ( although we appreciate them ). So enjoy just watch the people around you and all should be good.",https://www.tripadvisor.com/Profile/michaelsU6111TD
40,Very nicely surprised !!! Never had heard about this mall!,Had few hours to kill while waiting to pick up my kids. Del Amo Fashion Center was one of my choices. Went there expecting a small mall but was very surprised by seeing how big it was and the variety of stores and restaurants there....What made it also very nice is that the mall has inside and outside area and is very clean and sophisticated.I ended up doing lots of shopping :-),https://www.tripadvisor.com/Profile/HeraLalaian
20,Good food.,"Had to wait 30 mins for a table but it was worth it. Everything is freshly made by hand (dumplings and noodles) We had vegetable dumplings. They were good. I ordered shrimp and noodles. Very good. And the bok choy was outstanding. Be careful with the green tea. Its very high quality but sent me to the ladies room, if you know what I mean. Service was good and each item was brought to our table as soon as it was done. Each dish came one at a time, steaming hot. I enjoyed my meal there. I would go back",https://www.tripadvisor.com/Profile/232missyc
30,Big clean and bright mall,Big mall with all of the big names. Very busy with lots of parking. Many local buses serve and lots of places to eat both inside and around the mall.Nothing much to distinguish it from any other mall.,https://www.tripadvisor.com/Profile/joep735
40,Great stores and a nice food court,"Sports Treasure, Book-off, Macy', Marshalls and Dick's Sporting Goods in one and the same mall! One of the best malls in LA - and I do recommend a visit to both Sports Treasure and Book-off; two really nice stores for both sports souvenirs and books, movies and games!",https://www.tripadvisor.com/Profile/Fretel1891
50,Impressive,Our family recently visited this mall. Wow. Impressive. Huge mall. Lots of parking all around the mall. They have the Large Nordstrom's and Macy stores as well as smaller shops. Their food court offers plenty of selections. It does get busy but nothing too crazy.,https://www.tripadvisor.com/Profile/ChargerNgo
50,Shopping & Eating,Great place to shop and enjoy time together. So many stores and places to eat. Macys has two separate stores for men and women. So many men’s styles to choose from. There are too many stores and eateries to mention. Foodies won’t be disappointed!,https://www.tripadvisor.com/Profile/maggiepagan
40,Quick Visit,Loved this mall! Pretty big with so many selections. I love that they have Missha and other Asian skincare store. I love their outdoor area too and has plenty of parking space.,https://www.tripadvisor.com/Profile/VernaZ
50,Yearly visit for shopping,"Del Amo mall has everything you need, tons of options and overall the staff in the stores are quite good-attentive. The new makeover of the mall can make it a bit difficult to find shops so make sure to use tge Info-Map kiosk. Prepare for a lot of walking!",https://www.tripadvisor.com/Profile/Wendy_PlettSunTours
50,Very nice shopping center,Always like to go shopping while visiting. And this place did not disappoint with all the different types of stores and the cleanliness of the center inside and out.,https://www.tripadvisor.com/Profile/636davef
40,"Very clean, modern and a great variety of stores","Very clean, modern and a great variety of stores, very close to the Doubletree Hilton. All the major brands as well as Macys and Nordstrom.",https://www.tripadvisor.com/Profile/johnw097
50,Beautification Complete,"This is a great place and a shopper's dream. They only thing missing is a high end steak restaurant. (Flemings or Ruth's Chris). Parking on the NorthWest side is difficult at times, but there are parking structures on the east side.The updgrades and remodeling is great and there are a lot of new stores on the premises.Lots of good eateries. Come check it out.Security presence is a plus.",https://www.tripadvisor.com/Profile/deanas430
50,One of the largest indoor shopping malls in SoCal,"If it’s hot outside, head for the Del Amo Mall - Indoor air conditioned. It’s got everything from Nordstroms to Macy’s. It’s got all the chain stores, such as Zara, H&M, and Uniqlo. There’s the AMC theatre as well. The food court is large and has a lot of different options to choose from. Good Asian food. The internationally famous dim sum restaurant -Din Tai Fung allows patrons to watch their staff prepare the dim sum behind a glass wall. If you don’t have a reservation, then expect to wait over an hour to be seated, especially in the weekends. If you have time to spare, then an afternoon at the Del Amo Mall is time well spent!",https://www.tripadvisor.com/Profile/MarktheWay
50,DEL AMO FASHION CENTER,This is a huge Mall with outlets for everything one can need or desire. The Ambience is excellent and you can spend the whole day just trying to see all the shops on the premises. The Overall experience is delightful and one can come back for more. There are food and beverage outlets to take care of the physical needs also,https://www.tripadvisor.com/Profile/Sunilvk64
50,Colosal Shopping Mall,"If you are a shoppaholic and you love to shop until you drop, this will be your sanctuary in LA, it’s huge and you get pretty much all options possible to shopEnjoy!",https://www.tripadvisor.com/Profile/PattyG76
50,Best Mall in California,250+ plus stores but I only shopped a handful. Lots of places to eat. My favorite was Brio. Can't wait to visit again.,https://www.tripadvisor.com/Profile/654chrisy
40,Offers most of the famous chain stores,"Visiting friendly and comfortable shopping environment.Unusually few visitors, it's internet that takes its tribute? No big surprises at the food court.However, there are more interesting restaurants on the outskirts of the mall",https://www.tripadvisor.com/Profile/Phayao13
50,Great shopping and eating,Great shopping and eating at this large mall. We loved Din Tai Fung for lunch and check out Book Off for bargains.,https://www.tripadvisor.com/Profile/wombatdavid
30,Not As Good As It Used To Be,"The last time I was at Del Amo Fashion Center was 1997. Back then, this mall was simply amazing. It was also larger than what it is today. The mall itself has a nice feel to it but there are not that many good retail stores to choose from and the layout is very confusing. The food court has good options but I just wish they had more selections of stores to shop from. Maybe I am just a relic of the past...",https://www.tripadvisor.com/Profile/L6313QUjamesk
50,Great sekection,"All your favourite brands and chain shops here, great layout - very airy and spacious. Also a nice food court but I especially enjoyed the PF Chang’s restaurant located on the outer east side. There’s a few other high end restaurants too if you want to escape the hustle & bustle of the main food court.Not normally a fan of American shopping malls but this one was easy to navigate.",https://www.tripadvisor.com/Profile/NickS1975
40,Nice update,The layout is somewhat odd. There should be more bathrooms to accommodate all the people that go through here. There is a section that not many people go to and I've noticed a bit of turnover with the stores located there. It is better than how the mall used to be though.,https://www.tripadvisor.com/Profile/kimtastrophem
40,WOW! This is s fabulous mall right here in Torrance....,This mall has been remodeled & what a great improvement! I personally like the outdoor section by AMC theaters~ lot of restaurants close by~ great food court that does not feel or look like what you would expect.... Walk movie meal. Free parking....,https://www.tripadvisor.com/Profile/YardSaleLdy
50,Shopping mall,Shopping mall renovated since 2014-2016Monday- Thursday Week day wasn’t that busy its not include holidays and weekend||||||||||||||||||||||||||||||||||||Service - 5/5Parking - 5/5Clean - 4/5atmosphere 4/5lavatory 3/5,https://www.tripadvisor.com/Profile/Inspire675638
40,Very comprehensive,"Looks like this place had an overhaul a couple of years ago. Featuring some higher end department stores and a greater variety of shops and eating establishments, this center will have something for most people. Plenty of open space, adds to a pleasant shopping experience.",https://www.tripadvisor.com/Profile/Nisekoite
40,"Food, Fashion, Beauty & Culture","This is what the Del Amo Fashion Center is known for - Fashion, beauty, culture, food, etc.. The sprawl is located in Torrance, CA.It’s restaurants are world-class eateries. The food is excellent and it is a blend of East and West cultures from the Din Tai Fung Chinese Restaurant to Lucille’s Smokehouse Barbecue with so many other fine dining places like Black Angus and BJ’s.The center has also first class clothing and boutique stores stores.Electronic stores to sporting goods and small specialty businesses.They have a website anyone can visit and a list of hundreds of businesses within the complex.If you want to spend a day or an afternoon shopping with the family, you can’t go wrong with this mall. It is one of the largest in this part of California.We had a pleasant time walking around and shopping for family members.",https://www.tripadvisor.com/Profile/Hexelspixels
50,Large Nordstrom and Macy’s with fine dining,"Twice bought shirts at Nordstrom, but couldn’t find a jacket. My friend found bargains for a 10 month old granddaughter at Macy’s. Dined at night twice in Brio (I think) Italian restaurant and had lunch in Nordstrom’s 2nd level cafe with a heated patio. There is also a separate Barnes & Noble bookstore between the Street and parking lot that is open late.",https://www.tripadvisor.com/Profile/SLOnative
