50,a little bit of history in your backyard,,,https://www.tripadvisor.com/Profile/viperamd64
40,Great for experiencing the Local History of the area.,,,https://www.tripadvisor.com/Profile/losal3912
50,Go for the Mud Mania,,,https://www.tripadvisor.com/Profile/guinearags
50,Beautiful Historical Rancho,,,https://www.tripadvisor.com/Profile/191erlindac
40,"Stroll through history on your own, or have a guided tour.",,,https://www.tripadvisor.com/Profile/363kathyd
50,A GReat Bit of Little Hills (Cerritos) History,,,https://www.tripadvisor.com/Profile/Joestuffsda
50,The other Long Beach Rancho,,,https://www.tripadvisor.com/Profile/bobandmargieg
50,Pleasant and informative,,,https://www.tripadvisor.com/Profile/allag471
40,Architecture & open space,,,https://www.tripadvisor.com/Profile/seekers38
50,Lovely,,,https://www.tripadvisor.com/Profile/monicabT6729BP
50,Summer concerts,,,https://www.tripadvisor.com/Profile/davidgL4998OE
50,Loveky way to spend an afternoon,,,https://www.tripadvisor.com/Profile/TraveLee073
50,After Los Almamitos,,,https://www.tripadvisor.com/Profile/Starviagera
50,Lovely afternoon spent at this lovely old Rancho,,,https://www.tripadvisor.com/Profile/427rosemaryp
50,A Really good time !,,,https://www.tripadvisor.com/Profile/V9822PLmarieb
50,Excellent way to get a little History into your day,,,https://www.tripadvisor.com/Profile/Travel27097265137
40,Historic Rancho,,,https://www.tripadvisor.com/Profile/edvonlef
50,Great little museum,,,https://www.tripadvisor.com/Profile/sessynj
50,I Love It!,,,https://www.tripadvisor.com/Profile/762carolc
50,Feels like you are in old California!,,,https://www.tripadvisor.com/Profile/lauramN9491WA
50,Early Long Beach,,,https://www.tripadvisor.com/Profile/nessncali
50,Amazing Historical Site,,,https://www.tripadvisor.com/Profile/BoboTravlr
40,Our guide was great,,,https://www.tripadvisor.com/Profile/794debim
50,Local history at it's best.,,,https://www.tripadvisor.com/Profile/katherinehF6893GC
50,Visit a historical Long Beach homestead,,,https://www.tripadvisor.com/Profile/booptraveler
50,Where Long Beach Started,,,https://www.tripadvisor.com/Profile/califken
50,Relive the world of Ranchos as California enters the US,,,https://www.tripadvisor.com/Profile/Contribution2All
50,Vacation,,,https://www.tripadvisor.com/Profile/lorin302
40,Nice place to spend an afternoon,,,https://www.tripadvisor.com/Profile/AB4415
50,The Living History Experience was Wonderful,,,https://www.tripadvisor.com/Profile/LongBeachUS
40,Cool History in the LBC,,,https://www.tripadvisor.com/Profile/jree261
40,Very nice!,,,https://www.tripadvisor.com/Profile/81alisag
40,"Beauty, peace and a little history.",,,https://www.tripadvisor.com/Profile/luvs2fly246
40,The Gem on the hill,,,https://www.tripadvisor.com/Profile/barbgal
40,Worth a visit to experience Long Beach’s rancho life,,,https://www.tripadvisor.com/Profile/JimL239
50,Great place,,,https://www.tripadvisor.com/Profile/tripbhb
50,A rare historical find in Southern California!,,,https://www.tripadvisor.com/Profile/ChrisY1952
40,A little bit of Spanish history in the LBC,,,https://www.tripadvisor.com/Profile/Alexander_Designs
50,Rancho Los Cerritos,,,https://www.tripadvisor.com/Profile/JimHoover
50,Step back into time,,,https://www.tripadvisor.com/Profile/napiligal
40,Historical Rancho,,,https://www.tripadvisor.com/Profile/ClassyJewel
50,A fresh step backwards!,,,https://www.tripadvisor.com/Profile/michellep844
50,Authentic bit of history hidden it the city,,,https://www.tripadvisor.com/Profile/ANonyMouse45
40,Great place to get the flavor of Long Beach history,,,https://www.tripadvisor.com/Profile/ryanroost
50,Don't miss Rancho Los Cerritos,,,https://www.tripadvisor.com/Profile/GeneG126
50,The birthplace of Long Beach and most of So. Cal.,,,https://www.tripadvisor.com/Profile/seanr581
40,Nice guided tour of a bit of history,,,https://www.tripadvisor.com/Profile/ChurchMouse2010
20,Nice little bit of California history,,,https://www.tripadvisor.com/Profile/DavidR413
50,"Mr Bixby great tour, Best find in area!",,,https://www.tripadvisor.com/Profile/bonitadi1
50,Free and the best tour guide I've seen,,,https://www.tripadvisor.com/Profile/Pauak
50,Long Beach history - personalized,,,https://www.tripadvisor.com/Profile/judyross1000
40,Rancho traditions of early California,,,https://www.tripadvisor.com/Profile/carolshodge
40,Wonderful tour.,,,https://www.tripadvisor.com/Profile/BigFishDiveClub
50,"The only National, State and Local Historical Monument in Long Beach",,,https://www.tripadvisor.com/Profile/TrinaSchoon
50,New Visitor Center,,,https://www.tripadvisor.com/Profile/null
50,Great Place to take the family or learn more about Long Beach history,,,https://www.tripadvisor.com/Profile/Dangerouskurvz
50,A hidden Gem,,,https://www.tripadvisor.com/Profile/TheWind26
30,It was ok,,,https://www.tripadvisor.com/Profile/328KellyP
50,Living History at Rancho,,,https://www.tripadvisor.com/Profile/ChrisC134
40,Historic Ranch in Long Beach,,,https://www.tripadvisor.com/Profile/kjmagnuson
50,History today,,,https://www.tripadvisor.com/Profile/maryl49
50,Where Long Beach California Began,,,https://www.tripadvisor.com/Profile/califken
40,Great place to get away from it all for awhile,,,https://www.tripadvisor.com/Profile/YR-LGB
50,A wonderful time visiting History,,,https://www.tripadvisor.com/Profile/cmesign4u
50,"Grand old adobe, lovely gardens",,,https://www.tripadvisor.com/Profile/sandytravelbug
50,You Must Visit Rancho Los Cerritos,,,https://www.tripadvisor.com/Profile/Passport10185
