tag,place,user
"""been""","Vancouver, British Columbia, Canada",877lawrenced
"""been""","Maple Ridge, British Columbia, Canada",877lawrenced
"""been""","Pemberton, British Columbia, Canada",877lawrenced
"""been""","Torrance, CA, USA",877lawrenced
"""been""","Long Beach, CA, USA",877lawrenced
"""been""","Los Angeles, CA, USA",877lawrenced
"""been""","Lake Country, British Columbia, Canada",877lawrenced
"""been""","Redondo Beach, CA, USA",877lawrenced
"""been""","Hope, British Columbia, Canada",877lawrenced
