tag,place,user
"""been""","Chilliwack, British Columbia, Canada",me2me279
"""been""","North Vancouver, British Columbia, Canada",me2me279
"""been""","Clearwater, FL, USA",me2me279
"""been""","Burnaby, British Columbia, Canada",me2me279
"""been""","Los Angeles, CA, USA",me2me279
"""been""","Salt Spring Island, British Columbia, Canada",me2me279
"""been""","Ganges, British Columbia, Canada",me2me279
"""been""","Kelowna, British Columbia, Canada",me2me279
"""been""","Vancouver, British Columbia, Canada",me2me279
